user_input,retrieved_contexts,response,reference,faithfulness,llm_context_precision_with_reference,context_recall
What are the risk factors associated with Tesla?,"['In\taddition,\tthe\tSEC\tmaintains\ta\twebsite\t(\nwww.sec.gov\n)\tthat\tcontains\nreports,\tproxy\tand\tinformation\tstatements,\tand\tother\tinformation\tregarding\tissuers\tthat\tfile\telectronically.\tOur\twebsite\tis\tlocated\tat\t\nwww.tesla.com\n,\tand\nour\treports,\tamendments\tthereto,\tproxy\tstatements\tand\tother\tinformation\tare\talso\tmade\tavailable,\tfree\tof\tcharge,\ton\tour\tinvestor\trelations\twebsite\tat\nir.tesla.com\n\tas\tsoon\tas\treasonably\tpracticable\tafter\twe\telectronically\tfile\tor\tfurnish\tsuch\tinformation\twith\tthe\tSEC.\tThe\tinformation\tposted\ton\tour\twebsite\nis\tnot\tincorporated\tby\treference\tinto\tthis\tAnnual\tReport\ton\tForm\t10-K.\nITEM\t1A.\tRISK\tFACTORS\nYou\tshould\tcarefully\tconsider\tthe\trisks\tdescribed\tbelow\ttogether\twith\tthe\tother\tinformation\tset\tforth\tin\tthis\treport,\twhich\tcould\tmaterially\taffect\tour\nbusiness,\tfinancial\tcondition\tand\tfuture\tresults.\tThe\trisks\tdescribed\tbelow\tare\tnot\tthe\tonly\trisks\tfacing\tour\tcompany.\tRisks\tand\tuncertainties\tnot\tcurrently\nknown\tto\tus\tor\tthat\twe\tcurrently\tdeem\tto\tbe\timmaterial\talso\tmay\tmaterially\tadversely\taffect\tour\tbusiness,\tfinancial\tcondition\tand\toperating\tresults.\nRisks\tRelated\tto\tOur\tAbility\tto\tGrow\tOur\tBusiness\nWe\tmay\texperience\tdelays\tin\tlaunching\tand\tramping\tthe\tproduction\tof\tour\tproducts\tand\tfeatures,\tor\twe\tmay\tbe\tunable\tto\tcontrol\nour\tmanufacturing\tcosts.\nWe\thave\tpreviously\texperienced\tand\tmay\tin\tthe\tfuture\texperience\tlaunch\tand\tproduction\tramp\tdelays\tfor\tnew\tproducts\tand\tfeatures.\tFor\texample,\nwe\tencountered\tunanticipated\tsupplier\tissues\tthat\tled\tto\tdelays\tduring\tthe\tinitial\tramp\tof\tour\tfirst\tModel\tX\tand\texperienced\tchallenges\twith\ta\tsupplier\tand\nwith\tramping\tfull\tautomation\tfor\tcertain\tof\tour\tinitial\tModel\t3\tmanufacturing\tprocesses.\tIn\taddition,\twe\tmay\tintroduce\tin\tthe\tfuture\tnew\tor\tunique\nmanufacturing\tprocesses\tand\tdesign\tfeatures\tfor\tour\tproducts.\tAs\twe\texpand\tour\tvehicle\tofferings\tand\tglobal\tfootprint,\tthere\tis\tno\tguarantee\tthat\twe\twill\nbe\table\tto\tsuccessfully\tand\ttimely\tintroduce\tand\tscale\tsuch\tprocesses\tor\tfeatures.\n14', ""TESLA,\tINC.\nANNUAL\tREPORT\tON\tFORM\t10-K\tFOR\tTHE\tYEAR\tENDED\tDECEMBER\t31,\t2023\nINDEX\n\t\n\t\nPage\nPART\tI.\n\t\n\t\nItem\t1.\nBusiness\n4\nItem\t1A.\nRisk\tFactors\n14\nItem\t1B.\nUnresolved\tStaff\tComments\n28\nItem\t1C.\nCybersecurity\n29\nItem\t2.\nProperties\n30\nItem\t3.\nLegal\tProceedings\n30\nItem\t4.\nMine\tSafety\tDisclosures\n30\n\t\nPART\tII.\n\t\nItem\t5.\nMarket\tfor\tRegistrant's\tCommon\tEquity,\tRelated\tStockholder\tMatters\tand\tIssuer\tPurchases\tof\tEquity\tSecurities\n31\nItem\t6.\n[Reserved]\n32\nItem\t7.\nManagement's\tDiscussion\tand\tAnalysis\tof\tFinancial\tCondition\tand\tResults\tof\tOperations\n33\nItem\t7A.\nQuantitative\tand\tQualitative\tDisclosures\tabout\tMarket\tRisk\n45\nItem\t8.\nFinancial\tStatements\tand\tSupplementary\tData\n46\nItem\t9.\nChanges\tin\tand\tDisagreements\twith\tAccountants\ton\tAccounting\tand\tFinancial\tDisclosure\n93\nItem\t9A.\nControls\tand\tProcedures\n93\nItem\t9B.\nOther\tInformation\n94\nItem\t9C.\nDisclosure\tRegarding\tForeign\tJurisdictions\tthat\tPrevent\tInspections\n94\n\t\nPART\tIII.\n\t\nItem\t10.\nDirectors,\tExecutive\tOfficers\tand\tCorporate\tGovernance\n95\nItem\t11.\nExecutive\tCompensation\n95\nItem\t12.\nSecurity\tOwnership\tof\tCertain\tBeneficial\tOwners\tand\tManagement\tand\tRelated\tStockholder\tMatters\n95\nItem\t13.\nCertain\tRelationships\tand\tRelated\tTransactions,\tand\tDirector\tIndependence\n95\nItem\t14.\nPrincipal\tAccountant\tFees\tand\tServices\n95\n\t\nPART\tIV.\n\t\nItem\t15.\nExhibits\tand\tFinancial\tStatement\tSchedules\n96\nItem\t16.\nSummary\n111\n\t\nSignatures"", 'Any\tunfavorable\tultimate\toutcome\tfor\tTesla\tmay\thave\ta\tnegative\timpact\ton\tthe\tperception\tof\tTesla’s\ttreatment\tof\tour\temployees.\tFurthermore,\twe\tare\ndirectly\tor\tindirectly\tdependent\tupon\tcompanies\twith\tunionized\twork\tforces,\tsuch\tas\tsuppliers\tand\ttrucking\tand\tfreight\tcompanies.\tAny\twork\tstoppages\tor\nstrikes\torganized\tby\tsuch\tunions\tcould\tdelay\tthe\tmanufacture\tand\tsale\tof\tour\tproducts\tand\tmay\tharm\tour\tbusiness\tand\toperating\tresults.\nWe\tmay\tchoose\tto\tor\tbe\tcompelled\tto\tundertake\tproduct\trecalls\tor\ttake\tother\tsimilar\tactions.\nAs\ta\tmanufacturing\tcompany,\twe\tmust\tmanage\tthe\trisk\tof\tproduct\trecalls\twith\trespect\tto\tour\tproducts.\tRecalls\tfor\tour\tvehicles\thave\tresulted\tfrom\nvarious\thardware\tand\tsoftware-related\tsafety\tconcerns\tor\tnon-compliance\tdeterminations.\tIn\taddition\tto\trecalls\tinitiated\tby\tus\tfor\tvarious\tcauses,\ttesting\nof\tor\tinvestigations\tinto\tour\tproducts\tby\tgovernment\tregulators\tor\tindustry\tgroups\tmay\tcompel\tus\tto\tinitiate\tproduct\trecalls\tor\tmay\tresult\tin\tnegative\npublic\tperceptions\tabout\tthe\tsafety\tof\tour\tproducts,\teven\tif\twe\tdisagree\twith\tthe\tdefect\tdetermination\tor\thave\tdata\tthat\tcontradicts\tit.\tIn\tthe\tfuture,\twe\nmay\tvoluntarily\tor\tinvoluntarily\tinitiate\trecalls\tif\tany\tof\tour\tproducts\tare\tdetermined\tby\tus\tor\ta\tregulator\tto\tcontain\ta\tsafety\tdefect\tor\tbe\tnoncompliant\nwith\tapplicable\tlaws\tand\tregulations,\tsuch\tas\tU.S.\tFederal\tMotor\tVehicle\tSafety\tStandards.\tSuch\trecalls,\twhether\tvoluntary\tor\tinvoluntary\tor\tcaused\tby\nsystems\tor\tcomponents\tengineered\tor\tmanufactured\tby\tus\tor\tour\tsuppliers,\tcould\tresult\tin\tsignificant\texpense,\tsupply\tchain\tcomplications\tand\tservice\nburdens,\tand\tmay\tharm\tour\tbrand,\tbusiness,\tprospects,\tfinancial\tcondition\tand\toperating\tresults.\nOur\tcurrent\tand\tfuture\twarranty\treserves\tmay\tbe\tinsufficient\tto\tcover\tfuture\twarranty\tclaims.\nWe\tprovide\ta\tmanufacturer’s\twarranty\ton\tall\tnew\tand\tused\tTesla\tvehicles\twe\tsell\tdirectly\tto\tcustomers.\tWe\talso\tprovide\tcertain\twarranties\twith\nrespect\tto\tthe\tenergy\tgeneration\tand\tstorage\tsystems\twe\tsell,\tincluding\ton\ttheir\tinstallation\tand\tmaintenance.\tFor\tcomponents\tnot\tmanufactured\tby\tus,\nwe\tgenerally\tpass\tthrough\tto\tour\tcustomers\tthe\tapplicable\tmanufacturers’\twarranties,\tbut\tmay\tretain\tsome\twarranty\tresponsibilities\tfor\tsome\tor\tall\tof\tthe\nlife\tof\tsuch\tcomponents.\tAs\tpart\tof\tour\tenergy\tgeneration\tand\tstorage\tsystem\tcontracts,\twe\tmay\tprovide\tthe\tcustomer\twith\tperformance\tguarantees\tthat\nguarantee\tthat\tthe\tunderlying\tsystem\twill\tmeet\tor\texceed\tthe\tminimum\tenergy\tgeneration\tor\tother\tenergy\tperformance\trequirements\tspecified\tin\tthe\ncontract.\tUnder\tthese\tperformance\tguarantees,\twe\tgenerally\tbear\tthe\trisk\tof\telectricity\tproduction\tor\tother\tperformance\tshortfalls,\tincluding\tin\tsome\ncases\tshortfalls\tcaused\tby\tfailures\tin\tcomponents\tfrom\tthird\tparty\tmanufacturers.\tThese\trisks\tare\texacerbated\tin\tthe\tevent\tsuch\tmanufacturers\tcease\noperations\tor\tfail\tto\thonor\ttheir\twarranties.\n22', 'Table\tof\tContents\nWe\talso\tface\tcompetition\tin\tour\tenergy\tgeneration\tand\tstorage\tbusiness\tfrom\tother\tmanufacturers,\tdevelopers,\tinstallers\tand\tservice\tproviders\tof\ncompeting\tenergy\ttechnologies,\tas\twell\tas\tfrom\tlarge\tutilities.\tDecreases\tin\tthe\tretail\tor\twholesale\tprices\tof\telectricity\tfrom\tutilities\tor\tother\trenewable\nenergy\tsources\tcould\tmake\tour\tproducts\tless\tattractive\tto\tcustomers\tand\tlead\tto\tan\tincreased\trate\tof\tcustomer\tdefaults.\nRisks\tRelated\tto\tOur\tOperations\nWe\tmay\texperience\tissues\twith\tlithium-ion\tcells\tor\tother\tcomponents\tmanufactured\tat\tour\tGigafactories,\twhich\tmay\tharm\tthe\nproduction\tand\tprofitability\tof\tour\tvehicle\tand\tenergy\tstorage\tproducts.\nOur\tplan\tto\tgrow\tthe\tvolume\tand\tprofitability\tof\tour\tvehicles\tand\tenergy\tstorage\tproducts\tdepends\ton\tsignificant\tlithium-ion\tbattery\tcell\tproduction,\nincluding\tby\tour\tpartner\tPanasonic\tat\tGigafactory\tNevada.\tWe\talso\tproduce\tseveral\tvehicle\tcomponents\tat\tour\tGigafactories,\tsuch\tas\tbattery\tmodules\tand\npacks\tand\tdrive\tunits,\tand\tmanufacture\tenergy\tstorage\tproducts.\tIf\twe\tare\tunable\tto\tor\totherwise\tdo\tnot\tmaintain\tand\tgrow\tour\trespective\toperations,\tor\nif\twe\tare\tunable\tto\tdo\tso\tcost-effectively\tor\thire\tand\tretain\thighly-skilled\tpersonnel\tthere,\tour\tability\tto\tmanufacture\tour\tproducts\tprofitably\twould\tbe\nlimited,\twhich\tmay\tharm\tour\tbusiness\tand\toperating\tresults.\nFinally,\tthe\thigh\tvolumes\tof\tlithium-ion\tcells\tand\tbattery\tmodules\tand\tpacks\tmanufactured\tby\tus\tand\tby\tour\tsuppliers\tare\tstored\tand\trecycled\tat\tour\nvarious\tfacilities.\tAny\tmishandling\tof\tthese\tproducts\tmay\tcause\tdisruption\tto\tthe\toperation\tof\tsuch\tfacilities.\tWhile\twe\thave\timplemented\tsafety\nprocedures\trelated\tto\tthe\thandling\tof\tthe\tcells,\tthere\tcan\tbe\tno\tassurance\tthat\ta\tsafety\tissue\tor\tfire\trelated\tto\tthe\tcells\twould\tnot\tdisrupt\tour\toperations.\nAny\tsuch\tdisruptions\tor\tissues\tmay\tharm\tour\tbrand\tand\tbusiness.\nWe\tface\trisks\tassociated\twith\tmaintaining\tand\texpanding\tour\tinternational\toperations,\tincluding\tunfavorable\tand\tuncertain\nregulatory,\tpolitical,\teconomic,\ttax\tand\tlabor\tconditions.\nWe\tare\tsubject\tto\tlegal\tand\tregulatory\trequirements,\tpolitical\tuncertainty\tand\tsocial,\tenvironmental\tand\teconomic\tconditions\tin\tnumerous\njurisdictions,\tincluding\tmarkets\tin\twhich\twe\tgenerate\tsignificant\tsales,\tover\twhich\twe\thave\tlittle\tcontrol\tand\twhich\tare\tinherently\tunpredictable.\tOur\noperations\tin\tsuch\tjurisdictions,\tparticularly\tas\ta\tcompany\tbased\tin\tthe\tU.S.,\tcreate\trisks\trelating\tto\tconforming\tour\tproducts\tto\tregulatory\tand\tsafety\nrequirements\tand\tcharging\tand\tother\telectric\tinfrastructures;\torganizing\tlocal\toperating\tentities;\testablishing,\tstaffing\tand\tmanaging\tforeign\tbusiness\nlocations;\tattracting\tlocal\tcustomers;\tnavigating\tforeign\tgovernment\ttaxes,\tregulations\tand\tpermit\trequirements;\tenforceability\tof\tour\tcontractual\trights;\ntrade\trestrictions,\tcustoms\tregulations,\ttariffs\tand\tprice\tor\texchange\tcontrols;\tand\tpreferences\tin\tforeign\tnations\tfor\tdomestically\tmanufactured\tproducts.\nFor\texample,\twe\tmonitor\ttax\tlegislation\tchanges\ton\ta\tglobal\tbasis,\tincluding\tchanges\tarising\tas\ta\tresult\tof\tthe\tOrganization\tfor\tEconomic\tCooperation\tand\nDevelopment’s\tmulti-jurisdictional\tplan\tof\taction\tto\taddress\tbase\terosion\tand\tprofit\tshifting.\tSuch\tconditions\tmay\tincrease\tour\tcosts,\timpact\tour\tability\tto\nsell\tour\tproducts\tand\trequire\tsignificant\tmanagement\tattention,\tand\tmay\tharm\tour\tbusiness\tif\twe\tare\tunable\tto\tmanage\tthem\teffectively.', 'Table\tof\tContents\nunable\tto\tdo\tso,\twe\tmay\thave\tto\tcurtail\tour\tplanned\tvehicle\tand\tenergy\tstorage\tproduct\tproduction\tor\tprocure\tadditional\tcells\tfrom\tsuppliers\tat\npotentially\tgreater\tcosts,\teither\tof\twhich\tmay\tharm\tour\tbusiness\tand\toperating\tresults.\nIn\taddition,\tthe\tcost\tand\tmass\tproduction\tof\tbattery\tcells,\twhether\tmanufactured\tby\tour\tsuppliers\tor\tby\tus,\tdepends\tin\tpart\tupon\tthe\tprices\tand\navailability\tof\traw\tmaterials\tsuch\tas\tlithium,\tnickel,\tcobalt\tand/or\tother\tmetals.\tThe\tprices\tfor\tthese\tmaterials\tfluctuate\tand\ttheir\tavailable\tsupply\tmay\tbe\nunstable,\tdepending\ton\tmarket\tconditions\tand\tglobal\tdemand\tfor\tthese\tmaterials.\tFor\texample,\tas\ta\tresult\tof\tincreased\tglobal\tproduction\tof\telectric\nvehicles\tand\tenergy\tstorage\tproducts,\tsuppliers\tof\tthese\traw\tmaterials\tmay\tbe\tunable\tto\tmeet\tour\tvolume\tneeds.\tAdditionally,\tour\tsuppliers\tmay\tnot\tbe\nwilling\tor\table\tto\treliably\tmeet\tour\ttimelines\tor\tour\tcost\tand\tquality\tneeds,\twhich\tmay\trequire\tus\tto\treplace\tthem\twith\tother\tsources.\tAny\treduced\navailability\tof\tthese\tmaterials\tmay\timpact\tour\taccess\tto\tcells\tand\tour\tgrowth,\tand\tany\tincreases\tin\ttheir\tprices\tmay\treduce\tour\tprofitability\tif\twe\tcannot\nrecoup\tsuch\tcosts\tthrough\tincreased\tprices.\tMoreover,\tour\tinability\tto\tmeet\tdemand\tand\tany\tproduct\tprice\tincreases\tmay\tharm\tour\tbrand,\tgrowth,\nprospects\tand\toperating\tresults.\nOur\tfuture\tgrowth\tand\tsuccess\tare\tdependent\tupon\tconsumers’\tdemand\tfor\telectric\tvehicles\tand\tspecifically\tour\tvehicles\tin\tan\nautomotive\tindustry\tthat\tis\tgenerally\tcompetitive,\tcyclical\tand\tvolatile.\nThough\twe\tcontinue\tto\tsee\tincreased\tinterest\tand\tadoption\tof\telectric\tvehicles,\tif\tthe\tmarket\tfor\telectric\tvehicles\tin\tgeneral\tand\tTesla\tvehicles\tin\nparticular\tdoes\tnot\tdevelop\tas\twe\texpect,\tdevelops\tmore\tslowly\tthan\twe\texpect,\tor\tif\tdemand\tfor\tour\tvehicles\tdecreases\tin\tour\tmarkets\tor\tour\tvehicles\ncompete\twith\teach\tother,\tour\tbusiness,\tprospects,\tfinancial\tcondition\tand\toperating\tresults\tmay\tbe\tharmed.\nIn\taddition,\telectric\tvehicles\tstill\tconstitute\ta\tsmall\tpercentage\tof\toverall\tvehicle\tsales.\tAs\ta\tresult,\tthe\tmarket\tfor\tour\tvehicles\tcould\tbe\tnegatively\naffected\tby\tnumerous\tfactors,\tsuch\tas:\n•\nperceptions\tabout\telectric\tvehicle\tfeatures,\tquality,\tsafety,\tperformance\tand\tcost;\n•\nperceptions\tabout\tthe\tlimited\trange\tover\twhich\telectric\tvehicles\tmay\tbe\tdriven\ton\ta\tsingle\tbattery\tcharge,\tand\taccess\tto\tcharging\tfacilities;\n•\ncompetition,\tincluding\tfrom\tother\ttypes\tof\talternative\tfuel\tvehicles,\tplug-in\thybrid\telectric\tvehicles\tand\thigh\tfuel-economy\tinternal\tcombustion\nengine\tvehicles;\n•\nvolatility\tin\tthe\tcost\tof\toil,\tgasoline\tand\tenergy;\n•\ngovernment\tregulations\tand\teconomic\tincentives\tand\tconditions;\tand\n•\nconcerns\tabout\tour\tfuture\tviability.\nThe\ttarget\tdemographics\tfor\tour\tvehicles\tare\thighly\tcompetitive.\tSales\tof\tvehicles\tin\tthe\tautomotive\tindustry\ttend\tto\tbe\tcyclical\tin\tmany\tmarkets,\nwhich\tmay\texpose\tus\tto\tfurther\tvolatility.\tWe\talso\tcannot\tpredict\tthe\tduration\tor\tdirection\tof\tcurrent\tglobal\ttrends\tor\ttheir\tsustained\timpact\ton\tconsumer\ndemand.\tUltimately,\twe\tcontinue\tto\tmonitor\tmacroeconomic\tconditions\tto\tremain\tflexible\tand\tto\toptimize\tand\tevolve\tour\tbusiness\tas\tappropriate,\tand\nattempt\tto\taccurately\tproject\tdemand\tand\tinfrastructure\trequirements\tglobally\tand\tdeploy\tour\tproduction,\tworkforce\tand\tother\tresources\taccordingly.']","Tesla's success depends on consumer demand for electric vehicles, which is influenced by factors like public perception of electric vehicles, charging infrastructure availability, and competition from other vehicle types.  

The automotive industry is known for its cyclical nature and volatility, and Tesla's sales could be affected by economic downturns or shifts in consumer preferences.  

Additionally, Tesla's reliance on lithium-ion batteries and raw materials like lithium, nickel, and cobalt exposes them to price fluctuations and supply chain disruptions. 


Tesla also operates in a highly competitive market and faces risks related to government regulations, economic incentives, and consumer concerns about the company's future viability. 
","Consumer demand risks (public perception, infrastructure, competition), cyclical volatility, raw material supply and price fluctuations, intense competition, regulatory/legal risks",1.0,0.8041666666465626,1.0
What is Tesla’s mission?,"['Table\tof\tContents\nPART\tI\nITEM\t1.\tBUSINESS\nOverview\nWe\tdesign,\tdevelop,\tmanufacture,\tsell\tand\tlease\thigh-performance\tfully\telectric\tvehicles\tand\tenergy\tgeneration\tand\tstorage\tsystems,\tand\toffer\nservices\trelated\tto\tour\tproducts.\tWe\tgenerally\tsell\tour\tproducts\tdirectly\tto\tcustomers,\tand\tcontinue\tto\tgrow\tour\tcustomer-facing\tinfrastructure\tthrough\ta\nglobal\tnetwork\tof\tvehicle\tshowrooms\tand\tservice\tcenters,\tMobile\tService,\tbody\tshops,\tSupercharger\tstations\tand\tDestination\tChargers\tto\taccelerate\tthe\nwidespread\tadoption\tof\tour\tproducts.\tWe\temphasize\tperformance,\tattractive\tstyling\tand\tthe\tsafety\tof\tour\tusers\tand\tworkforce\tin\tthe\tdesign\tand\nmanufacture\tof\tour\tproducts\tand\tare\tcontinuing\tto\tdevelop\tfull\tself-driving\ttechnology\tfor\timproved\tsafety.\tWe\talso\tstrive\tto\tlower\tthe\tcost\tof\townership\nfor\tour\tcustomers\tthrough\tcontinuous\tefforts\tto\treduce\tmanufacturing\tcosts\tand\tby\toffering\tfinancial\tand\tother\tservices\ttailored\tto\tour\tproducts.\nOur\tmission\tis\tto\taccelerate\tthe\tworld’s\ttransition\tto\tsustainable\tenergy.\tWe\tbelieve\tthat\tthis\tmission,\talong\twith\tour\tengineering\texpertise,\nvertically\tintegrated\tbusiness\tmodel\tand\tfocus\ton\tuser\texperience\tdifferentiate\tus\tfrom\tother\tcompanies.\nSegment\tInformation\nWe\toperate\tas\ttwo\treportable\tsegments:\t(i)\tautomotive\tand\t(ii)\tenergy\tgeneration\tand\tstorage.\nThe\tautomotive\tsegment\tincludes\tthe\tdesign,\tdevelopment,\tmanufacturing,\tsales\tand\tleasing\tof\thigh-performance\tfully\telectric\tvehicles\tas\twell\tas\nsales\tof\tautomotive\tregulatory\tcredits.\tAdditionally,\tthe\tautomotive\tsegment\talso\tincludes\tservices\tand\tother,\twhich\tincludes\tsales\tof\tused\tvehicles,\tnon-\nwarranty\tafter-sales\tvehicle\tservices,\tbody\tshop\tand\tparts,\tpaid\tSupercharging,\tvehicle\tinsurance\trevenue\tand\tretail\tmerchandise.\tThe\tenergy\tgeneration\nand\tstorage\tsegment\tincludes\tthe\tdesign,\tmanufacture,\tinstallation,\tsales\tand\tleasing\tof\tsolar\tenergy\tgeneration\tand\tenergy\tstorage\tproducts\tand\trelated\nservices\tand\tsales\tof\tsolar\tenergy\tsystems\tincentives.\nOur\tProducts\tand\tServices\nAutomotive\nWe\tcurrently\tmanufacture\tfive\tdifferent\tconsumer\tvehicles\t–\tthe\tModel\t3,\tY,\tS,\tX\tand\tCybertruck.\tModel\t3\tis\ta\tfour-door\tmid-size\tsedan\tthat\twe\ndesigned\tfor\tmanufacturability\twith\ta\tbase\tprice\tfor\tmass-market\tappeal.\tModel\tY\tis\ta\tcompact\tsport\tutility\tvehicle\t(“SUV”)\tbuilt\ton\tthe\tModel\t3\tplatform\nwith\tseating\tfor\tup\tto\tseven\tadults.\tModel\tS\tis\ta\tfour-door\tfull-size\tsedan\tand\tModel\tX\tis\ta\tmid-size\tSUV\twith\tseating\tfor\tup\tto\tseven\tadults.\tModel\tS\tand\nModel\tX\tfeature\tthe\thighest\tperformance\tcharacteristics\tand\tlongest\tranges\tthat\twe\toffer\tin\ta\tsedan\tand\tSUV,\trespectively.\tIn\tNovember\t2023,\twe\nentered\tthe\tconsumer\tpickup\ttruck\tmarket\twith\tfirst\tdeliveries\tof\tthe\tCybertruck,\ta\tfull-size\telectric\tpickup\ttruck\twith\ta\tstainless\tsteel\texterior\tthat\thas\nthe\tutility\tand\tstrength\tof\ta\ttruck\twhile\tfeaturing\tthe\tspeed\tof\ta\tsports\tcar.\nIn\t2022,\twe\talso\tbegan\tearly\tproduction\tand\tdeliveries\tof\ta\tcommercial\telectric\tvehicle,\tthe\tTesla\tSemi.\tWe\thave\tplanned\telectric\tvehicles\tto\naddress\tadditional\tvehicle\tmarkets,\tand\tto\tcontinue\tleveraging\tdevelopments\tin\tour\tproprietary\tFull\tSelf-Driving\t(“FSD”)\tCapability\tfeatures,\tbattery\tcell\nand\tother\ttechnologies.\nEnergy\tGeneration\tand\tStorage\nEnergy\tStorage\tProducts\nPowerwall\tand\tMegapack\tare\tour\tlithium-ion\tbattery\tenergy\tstorage\tproducts.', ""We\tmade\tthis\npledge\tin\torder\tto\tencourage\tthe\tadvancement\tof\ta\tcommon,\trapidly-evolving\tplatform\tfor\telectric\tvehicles,\tthereby\tbenefiting\tourselves,\tother\ncompanies\tmaking\telectric\tvehicles\tand\tthe\tworld.\nEnvironmental,\tSocial\tand\tGovernance\t(ESG)\tand\tHuman\tCapital\tResources\nESG\nThe\tvery\tpurpose\tof\tTesla's\texistence\tis\tto\taccelerate\tthe\tworld's\ttransition\tto\tsustainable\tenergy.\tWe\tbelieve\tthe\tworld\tcannot\treduce\tcarbon\nemissions\twithout\taddressing\tboth\tenergy\tgeneration\tand\tconsumption,\tand\twe\tare\tdesigning\tand\tmanufacturing\ta\tcomplete\tenergy\tand\ttransportation\necosystem\tto\tachieve\tthis\tgoal.\tAs\twe\texpand,\twe\tare\tbuilding\teach\tnew\tfactory\tto\tbe\tmore\tefficient\tand\tsustainably\tdesigned\tthan\tthe\tprevious\tone,\nincluding\twith\trespect\tto\tper-unit\twaste\treduction\tand\tresource\tconsumption,\tincluding\twater\tand\tenergy\tusage.\tWe\tare\tfocused\ton\tfurther\tenhancing\nsustainability\tof\toperations\toutside\tof\tour\tdirect\tcontrol,\tincluding\treducing\tthe\tcarbon\tfootprint\tof\tour\tsupply\tchain.\nWe\tare\tcommitted\tto\tsourcing\tonly\tresponsibly\tproduced\tmaterials,\tand\tour\tsuppliers\tare\trequired\tto\tprovide\tevidence\tof\tmanagement\tsystems\tthat\nensure\tsocial,\tenvironmental\tand\tsustainability\tbest\tpractices\tin\ttheir\town\toperations,\tas\twell\tas\tto\tdemonstrate\ta\tcommitment\tto\tresponsible\tsourcing\ninto\ttheir\tsupply\tchains.\tWe\thave\ta\tzero-tolerance\tpolicy\twhen\tit\tcomes\tto\tchild\tor\tforced\tlabor\tand\thuman\ttrafficking\tby\tour\tsuppliers\tand\twe\tlook\tto\tthe\nOrganization\tfor\tEconomic\tCo-operation\tand\tDevelopment\tDue\tDiligence\tGuidelines\tto\tinform\tour\tprocess\tand\tuse\tfeedback\tfrom\tour\tinternal\tand\nexternal\tstakeholders\tto\tfind\tways\tto\tcontinually\timprove.\tWe\tare\talso\tdriving\tsafety\tin\tour\town\tfactories\tby\tfocusing\ton\tworker\tengagement.\tOur\nincidents\tper\tvehicle\tcontinue\tto\tdrop\teven\tas\tour\tproduction\tvolumes\tincrease.\tWe\talso\tstrive\tto\tbe\tan\temployer\tof\tchoice\tby\toffering\tcompelling,\nimpactful\tjobs\twith\tbest\tin-industry\tbenefits.\n12"", 'ITEM\t7.\tMANAGEMENT’S\tDISCUSSION\tAND\tANALYSIS\tOF\tFINANCIAL\tCONDITION\tAND\tRESULTS\tOF\tOPERATIONS\nThe\tfollowing\tdiscussion\tand\tanalysis\tshould\tbe\tread\tin\tconjunction\twith\tthe\tconsolidated\tfinancial\tstatements\tand\tthe\trelated\tnotes\tincluded\nelsewhere\tin\tthis\tAnnual\tReport\ton\tForm\t10-K.\tFor\tfurther\tdiscussion\tof\tour\tproducts\tand\tservices,\ttechnology\tand\tcompetitive\tstrengths,\trefer\tto\tItem\t1-\nBusiness.\tFor\tdiscussion\trelated\tto\tchanges\tin\tfinancial\tcondition\tand\tthe\tresults\tof\toperations\tfor\tfiscal\tyear\t2022-related\titems,\trefer\tto\tPart\tII,\tItem\t7.\nManagement’s\tDiscussion\tand\tAnalysis\tof\tFinancial\tCondition\tand\tResults\tof\tOperations\tin\tour\tAnnual\tReport\ton\tForm\t10-K\tfor\tfiscal\tyear\t2022,\twhich\twas\nfiled\twith\tthe\tSecurities\tand\tExchange\tCommission\ton\tJanuary\t31,\t2023.\nOverview\tand\t2023\tHighlights\nOur\tmission\tis\tto\taccelerate\tthe\tworld’s\ttransition\tto\tsustainable\tenergy.\tWe\tdesign,\tdevelop,\tmanufacture,\tlease\tand\tsell\thigh-performance\tfully\nelectric\tvehicles,\tsolar\tenergy\tgeneration\tsystems\tand\tenergy\tstorage\tproducts.\tWe\talso\toffer\tmaintenance,\tinstallation,\toperation,\tcharging,\tinsurance,\nfinancial\tand\tother\tservices\trelated\tto\tour\tproducts.\tAdditionally,\twe\tare\tincreasingly\tfocused\ton\tproducts\tand\tservices\tbased\ton\tartificial\tintelligence,\nrobotics\tand\tautomation.\nIn\t2023,\twe\tproduced\t1,845,985\tconsumer\tvehicles\tand\tdelivered\t1,808,581\tconsumer\tvehicles.\tWe\tare\tcurrently\tfocused\ton\tincreasing\tvehicle\nproduction,\tcapacity\tand\tdelivery\tcapabilities,\treducing\tcosts,\timproving\tand\tdeveloping\tour\tvehicles\tand\tbattery\ttechnologies,\tvertically\tintegrating\tand\nlocalizing\tour\tsupply\tchain,\timproving\tand\tfurther\tdeploying\tour\tFSD\tcapabilities,\tincreasing\tthe\taffordability\tand\tefficiency\tof\tour\tvehicles,\tbringing\tnew\nproducts\tto\tmarket\tand\texpanding\tour\tglobal\tinfrastructure,\tincluding\tour\tservice\tand\tcharging\tinfrastructure.\nIn\t2023,\twe\tdeployed\t14.72\tGWh\tof\tenergy\tstorage\tproducts\tand\t223\tmegawatts\tof\tsolar\tenergy\tsystems.\tWe\tare\tcurrently\tfocused\ton\tramping\nproduction\tof\tenergy\tstorage\tproducts,\timproving\tour\tSolar\tRoof\tinstallation\tcapability\tand\tefficiency,\tand\tincreasing\tmarket\tshare\tof\tretrofit\tsolar\tenergy\nsystems.\nIn\t2023,\twe\trecognized\ttotal\trevenues\tof\t$96.77\tbillion,\trepresenting\tan\tincrease\tof\t$15.31\tbillion,\tcompared\tto\tthe\tprior\tyear.\tWe\tcontinue\tto\tramp\nproduction,\tbuild\tnew\tmanufacturing\tcapacity\tand\texpand\tour\toperations\tto\tenable\tincreased\tdeliveries\tand\tdeployments\tof\tour\tproducts,\tand\tinvest\tin\nresearch\tand\tdevelopment\tto\taccelerate\tour\tAI,\tsoftware\tand\tfleet-based\tprofits\tfor\tfurther\trevenue\tgrowth.\nIn\t2023,\tour\tnet\tincome\tattributable\tto\tcommon\tstockholders\twas\t$15.00\tbillion,\trepresenting\ta\tfavorable\tchange\tof\t$2.44\tbillion,\tcompared\tto\tthe\nprior\tyear.\tThis\tincluded\ta\tone-time\tnon-cash\ttax\tbenefit\tof\t$5.93\tbillion\tfor\tthe\trelease\tof\tvaluation\tallowance\ton\tcertain\tdeferred\ttax\tassets.\tWe\tcontinue\nto\tfocus\ton\tfurther\tcost\treductions\tand\toperational\tefficiencies\twhile\tmaximizing\tdelivery\tvolumes.\nWe\tended\t2023\twith\t$29.09\tbillion\tin\tcash\tand\tcash\tequivalents\tand\tinvestments,\trepresenting\tan\tincrease\tof\t$6.91\tbillion\tfrom\tthe\tend\tof\t2022.\nOur\tcash\tflows\tprovided\tby\toperating\tactivities\tin\t2023\tand\t2022\twere\t$13.26\tbillion\tand\t$14.72\tbillion,\trespectively,\trepresenting\ta\tdecrease\tof\t$1.47\nbillion.', 'Table\tof\tContents\nWe\tare\thighly\tdependent\ton\tthe\tservices\tof\tElon\tMusk,\tTechnoking\tof\tTesla\tand\tour\tChief\tExecutive\tOfficer.\nWe\tare\thighly\tdependent\ton\tthe\tservices\tof\tElon\tMusk,\tTechnoking\tof\tTesla\tand\tour\tChief\tExecutive\tOfficer.\tAlthough\tMr.\tMusk\tspends\tsignificant\ntime\twith\tTesla\tand\tis\thighly\tactive\tin\tour\tmanagement,\the\tdoes\tnot\tdevote\this\tfull\ttime\tand\tattention\tto\tTesla.\tMr.\tMusk\talso\tcurrently\tserves\tas\tChief\nExecutive\tOfficer\tand\tChief\tTechnical\tOfficer\tof\tSpace\tExploration\tTechnologies\tCorp.,\ta\tdeveloper\tand\tmanufacturer\tof\tspace\tlaunch\tvehicles,\tChairman\nand\tChief\tTechnical\tOfficer\tof\tX\tCorp.,\ta\tsocial\tmedia\tcompany,\tand\tis\tinvolved\tin\tother\temerging\ttechnology\tventures.\nOur\tinformation\ttechnology\tsystems\tor\tdata,\tor\tthose\tof\tour\tservice\tproviders\tor\tcustomers\tor\tusers\tcould\tbe\tsubject\tto\tcyber-\nattacks\tor\tother\tsecurity\tincidents,\twhich\tcould\tresult\tin\tdata\tbreaches,\tintellectual\tproperty\ttheft,\tclaims,\tlitigation,\tregulatory\ninvestigations,\tsignificant\tliability,\treputational\tdamage\tand\tother\tadverse\tconsequences.\nWe\tcontinue\tto\texpand\tour\tinformation\ttechnology\tsystems\tas\tour\toperations\tgrow,\tsuch\tas\tproduct\tdata\tmanagement,\tprocurement,\tinventory\nmanagement,\tproduction\tplanning\tand\texecution,\tsales,\tservice\tand\tlogistics,\tdealer\tmanagement,\tfinancial,\ttax\tand\tregulatory\tcompliance\tsystems.\tThis\nincludes\tthe\timplementation\tof\tnew\tinternally\tdeveloped\tsystems\tand\tthe\tdeployment\tof\tsuch\tsystems\tin\tthe\tU.S.\tand\tabroad.\tWhile,\twe\tmaintain\ninformation\ttechnology\tmeasures\tdesigned\tto\tprotect\tus\tagainst\tintellectual\tproperty\ttheft,\tdata\tbreaches,\tsabotage\tand\tother\texternal\tor\tinternal\tcyber-\nattacks\tor\tmisappropriation,\tour\tsystems\tand\tthose\tof\tour\tservice\tproviders\tare\tpotentially\tvulnerable\tto\tmalware,\transomware,\tviruses,\tdenial-of-service\nattacks,\tphishing\tattacks,\tsocial\tengineering,\tcomputer\thacking,\tunauthorized\taccess,\texploitation\tof\tbugs,\tdefects\tand\tvulnerabilities,\tbreakdowns,\ndamage,\tinterruptions,\tsystem\tmalfunctions,\tpower\toutages,\tterrorism,\tacts\tof\tvandalism,\tsecurity\tbreaches,\tsecurity\tincidents,\tinadvertent\tor\tintentional\nactions\tby\temployees\tor\tother\tthird\tparties,\tand\tother\tcyber-attacks.\nTo\tthe\textent\tany\tsecurity\tincident\tresults\tin\tunauthorized\taccess\tor\tdamage\tto\tor\tacquisition,\tuse,\tcorruption,\tloss,\tdestruction,\talteration\tor\ndissemination\tof\tour\tdata,\tincluding\tintellectual\tproperty\tand\tpersonal\tinformation,\tor\tour\tproducts\tor\tvehicles,\tor\tfor\tit\tto\tbe\tbelieved\tor\treported\tthat\tany\nof\tthese\toccurred,\tit\tcould\tdisrupt\tour\tbusiness,\tharm\tour\treputation,\tcompel\tus\tto\tcomply\twith\tapplicable\tdata\tbreach\tnotification\tlaws,\tsubject\tus\tto\ttime\nconsuming,\tdistracting\tand\texpensive\tlitigation,\tregulatory\tinvestigation\tand\toversight,\tmandatory\tcorrective\taction,\trequire\tus\tto\tverify\tthe\tcorrectness\nof\tdatabase\tcontents,\tor\totherwise\tsubject\tus\tto\tliability\tunder\tlaws,\tregulations\tand\tcontractual\tobligations,\tincluding\tthose\tthat\tprotect\tthe\tprivacy\tand\nsecurity\tof\tpersonal\tinformation.\tThis\tcould\tresult\tin\tincreased\tcosts\tto\tus\tand\tresult\tin\tsignificant\tlegal\tand\tfinancial\texposure\tand/or\treputational\tharm.\nWe\talso\trely\ton\tservice\tproviders,\tand\tsimilar\tincidents\trelating\tto\ttheir\tinformation\ttechnology\tsystems\tcould\talso\thave\ta\tmaterial\tadverse\teffect\ton\nour\tbusiness.\tThere\thave\tbeen\tand\tmay\tcontinue\tto\tbe\tsignificant\tsupply\tchain\tattacks.', 'Table\tof\tContents\nSolar\tEnergy\tOfferings\nWe\tsell\tretrofit\tsolar\tenergy\tsystems\tto\tcustomers\tand\tchannel\tpartners\tand\talso\tmake\tthem\tavailable\tthrough\tpower\tpurchase\tagreement\t(“PPA”)\narrangements.\tWe\tpurchase\tmost\tof\tthe\tcomponents\tfor\tour\tretrofit\tsolar\tenergy\tsystems\tfrom\tmultiple\tsources\tto\tensure\tcompetitive\tpricing\tand\nadequate\tsupply.\tWe\talso\tdesign\tand\tmanufacture\tcertain\tcomponents\tfor\tour\tsolar\tenergy\tproducts.\nWe\tsell\tour\tSolar\tRoof,\twhich\tcombines\tpremium\tglass\troof\ttiles\twith\tenergy\tgeneration,\tdirectly\tto\tcustomers,\tas\twell\tas\tthrough\tchannel\ncustomers.\tWe\tcontinue\tto\timprove\tour\tinstallation\tcapability\tand\tefficiency,\tincluding\tthrough\tcollaboration\twith\treal\testate\tdevelopers\tand\tbuilders\ton\nnew\thomes.\nTechnology\nAutomotive\nBattery\tand\tPowertrain\nOur\tcore\tvehicle\ttechnology\tcompetencies\tinclude\tpowertrain\tengineering\tand\tmanufacturing\tand\tour\tability\tto\tdesign\tvehicles\tthat\tutilize\tthe\nunique\tadvantages\tof\tan\telectric\tpowertrain.\tWe\thave\tdesigned\tour\tproprietary\tpowertrain\tsystems\tto\tbe\tadaptable,\tefficient,\treliable\tand\tcost-effective\nwhile\twithstanding\tthe\trigors\tof\tan\tautomotive\tenvironment.\tWe\toffer\tdual\tmotor\tpowertrain\tvehicles,\twhich\tuse\ttwo\telectric\tmotors\tto\tmaximize\ttraction\nand\tperformance\tin\tan\tall-wheel\tdrive\tconfiguration,\tas\twell\tas\tvehicle\tpowertrain\ttechnology\tfeaturing\tthree\telectric\tmotors\tfor\tfurther\tincreased\nperformance\tin\tcertain\tversions\tof\tModel\tS\tand\tModel\tX,\tCybertruck\tand\tthe\tTesla\tSemi.\nWe\tmaintain\textensive\ttesting\tand\tR&D\tcapabilities\tfor\tbattery\tcells,\tpacks\tand\tsystems,\tand\thave\tbuilt\tan\texpansive\tbody\tof\tknowledge\ton\tlithium-\nion\tcell\tchemistry\ttypes\tand\tperformance\tcharacteristics.\tIn\torder\tto\tenable\ta\tgreater\tsupply\tof\tcells\tfor\tour\tproducts\twith\thigher\tenergy\tdensity\tat\tlower\ncosts,\twe\thave\tdeveloped\ta\tnew\tproprietary\tlithium-ion\tbattery\tcell\tand\timproved\tmanufacturing\tprocesses.\nVehicle\tControl\tand\tInfotainment\tSoftware\nThe\tperformance\tand\tsafety\tsystems\tof\tour\tvehicles\tand\ttheir\tbattery\tpacks\tutilize\tsophisticated\tcontrol\tsoftware.\tControl\tsystems\tin\tour\tvehicles\noptimize\tperformance,\tcustomize\tvehicle\tbehavior,\tmanage\tcharging\tand\tcontrol\tall\tinfotainment\tfunctions.\tWe\tdevelop\talmost\tall\tof\tthis\tsoftware,\nincluding\tmost\tof\tthe\tuser\tinterfaces,\tinternally\tand\tupdate\tour\tvehicles’\tsoftware\tregularly\tthrough\tover-the-air\tupdates.\nSelf-Driving\tDevelopment\tand\tArtificial\tIntelligence\nWe\thave\texpertise\tin\tdeveloping\ttechnologies,\tsystems\tand\tsoftware\tto\tenable\tself-driving\tvehicles\tusing\tprimarily\tvision-based\ttechnologies.\tOur\nFSD\tComputer\truns\tour\tneural\tnetworks\tin\tour\tvehicles,\tand\twe\tare\talso\tdeveloping\tadditional\tcomputer\thardware\tto\tbetter\tenable\tthe\tmassive\tamounts\nof\tfield\tdata\tcaptured\tby\tour\tvehicles\tto\tcontinually\ttrain\tand\timprove\tthese\tneural\tnetworks\tfor\treal-world\tperformance.\nCurrently,\twe\toffer\tin\tour\tvehicles\tcertain\tadvanced\tdriver\tassist\tsystems\tunder\tour\tAutopilot\tand\tFSD\tCapability\toptions.\tAlthough\tat\tpresent\tthe\ndriver\tis\tultimately\tresponsible\tfor\tcontrolling\tthe\tvehicle,\tour\tsystems\tprovide\tsafety\tand\tconvenience\tfunctionality\tthat\trelieves\tdrivers\tof\tthe\tmost\ntedious\tand\tpotentially\tdangerous\taspects\tof\troad\ttravel\tmuch\tlike\tthe\tsystem\tthat\tairplane\tpilots\tuse,\twhen\tconditions\tpermit.\tAs\twith\tother\tvehicle\nsystems,\twe\timprove\tthese\tfunctions\tin\tour\tvehicles\tover\ttime\tthrough\tover-the-air\tupdates.\nWe\tintend\tto\testablish\tin\tthe\tfuture\tan\tautonomous\tTesla\tride-hailing\tnetwork,\twhich\twe\texpect\twould\talso\tallow\tus\tto\taccess\ta\tnew\tcustomer\tbase\neven\tas\tmodes\tof\ttransportation\tevolve.']","We sell retrofit solar energy systems to customers and channel partners and also make them available through power purchase agreement (“PPA”) arrangements. We purchase most of the components for our retrofit solar energy systems from multiple sources to ensure competitive pricing and adequate supply. We also design and manufacture certain components for our solar energy products. 


We sell our Solar Roof, which combines premium glass roof tiles with energy generation, directly to customers, as well as through channel customers. We continue to improve our installation capability and efficiency, including through collaboration with real estate developers and builders on new homes. 
",Accelerate the world’s transition to sustainable energy,1.0,0.9999999999666667,1.0
What business segments does Tesla operate?,"['Table\tof\tContents\nPART\tI\nITEM\t1.\tBUSINESS\nOverview\nWe\tdesign,\tdevelop,\tmanufacture,\tsell\tand\tlease\thigh-performance\tfully\telectric\tvehicles\tand\tenergy\tgeneration\tand\tstorage\tsystems,\tand\toffer\nservices\trelated\tto\tour\tproducts.\tWe\tgenerally\tsell\tour\tproducts\tdirectly\tto\tcustomers,\tand\tcontinue\tto\tgrow\tour\tcustomer-facing\tinfrastructure\tthrough\ta\nglobal\tnetwork\tof\tvehicle\tshowrooms\tand\tservice\tcenters,\tMobile\tService,\tbody\tshops,\tSupercharger\tstations\tand\tDestination\tChargers\tto\taccelerate\tthe\nwidespread\tadoption\tof\tour\tproducts.\tWe\temphasize\tperformance,\tattractive\tstyling\tand\tthe\tsafety\tof\tour\tusers\tand\tworkforce\tin\tthe\tdesign\tand\nmanufacture\tof\tour\tproducts\tand\tare\tcontinuing\tto\tdevelop\tfull\tself-driving\ttechnology\tfor\timproved\tsafety.\tWe\talso\tstrive\tto\tlower\tthe\tcost\tof\townership\nfor\tour\tcustomers\tthrough\tcontinuous\tefforts\tto\treduce\tmanufacturing\tcosts\tand\tby\toffering\tfinancial\tand\tother\tservices\ttailored\tto\tour\tproducts.\nOur\tmission\tis\tto\taccelerate\tthe\tworld’s\ttransition\tto\tsustainable\tenergy.\tWe\tbelieve\tthat\tthis\tmission,\talong\twith\tour\tengineering\texpertise,\nvertically\tintegrated\tbusiness\tmodel\tand\tfocus\ton\tuser\texperience\tdifferentiate\tus\tfrom\tother\tcompanies.\nSegment\tInformation\nWe\toperate\tas\ttwo\treportable\tsegments:\t(i)\tautomotive\tand\t(ii)\tenergy\tgeneration\tand\tstorage.\nThe\tautomotive\tsegment\tincludes\tthe\tdesign,\tdevelopment,\tmanufacturing,\tsales\tand\tleasing\tof\thigh-performance\tfully\telectric\tvehicles\tas\twell\tas\nsales\tof\tautomotive\tregulatory\tcredits.\tAdditionally,\tthe\tautomotive\tsegment\talso\tincludes\tservices\tand\tother,\twhich\tincludes\tsales\tof\tused\tvehicles,\tnon-\nwarranty\tafter-sales\tvehicle\tservices,\tbody\tshop\tand\tparts,\tpaid\tSupercharging,\tvehicle\tinsurance\trevenue\tand\tretail\tmerchandise.\tThe\tenergy\tgeneration\nand\tstorage\tsegment\tincludes\tthe\tdesign,\tmanufacture,\tinstallation,\tsales\tand\tleasing\tof\tsolar\tenergy\tgeneration\tand\tenergy\tstorage\tproducts\tand\trelated\nservices\tand\tsales\tof\tsolar\tenergy\tsystems\tincentives.\nOur\tProducts\tand\tServices\nAutomotive\nWe\tcurrently\tmanufacture\tfive\tdifferent\tconsumer\tvehicles\t–\tthe\tModel\t3,\tY,\tS,\tX\tand\tCybertruck.\tModel\t3\tis\ta\tfour-door\tmid-size\tsedan\tthat\twe\ndesigned\tfor\tmanufacturability\twith\ta\tbase\tprice\tfor\tmass-market\tappeal.\tModel\tY\tis\ta\tcompact\tsport\tutility\tvehicle\t(“SUV”)\tbuilt\ton\tthe\tModel\t3\tplatform\nwith\tseating\tfor\tup\tto\tseven\tadults.\tModel\tS\tis\ta\tfour-door\tfull-size\tsedan\tand\tModel\tX\tis\ta\tmid-size\tSUV\twith\tseating\tfor\tup\tto\tseven\tadults.\tModel\tS\tand\nModel\tX\tfeature\tthe\thighest\tperformance\tcharacteristics\tand\tlongest\tranges\tthat\twe\toffer\tin\ta\tsedan\tand\tSUV,\trespectively.\tIn\tNovember\t2023,\twe\nentered\tthe\tconsumer\tpickup\ttruck\tmarket\twith\tfirst\tdeliveries\tof\tthe\tCybertruck,\ta\tfull-size\telectric\tpickup\ttruck\twith\ta\tstainless\tsteel\texterior\tthat\thas\nthe\tutility\tand\tstrength\tof\ta\ttruck\twhile\tfeaturing\tthe\tspeed\tof\ta\tsports\tcar.\nIn\t2022,\twe\talso\tbegan\tearly\tproduction\tand\tdeliveries\tof\ta\tcommercial\telectric\tvehicle,\tthe\tTesla\tSemi.\tWe\thave\tplanned\telectric\tvehicles\tto\naddress\tadditional\tvehicle\tmarkets,\tand\tto\tcontinue\tleveraging\tdevelopments\tin\tour\tproprietary\tFull\tSelf-Driving\t(“FSD”)\tCapability\tfeatures,\tbattery\tcell\nand\tother\ttechnologies.\nEnergy\tGeneration\tand\tStorage\nEnergy\tStorage\tProducts\nPowerwall\tand\tMegapack\tare\tour\tlithium-ion\tbattery\tenergy\tstorage\tproducts.', 'Note\t18\t–\t\nSegment\tReporting\tand\tInformation\tabout\tGeographic\tAreas\nWe\thave\t\ntwo\n\toperating\tand\treportable\tsegments:\t(i)\tautomotive\tand\t(ii)\tenergy\tgeneration\tand\tstorage.\tThe\tautomotive\tsegment\tincludes\tthe\ndesign,\tdevelopment,\tmanufacturing,\tsales\tand\tleasing\tof\telectric\tvehicles\tas\twell\tas\tsales\tof\tautomotive\tregulatory\tcredits.\tAdditionally,\tthe\tautomotive\nsegment\tis\talso\tcomprised\tof\tservices\tand\tother,\twhich\tincludes\tsales\tof\tused\tvehicles,\tnon-warranty\tafter-sales\tvehicle\tservices,\tbody\tshop\tand\tparts,\npaid\tSupercharging,\tvehicle\tinsurance\trevenue\tand\tretail\tmerchandise.\tThe\tenergy\tgeneration\tand\tstorage\tsegment\tincludes\tthe\tdesign,\tmanufacture,\ninstallation,\tsales\tand\tleasing\tof\tsolar\tenergy\tgeneration\tand\tenergy\tstorage\tproducts\tand\trelated\tservices\tand\tsales\tof\tsolar\tenergy\tsystems\tincentives.\nOur\tCODM\tdoes\tnot\tevaluate\toperating\tsegments\tusing\tasset\tor\tliability\tinformation.\t\nThe\tfollowing\ttable\tpresents\trevenues\tand\tgross\tprofit\tby\treportable\nsegment\t(in\tmillions):\nYear\tEnded\tDecember\t31,\n2023\n2022\n2021\nAutomotive\tsegment\n\t\n\t\nRevenues\n$\n90,738\n\t\n$\n77,553\n\t\n$\n51,034\n\t\nGross\tprofit\n$\n16,519\n\t\n$\n20,565\n\t\n$\n13,735\n\t\nEnergy\tgeneration\tand\tstorage\tsegment\n\t\n\t\nRevenues\n$\n6,035\n\t\n$\n3,909\n\t\n$\n2,789\n\t\nGross\tprofit\n$\n1,141\n\t\n$\n288\n\t\n$\n(\n129\n)\nThe\tfollowing\ttable\tpresents\trevenues\tby\tgeographic\tarea\tbased\ton\tthe\tsales\tlocation\tof\tour\tproducts\t(in\tmillions):\nYear\tEnded\tDecember\t31,\n2023\n2022\n2021\nUnited\tStates\n$\n45,235\n\t\n$\n40,553\n\t\n$\n23,973\n\t\nChina\n21,745\n\t\n18,145\n\t\n13,844\n\t\nOther\tinternational\n29,793\n\t\n22,764\n\t\n16,006\n\t\nTotal\n$\n96,773\n\t\n$\n81,462\n\t\n$\n53,823\n\t\nThe\tfollowing\ttable\tpresents\tlong-lived\tassets\tby\tgeographic\tarea\t(in\tmillions):\nDecember\t31,\n2023\nDecember\t31,\n2022\nUnited\tStates\n$\n26,629\n\t\n$\n21,667\n\t\nGermany\n4,258\n\t\n3,547\n\t\nChina\n2,820\n\t\n2,978\n\t\nOther\tinternational\n1,247\n\t\n845\n\t\nTotal\n$\n34,954\n\t\n$\n29,037\n\t\nThe\tfollowing\ttable\tpresents\tinventory\tby\treportable\tsegment\t(in\tmillions):\nDecember\t31,\n2023\nDecember\t31,\n2022\nAutomotive\n$\n11,139\n\t\n$\n10,996\n\t\nEnergy\tgeneration\tand\tstorage\n2,487\n\t\n1,843\n\t\nTotal\n$\n13,626\n\t\n$\n12,839\n\t\nNote\t19\t–\t\nRestructuring\tand\tOther\nDuring\tthe\tyears\tended\tDecember\t31,\t2022\tand\t2021,\twe\t\nrecorded\n\t$\n204\n\tmillion\tand\t$\n101\n\tmillion,\trespectively,\tof\timpairment\tlosses\ton\tdigital\nassets.\tDuring\tthe\tyears\tended\tDecember\t31,\t2022\tand\t2021\twe\talso\trealized\tgains\tof\t$\n64\n\tmillion\tand\t$\n128\n\tmillion,\trespectively,\tin\tconnection\twith\nconverting\tour\tholdings\tof\tdigital\tassets\tinto\tfiat\tcurrency.\tWe\talso\trecorded\tother\texpenses\tof\t$\n36\n\tmillion\tduring\tthe\tsecond\tquarter\tof\tthe\tyear\tended\nDecember\t31,\t2022,\trelated\tto\temployee\tterminations.\n92', 'ITEM\t7.\tMANAGEMENT’S\tDISCUSSION\tAND\tANALYSIS\tOF\tFINANCIAL\tCONDITION\tAND\tRESULTS\tOF\tOPERATIONS\nThe\tfollowing\tdiscussion\tand\tanalysis\tshould\tbe\tread\tin\tconjunction\twith\tthe\tconsolidated\tfinancial\tstatements\tand\tthe\trelated\tnotes\tincluded\nelsewhere\tin\tthis\tAnnual\tReport\ton\tForm\t10-K.\tFor\tfurther\tdiscussion\tof\tour\tproducts\tand\tservices,\ttechnology\tand\tcompetitive\tstrengths,\trefer\tto\tItem\t1-\nBusiness.\tFor\tdiscussion\trelated\tto\tchanges\tin\tfinancial\tcondition\tand\tthe\tresults\tof\toperations\tfor\tfiscal\tyear\t2022-related\titems,\trefer\tto\tPart\tII,\tItem\t7.\nManagement’s\tDiscussion\tand\tAnalysis\tof\tFinancial\tCondition\tand\tResults\tof\tOperations\tin\tour\tAnnual\tReport\ton\tForm\t10-K\tfor\tfiscal\tyear\t2022,\twhich\twas\nfiled\twith\tthe\tSecurities\tand\tExchange\tCommission\ton\tJanuary\t31,\t2023.\nOverview\tand\t2023\tHighlights\nOur\tmission\tis\tto\taccelerate\tthe\tworld’s\ttransition\tto\tsustainable\tenergy.\tWe\tdesign,\tdevelop,\tmanufacture,\tlease\tand\tsell\thigh-performance\tfully\nelectric\tvehicles,\tsolar\tenergy\tgeneration\tsystems\tand\tenergy\tstorage\tproducts.\tWe\talso\toffer\tmaintenance,\tinstallation,\toperation,\tcharging,\tinsurance,\nfinancial\tand\tother\tservices\trelated\tto\tour\tproducts.\tAdditionally,\twe\tare\tincreasingly\tfocused\ton\tproducts\tand\tservices\tbased\ton\tartificial\tintelligence,\nrobotics\tand\tautomation.\nIn\t2023,\twe\tproduced\t1,845,985\tconsumer\tvehicles\tand\tdelivered\t1,808,581\tconsumer\tvehicles.\tWe\tare\tcurrently\tfocused\ton\tincreasing\tvehicle\nproduction,\tcapacity\tand\tdelivery\tcapabilities,\treducing\tcosts,\timproving\tand\tdeveloping\tour\tvehicles\tand\tbattery\ttechnologies,\tvertically\tintegrating\tand\nlocalizing\tour\tsupply\tchain,\timproving\tand\tfurther\tdeploying\tour\tFSD\tcapabilities,\tincreasing\tthe\taffordability\tand\tefficiency\tof\tour\tvehicles,\tbringing\tnew\nproducts\tto\tmarket\tand\texpanding\tour\tglobal\tinfrastructure,\tincluding\tour\tservice\tand\tcharging\tinfrastructure.\nIn\t2023,\twe\tdeployed\t14.72\tGWh\tof\tenergy\tstorage\tproducts\tand\t223\tmegawatts\tof\tsolar\tenergy\tsystems.\tWe\tare\tcurrently\tfocused\ton\tramping\nproduction\tof\tenergy\tstorage\tproducts,\timproving\tour\tSolar\tRoof\tinstallation\tcapability\tand\tefficiency,\tand\tincreasing\tmarket\tshare\tof\tretrofit\tsolar\tenergy\nsystems.\nIn\t2023,\twe\trecognized\ttotal\trevenues\tof\t$96.77\tbillion,\trepresenting\tan\tincrease\tof\t$15.31\tbillion,\tcompared\tto\tthe\tprior\tyear.\tWe\tcontinue\tto\tramp\nproduction,\tbuild\tnew\tmanufacturing\tcapacity\tand\texpand\tour\toperations\tto\tenable\tincreased\tdeliveries\tand\tdeployments\tof\tour\tproducts,\tand\tinvest\tin\nresearch\tand\tdevelopment\tto\taccelerate\tour\tAI,\tsoftware\tand\tfleet-based\tprofits\tfor\tfurther\trevenue\tgrowth.\nIn\t2023,\tour\tnet\tincome\tattributable\tto\tcommon\tstockholders\twas\t$15.00\tbillion,\trepresenting\ta\tfavorable\tchange\tof\t$2.44\tbillion,\tcompared\tto\tthe\nprior\tyear.\tThis\tincluded\ta\tone-time\tnon-cash\ttax\tbenefit\tof\t$5.93\tbillion\tfor\tthe\trelease\tof\tvaluation\tallowance\ton\tcertain\tdeferred\ttax\tassets.\tWe\tcontinue\nto\tfocus\ton\tfurther\tcost\treductions\tand\toperational\tefficiencies\twhile\tmaximizing\tdelivery\tvolumes.\nWe\tended\t2023\twith\t$29.09\tbillion\tin\tcash\tand\tcash\tequivalents\tand\tinvestments,\trepresenting\tan\tincrease\tof\t$6.91\tbillion\tfrom\tthe\tend\tof\t2022.\nOur\tcash\tflows\tprovided\tby\toperating\tactivities\tin\t2023\tand\t2022\twere\t$13.26\tbillion\tand\t$14.72\tbillion,\trespectively,\trepresenting\ta\tdecrease\tof\t$1.47\nbillion.', 'Our\tcybersecurity\trisk\tmanagement\tand\tstrategy\tprocesses\tare\toverseen\tby\tleaders\tfrom\tour\tInformation\tSecurity,\tProduct\tSecurity,\tCompliance\nand\tLegal\tteams.\tSuch\tindividuals\thave\tan\taverage\tof\tover\t15\tyears\tof\tprior\twork\texperience\tin\tvarious\troles\tinvolving\tinformation\ttechnology,\tincluding\nsecurity,\tauditing,\tcompliance,\tsystems\tand\tprogramming.\tThese\tindividuals\tare\tinformed\tabout,\tand\tmonitor\tthe\tprevention,\tmitigation,\tdetection\tand\nremediation\tof\tcybersecurity\tincidents\tthrough\ttheir\tmanagement\tof,\tand\tparticipation\tin,\tthe\tcybersecurity\trisk\tmanagement\tand\tstrategy\tprocesses\ndescribed\tabove,\tincluding\tthe\toperation\tof\tour\tincident\tresponse\tplan,\tand\treport\tto\tthe\tAudit\tCommittee\ton\tany\tappropriate\titems.\nITEM\t2.\tPROPERTIES\nWe\tare\theadquartered\tin\tAustin,\tTexas.\tOur\tprincipal\tfacilities\tinclude\ta\tlarge\tnumber\tof\tproperties\tin\tNorth\tAmerica,\tEurope\tand\tAsia\tutilized\tfor\nmanufacturing\tand\tassembly,\twarehousing,\tengineering,\tretail\tand\tservice\tlocations,\tSupercharger\tsites\tand\tadministrative\tand\tsales\toffices.\tOur\tfacilities\nare\tused\tto\tsupport\tboth\tof\tour\treporting\tsegments,\tand\tare\tsuitable\tand\tadequate\tfor\tthe\tconduct\tof\tour\tbusiness.\tWe\tgenerally\tlease\tsuch\tfacilities\twith\nthe\tprimary\texception\tof\tsome\tmanufacturing\tfacilities.\tThe\tfollowing\ttable\tsets\tforth\tthe\tlocation\tof\tour\tprimary\towned\tand\tleased\tmanufacturing\nfacilities.\nPrimary\tManufacturing\tFacilities\nLocation\nOwned\tor\tLeased\nGigafactory\tTexas\nAustin,\tTexas\nOwned\nFremont\tFactory\nFremont,\tCalifornia\nOwned\nGigafactory\tNevada\nSparks,\tNevada\nOwned\nGigafactory\tBerlin-Brandenburg\nGrunheide,\tGermany\nOwned\nGigafactory\tShanghai\nShanghai,\tChina\n*\nGigafactory\tNew\tYork\nBuffalo,\tNew\tYork\nLeased\nMegafactory\nLathrop,\tCalifornia\nLeased\n*\nWe\town\tthe\tbuilding\tand\tthe\tland\tuse\trights\twith\tan\tinitial\tterm\tof\t50\tyears.\tThe\tland\tuse\trights\tare\ttreated\tas\toperating\tlease\tright-of-use\tassets.\nITEM\t3.\tLEGAL\tPROCEEDINGS\nFor\ta\tdescription\tof\tour\tmaterial\tpending\tlegal\tproceedings,\tplease\tsee\tNote\t15,\t\nCommitments\tand\tContingencies\n,\tto\tthe\tconsolidated\tfinancial\nstatements\tincluded\telsewhere\tin\tthis\tAnnual\tReport\ton\tForm\t10-K.\nIn\taddition,\teach\tof\tthe\tmatters\tbelow\tis\tbeing\tdisclosed\tpursuant\tto\tItem\t103\tof\tRegulation\tS-K\tbecause\tit\trelates\tto\tenvironmental\tregulations\tand\naggregate\tcivil\tpenalties\tthat\twe\tcurrently\tbelieve\tcould\tpotentially\texceed\t$1\tmillion.\tWe\tbelieve\tthat\tany\tproceeding\tthat\tis\tmaterial\tto\tour\tbusiness\tor\nfinancial\tcondition\tis\tlikely\tto\thave\tpotential\tpenalties\tfar\tin\texcess\tof\tsuch\tamount.\nDistrict\tattorneys\tin\tcertain\tCalifornia\tcounties\tconducted\tan\tinvestigation\tinto\tTesla’s\twaste\tsegregation\tpractices\tpursuant\tto\tCal.\tHealth\t&\tSaf.\nCode\t§\t25100\tet\tseq.\tand\tCal.\tCivil\tCode\t§\t1798.80.\tTesla\thas\timplemented\tvarious\tremedial\tmeasures,\tincluding\tconducting\ttraining\tand\taudits,\tand\nenhancements\tto\tits\tsite\twaste\tmanagement\tprograms,\tand\tsettlement\tdiscussions\tare\tongoing.\tWhile\tthe\toutcome\tof\tthis\tmatter\tcannot\tbe\tdetermined\nat\tthis\ttime,\tit\tis\tnot\tcurrently\texpected\tto\thave\ta\tmaterial\tadverse\timpact\ton\tour\tbusiness.\nITEM\t4.\tMINE\tSAFETY\tDISCLOSURES\nNot\tapplicable.\n30', 'Tesla,\tInc.\nNotes\tto\tConsolidated\tFinancial\tStatements\nNote\t1\t–\t\nOverview\nTesla,\tInc.\t(“Tesla”,\tthe\t“Company”,\t“we”,\t“us”\tor\t“our”)\twas\tincorporated\tin\tthe\tState\tof\tDelaware\ton\tJuly\t1,\t2003.\tWe\tdesign,\tdevelop,\nmanufacture,\tsell\tand\tlease\thigh-performance\tfully\telectric\tvehicles\tand\tenergy\tgeneration\tand\tstorage\tsystems,\tand\toffer\tservices\trelated\tto\tour\nproducts.\tOur\tChief\tExecutive\tOfficer,\tas\tthe\tchief\toperating\tdecision\tmaker\t(“CODM”),\torganizes\tour\tcompany,\tmanages\tresource\tallocations\tand\nmeasures\tperformance\tamong\t\ntwo\n\toperating\tand\treportable\tsegments:\t(i)\tautomotive\tand\t(ii)\tenergy\tgeneration\tand\tstorage.\nNote\t2\t–\t\nSummary\tof\tSignificant\tAccounting\tPolicies\nPrinciples\tof\tConsolidation\nThe\taccompanying\tconsolidated\tfinancial\tstatements\thave\tbeen\tprepared\tin\tconformity\twith\tGAAP\tand\treflect\tour\taccounts\tand\toperations\tand\nthose\tof\tour\tsubsidiaries\tin\twhich\twe\thave\ta\tcontrolling\tfinancial\tinterest.\tIn\taccordance\twith\tthe\tprovisions\tof\tASC\t810,\t\nConsolidation\t\n(“ASC\t810”),\twe\nconsolidate\tany\tvariable\tinterest\tentity\t(“VIE”)\tof\twhich\twe\tare\tthe\tprimary\tbeneficiary.\tWe\thave\tformed\tVIEs\twith\tfinancing\tfund\tinvestors\tin\tthe\tordinary\ncourse\tof\tbusiness\tin\torder\tto\tfacilitate\tthe\tfunding\tand\tmonetization\tof\tcertain\tattributes\tassociated\twith\tsolar\tenergy\tsystems\tand\tleases\tunder\tour\ndirect\tvehicle\tleasing\tprograms.\tThe\ttypical\tcondition\tfor\ta\tcontrolling\tfinancial\tinterest\townership\tis\tholding\ta\tmajority\tof\tthe\tvoting\tinterests\tof\tan\tentity;\nhowever,\ta\tcontrolling\tfinancial\tinterest\tmay\talso\texist\tin\tentities,\tsuch\tas\tVIEs,\tthrough\tarrangements\tthat\tdo\tnot\tinvolve\tcontrolling\tvoting\tinterests.\tASC\n810\trequires\ta\tvariable\tinterest\tholder\tto\tconsolidate\ta\tVIE\tif\tthat\tparty\thas\tthe\tpower\tto\tdirect\tthe\tactivities\tof\tthe\tVIE\tthat\tmost\tsignificantly\timpact\tthe\nVIE’s\teconomic\tperformance\tand\tthe\tobligation\tto\tabsorb\tlosses\tof\tthe\tVIE\tthat\tcould\tpotentially\tbe\tsignificant\tto\tthe\tVIE\tor\tthe\tright\tto\treceive\tbenefits\nfrom\tthe\tVIE\tthat\tcould\tpotentially\tbe\tsignificant\tto\tthe\tVIE.\tWe\tdo\tnot\tconsolidate\ta\tVIE\tin\twhich\twe\thave\ta\tmajority\townership\tinterest\twhen\twe\tare\tnot\nconsidered\tthe\tprimary\tbeneficiary.\tWe\thave\tdetermined\tthat\twe\tare\tthe\tprimary\tbeneficiary\tof\tall\tthe\tVIEs\t(see\tNote\t16\n,\tVariable\tInterest\tEntity\nArrangements\n).\tWe\tevaluate\tour\trelationships\twith\tall\tthe\tVIEs\ton\tan\tongoing\tbasis\tto\tensure\tthat\twe\tcontinue\tto\tbe\tthe\tprimary\tbeneficiary.\tAll\nintercompany\ttransactions\tand\tbalances\thave\tbeen\teliminated\tupon\tconsolidation.\nUse\tof\tEstimates\nThe\tpreparation\tof\tfinancial\tstatements\tin\tconformity\twith\tGAAP\trequires\tmanagement\tto\tmake\testimates\tand\tassumptions\tthat\taffect\tthe\treported\namounts\tof\tassets,\tliabilities,\trevenues,\tcosts\tand\texpenses\tand\trelated\tdisclosures\tin\tthe\taccompanying\tnotes.\tThe\testimates\tused\tfor,\tbut\tnot\tlimited\tto,\ndetermining\tsignificant\teconomic\tincentive\tfor\tresale\tvalue\tguarantee\tarrangements,\tsales\treturn\treserves,\tincome\ttaxes,\tthe\tcollectability\tof\taccounts\nand\tfinance\treceivables,\tinventory\tvaluation,\twarranties,\tfair\tvalue\tof\tlong-lived\tassets,\tgoodwill,\tfair\tvalue\tof\tfinancial\tinstruments,\tfair\tvalue\tand\tresidual\nvalue\tof\toperating\tlease\tvehicles\tand\tsolar\tenergy\tsystems\tsubject\tto\tleases\tcould\tbe\timpacted.']","Tesla operates as two reportable segments: automotive and energy generation and storage.  
",Two segments: automotive; energy generation and storage,1.0,0.94999999997625,1.0
What products and services are included in Tesla’s automotive segment?,"['Table\tof\tContents\nPART\tI\nITEM\t1.\tBUSINESS\nOverview\nWe\tdesign,\tdevelop,\tmanufacture,\tsell\tand\tlease\thigh-performance\tfully\telectric\tvehicles\tand\tenergy\tgeneration\tand\tstorage\tsystems,\tand\toffer\nservices\trelated\tto\tour\tproducts.\tWe\tgenerally\tsell\tour\tproducts\tdirectly\tto\tcustomers,\tand\tcontinue\tto\tgrow\tour\tcustomer-facing\tinfrastructure\tthrough\ta\nglobal\tnetwork\tof\tvehicle\tshowrooms\tand\tservice\tcenters,\tMobile\tService,\tbody\tshops,\tSupercharger\tstations\tand\tDestination\tChargers\tto\taccelerate\tthe\nwidespread\tadoption\tof\tour\tproducts.\tWe\temphasize\tperformance,\tattractive\tstyling\tand\tthe\tsafety\tof\tour\tusers\tand\tworkforce\tin\tthe\tdesign\tand\nmanufacture\tof\tour\tproducts\tand\tare\tcontinuing\tto\tdevelop\tfull\tself-driving\ttechnology\tfor\timproved\tsafety.\tWe\talso\tstrive\tto\tlower\tthe\tcost\tof\townership\nfor\tour\tcustomers\tthrough\tcontinuous\tefforts\tto\treduce\tmanufacturing\tcosts\tand\tby\toffering\tfinancial\tand\tother\tservices\ttailored\tto\tour\tproducts.\nOur\tmission\tis\tto\taccelerate\tthe\tworld’s\ttransition\tto\tsustainable\tenergy.\tWe\tbelieve\tthat\tthis\tmission,\talong\twith\tour\tengineering\texpertise,\nvertically\tintegrated\tbusiness\tmodel\tand\tfocus\ton\tuser\texperience\tdifferentiate\tus\tfrom\tother\tcompanies.\nSegment\tInformation\nWe\toperate\tas\ttwo\treportable\tsegments:\t(i)\tautomotive\tand\t(ii)\tenergy\tgeneration\tand\tstorage.\nThe\tautomotive\tsegment\tincludes\tthe\tdesign,\tdevelopment,\tmanufacturing,\tsales\tand\tleasing\tof\thigh-performance\tfully\telectric\tvehicles\tas\twell\tas\nsales\tof\tautomotive\tregulatory\tcredits.\tAdditionally,\tthe\tautomotive\tsegment\talso\tincludes\tservices\tand\tother,\twhich\tincludes\tsales\tof\tused\tvehicles,\tnon-\nwarranty\tafter-sales\tvehicle\tservices,\tbody\tshop\tand\tparts,\tpaid\tSupercharging,\tvehicle\tinsurance\trevenue\tand\tretail\tmerchandise.\tThe\tenergy\tgeneration\nand\tstorage\tsegment\tincludes\tthe\tdesign,\tmanufacture,\tinstallation,\tsales\tand\tleasing\tof\tsolar\tenergy\tgeneration\tand\tenergy\tstorage\tproducts\tand\trelated\nservices\tand\tsales\tof\tsolar\tenergy\tsystems\tincentives.\nOur\tProducts\tand\tServices\nAutomotive\nWe\tcurrently\tmanufacture\tfive\tdifferent\tconsumer\tvehicles\t–\tthe\tModel\t3,\tY,\tS,\tX\tand\tCybertruck.\tModel\t3\tis\ta\tfour-door\tmid-size\tsedan\tthat\twe\ndesigned\tfor\tmanufacturability\twith\ta\tbase\tprice\tfor\tmass-market\tappeal.\tModel\tY\tis\ta\tcompact\tsport\tutility\tvehicle\t(“SUV”)\tbuilt\ton\tthe\tModel\t3\tplatform\nwith\tseating\tfor\tup\tto\tseven\tadults.\tModel\tS\tis\ta\tfour-door\tfull-size\tsedan\tand\tModel\tX\tis\ta\tmid-size\tSUV\twith\tseating\tfor\tup\tto\tseven\tadults.\tModel\tS\tand\nModel\tX\tfeature\tthe\thighest\tperformance\tcharacteristics\tand\tlongest\tranges\tthat\twe\toffer\tin\ta\tsedan\tand\tSUV,\trespectively.\tIn\tNovember\t2023,\twe\nentered\tthe\tconsumer\tpickup\ttruck\tmarket\twith\tfirst\tdeliveries\tof\tthe\tCybertruck,\ta\tfull-size\telectric\tpickup\ttruck\twith\ta\tstainless\tsteel\texterior\tthat\thas\nthe\tutility\tand\tstrength\tof\ta\ttruck\twhile\tfeaturing\tthe\tspeed\tof\ta\tsports\tcar.\nIn\t2022,\twe\talso\tbegan\tearly\tproduction\tand\tdeliveries\tof\ta\tcommercial\telectric\tvehicle,\tthe\tTesla\tSemi.\tWe\thave\tplanned\telectric\tvehicles\tto\naddress\tadditional\tvehicle\tmarkets,\tand\tto\tcontinue\tleveraging\tdevelopments\tin\tour\tproprietary\tFull\tSelf-Driving\t(“FSD”)\tCapability\tfeatures,\tbattery\tcell\nand\tother\ttechnologies.\nEnergy\tGeneration\tand\tStorage\nEnergy\tStorage\tProducts\nPowerwall\tand\tMegapack\tare\tour\tlithium-ion\tbattery\tenergy\tstorage\tproducts.', 'We\texpect\tthat\tthis\tfunctionality\twill\talso\tallow\tus\tto\toffer\tcertain\toptions\tand\tfeatures\ton\ta\nsubscription\tbasis\tin\tthe\tfuture.\nEnergy\tGeneration\tand\tStorage\nWe\tmarket\tand\tsell\tour\tsolar\tand\tenergy\tstorage\tproducts\tto\tresidential,\tcommercial\tand\tindustrial\tcustomers\tand\tutilities\tthrough\ta\tvariety\tof\nchannels,\tincluding\tthrough\tour\twebsite,\tstores\tand\tgalleries,\tas\twell\tas\tthrough\tour\tnetwork\tof\tchannel\tpartners,\tand\tin\tthe\tcase\tof\tsome\tcommercial\ncustomers,\tthrough\tPPA\ttransactions.\tWe\temphasize\tsimplicity,\tstandardization\tand\taccessibility\tto\tmake\tit\teasy\tand\tcost-effective\tfor\tcustomers\tto\tadopt\nclean\tenergy,\twhile\treducing\tour\tcustomer\tacquisition\tcosts.\nService\tand\tWarranty\nAutomotive\nService\nWe\tprovide\tservice\tfor\tour\telectric\tvehicles\tat\tour\tcompany-owned\tservice\tlocations\tand\tthrough\tTesla\tMobile\tService\ttechnicians\twho\tperform\twork\nremotely\tat\tcustomers’\thomes\tor\tother\tlocations.\tServicing\tthe\tvehicles\tourselves\tallows\tus\tto\tidentify\tproblems\tand\timplement\tsolutions\tand\nimprovements\tfaster\tthan\ttraditional\tautomobile\tmanufacturers\tand\ttheir\tdealer\tnetworks.\tThe\tconnectivity\tof\tour\tvehicles\talso\tallows\tus\tto\tdiagnose\tand\nremedy\tmany\tproblems\tremotely\tand\tproactively.\nVehicle\tLimited\tWarranties\tand\tExtended\tService\tPlans\nWe\tprovide\ta\tmanufacturer’s\tlimited\twarranty\ton\tall\tnew\tand\tused\tTesla\tvehicles\twe\tsell\tdirectly\tto\tconsumers,\twhich\tmay\tinclude\tlimited\nwarranties\ton\tcertain\tcomponents,\tspecific\ttypes\tof\tdamage\tor\tbattery\tcapacity\tretention.\tWe\talso\tcurrently\toffer\toptional\textended\tservice\tplans\tthat\nprovide\tcoverage\tbeyond\tthe\tnew\tvehicle\tlimited\twarranties\tfor\tcertain\tmodels\tin\tspecified\tregions.\n7', 'Note\t18\t–\t\nSegment\tReporting\tand\tInformation\tabout\tGeographic\tAreas\nWe\thave\t\ntwo\n\toperating\tand\treportable\tsegments:\t(i)\tautomotive\tand\t(ii)\tenergy\tgeneration\tand\tstorage.\tThe\tautomotive\tsegment\tincludes\tthe\ndesign,\tdevelopment,\tmanufacturing,\tsales\tand\tleasing\tof\telectric\tvehicles\tas\twell\tas\tsales\tof\tautomotive\tregulatory\tcredits.\tAdditionally,\tthe\tautomotive\nsegment\tis\talso\tcomprised\tof\tservices\tand\tother,\twhich\tincludes\tsales\tof\tused\tvehicles,\tnon-warranty\tafter-sales\tvehicle\tservices,\tbody\tshop\tand\tparts,\npaid\tSupercharging,\tvehicle\tinsurance\trevenue\tand\tretail\tmerchandise.\tThe\tenergy\tgeneration\tand\tstorage\tsegment\tincludes\tthe\tdesign,\tmanufacture,\ninstallation,\tsales\tand\tleasing\tof\tsolar\tenergy\tgeneration\tand\tenergy\tstorage\tproducts\tand\trelated\tservices\tand\tsales\tof\tsolar\tenergy\tsystems\tincentives.\nOur\tCODM\tdoes\tnot\tevaluate\toperating\tsegments\tusing\tasset\tor\tliability\tinformation.\t\nThe\tfollowing\ttable\tpresents\trevenues\tand\tgross\tprofit\tby\treportable\nsegment\t(in\tmillions):\nYear\tEnded\tDecember\t31,\n2023\n2022\n2021\nAutomotive\tsegment\n\t\n\t\nRevenues\n$\n90,738\n\t\n$\n77,553\n\t\n$\n51,034\n\t\nGross\tprofit\n$\n16,519\n\t\n$\n20,565\n\t\n$\n13,735\n\t\nEnergy\tgeneration\tand\tstorage\tsegment\n\t\n\t\nRevenues\n$\n6,035\n\t\n$\n3,909\n\t\n$\n2,789\n\t\nGross\tprofit\n$\n1,141\n\t\n$\n288\n\t\n$\n(\n129\n)\nThe\tfollowing\ttable\tpresents\trevenues\tby\tgeographic\tarea\tbased\ton\tthe\tsales\tlocation\tof\tour\tproducts\t(in\tmillions):\nYear\tEnded\tDecember\t31,\n2023\n2022\n2021\nUnited\tStates\n$\n45,235\n\t\n$\n40,553\n\t\n$\n23,973\n\t\nChina\n21,745\n\t\n18,145\n\t\n13,844\n\t\nOther\tinternational\n29,793\n\t\n22,764\n\t\n16,006\n\t\nTotal\n$\n96,773\n\t\n$\n81,462\n\t\n$\n53,823\n\t\nThe\tfollowing\ttable\tpresents\tlong-lived\tassets\tby\tgeographic\tarea\t(in\tmillions):\nDecember\t31,\n2023\nDecember\t31,\n2022\nUnited\tStates\n$\n26,629\n\t\n$\n21,667\n\t\nGermany\n4,258\n\t\n3,547\n\t\nChina\n2,820\n\t\n2,978\n\t\nOther\tinternational\n1,247\n\t\n845\n\t\nTotal\n$\n34,954\n\t\n$\n29,037\n\t\nThe\tfollowing\ttable\tpresents\tinventory\tby\treportable\tsegment\t(in\tmillions):\nDecember\t31,\n2023\nDecember\t31,\n2022\nAutomotive\n$\n11,139\n\t\n$\n10,996\n\t\nEnergy\tgeneration\tand\tstorage\n2,487\n\t\n1,843\n\t\nTotal\n$\n13,626\n\t\n$\n12,839\n\t\nNote\t19\t–\t\nRestructuring\tand\tOther\nDuring\tthe\tyears\tended\tDecember\t31,\t2022\tand\t2021,\twe\t\nrecorded\n\t$\n204\n\tmillion\tand\t$\n101\n\tmillion,\trespectively,\tof\timpairment\tlosses\ton\tdigital\nassets.\tDuring\tthe\tyears\tended\tDecember\t31,\t2022\tand\t2021\twe\talso\trealized\tgains\tof\t$\n64\n\tmillion\tand\t$\n128\n\tmillion,\trespectively,\tin\tconnection\twith\nconverting\tour\tholdings\tof\tdigital\tassets\tinto\tfiat\tcurrency.\tWe\talso\trecorded\tother\texpenses\tof\t$\n36\n\tmillion\tduring\tthe\tsecond\tquarter\tof\tthe\tyear\tended\nDecember\t31,\t2022,\trelated\tto\temployee\tterminations.\n92', 'Automotive\t&\tServices\tand\tOther\tSegment\nCost\tof\tautomotive\tsales\trevenue\tincludes\tdirect\tand\tindirect\tmaterials,\tlabor\tcosts,\tmanufacturing\toverhead,\tincluding\tdepreciation\tcosts\tof\ttooling\nand\tmachinery,\tshipping\tand\tlogistic\tcosts,\tvehicle\tconnectivity\tcosts,\tFSD\tongoing\tmaintenance\tcosts,\tallocations\tof\telectricity\tand\tinfrastructure\tcosts\nrelated\tto\tour\tSupercharger\tnetwork\tand\treserves\tfor\testimated\twarranty\texpenses.\tCost\tof\tautomotive\tsales\trevenues\talso\tincludes\tadjustments\tto\nwarranty\texpense\tand\tcharges\tto\twrite\tdown\tthe\tcarrying\tvalue\tof\tour\tinventory\twhen\tit\texceeds\tits\testimated\tnet\trealizable\tvalue\tand\tto\tprovide\tfor\nobsolete\tand\ton-hand\tinventory\tin\texcess\tof\tforecasted\tdemand.\tAdditionally,\tcost\tof\tautomotive\tsales\trevenue\tbenefits\tfrom\tmanufacturing\tcredits\nearned.\nCost\tof\tautomotive\tleasing\trevenue\tincludes\tthe\tdepreciation\tof\toperating\tlease\tvehicles,\tcost\tof\tgoods\tsold\tassociated\twith\tdirect\tsales-type\tleases\nand\twarranty\texpense\trelated\tto\tleased\tvehicles.\nCosts\tof\tservices\tand\tother\trevenue\tincludes\tcost\tof\tused\tvehicles\tincluding\trefurbishment\tcosts,\tcosts\tassociated\twith\tproviding\tnon-warranty\nafter-sales\tservices,\tcosts\tassociated\twith\tour\tbody\tshops\tand\tpart\tsales,\tcosts\tof\tpaid\tSupercharging,\tcosts\tto\tprovide\tvehicle\tinsurance\tand\tcosts\tfor\nretail\tmerchandise.\n2023\tcompared\tto\t2022\nCost\tof\tautomotive\tsales\trevenue\tincreased\t$15.52\tbillion,\tor\t31%,\tin\tthe\tyear\tended\tDecember\t31,\t2023\tas\tcompared\tto\tthe\tyear\tended\nDecember\t31,\t2022.\tCost\tof\tautomotive\tsales\trevenue\tincreased\tin\tline\twith\tthe\tchange\tin\tdeliveries\tyear\tover\tyear,\tas\tdiscussed\tabove.\tThe\tincrease\nwas\tpartially\toffset\tby\ta\tdecrease\tin\tthe\taverage\tcombined\tcost\tper\tunit\tof\tour\tvehicles\tprimarily\tdue\tto\tsales\tmix,\tlower\tinbound\tfreight,\ta\tdecrease\tin\nmaterial\tcosts\tand\tlower\tmanufacturing\tcosts\tfrom\tbetter\tfixed\tcost\tabsorption.\tOur\tcosts\tof\trevenue\twere\talso\tpositively\timpacted\tby\tthe\tUnited\tStates\ndollar\tstrengthening\tagainst\tour\tforeign\tcurrencies\tas\tcompared\tto\tthe\tprior\tperiods\tand\tby\tthe\tIRA\tmanufacturing\tcredits\tearned\tduring\tthe\tcurrent\tyear.\nCost\tof\tautomotive\tleasing\trevenue\tdecreased\t$241\tmillion,\tor\t16%,\tin\tthe\tyear\tended\tDecember\t31,\t2023\tas\tcompared\tto\tthe\tyear\tended\nDecember\t31,\t2022.\tThe\tdecrease\twas\tprimarily\tdue\tto\ta\tdecrease\tin\tdirect\tsales-type\tleasing\tcost\tof\trevenue\tdriven\tby\tlower\tdeliveries\tyear\tover\tyear.\nCost\tof\tservices\tand\tother\trevenue\tincreased\t$1.95\tbillion,\tor\t33%,\tin\tthe\tyear\tended\tDecember\t31,\t2023\tas\tcompared\tto\tthe\tyear\tended\nDecember\t31,\t2022.\tThe\tincrease\twas\tgenerally\tin\tline\twith\tthe\tchanges\tin\tservices\tand\tother\trevenue\tas\tdiscussed\tabove.\nGross\tmargin\tfor\ttotal\tautomotive\tdecreased\tfrom\t28.5%\tto\t19.4%\tin\tthe\tyear\tended\tDecember\t31,\t2023\tas\tcompared\tto\tthe\tyear\tended\nDecember\t31,\t2022.\tThe\tdecrease\twas\tprimarily\tdue\tto\ta\tlower\taverage\tselling\tprice\ton\tour\tvehicles\tpartially\toffset\tby\tthe\tfavorable\tchange\tin\tour\naverage\tcombined\tcost\tper\tunit\tof\tour\tvehicles\tand\tIRA\tmanufacturing\tcredits\tearned\tas\tdiscussed\tabove.', 'Revenue\tRecognition\nRevenue\tby\tsource\nThe\tfollowing\ttable\tdisaggregates\tour\trevenue\tby\tmajor\tsource\t(in\tmillions):\nYear\tEnded\tDecember\t31,\n2023\n2022\n2021\nAutomotive\tsales\n$\n78,509\n\t\n$\n67,210\n\t\n$\n44,125\n\t\nAutomotive\tregulatory\tcredits\n1,790\n\t\n1,776\n\t\n1,465\n\t\nEnergy\tgeneration\tand\tstorage\tsales\n5,515\n\t\n3,376\n\t\n2,279\n\t\nServices\tand\tother\n8,319\n\t\n6,091\n\t\n3,802\n\t\nTotal\trevenues\tfrom\tsales\tand\tservices\n94,133\n\t\n78,453\n\t\n51,671\n\t\nAutomotive\tleasing\n2,120\n\t\n2,476\n\t\n1,642\n\t\nEnergy\tgeneration\tand\tstorage\tleasing\n520\n\t\n533\n\t\n510\n\t\nTotal\trevenues\n$\n96,773\n\t\n$\n81,462\n\t\n$\n53,823\n\t\nAutomotive\tSegment\nAutomotive\tSales\nAutomotive\tsales\trevenue\tincludes\trevenues\trelated\tto\tcash\tand\tfinancing\tdeliveries\tof\tnew\tvehicles,\tand\tspecific\tother\tfeatures\tand\tservices\tthat\nmeet\tthe\tdefinition\tof\ta\tperformance\tobligation\tunder\tASC\t606,\tincluding\taccess\tto\tour\tFSD\tCapability\tfeatures\tand\ttheir\tongoing\tmaintenance,\tinternet\nconnectivity,\tfree\tSupercharging\tprograms\tand\tover-the-air\tsoftware\tupdates.\tWe\trecognize\trevenue\ton\tautomotive\tsales\tupon\tdelivery\tto\tthe\tcustomer,\nwhich\tis\twhen\tthe\tcontrol\tof\ta\tvehicle\ttransfers.\tPayments\tare\ttypically\treceived\tat\tthe\tpoint\tcontrol\ttransfers\tor\tin\taccordance\twith\tpayment\tterms\ncustomary\tto\tthe\tbusiness,\texcept\tsales\twe\tfinance\tfor\twhich\tpayments\tare\tcollected\tover\tthe\tcontractual\tloan\tterm.\tWe\talso\trecognize\ta\tsales\treturn\nreserve\tbased\ton\thistorical\texperience\tplus\tconsideration\tfor\texpected\tfuture\tmarket\tvalues,\twhen\twe\toffer\tresale\tvalue\tguarantees\tor\tsimilar\tbuyback\nterms.\tOther\tfeatures\tand\tservices\tsuch\tas\taccess\tto\tour\tinternet\tconnectivity,\tunlimited\tfree\tSupercharging\tand\tover-the-air\tsoftware\tupdates\tare\nprovisioned\tupon\tcontrol\ttransfer\tof\ta\tvehicle\tand\trecognized\tover\ttime\ton\ta\tstraight-line\tbasis\tas\twe\thave\ta\tstand-ready\tobligation\tto\tdeliver\tsuch\nservices\tto\tthe\tcustomer.\tOther\tlimited\tfree\tSupercharging\tincentives\tare\trecognized\tbased\ton\tactual\tusage\tor\texpiration,\twhichever\tis\tearlier.\tWe\nrecognize\trevenue\trelated\tto\tthese\tother\tfeatures\tand\tservices\tover\tthe\tperformance\tperiod,\twhich\tis\tgenerally\tthe\texpected\townership\tlife\tof\tthe\tvehicle.\nRevenue\trelated\tto\tFSD\tCapability\tfeatures\tis\trecognized\twhen\tfunctionality\tis\tdelivered\tto\tthe\tcustomer\tand\ttheir\tongoing\tmaintenance\tis\trecognized\nover\ttime.\tFor\tour\tobligations\trelated\tto\tautomotive\tsales,\twe\testimate\tstandalone\tselling\tprice\tby\tconsidering\tcosts\tused\tto\tdevelop\tand\tdeliver\tthe\nservice,\tthird-party\tpricing\tof\tsimilar\toptions\tand\tother\tinformation\tthat\tmay\tbe\tavailable.\nAny\tfees\tthat\tare\tpaid\tor\tpayable\tby\tus\tto\ta\tcustomer’s\tlender\twhen\twe\tarrange\tthe\tfinancing\tare\trecognized\tas\tan\toffset\tagainst\tautomotive\tsales\nrevenue.\tCosts\tto\tobtain\ta\tcontract\tmainly\trelate\tto\tcommissions\tpaid\tto\tour\tsales\tpersonnel\tfor\tthe\tsale\tof\tvehicles.\tAs\tour\tcontract\tcosts\trelated\tto\nautomotive\tsales\tare\ttypically\tfulfilled\twithin\tone\tyear,\tthe\tcosts\tto\tobtain\ta\tcontract\tare\texpensed\tas\tincurred.\tAmounts\tbilled\tto\tcustomers\trelated\tto\nshipping\tand\thandling\tare\tclassified\tas\tautomotive\tsales\trevenue,\tand\twe\thave\telected\tto\trecognize\tthe\tcost\tfor\tfreight\tand\tshipping\twhen\tcontrol\tover\nvehicles,\tparts\tor\taccessories\thave\ttransferred\tto\tthe\tcustomer\tas\tan\texpense\tin\tcost\tof\tautomotive\tsales\trevenue.\tOur\tpolicy\tis\tto\texclude\ttaxes\ncollected\tfrom\ta\tcustomer\tfrom\tthe\ttransaction\tprice\tof\tautomotive\tcontracts.\n55']","Tesla's automotive segment encompasses the creation, advancement, production, marketing, and leasing of high-performance, fully electric vehicles.  It also involves the sale of automotive regulatory credits.  Furthermore, this segment includes a range of services and other offerings, such as sales of pre-owned vehicles, non-warranty after-sales vehicle services, body shop and parts, paid Supercharging, vehicle insurance revenue, and retail merchandise. 


","Design, development, manufacturing, sale and lease of electric vehicles; sale of regulatory credits; related services (used vehicles, service, parts, Supercharging, insurance)",0.75,0.99999999998,1.0
What products and services are included in Tesla’s energy generation and storage segment?,"['Table\tof\tContents\nPART\tI\nITEM\t1.\tBUSINESS\nOverview\nWe\tdesign,\tdevelop,\tmanufacture,\tsell\tand\tlease\thigh-performance\tfully\telectric\tvehicles\tand\tenergy\tgeneration\tand\tstorage\tsystems,\tand\toffer\nservices\trelated\tto\tour\tproducts.\tWe\tgenerally\tsell\tour\tproducts\tdirectly\tto\tcustomers,\tand\tcontinue\tto\tgrow\tour\tcustomer-facing\tinfrastructure\tthrough\ta\nglobal\tnetwork\tof\tvehicle\tshowrooms\tand\tservice\tcenters,\tMobile\tService,\tbody\tshops,\tSupercharger\tstations\tand\tDestination\tChargers\tto\taccelerate\tthe\nwidespread\tadoption\tof\tour\tproducts.\tWe\temphasize\tperformance,\tattractive\tstyling\tand\tthe\tsafety\tof\tour\tusers\tand\tworkforce\tin\tthe\tdesign\tand\nmanufacture\tof\tour\tproducts\tand\tare\tcontinuing\tto\tdevelop\tfull\tself-driving\ttechnology\tfor\timproved\tsafety.\tWe\talso\tstrive\tto\tlower\tthe\tcost\tof\townership\nfor\tour\tcustomers\tthrough\tcontinuous\tefforts\tto\treduce\tmanufacturing\tcosts\tand\tby\toffering\tfinancial\tand\tother\tservices\ttailored\tto\tour\tproducts.\nOur\tmission\tis\tto\taccelerate\tthe\tworld’s\ttransition\tto\tsustainable\tenergy.\tWe\tbelieve\tthat\tthis\tmission,\talong\twith\tour\tengineering\texpertise,\nvertically\tintegrated\tbusiness\tmodel\tand\tfocus\ton\tuser\texperience\tdifferentiate\tus\tfrom\tother\tcompanies.\nSegment\tInformation\nWe\toperate\tas\ttwo\treportable\tsegments:\t(i)\tautomotive\tand\t(ii)\tenergy\tgeneration\tand\tstorage.\nThe\tautomotive\tsegment\tincludes\tthe\tdesign,\tdevelopment,\tmanufacturing,\tsales\tand\tleasing\tof\thigh-performance\tfully\telectric\tvehicles\tas\twell\tas\nsales\tof\tautomotive\tregulatory\tcredits.\tAdditionally,\tthe\tautomotive\tsegment\talso\tincludes\tservices\tand\tother,\twhich\tincludes\tsales\tof\tused\tvehicles,\tnon-\nwarranty\tafter-sales\tvehicle\tservices,\tbody\tshop\tand\tparts,\tpaid\tSupercharging,\tvehicle\tinsurance\trevenue\tand\tretail\tmerchandise.\tThe\tenergy\tgeneration\nand\tstorage\tsegment\tincludes\tthe\tdesign,\tmanufacture,\tinstallation,\tsales\tand\tleasing\tof\tsolar\tenergy\tgeneration\tand\tenergy\tstorage\tproducts\tand\trelated\nservices\tand\tsales\tof\tsolar\tenergy\tsystems\tincentives.\nOur\tProducts\tand\tServices\nAutomotive\nWe\tcurrently\tmanufacture\tfive\tdifferent\tconsumer\tvehicles\t–\tthe\tModel\t3,\tY,\tS,\tX\tand\tCybertruck.\tModel\t3\tis\ta\tfour-door\tmid-size\tsedan\tthat\twe\ndesigned\tfor\tmanufacturability\twith\ta\tbase\tprice\tfor\tmass-market\tappeal.\tModel\tY\tis\ta\tcompact\tsport\tutility\tvehicle\t(“SUV”)\tbuilt\ton\tthe\tModel\t3\tplatform\nwith\tseating\tfor\tup\tto\tseven\tadults.\tModel\tS\tis\ta\tfour-door\tfull-size\tsedan\tand\tModel\tX\tis\ta\tmid-size\tSUV\twith\tseating\tfor\tup\tto\tseven\tadults.\tModel\tS\tand\nModel\tX\tfeature\tthe\thighest\tperformance\tcharacteristics\tand\tlongest\tranges\tthat\twe\toffer\tin\ta\tsedan\tand\tSUV,\trespectively.\tIn\tNovember\t2023,\twe\nentered\tthe\tconsumer\tpickup\ttruck\tmarket\twith\tfirst\tdeliveries\tof\tthe\tCybertruck,\ta\tfull-size\telectric\tpickup\ttruck\twith\ta\tstainless\tsteel\texterior\tthat\thas\nthe\tutility\tand\tstrength\tof\ta\ttruck\twhile\tfeaturing\tthe\tspeed\tof\ta\tsports\tcar.\nIn\t2022,\twe\talso\tbegan\tearly\tproduction\tand\tdeliveries\tof\ta\tcommercial\telectric\tvehicle,\tthe\tTesla\tSemi.\tWe\thave\tplanned\telectric\tvehicles\tto\naddress\tadditional\tvehicle\tmarkets,\tand\tto\tcontinue\tleveraging\tdevelopments\tin\tour\tproprietary\tFull\tSelf-Driving\t(“FSD”)\tCapability\tfeatures,\tbattery\tcell\nand\tother\ttechnologies.\nEnergy\tGeneration\tand\tStorage\nEnergy\tStorage\tProducts\nPowerwall\tand\tMegapack\tare\tour\tlithium-ion\tbattery\tenergy\tstorage\tproducts.', 'We\texpect\tthat\tthis\tfunctionality\twill\talso\tallow\tus\tto\toffer\tcertain\toptions\tand\tfeatures\ton\ta\nsubscription\tbasis\tin\tthe\tfuture.\nEnergy\tGeneration\tand\tStorage\nWe\tmarket\tand\tsell\tour\tsolar\tand\tenergy\tstorage\tproducts\tto\tresidential,\tcommercial\tand\tindustrial\tcustomers\tand\tutilities\tthrough\ta\tvariety\tof\nchannels,\tincluding\tthrough\tour\twebsite,\tstores\tand\tgalleries,\tas\twell\tas\tthrough\tour\tnetwork\tof\tchannel\tpartners,\tand\tin\tthe\tcase\tof\tsome\tcommercial\ncustomers,\tthrough\tPPA\ttransactions.\tWe\temphasize\tsimplicity,\tstandardization\tand\taccessibility\tto\tmake\tit\teasy\tand\tcost-effective\tfor\tcustomers\tto\tadopt\nclean\tenergy,\twhile\treducing\tour\tcustomer\tacquisition\tcosts.\nService\tand\tWarranty\nAutomotive\nService\nWe\tprovide\tservice\tfor\tour\telectric\tvehicles\tat\tour\tcompany-owned\tservice\tlocations\tand\tthrough\tTesla\tMobile\tService\ttechnicians\twho\tperform\twork\nremotely\tat\tcustomers’\thomes\tor\tother\tlocations.\tServicing\tthe\tvehicles\tourselves\tallows\tus\tto\tidentify\tproblems\tand\timplement\tsolutions\tand\nimprovements\tfaster\tthan\ttraditional\tautomobile\tmanufacturers\tand\ttheir\tdealer\tnetworks.\tThe\tconnectivity\tof\tour\tvehicles\talso\tallows\tus\tto\tdiagnose\tand\nremedy\tmany\tproblems\tremotely\tand\tproactively.\nVehicle\tLimited\tWarranties\tand\tExtended\tService\tPlans\nWe\tprovide\ta\tmanufacturer’s\tlimited\twarranty\ton\tall\tnew\tand\tused\tTesla\tvehicles\twe\tsell\tdirectly\tto\tconsumers,\twhich\tmay\tinclude\tlimited\nwarranties\ton\tcertain\tcomponents,\tspecific\ttypes\tof\tdamage\tor\tbattery\tcapacity\tretention.\tWe\talso\tcurrently\toffer\toptional\textended\tservice\tplans\tthat\nprovide\tcoverage\tbeyond\tthe\tnew\tvehicle\tlimited\twarranties\tfor\tcertain\tmodels\tin\tspecified\tregions.\n7', 'In\t2022,\twe\talso\tbegan\tearly\tproduction\tand\tdeliveries\tof\ta\tcommercial\telectric\tvehicle,\tthe\tTesla\tSemi.\tWe\thave\tplanned\telectric\tvehicles\tto\naddress\tadditional\tvehicle\tmarkets,\tand\tto\tcontinue\tleveraging\tdevelopments\tin\tour\tproprietary\tFull\tSelf-Driving\t(“FSD”)\tCapability\tfeatures,\tbattery\tcell\nand\tother\ttechnologies.\nEnergy\tGeneration\tand\tStorage\nEnergy\tStorage\tProducts\nPowerwall\tand\tMegapack\tare\tour\tlithium-ion\tbattery\tenergy\tstorage\tproducts.\tPowerwall,\twhich\twe\tsell\tdirectly\tto\tcustomers,\tas\twell\tas\tthrough\nchannel\tpartners,\tis\tdesigned\tto\tstore\tenergy\tat\ta\thome\tor\tsmall\tcommercial\tfacility.\tMegapack\tis\tan\tenergy\tstorage\tsolution\tfor\tcommercial,\tindustrial,\nutility\tand\tenergy\tgeneration\tcustomers,\tmultiple\tof\twhich\tmay\tbe\tgrouped\ttogether\tto\tform\tlarger\tinstallations\tof\tgigawatt\thours\t(“GWh”)\tor\tgreater\ncapacity.\nWe\talso\tcontinue\tto\tdevelop\tsoftware\tcapabilities\tfor\tremotely\tcontrolling\tand\tdispatching\tour\tenergy\tstorage\tsystems\tacross\ta\twide\trange\tof\nmarkets\tand\tapplications,\tincluding\tthrough\tour\treal-time\tenergy\tcontrol\tand\toptimization\tplatforms.\n4', 'Table\tof\tContents\nEnergy\tGeneration\tand\tStorage\nEnergy\tStorage\tProducts\nWe\tleverage\tmany\tof\tthe\tcomponent-level\ttechnologies\tfrom\tour\tvehicles\tin\tour\tenergy\tstorage\tproducts.\tBy\ttaking\ta\tmodular\tapproach\tto\tthe\ndesign\tof\tbattery\tsystems,\twe\tcan\toptimize\tmanufacturing\tcapacity\tof\tour\tenergy\tstorage\tproducts.\tAdditionally,\tour\texpertise\tin\tpower\telectronics\nenables\tour\tbattery\tsystems\tto\tinterconnect\twith\telectricity\tgrids\twhile\tproviding\tfast-acting\tsystems\tfor\tpower\tinjection\tand\tabsorption.\tWe\thave\talso\ndeveloped\tsoftware\tto\tremotely\tcontrol\tand\tdispatch\tour\tenergy\tstorage\tsystems.\nSolar\tEnergy\tSystems\nWe\thave\tengineered\tSolar\tRoof\tover\tnumerous\titerations\tto\tcombine\taesthetic\tappeal\tand\tdurability\twith\tpower\tgeneration.\tThe\tefficiency\tof\tour\nsolar\tenergy\tproducts\tis\taided\tby\tour\town\tsolar\tinverter,\twhich\tincorporates\tour\tpower\telectronics\ttechnologies.\tWe\tdesigned\tboth\tproducts\tto\tintegrate\nwith\tPowerwall.\nDesign\tand\tEngineering\nAutomotive\nWe\thave\testablished\tsignificant\tin-house\tcapabilities\tin\tthe\tdesign\tand\ttest\tengineering\tof\telectric\tvehicles\tand\ttheir\tcomponents\tand\tsystems.\tOur\nteam\thas\tsignificant\texperience\tin\tcomputer-aided\tdesign\tas\twell\tas\tdurability,\tstrength\tand\tcrash\ttest\tsimulations,\twhich\treduces\tthe\tproduct\ndevelopment\ttime\tof\tnew\tmodels.\tWe\thave\talso\tachieved\tcomplex\tengineering\tfeats\tin\tstamping,\tcasting\tand\tthermal\tsystems,\tand\tdeveloped\ta\tmethod\nto\tintegrate\tbatteries\tdirectly\twith\tvehicle\tbody\tstructures\twithout\tseparate\tbattery\tpacks\tto\toptimize\tmanufacturability,\tweight,\trange\tand\tcost\ncharacteristics.\nWe\tare\talso\texpanding\tour\tmanufacturing\toperations\tglobally\twhile\ttaking\taction\tto\tlocalize\tour\tvehicle\tdesigns\tand\tproduction\tfor\tparticular\nmarkets,\tincluding\tcountry-specific\tmarket\tdemands\tand\tfactory\toptimizations\tfor\tlocal\tworkforces.\tAs\twe\tincrease\tour\tcapabilities,\tparticularly\tin\tthe\nareas\tof\tautomation,\tdie-making\tand\tline-building,\twe\tare\talso\tmaking\tstrides\tin\tthe\tsimulations\tmodeling\tthese\tcapabilities\tprior\tto\tconstruction.\nEnergy\tGeneration\tand\tStorage\nOur\texpertise\tin\telectrical,\tmechanical,\tcivil\tand\tsoftware\tengineering\tallows\tus\tto\tdesign,\tengineer,\tmanufacture\tand\tinstall\tenergy\tgenerating\tand\nstorage\tproducts\tand\tcomponents,\tincluding\tat\tthe\tresidential\tthrough\tutility\tscale.\tFor\texample,\tthe\tmodular\tdesign\tof\tour\tMegapack\tutility-scale\tbattery\nline\tis\tintended\tto\tsignificantly\treduce\tthe\tamount\tof\tassembly\trequired\tin\tthe\tfield.\tWe\talso\tcustomize\tsolutions\tincluding\tour\tenergy\tstorage\tproducts,\nsolar\tenergy\tsystems\tand/or\tSolar\tRoof\tfor\tcustomers\tto\tmeet\ttheir\tspecific\tneeds.\nSales\tand\tMarketing\nHistorically,\twe\thave\tbeen\table\tto\tachieve\tsales\twithout\ttraditional\tadvertising\tand\tat\trelatively\tlow\tmarketing\tcosts.\tWe\tcontinue\tto\tmonitor\tour\npublic\tnarrative\tand\tbrand,\tand\ttailor\tour\tmarketing\tefforts\taccordingly,\tincluding\tthrough\tinvestments\tin\tcustomer\teducation\tand\tadvertising\tas\nnecessary.\nAutomotive\nDirect\tSales\nOur\tvehicle\tsales\tchannels\tcurrently\tinclude\tour\twebsite\tand\tan\tinternational\tnetwork\tof\tcompany-owned\tstores.\tIn\tsome\tjurisdictions,\twe\talso\thave\ngalleries\tto\teducate\tand\tinform\tcustomers\tabout\tour\tproducts,\tbut\tsuch\tlocations\tdo\tnot\ttransact\tin\tthe\tsale\tof\tvehicles.\tWe\tbelieve\tthis\tinfrastructure\nenables\tus\tto\tbetter\tcontrol\tcosts\tof\tinventory,\tmanage\twarranty\tservice\tand\tpricing,\teducate\tconsumers\tabout\telectric\tvehicles,\tmake\tour\tvehicles\tmore\naffordable,\tmaintain\tand\tstrengthen\tthe\tTesla\tbrand\tand\tobtain\trapid\tcustomer\tfeedback.', 'Note\t18\t–\t\nSegment\tReporting\tand\tInformation\tabout\tGeographic\tAreas\nWe\thave\t\ntwo\n\toperating\tand\treportable\tsegments:\t(i)\tautomotive\tand\t(ii)\tenergy\tgeneration\tand\tstorage.\tThe\tautomotive\tsegment\tincludes\tthe\ndesign,\tdevelopment,\tmanufacturing,\tsales\tand\tleasing\tof\telectric\tvehicles\tas\twell\tas\tsales\tof\tautomotive\tregulatory\tcredits.\tAdditionally,\tthe\tautomotive\nsegment\tis\talso\tcomprised\tof\tservices\tand\tother,\twhich\tincludes\tsales\tof\tused\tvehicles,\tnon-warranty\tafter-sales\tvehicle\tservices,\tbody\tshop\tand\tparts,\npaid\tSupercharging,\tvehicle\tinsurance\trevenue\tand\tretail\tmerchandise.\tThe\tenergy\tgeneration\tand\tstorage\tsegment\tincludes\tthe\tdesign,\tmanufacture,\ninstallation,\tsales\tand\tleasing\tof\tsolar\tenergy\tgeneration\tand\tenergy\tstorage\tproducts\tand\trelated\tservices\tand\tsales\tof\tsolar\tenergy\tsystems\tincentives.\nOur\tCODM\tdoes\tnot\tevaluate\toperating\tsegments\tusing\tasset\tor\tliability\tinformation.\t\nThe\tfollowing\ttable\tpresents\trevenues\tand\tgross\tprofit\tby\treportable\nsegment\t(in\tmillions):\nYear\tEnded\tDecember\t31,\n2023\n2022\n2021\nAutomotive\tsegment\n\t\n\t\nRevenues\n$\n90,738\n\t\n$\n77,553\n\t\n$\n51,034\n\t\nGross\tprofit\n$\n16,519\n\t\n$\n20,565\n\t\n$\n13,735\n\t\nEnergy\tgeneration\tand\tstorage\tsegment\n\t\n\t\nRevenues\n$\n6,035\n\t\n$\n3,909\n\t\n$\n2,789\n\t\nGross\tprofit\n$\n1,141\n\t\n$\n288\n\t\n$\n(\n129\n)\nThe\tfollowing\ttable\tpresents\trevenues\tby\tgeographic\tarea\tbased\ton\tthe\tsales\tlocation\tof\tour\tproducts\t(in\tmillions):\nYear\tEnded\tDecember\t31,\n2023\n2022\n2021\nUnited\tStates\n$\n45,235\n\t\n$\n40,553\n\t\n$\n23,973\n\t\nChina\n21,745\n\t\n18,145\n\t\n13,844\n\t\nOther\tinternational\n29,793\n\t\n22,764\n\t\n16,006\n\t\nTotal\n$\n96,773\n\t\n$\n81,462\n\t\n$\n53,823\n\t\nThe\tfollowing\ttable\tpresents\tlong-lived\tassets\tby\tgeographic\tarea\t(in\tmillions):\nDecember\t31,\n2023\nDecember\t31,\n2022\nUnited\tStates\n$\n26,629\n\t\n$\n21,667\n\t\nGermany\n4,258\n\t\n3,547\n\t\nChina\n2,820\n\t\n2,978\n\t\nOther\tinternational\n1,247\n\t\n845\n\t\nTotal\n$\n34,954\n\t\n$\n29,037\n\t\nThe\tfollowing\ttable\tpresents\tinventory\tby\treportable\tsegment\t(in\tmillions):\nDecember\t31,\n2023\nDecember\t31,\n2022\nAutomotive\n$\n11,139\n\t\n$\n10,996\n\t\nEnergy\tgeneration\tand\tstorage\n2,487\n\t\n1,843\n\t\nTotal\n$\n13,626\n\t\n$\n12,839\n\t\nNote\t19\t–\t\nRestructuring\tand\tOther\nDuring\tthe\tyears\tended\tDecember\t31,\t2022\tand\t2021,\twe\t\nrecorded\n\t$\n204\n\tmillion\tand\t$\n101\n\tmillion,\trespectively,\tof\timpairment\tlosses\ton\tdigital\nassets.\tDuring\tthe\tyears\tended\tDecember\t31,\t2022\tand\t2021\twe\talso\trealized\tgains\tof\t$\n64\n\tmillion\tand\t$\n128\n\tmillion,\trespectively,\tin\tconnection\twith\nconverting\tour\tholdings\tof\tdigital\tassets\tinto\tfiat\tcurrency.\tWe\talso\trecorded\tother\texpenses\tof\t$\n36\n\tmillion\tduring\tthe\tsecond\tquarter\tof\tthe\tyear\tended\nDecember\t31,\t2022,\trelated\tto\temployee\tterminations.\n92']","This segment focuses on designing, manufacturing, installing, selling, and leasing products related to solar energy generation and energy storage.  They also offer related services and sell incentives for solar energy systems. 


","Design, manufacture, installation, sale and lease of solar energy systems and energy storage products; related services",0.9166666666666666,0.99999999998,1.0
Which electric vehicle models does Tesla manufacture and sell?,"['Table\tof\tContents\nPART\tI\nITEM\t1.\tBUSINESS\nOverview\nWe\tdesign,\tdevelop,\tmanufacture,\tsell\tand\tlease\thigh-performance\tfully\telectric\tvehicles\tand\tenergy\tgeneration\tand\tstorage\tsystems,\tand\toffer\nservices\trelated\tto\tour\tproducts.\tWe\tgenerally\tsell\tour\tproducts\tdirectly\tto\tcustomers,\tand\tcontinue\tto\tgrow\tour\tcustomer-facing\tinfrastructure\tthrough\ta\nglobal\tnetwork\tof\tvehicle\tshowrooms\tand\tservice\tcenters,\tMobile\tService,\tbody\tshops,\tSupercharger\tstations\tand\tDestination\tChargers\tto\taccelerate\tthe\nwidespread\tadoption\tof\tour\tproducts.\tWe\temphasize\tperformance,\tattractive\tstyling\tand\tthe\tsafety\tof\tour\tusers\tand\tworkforce\tin\tthe\tdesign\tand\nmanufacture\tof\tour\tproducts\tand\tare\tcontinuing\tto\tdevelop\tfull\tself-driving\ttechnology\tfor\timproved\tsafety.\tWe\talso\tstrive\tto\tlower\tthe\tcost\tof\townership\nfor\tour\tcustomers\tthrough\tcontinuous\tefforts\tto\treduce\tmanufacturing\tcosts\tand\tby\toffering\tfinancial\tand\tother\tservices\ttailored\tto\tour\tproducts.\nOur\tmission\tis\tto\taccelerate\tthe\tworld’s\ttransition\tto\tsustainable\tenergy.\tWe\tbelieve\tthat\tthis\tmission,\talong\twith\tour\tengineering\texpertise,\nvertically\tintegrated\tbusiness\tmodel\tand\tfocus\ton\tuser\texperience\tdifferentiate\tus\tfrom\tother\tcompanies.\nSegment\tInformation\nWe\toperate\tas\ttwo\treportable\tsegments:\t(i)\tautomotive\tand\t(ii)\tenergy\tgeneration\tand\tstorage.\nThe\tautomotive\tsegment\tincludes\tthe\tdesign,\tdevelopment,\tmanufacturing,\tsales\tand\tleasing\tof\thigh-performance\tfully\telectric\tvehicles\tas\twell\tas\nsales\tof\tautomotive\tregulatory\tcredits.\tAdditionally,\tthe\tautomotive\tsegment\talso\tincludes\tservices\tand\tother,\twhich\tincludes\tsales\tof\tused\tvehicles,\tnon-\nwarranty\tafter-sales\tvehicle\tservices,\tbody\tshop\tand\tparts,\tpaid\tSupercharging,\tvehicle\tinsurance\trevenue\tand\tretail\tmerchandise.\tThe\tenergy\tgeneration\nand\tstorage\tsegment\tincludes\tthe\tdesign,\tmanufacture,\tinstallation,\tsales\tand\tleasing\tof\tsolar\tenergy\tgeneration\tand\tenergy\tstorage\tproducts\tand\trelated\nservices\tand\tsales\tof\tsolar\tenergy\tsystems\tincentives.\nOur\tProducts\tand\tServices\nAutomotive\nWe\tcurrently\tmanufacture\tfive\tdifferent\tconsumer\tvehicles\t–\tthe\tModel\t3,\tY,\tS,\tX\tand\tCybertruck.\tModel\t3\tis\ta\tfour-door\tmid-size\tsedan\tthat\twe\ndesigned\tfor\tmanufacturability\twith\ta\tbase\tprice\tfor\tmass-market\tappeal.\tModel\tY\tis\ta\tcompact\tsport\tutility\tvehicle\t(“SUV”)\tbuilt\ton\tthe\tModel\t3\tplatform\nwith\tseating\tfor\tup\tto\tseven\tadults.\tModel\tS\tis\ta\tfour-door\tfull-size\tsedan\tand\tModel\tX\tis\ta\tmid-size\tSUV\twith\tseating\tfor\tup\tto\tseven\tadults.\tModel\tS\tand\nModel\tX\tfeature\tthe\thighest\tperformance\tcharacteristics\tand\tlongest\tranges\tthat\twe\toffer\tin\ta\tsedan\tand\tSUV,\trespectively.\tIn\tNovember\t2023,\twe\nentered\tthe\tconsumer\tpickup\ttruck\tmarket\twith\tfirst\tdeliveries\tof\tthe\tCybertruck,\ta\tfull-size\telectric\tpickup\ttruck\twith\ta\tstainless\tsteel\texterior\tthat\thas\nthe\tutility\tand\tstrength\tof\ta\ttruck\twhile\tfeaturing\tthe\tspeed\tof\ta\tsports\tcar.\nIn\t2022,\twe\talso\tbegan\tearly\tproduction\tand\tdeliveries\tof\ta\tcommercial\telectric\tvehicle,\tthe\tTesla\tSemi.\tWe\thave\tplanned\telectric\tvehicles\tto\naddress\tadditional\tvehicle\tmarkets,\tand\tto\tcontinue\tleveraging\tdevelopments\tin\tour\tproprietary\tFull\tSelf-Driving\t(“FSD”)\tCapability\tfeatures,\tbattery\tcell\nand\tother\ttechnologies.\nEnergy\tGeneration\tand\tStorage\nEnergy\tStorage\tProducts\nPowerwall\tand\tMegapack\tare\tour\tlithium-ion\tbattery\tenergy\tstorage\tproducts.', 'Management\tOpportunities,\tChallenges\tand\tUncertainties\tand\t2024\tOutlook\nAutomotive—Production\nThe\tfollowing\tis\ta\tsummary\tof\tthe\tstatus\tof\tproduction\tof\teach\tof\tour\tannounced\tvehicle\tmodels\tin\tproduction\tand\tunder\tdevelopment,\tas\tof\tthe\ndate\tof\tthis\tAnnual\tReport\ton\tForm\t10-K:\nProduction\tLocation\nVehicle\tModel(s)\nProduction\tStatus\nFremont\tFactory\nModel\tS\t/\tModel\tX\nActive\n\t\nModel\t3\t/\tModel\tY\nActive\nGigafactory\tShanghai\nModel\t3\t/\tModel\tY\nActive\nGigafactory\tBerlin-Brandenburg\nModel\tY\nActive\nGigafactory\tTexas\nModel\tY\nActive\n\t\nCybertruck\nActive\nGigafactory\tNevada\nTesla\tSemi\nPilot\tproduction\nVarious\nNext\tGeneration\tPlatform\nIn\tdevelopment\nTBD\nTesla\tRoadster\nIn\tdevelopment\nWe\tare\tfocused\ton\tgrowing\tour\tmanufacturing\tcapacity,\twhich\tincludes\tcapacity\tfor\tmanufacturing\tnew\tvehicle\tmodels\tsuch\tas\tour\tCybertruck\tand\nnext\tgeneration\tplatform,\tand\tramping\tall\tof\tour\tproduction\tvehicles\tto\ttheir\tinstalled\tproduction\tcapacities\tas\twell\tas\tincreasing\tproduction\trate\tand\nefficiency\tat\tour\tcurrent\tfactories.\tThe\tnext\tphase\tof\tproduction\tgrowth\twill\tdepend\ton\tthe\tcontinued\tramp\tat\tour\tfactories\tand\tthe\tintroduction\tof\tour\nnext\tgeneration\tplatform,\tas\twell\tas\tour\tability\tto\tadd\tto\tour\tavailable\tsources\tof\tbattery\tcell\tsupply\tby\tmanufacturing\tour\town\tcells\tthat\twe\tare\ndeveloping\tto\thave\thigh-volume\toutput,\tlower\tcapital\tand\tproduction\tcosts\tand\tlonger\trange.\tOur\tgoals\tare\tto\timprove\tvehicle\tperformance,\tdecrease\nproduction\tcosts\tand\tincrease\taffordability\tand\tcustomer\tawareness.\nThese\tplans\tare\tsubject\tto\tuncertainties\tinherent\tin\testablishing\tand\tramping\tmanufacturing\toperations,\twhich\tmay\tbe\texacerbated\tby\tnew\tproduct\nand\tmanufacturing\ttechnologies\twe\tintroduce,\tthe\tnumber\tof\tconcurrent\tinternational\tprojects,\tany\tindustry-wide\tcomponent\tconstraints,\tlabor\tshortages\nand\tany\tfuture\timpact\tfrom\tevents\toutside\tof\tour\tcontrol.\tFor\texample,\tduring\tthe\tthird\tquarter\tof\t2023,\twe\texperienced\ta\tsequential\tdecline\tin\nproduction\tvolumes\tdue\tto\tpre-planned\tshutdowns\tfor\tupgrades\tat\tvarious\tfactories.\tMoreover,\twe\thave\tset\tambitious\ttechnological\ttargets\twith\tour\nplans\tfor\tbattery\tcells\tas\twell\tas\tfor\titerative\tmanufacturing\tand\tdesign\timprovements\tfor\tour\tvehicles\twith\teach\tnew\tfactory.\nAutomotive—Demand,\tSales,\tDeliveries\tand\tInfrastructure\nOur\tcost\treduction\tefforts,\tcost\tinnovation\tstrategies,\tand\tadditional\tlocalized\tprocurement\tand\tmanufacturing\tare\tkey\tto\tour\tvehicles’\taffordability\nand\thave\tallowed\tus\tto\tcompetitively\tprice\tour\tvehicles.\tWe\twill\talso\tcontinue\tto\tgenerate\tdemand\tand\tbrand\tawareness\tby\timproving\tour\tvehicles’\nperformance\tand\tfunctionality,\tincluding\tthrough\tproducts\tbased\ton\tartificial\tintelligence\tsuch\tas\tAutopilot,\tFSD\tCapability,\tand\tother\tsoftware\tfeatures\nand\tdelivering\tnew\tvehicles,\tsuch\tas\tour\tCybertruck.\tMoreover,\twe\texpect\tto\tcontinue\tto\tbenefit\tfrom\tongoing\telectrification\tof\tthe\tautomotive\tsector\tand\nincreasing\tenvironmental\tregulations\tand\tinitiatives.\nHowever,\twe\toperate\tin\ta\tcyclical\tindustry\tthat\tis\tsensitive\tto\tpolitical\tand\tregulatory\tuncertainty,\tincluding\twith\trespect\tto\ttrade\tand\tthe\nenvironment,\tall\tof\twhich\tcan\tbe\tcompounded\tby\tinflationary\tpressures,\trising\tenergy\tprices,\tinterest\trate\tfluctuations\tand\tthe\tliquidity\tof\tenterprise\ncustomers.\tFor\texample,\tinflationary\tpressures\thave\tincreased\tacross\tthe\tmarkets\tin\twhich\twe\toperate.', 'Table\tof\tContents\nSolar\tEnergy\tOfferings\nWe\tsell\tretrofit\tsolar\tenergy\tsystems\tto\tcustomers\tand\tchannel\tpartners\tand\talso\tmake\tthem\tavailable\tthrough\tpower\tpurchase\tagreement\t(“PPA”)\narrangements.\tWe\tpurchase\tmost\tof\tthe\tcomponents\tfor\tour\tretrofit\tsolar\tenergy\tsystems\tfrom\tmultiple\tsources\tto\tensure\tcompetitive\tpricing\tand\nadequate\tsupply.\tWe\talso\tdesign\tand\tmanufacture\tcertain\tcomponents\tfor\tour\tsolar\tenergy\tproducts.\nWe\tsell\tour\tSolar\tRoof,\twhich\tcombines\tpremium\tglass\troof\ttiles\twith\tenergy\tgeneration,\tdirectly\tto\tcustomers,\tas\twell\tas\tthrough\tchannel\ncustomers.\tWe\tcontinue\tto\timprove\tour\tinstallation\tcapability\tand\tefficiency,\tincluding\tthrough\tcollaboration\twith\treal\testate\tdevelopers\tand\tbuilders\ton\nnew\thomes.\nTechnology\nAutomotive\nBattery\tand\tPowertrain\nOur\tcore\tvehicle\ttechnology\tcompetencies\tinclude\tpowertrain\tengineering\tand\tmanufacturing\tand\tour\tability\tto\tdesign\tvehicles\tthat\tutilize\tthe\nunique\tadvantages\tof\tan\telectric\tpowertrain.\tWe\thave\tdesigned\tour\tproprietary\tpowertrain\tsystems\tto\tbe\tadaptable,\tefficient,\treliable\tand\tcost-effective\nwhile\twithstanding\tthe\trigors\tof\tan\tautomotive\tenvironment.\tWe\toffer\tdual\tmotor\tpowertrain\tvehicles,\twhich\tuse\ttwo\telectric\tmotors\tto\tmaximize\ttraction\nand\tperformance\tin\tan\tall-wheel\tdrive\tconfiguration,\tas\twell\tas\tvehicle\tpowertrain\ttechnology\tfeaturing\tthree\telectric\tmotors\tfor\tfurther\tincreased\nperformance\tin\tcertain\tversions\tof\tModel\tS\tand\tModel\tX,\tCybertruck\tand\tthe\tTesla\tSemi.\nWe\tmaintain\textensive\ttesting\tand\tR&D\tcapabilities\tfor\tbattery\tcells,\tpacks\tand\tsystems,\tand\thave\tbuilt\tan\texpansive\tbody\tof\tknowledge\ton\tlithium-\nion\tcell\tchemistry\ttypes\tand\tperformance\tcharacteristics.\tIn\torder\tto\tenable\ta\tgreater\tsupply\tof\tcells\tfor\tour\tproducts\twith\thigher\tenergy\tdensity\tat\tlower\ncosts,\twe\thave\tdeveloped\ta\tnew\tproprietary\tlithium-ion\tbattery\tcell\tand\timproved\tmanufacturing\tprocesses.\nVehicle\tControl\tand\tInfotainment\tSoftware\nThe\tperformance\tand\tsafety\tsystems\tof\tour\tvehicles\tand\ttheir\tbattery\tpacks\tutilize\tsophisticated\tcontrol\tsoftware.\tControl\tsystems\tin\tour\tvehicles\noptimize\tperformance,\tcustomize\tvehicle\tbehavior,\tmanage\tcharging\tand\tcontrol\tall\tinfotainment\tfunctions.\tWe\tdevelop\talmost\tall\tof\tthis\tsoftware,\nincluding\tmost\tof\tthe\tuser\tinterfaces,\tinternally\tand\tupdate\tour\tvehicles’\tsoftware\tregularly\tthrough\tover-the-air\tupdates.\nSelf-Driving\tDevelopment\tand\tArtificial\tIntelligence\nWe\thave\texpertise\tin\tdeveloping\ttechnologies,\tsystems\tand\tsoftware\tto\tenable\tself-driving\tvehicles\tusing\tprimarily\tvision-based\ttechnologies.\tOur\nFSD\tComputer\truns\tour\tneural\tnetworks\tin\tour\tvehicles,\tand\twe\tare\talso\tdeveloping\tadditional\tcomputer\thardware\tto\tbetter\tenable\tthe\tmassive\tamounts\nof\tfield\tdata\tcaptured\tby\tour\tvehicles\tto\tcontinually\ttrain\tand\timprove\tthese\tneural\tnetworks\tfor\treal-world\tperformance.\nCurrently,\twe\toffer\tin\tour\tvehicles\tcertain\tadvanced\tdriver\tassist\tsystems\tunder\tour\tAutopilot\tand\tFSD\tCapability\toptions.\tAlthough\tat\tpresent\tthe\ndriver\tis\tultimately\tresponsible\tfor\tcontrolling\tthe\tvehicle,\tour\tsystems\tprovide\tsafety\tand\tconvenience\tfunctionality\tthat\trelieves\tdrivers\tof\tthe\tmost\ntedious\tand\tpotentially\tdangerous\taspects\tof\troad\ttravel\tmuch\tlike\tthe\tsystem\tthat\tairplane\tpilots\tuse,\twhen\tconditions\tpermit.\tAs\twith\tother\tvehicle\nsystems,\twe\timprove\tthese\tfunctions\tin\tour\tvehicles\tover\ttime\tthrough\tover-the-air\tupdates.\nWe\tintend\tto\testablish\tin\tthe\tfuture\tan\tautonomous\tTesla\tride-hailing\tnetwork,\twhich\twe\texpect\twould\talso\tallow\tus\tto\taccess\ta\tnew\tcustomer\tbase\neven\tas\tmodes\tof\ttransportation\tevolve.', 'We\texpect\tthat\tthis\tfunctionality\twill\talso\tallow\tus\tto\toffer\tcertain\toptions\tand\tfeatures\ton\ta\nsubscription\tbasis\tin\tthe\tfuture.\nEnergy\tGeneration\tand\tStorage\nWe\tmarket\tand\tsell\tour\tsolar\tand\tenergy\tstorage\tproducts\tto\tresidential,\tcommercial\tand\tindustrial\tcustomers\tand\tutilities\tthrough\ta\tvariety\tof\nchannels,\tincluding\tthrough\tour\twebsite,\tstores\tand\tgalleries,\tas\twell\tas\tthrough\tour\tnetwork\tof\tchannel\tpartners,\tand\tin\tthe\tcase\tof\tsome\tcommercial\ncustomers,\tthrough\tPPA\ttransactions.\tWe\temphasize\tsimplicity,\tstandardization\tand\taccessibility\tto\tmake\tit\teasy\tand\tcost-effective\tfor\tcustomers\tto\tadopt\nclean\tenergy,\twhile\treducing\tour\tcustomer\tacquisition\tcosts.\nService\tand\tWarranty\nAutomotive\nService\nWe\tprovide\tservice\tfor\tour\telectric\tvehicles\tat\tour\tcompany-owned\tservice\tlocations\tand\tthrough\tTesla\tMobile\tService\ttechnicians\twho\tperform\twork\nremotely\tat\tcustomers’\thomes\tor\tother\tlocations.\tServicing\tthe\tvehicles\tourselves\tallows\tus\tto\tidentify\tproblems\tand\timplement\tsolutions\tand\nimprovements\tfaster\tthan\ttraditional\tautomobile\tmanufacturers\tand\ttheir\tdealer\tnetworks.\tThe\tconnectivity\tof\tour\tvehicles\talso\tallows\tus\tto\tdiagnose\tand\nremedy\tmany\tproblems\tremotely\tand\tproactively.\nVehicle\tLimited\tWarranties\tand\tExtended\tService\tPlans\nWe\tprovide\ta\tmanufacturer’s\tlimited\twarranty\ton\tall\tnew\tand\tused\tTesla\tvehicles\twe\tsell\tdirectly\tto\tconsumers,\twhich\tmay\tinclude\tlimited\nwarranties\ton\tcertain\tcomponents,\tspecific\ttypes\tof\tdamage\tor\tbattery\tcapacity\tretention.\tWe\talso\tcurrently\toffer\toptional\textended\tservice\tplans\tthat\nprovide\tcoverage\tbeyond\tthe\tnew\tvehicle\tlimited\twarranties\tfor\tcertain\tmodels\tin\tspecified\tregions.\n7', 'Tesla\tMotors\tNL\tLLC\nDelaware\nTesla\tMotors\tNV,\tInc.\nNevada\nTesla\tMotors\tPA,\tInc.\nPennsylvania\nTesla\tMotors\tRomania\tS.R.L.\nRomania\nTesla\tMotors\tSales\tand\tService\tLLC\nTurkey\nTesla\tMotors\tSingapore\tHoldings\tPte.\tLtd.\nSingapore\nTesla\tMotors\tSingapore\tPrivate\tLimited\nSingapore\nTesla\tMotors\tStichting\nNetherlands\nTesla\tMotors\tTaiwan\tLimited\nTaiwan\nTesla\tMotors\tTN,\tInc.\nTennessee\nTesla\tMotors\tTX,\tInc.\nTexas\nTesla\tMotors\tUT,\tInc.\nUtah\nTesla\tNambe\tLLC\nDelaware\nTesla\tNew\tZealand\tULC\nNew\tZealand\nTesla\tNorway\tAS\nNorway\nTesla\tPoland\tsp.\tz\to.o.\nPoland\nTesla\tProperty\t&Casualty,\tInc.\nCalifornia\nTesla\tPortugal,\tSociedade\tUnipessoal\tLDA\nPortugal\nTesla\tPuerto\tRico\tLLC\nPuerto\tRico\nTesla\tQatar\tLLC\nQatar\nTesla\tSales,\tInc.\nDelaware\nTesla\tSdn.\tBhd.\nMalaysia\nTesla\tShanghai\tCo.,\tLtd\nChina\nTesla\t(Shanghai)\tNew\tEnergy\tCo.,\tLTD.\nChina\nTesla\tSpain,\tS.L.\tUnipersonal\nSpain\nTesla\tSwitzerland\tGmbH\nSwitzerland\nTesla\t(Thailand)\tLtd.\nThailand\nTesla\tTH1\tLLC\nDelaware\nTesla\tTH2\tLLC\nDelaware\nTelsa\tToronto\tAutomation\tULC\nCanada\nTesla\tToronto\tInternational\tHoldings\tULC\nCanada\nTesla\t\nTransport\tB.V.\nNetherlands\nThe\tBig\tGreen\tSolar\tI,\tLLC\nDelaware\nThe\tBig\tGreen\tSolar\tManager\tI,\tLLC\nDelaware\nThree\tRivers\tSolar\t1,\tLLC\nDelaware\nThree\tRivers\tSolar\t2,\tLLC\nDelaware\nThree\tRivers\tSolar\t3,\tLLC\nDelaware\nThree\tRivers\tSolar\tManager\t1,\tLLC\nDelaware\nThree\tRivers\tSolar\tManager\t2,\tLLC\nDelaware\nThree\tRivers\tSolar\tManager\t3,\tLLC\nDelaware\nTM\tInternational\tC.V.\nNetherlands\nTM\tSweden\tAB\nSweden\nUSB\tSolarCity\tManager\tIV,\tLLC\nDelaware\nUSB\tSolarCity\tMaster\tTenant\tIV,\tLLC\nCalifornia\nUSB\tSolarCity\tOwner\tIV,\tLLC\nCalifornia\nVisigoth\tSolar\t1,\tLLC\nDelaware\nVisigoth\tSolar\tHoldings,\tLLC\nDelaware\nVisigoth\tSolar\tManaging\tMember\t1,\tLLC\nDelaware\nVPP\tProject\t1\t(SA)\tPty\tLtd.\nAustralia\nWeisshorn\tSolar\tI,\tLLC\nCayman\tIslands']","Tesla manufactures and sells the Model S, Model 3, Model X, Model Y, and Cybertruck. 
","Model 3, Model Y, Model S, Model X, Cybertruck",,0.9999999999666667,
What details are provided about the Cybertruck?,"['Table\tof\tContents\nauthority\tinvestigations,\tlegal\tproceedings\tby\tinternational\tgovernmental\tentities\tor\tothers\tresulting\tin\tmandated\tdisclosure\tof\tsensitive\tdata\tor\tother\ncommercially\tunfavorable\tterms.\tNotwithstanding\tour\tefforts\tto\tprotect\tthe\tsecurity\tand\tintegrity\tof\tour\tcustomers’\tpersonal\tinformation,\twe\tmay\tbe\nrequired\tto\texpend\tsignificant\tresources\tto\tcomply\twith\tdata\tbreach\trequirements\tif,\tfor\texample,\tthird\tparties\timproperly\tobtain\tand\tuse\tthe\tpersonal\ninformation\tof\tour\tcustomers\tor\twe\totherwise\texperience\ta\tdata\tloss\twith\trespect\tto\tthe\tpersonal\tinformation\twe\tprocess\tand\thandle.\tA\tmajor\tbreach\tof\nour\tnetwork\tsecurity\tand\tsystems\tmay\toccur\tdespite\tdefensive\tmeasures,\tand\tmay\tresult\tin\tfines,\tpenalties\tand\tdamages\tand\tharm\tour\tbrand,\tprospects\nand\toperating\tresults.\nWe\tcould\tbe\tsubject\tto\tliability,\tpenalties\tand\tother\trestrictive\tsanctions\tand\tadverse\tconsequences\tarising\tout\tof\tcertain\ngovernmental\tinvestigations\tand\tproceedings.\nWe\tare\tcooperating\twith\tcertain\tgovernment\tinvestigations\tas\tdiscussed\tin\tNote\t15,\t\nCommitments\tand\tContingencies\n,\tto\tthe\tconsolidated\tfinancial\nstatements\tincluded\telsewhere\tin\tthis\tAnnual\tReport\ton\tForm\t10-K.\tTo\tour\tknowledge,\tno\tgovernment\tagency\tin\tany\tsuch\tongoing\tinvestigation\thas\nconcluded\tthat\tany\twrongdoing\toccurred.\tHowever,\twe\tcannot\tpredict\tthe\toutcome\tor\timpact\tof\tany\tsuch\tongoing\tmatters,\tand\tthere\texists\tthe\tpossibility\nthat\twe\tcould\tbe\tsubject\tto\tliability,\tpenalties\tand\tother\trestrictive\tsanctions\tand\tadverse\tconsequences\tif\tthe\tSEC,\tthe\tU.S.\tDepartment\tof\tJustice\tor\tany\nother\tgovernment\tagency\twere\tto\tpursue\tlegal\taction\tin\tthe\tfuture.\tMoreover,\twe\texpect\tto\tincur\tcosts\tin\tresponding\tto\trelated\trequests\tfor\tinformation\nand\tsubpoenas,\tand\tif\tinstituted,\tin\tdefending\tagainst\tany\tgovernmental\tproceedings.\nWe\tmay\tface\tregulatory\tchallenges\tto\tor\tlimitations\ton\tour\tability\tto\tsell\tvehicles\tdirectly.\nWhile\twe\tintend\tto\tcontinue\tto\tleverage\tour\tmost\teffective\tsales\tstrategies,\tincluding\tsales\tthrough\tour\twebsite,\twe\tmay\tnot\tbe\table\tto\tsell\tour\nvehicles\tthrough\tour\town\tstores\tin\tcertain\tstates\tin\tthe\tU.S.\twith\tlaws\tthat\tmay\tbe\tinterpreted\tto\timpose\tlimitations\ton\tthis\tdirect-to-consumer\tsales\nmodel.\tIt\thas\talso\tbeen\tasserted\tthat\tthe\tlaws\tin\tsome\tstates\tlimit\tour\tability\tto\tobtain\tdealer\tlicenses\tfrom\tstate\tmotor\tvehicle\tregulators,\tand\tsuch\nassertions\tpersist.\tIn\tcertain\tlocations,\tdecisions\tby\tregulators\tpermitting\tus\tto\tsell\tvehicles\thave\tbeen,\tand\tmay\tbe,\tchallenged\tby\tdealer\tassociations\nand\tothers\tas\tto\twhether\tsuch\tdecisions\tcomply\twith\tapplicable\tstate\tmotor\tvehicle\tindustry\tlaws.\tWe\thave\tprevailed\tin\tmany\tof\tthese\tlawsuits\tand\tsuch\nresults\thave\treinforced\tour\tcontinuing\tbelief\tthat\tstate\tfranchise\tlaws\twere\tnot\tintended\tto\tapply\tto\ta\tmanufacturer\tthat\tdoes\tnot\thave\tfranchise\tdealers\nanywhere\tin\tthe\tworld.\tIn\tsome\tstates,\tthere\thave\talso\tbeen\tregulatory\tand\tlegislative\tefforts\tby\tdealer\tassociations\tto\tpropose\tlaws\tthat,\tif\tenacted,\nwould\tprevent\tus\tfrom\tobtaining\tdealer\tlicenses\tin\ttheir\tstates\tgiven\tour\tcurrent\tsales\tmodel.\tA\tfew\tstates\thave\tpassed\tlegislation\tthat\tclarifies\tour\tability\nto\toperate,\tbut\tat\tthe\tsame\ttime\tlimits\tthe\tnumber\tof\tdealer\tlicenses\twe\tcan\tobtain\tor\tstores\tthat\twe\tcan\toperate.\tThe\tapplication\tof\tstate\tlaws\tapplicable\nto\tour\toperations\tcontinues\tto\tbe\tdifficult\tto\tpredict.', 'Table\tof\tContents\nAny\tunauthorized\tcontrol\tor\tmanipulation\tof\tour\tproducts’\tsystems\tcould\tresult\tin\tloss\tof\tconfidence\tin\tus\tand\tour\tproducts.\nOur\tproducts\tcontain\tcomplex\tinformation\ttechnology\tsystems.\tFor\texample,\tour\tvehicles\tand\tenergy\tstorage\tproducts\tare\tdesigned\twith\tbuilt-in\ndata\tconnectivity\tto\taccept\tand\tinstall\tperiodic\tremote\tupdates\tfrom\tus\tto\timprove\tor\tupdate\ttheir\tfunctionality.\tWhile\twe\thave\timplemented\tsecurity\nmeasures\tintended\tto\tprevent\tunauthorized\taccess\tto\tour\tinformation\ttechnology\tnetworks,\tour\tproducts\tand\ttheir\tsystems,\tmalicious\tentities\thave\nreportedly\tattempted,\tand\tmay\tattempt\tin\tthe\tfuture,\tto\tgain\tunauthorized\taccess\tto\tmodify,\talter\tand\tuse\tsuch\tnetworks,\tproducts\tand\tsystems\tto\tgain\ncontrol\tof,\tor\tto\tchange,\tour\tproducts’\tfunctionality,\tuser\tinterface\tand\tperformance\tcharacteristics\tor\tto\tgain\taccess\tto\tdata\tstored\tin\tor\tgenerated\tby\tour\nproducts.\tWe\tencourage\treporting\tof\tpotential\tvulnerabilities\tin\tthe\tsecurity\tof\tour\tproducts\tthrough\tour\tsecurity\tvulnerability\treporting\tpolicy,\tand\twe\naim\tto\tremedy\tany\treported\tand\tverified\tvulnerability.\tHowever,\tthere\tcan\tbe\tno\tassurance\tthat\tany\tvulnerabilities\twill\tnot\tbe\texploited\tbefore\tthey\tcan\nbe\tidentified,\tor\tthat\tour\tremediation\tefforts\tare\tor\twill\tbe\tsuccessful.\nAny\tunauthorized\taccess\tto\tor\tcontrol\tof\tour\tproducts\tor\ttheir\tsystems\tor\tany\tloss\tof\tdata\tcould\tresult\tin\tlegal\tclaims\tor\tgovernment\tinvestigations.\nIn\taddition,\tregardless\tof\ttheir\tveracity,\treports\tof\tunauthorized\taccess\tto\tour\tproducts,\ttheir\tsystems\tor\tdata,\tas\twell\tas\tother\tfactors\tthat\tmay\tresult\tin\nthe\tperception\tthat\tour\tproducts,\ttheir\tsystems\tor\tdata\tare\tcapable\tof\tbeing\thacked,\tmay\tharm\tour\tbrand,\tprospects\tand\toperating\tresults.\tWe\thave\tbeen\nthe\tsubject\tof\tsuch\treports\tin\tthe\tpast.\nOur\tbusiness\tmay\tbe\tadversely\taffected\tby\tany\tdisruptions\tcaused\tby\tunion\tactivities.\nIt\tis\tnot\tuncommon\tfor\temployees\tof\tcertain\ttrades\tat\tcompanies\tsuch\tas\tours\tto\tbelong\tto\ta\tunion,\twhich\tcan\tresult\tin\thigher\temployee\tcosts\tand\nincreased\trisk\tof\twork\tstoppages.\tMoreover,\tregulations\tin\tsome\tjurisdictions\toutside\tof\tthe\tU.S.\tmandate\temployee\tparticipation\tin\tindustrial\tcollective\nbargaining\tagreements\tand\twork\tcouncils\twith\tcertain\tconsultation\trights\twith\trespect\tto\tthe\trelevant\tcompanies’\toperations.\tAlthough\twe\twork\tdiligently\nto\tprovide\tthe\tbest\tpossible\twork\tenvironment\tfor\tour\temployees,\tthey\tmay\tstill\tdecide\tto\tjoin\tor\tseek\trecognition\tto\tform\ta\tlabor\tunion,\tor\twe\tmay\tbe\nrequired\tto\tbecome\ta\tunion\tsignatory.\tFrom\ttime\tto\ttime,\tlabor\tunions\thave\tengaged\tin\tcampaigns\tto\torganize\tcertain\tof\tour\toperations,\tas\tpart\tof\twhich\nsuch\tunions\thave\tfiled\tunfair\tlabor\tpractice\tcharges\tagainst\tus\twith\tthe\tNational\tLabor\tRelations\tBoard\t(the\t“NLRB”),\tand\tthey\tmay\tdo\tso\tin\tthe\tfuture.\nAny\tunfavorable\tultimate\toutcome\tfor\tTesla\tmay\thave\ta\tnegative\timpact\ton\tthe\tperception\tof\tTesla’s\ttreatment\tof\tour\temployees.\tFurthermore,\twe\tare\ndirectly\tor\tindirectly\tdependent\tupon\tcompanies\twith\tunionized\twork\tforces,\tsuch\tas\tsuppliers\tand\ttrucking\tand\tfreight\tcompanies.\tAny\twork\tstoppages\tor\nstrikes\torganized\tby\tsuch\tunions\tcould\tdelay\tthe\tmanufacture\tand\tsale\tof\tour\tproducts\tand\tmay\tharm\tour\tbusiness\tand\toperating\tresults.\nWe\tmay\tchoose\tto\tor\tbe\tcompelled\tto\tundertake\tproduct\trecalls\tor\ttake\tother\tsimilar\tactions.\nAs\ta\tmanufacturing\tcompany,\twe\tmust\tmanage\tthe\trisk\tof\tproduct\trecalls\twith\trespect\tto\tour\tproducts.', '(1)\nIndicates\ta\tfiling\tof\tSolarCity\n(2)\nIndicates\ta\tfiling\tof\tMaxwell\tTechnologies,\tInc.\nITEM\t16.\tSUMMARY\nNone.\n111', 'Our\tcybersecurity\trisk\tmanagement\tand\tstrategy\tprocesses\tare\toverseen\tby\tleaders\tfrom\tour\tInformation\tSecurity,\tProduct\tSecurity,\tCompliance\nand\tLegal\tteams.\tSuch\tindividuals\thave\tan\taverage\tof\tover\t15\tyears\tof\tprior\twork\texperience\tin\tvarious\troles\tinvolving\tinformation\ttechnology,\tincluding\nsecurity,\tauditing,\tcompliance,\tsystems\tand\tprogramming.\tThese\tindividuals\tare\tinformed\tabout,\tand\tmonitor\tthe\tprevention,\tmitigation,\tdetection\tand\nremediation\tof\tcybersecurity\tincidents\tthrough\ttheir\tmanagement\tof,\tand\tparticipation\tin,\tthe\tcybersecurity\trisk\tmanagement\tand\tstrategy\tprocesses\ndescribed\tabove,\tincluding\tthe\toperation\tof\tour\tincident\tresponse\tplan,\tand\treport\tto\tthe\tAudit\tCommittee\ton\tany\tappropriate\titems.\nITEM\t2.\tPROPERTIES\nWe\tare\theadquartered\tin\tAustin,\tTexas.\tOur\tprincipal\tfacilities\tinclude\ta\tlarge\tnumber\tof\tproperties\tin\tNorth\tAmerica,\tEurope\tand\tAsia\tutilized\tfor\nmanufacturing\tand\tassembly,\twarehousing,\tengineering,\tretail\tand\tservice\tlocations,\tSupercharger\tsites\tand\tadministrative\tand\tsales\toffices.\tOur\tfacilities\nare\tused\tto\tsupport\tboth\tof\tour\treporting\tsegments,\tand\tare\tsuitable\tand\tadequate\tfor\tthe\tconduct\tof\tour\tbusiness.\tWe\tgenerally\tlease\tsuch\tfacilities\twith\nthe\tprimary\texception\tof\tsome\tmanufacturing\tfacilities.\tThe\tfollowing\ttable\tsets\tforth\tthe\tlocation\tof\tour\tprimary\towned\tand\tleased\tmanufacturing\nfacilities.\nPrimary\tManufacturing\tFacilities\nLocation\nOwned\tor\tLeased\nGigafactory\tTexas\nAustin,\tTexas\nOwned\nFremont\tFactory\nFremont,\tCalifornia\nOwned\nGigafactory\tNevada\nSparks,\tNevada\nOwned\nGigafactory\tBerlin-Brandenburg\nGrunheide,\tGermany\nOwned\nGigafactory\tShanghai\nShanghai,\tChina\n*\nGigafactory\tNew\tYork\nBuffalo,\tNew\tYork\nLeased\nMegafactory\nLathrop,\tCalifornia\nLeased\n*\nWe\town\tthe\tbuilding\tand\tthe\tland\tuse\trights\twith\tan\tinitial\tterm\tof\t50\tyears.\tThe\tland\tuse\trights\tare\ttreated\tas\toperating\tlease\tright-of-use\tassets.\nITEM\t3.\tLEGAL\tPROCEEDINGS\nFor\ta\tdescription\tof\tour\tmaterial\tpending\tlegal\tproceedings,\tplease\tsee\tNote\t15,\t\nCommitments\tand\tContingencies\n,\tto\tthe\tconsolidated\tfinancial\nstatements\tincluded\telsewhere\tin\tthis\tAnnual\tReport\ton\tForm\t10-K.\nIn\taddition,\teach\tof\tthe\tmatters\tbelow\tis\tbeing\tdisclosed\tpursuant\tto\tItem\t103\tof\tRegulation\tS-K\tbecause\tit\trelates\tto\tenvironmental\tregulations\tand\naggregate\tcivil\tpenalties\tthat\twe\tcurrently\tbelieve\tcould\tpotentially\texceed\t$1\tmillion.\tWe\tbelieve\tthat\tany\tproceeding\tthat\tis\tmaterial\tto\tour\tbusiness\tor\nfinancial\tcondition\tis\tlikely\tto\thave\tpotential\tpenalties\tfar\tin\texcess\tof\tsuch\tamount.\nDistrict\tattorneys\tin\tcertain\tCalifornia\tcounties\tconducted\tan\tinvestigation\tinto\tTesla’s\twaste\tsegregation\tpractices\tpursuant\tto\tCal.\tHealth\t&\tSaf.\nCode\t§\t25100\tet\tseq.\tand\tCal.\tCivil\tCode\t§\t1798.80.\tTesla\thas\timplemented\tvarious\tremedial\tmeasures,\tincluding\tconducting\ttraining\tand\taudits,\tand\nenhancements\tto\tits\tsite\twaste\tmanagement\tprograms,\tand\tsettlement\tdiscussions\tare\tongoing.\tWhile\tthe\toutcome\tof\tthis\tmatter\tcannot\tbe\tdetermined\nat\tthis\ttime,\tit\tis\tnot\tcurrently\texpected\tto\thave\ta\tmaterial\tadverse\timpact\ton\tour\tbusiness.\nITEM\t4.\tMINE\tSAFETY\tDISCLOSURES\nNot\tapplicable.\n30', 'Table\tof\tContents\nWe\tare\thighly\tdependent\ton\tthe\tservices\tof\tElon\tMusk,\tTechnoking\tof\tTesla\tand\tour\tChief\tExecutive\tOfficer.\nWe\tare\thighly\tdependent\ton\tthe\tservices\tof\tElon\tMusk,\tTechnoking\tof\tTesla\tand\tour\tChief\tExecutive\tOfficer.\tAlthough\tMr.\tMusk\tspends\tsignificant\ntime\twith\tTesla\tand\tis\thighly\tactive\tin\tour\tmanagement,\the\tdoes\tnot\tdevote\this\tfull\ttime\tand\tattention\tto\tTesla.\tMr.\tMusk\talso\tcurrently\tserves\tas\tChief\nExecutive\tOfficer\tand\tChief\tTechnical\tOfficer\tof\tSpace\tExploration\tTechnologies\tCorp.,\ta\tdeveloper\tand\tmanufacturer\tof\tspace\tlaunch\tvehicles,\tChairman\nand\tChief\tTechnical\tOfficer\tof\tX\tCorp.,\ta\tsocial\tmedia\tcompany,\tand\tis\tinvolved\tin\tother\temerging\ttechnology\tventures.\nOur\tinformation\ttechnology\tsystems\tor\tdata,\tor\tthose\tof\tour\tservice\tproviders\tor\tcustomers\tor\tusers\tcould\tbe\tsubject\tto\tcyber-\nattacks\tor\tother\tsecurity\tincidents,\twhich\tcould\tresult\tin\tdata\tbreaches,\tintellectual\tproperty\ttheft,\tclaims,\tlitigation,\tregulatory\ninvestigations,\tsignificant\tliability,\treputational\tdamage\tand\tother\tadverse\tconsequences.\nWe\tcontinue\tto\texpand\tour\tinformation\ttechnology\tsystems\tas\tour\toperations\tgrow,\tsuch\tas\tproduct\tdata\tmanagement,\tprocurement,\tinventory\nmanagement,\tproduction\tplanning\tand\texecution,\tsales,\tservice\tand\tlogistics,\tdealer\tmanagement,\tfinancial,\ttax\tand\tregulatory\tcompliance\tsystems.\tThis\nincludes\tthe\timplementation\tof\tnew\tinternally\tdeveloped\tsystems\tand\tthe\tdeployment\tof\tsuch\tsystems\tin\tthe\tU.S.\tand\tabroad.\tWhile,\twe\tmaintain\ninformation\ttechnology\tmeasures\tdesigned\tto\tprotect\tus\tagainst\tintellectual\tproperty\ttheft,\tdata\tbreaches,\tsabotage\tand\tother\texternal\tor\tinternal\tcyber-\nattacks\tor\tmisappropriation,\tour\tsystems\tand\tthose\tof\tour\tservice\tproviders\tare\tpotentially\tvulnerable\tto\tmalware,\transomware,\tviruses,\tdenial-of-service\nattacks,\tphishing\tattacks,\tsocial\tengineering,\tcomputer\thacking,\tunauthorized\taccess,\texploitation\tof\tbugs,\tdefects\tand\tvulnerabilities,\tbreakdowns,\ndamage,\tinterruptions,\tsystem\tmalfunctions,\tpower\toutages,\tterrorism,\tacts\tof\tvandalism,\tsecurity\tbreaches,\tsecurity\tincidents,\tinadvertent\tor\tintentional\nactions\tby\temployees\tor\tother\tthird\tparties,\tand\tother\tcyber-attacks.\nTo\tthe\textent\tany\tsecurity\tincident\tresults\tin\tunauthorized\taccess\tor\tdamage\tto\tor\tacquisition,\tuse,\tcorruption,\tloss,\tdestruction,\talteration\tor\ndissemination\tof\tour\tdata,\tincluding\tintellectual\tproperty\tand\tpersonal\tinformation,\tor\tour\tproducts\tor\tvehicles,\tor\tfor\tit\tto\tbe\tbelieved\tor\treported\tthat\tany\nof\tthese\toccurred,\tit\tcould\tdisrupt\tour\tbusiness,\tharm\tour\treputation,\tcompel\tus\tto\tcomply\twith\tapplicable\tdata\tbreach\tnotification\tlaws,\tsubject\tus\tto\ttime\nconsuming,\tdistracting\tand\texpensive\tlitigation,\tregulatory\tinvestigation\tand\toversight,\tmandatory\tcorrective\taction,\trequire\tus\tto\tverify\tthe\tcorrectness\nof\tdatabase\tcontents,\tor\totherwise\tsubject\tus\tto\tliability\tunder\tlaws,\tregulations\tand\tcontractual\tobligations,\tincluding\tthose\tthat\tprotect\tthe\tprivacy\tand\nsecurity\tof\tpersonal\tinformation.\tThis\tcould\tresult\tin\tincreased\tcosts\tto\tus\tand\tresult\tin\tsignificant\tlegal\tand\tfinancial\texposure\tand/or\treputational\tharm.\nWe\talso\trely\ton\tservice\tproviders,\tand\tsimilar\tincidents\trelating\tto\ttheir\tinformation\ttechnology\tsystems\tcould\talso\thave\ta\tmaterial\tadverse\teffect\ton\nour\tbusiness.\tThere\thave\tbeen\tand\tmay\tcontinue\tto\tbe\tsignificant\tsupply\tchain\tattacks.']","The provided text does not contain any details about the Cybertruck.  
","Full‑size electric pickup truck with stainless‑steel exterior, sports‑car performance; first deliveries Nov 2023",1.0,0.0,0.0
What information is given on the Tesla Semi?,"['Tesla,\tInc.\nNotes\tto\tConsolidated\tFinancial\tStatements\nNote\t1\t–\t\nOverview\nTesla,\tInc.\t(“Tesla”,\tthe\t“Company”,\t“we”,\t“us”\tor\t“our”)\twas\tincorporated\tin\tthe\tState\tof\tDelaware\ton\tJuly\t1,\t2003.\tWe\tdesign,\tdevelop,\nmanufacture,\tsell\tand\tlease\thigh-performance\tfully\telectric\tvehicles\tand\tenergy\tgeneration\tand\tstorage\tsystems,\tand\toffer\tservices\trelated\tto\tour\nproducts.\tOur\tChief\tExecutive\tOfficer,\tas\tthe\tchief\toperating\tdecision\tmaker\t(“CODM”),\torganizes\tour\tcompany,\tmanages\tresource\tallocations\tand\nmeasures\tperformance\tamong\t\ntwo\n\toperating\tand\treportable\tsegments:\t(i)\tautomotive\tand\t(ii)\tenergy\tgeneration\tand\tstorage.\nNote\t2\t–\t\nSummary\tof\tSignificant\tAccounting\tPolicies\nPrinciples\tof\tConsolidation\nThe\taccompanying\tconsolidated\tfinancial\tstatements\thave\tbeen\tprepared\tin\tconformity\twith\tGAAP\tand\treflect\tour\taccounts\tand\toperations\tand\nthose\tof\tour\tsubsidiaries\tin\twhich\twe\thave\ta\tcontrolling\tfinancial\tinterest.\tIn\taccordance\twith\tthe\tprovisions\tof\tASC\t810,\t\nConsolidation\t\n(“ASC\t810”),\twe\nconsolidate\tany\tvariable\tinterest\tentity\t(“VIE”)\tof\twhich\twe\tare\tthe\tprimary\tbeneficiary.\tWe\thave\tformed\tVIEs\twith\tfinancing\tfund\tinvestors\tin\tthe\tordinary\ncourse\tof\tbusiness\tin\torder\tto\tfacilitate\tthe\tfunding\tand\tmonetization\tof\tcertain\tattributes\tassociated\twith\tsolar\tenergy\tsystems\tand\tleases\tunder\tour\ndirect\tvehicle\tleasing\tprograms.\tThe\ttypical\tcondition\tfor\ta\tcontrolling\tfinancial\tinterest\townership\tis\tholding\ta\tmajority\tof\tthe\tvoting\tinterests\tof\tan\tentity;\nhowever,\ta\tcontrolling\tfinancial\tinterest\tmay\talso\texist\tin\tentities,\tsuch\tas\tVIEs,\tthrough\tarrangements\tthat\tdo\tnot\tinvolve\tcontrolling\tvoting\tinterests.\tASC\n810\trequires\ta\tvariable\tinterest\tholder\tto\tconsolidate\ta\tVIE\tif\tthat\tparty\thas\tthe\tpower\tto\tdirect\tthe\tactivities\tof\tthe\tVIE\tthat\tmost\tsignificantly\timpact\tthe\nVIE’s\teconomic\tperformance\tand\tthe\tobligation\tto\tabsorb\tlosses\tof\tthe\tVIE\tthat\tcould\tpotentially\tbe\tsignificant\tto\tthe\tVIE\tor\tthe\tright\tto\treceive\tbenefits\nfrom\tthe\tVIE\tthat\tcould\tpotentially\tbe\tsignificant\tto\tthe\tVIE.\tWe\tdo\tnot\tconsolidate\ta\tVIE\tin\twhich\twe\thave\ta\tmajority\townership\tinterest\twhen\twe\tare\tnot\nconsidered\tthe\tprimary\tbeneficiary.\tWe\thave\tdetermined\tthat\twe\tare\tthe\tprimary\tbeneficiary\tof\tall\tthe\tVIEs\t(see\tNote\t16\n,\tVariable\tInterest\tEntity\nArrangements\n).\tWe\tevaluate\tour\trelationships\twith\tall\tthe\tVIEs\ton\tan\tongoing\tbasis\tto\tensure\tthat\twe\tcontinue\tto\tbe\tthe\tprimary\tbeneficiary.\tAll\nintercompany\ttransactions\tand\tbalances\thave\tbeen\teliminated\tupon\tconsolidation.\nUse\tof\tEstimates\nThe\tpreparation\tof\tfinancial\tstatements\tin\tconformity\twith\tGAAP\trequires\tmanagement\tto\tmake\testimates\tand\tassumptions\tthat\taffect\tthe\treported\namounts\tof\tassets,\tliabilities,\trevenues,\tcosts\tand\texpenses\tand\trelated\tdisclosures\tin\tthe\taccompanying\tnotes.\tThe\testimates\tused\tfor,\tbut\tnot\tlimited\tto,\ndetermining\tsignificant\teconomic\tincentive\tfor\tresale\tvalue\tguarantee\tarrangements,\tsales\treturn\treserves,\tincome\ttaxes,\tthe\tcollectability\tof\taccounts\nand\tfinance\treceivables,\tinventory\tvaluation,\twarranties,\tfair\tvalue\tof\tlong-lived\tassets,\tgoodwill,\tfair\tvalue\tof\tfinancial\tinstruments,\tfair\tvalue\tand\tresidual\nvalue\tof\toperating\tlease\tvehicles\tand\tsolar\tenergy\tsystems\tsubject\tto\tleases\tcould\tbe\timpacted.', '(1)\nIndicates\ta\tfiling\tof\tSolarCity\n(2)\nIndicates\ta\tfiling\tof\tMaxwell\tTechnologies,\tInc.\nITEM\t16.\tSUMMARY\nNone.\n111', 'Table\tof\tContents\nPART\tI\nITEM\t1.\tBUSINESS\nOverview\nWe\tdesign,\tdevelop,\tmanufacture,\tsell\tand\tlease\thigh-performance\tfully\telectric\tvehicles\tand\tenergy\tgeneration\tand\tstorage\tsystems,\tand\toffer\nservices\trelated\tto\tour\tproducts.\tWe\tgenerally\tsell\tour\tproducts\tdirectly\tto\tcustomers,\tand\tcontinue\tto\tgrow\tour\tcustomer-facing\tinfrastructure\tthrough\ta\nglobal\tnetwork\tof\tvehicle\tshowrooms\tand\tservice\tcenters,\tMobile\tService,\tbody\tshops,\tSupercharger\tstations\tand\tDestination\tChargers\tto\taccelerate\tthe\nwidespread\tadoption\tof\tour\tproducts.\tWe\temphasize\tperformance,\tattractive\tstyling\tand\tthe\tsafety\tof\tour\tusers\tand\tworkforce\tin\tthe\tdesign\tand\nmanufacture\tof\tour\tproducts\tand\tare\tcontinuing\tto\tdevelop\tfull\tself-driving\ttechnology\tfor\timproved\tsafety.\tWe\talso\tstrive\tto\tlower\tthe\tcost\tof\townership\nfor\tour\tcustomers\tthrough\tcontinuous\tefforts\tto\treduce\tmanufacturing\tcosts\tand\tby\toffering\tfinancial\tand\tother\tservices\ttailored\tto\tour\tproducts.\nOur\tmission\tis\tto\taccelerate\tthe\tworld’s\ttransition\tto\tsustainable\tenergy.\tWe\tbelieve\tthat\tthis\tmission,\talong\twith\tour\tengineering\texpertise,\nvertically\tintegrated\tbusiness\tmodel\tand\tfocus\ton\tuser\texperience\tdifferentiate\tus\tfrom\tother\tcompanies.\nSegment\tInformation\nWe\toperate\tas\ttwo\treportable\tsegments:\t(i)\tautomotive\tand\t(ii)\tenergy\tgeneration\tand\tstorage.\nThe\tautomotive\tsegment\tincludes\tthe\tdesign,\tdevelopment,\tmanufacturing,\tsales\tand\tleasing\tof\thigh-performance\tfully\telectric\tvehicles\tas\twell\tas\nsales\tof\tautomotive\tregulatory\tcredits.\tAdditionally,\tthe\tautomotive\tsegment\talso\tincludes\tservices\tand\tother,\twhich\tincludes\tsales\tof\tused\tvehicles,\tnon-\nwarranty\tafter-sales\tvehicle\tservices,\tbody\tshop\tand\tparts,\tpaid\tSupercharging,\tvehicle\tinsurance\trevenue\tand\tretail\tmerchandise.\tThe\tenergy\tgeneration\nand\tstorage\tsegment\tincludes\tthe\tdesign,\tmanufacture,\tinstallation,\tsales\tand\tleasing\tof\tsolar\tenergy\tgeneration\tand\tenergy\tstorage\tproducts\tand\trelated\nservices\tand\tsales\tof\tsolar\tenergy\tsystems\tincentives.\nOur\tProducts\tand\tServices\nAutomotive\nWe\tcurrently\tmanufacture\tfive\tdifferent\tconsumer\tvehicles\t–\tthe\tModel\t3,\tY,\tS,\tX\tand\tCybertruck.\tModel\t3\tis\ta\tfour-door\tmid-size\tsedan\tthat\twe\ndesigned\tfor\tmanufacturability\twith\ta\tbase\tprice\tfor\tmass-market\tappeal.\tModel\tY\tis\ta\tcompact\tsport\tutility\tvehicle\t(“SUV”)\tbuilt\ton\tthe\tModel\t3\tplatform\nwith\tseating\tfor\tup\tto\tseven\tadults.\tModel\tS\tis\ta\tfour-door\tfull-size\tsedan\tand\tModel\tX\tis\ta\tmid-size\tSUV\twith\tseating\tfor\tup\tto\tseven\tadults.\tModel\tS\tand\nModel\tX\tfeature\tthe\thighest\tperformance\tcharacteristics\tand\tlongest\tranges\tthat\twe\toffer\tin\ta\tsedan\tand\tSUV,\trespectively.\tIn\tNovember\t2023,\twe\nentered\tthe\tconsumer\tpickup\ttruck\tmarket\twith\tfirst\tdeliveries\tof\tthe\tCybertruck,\ta\tfull-size\telectric\tpickup\ttruck\twith\ta\tstainless\tsteel\texterior\tthat\thas\nthe\tutility\tand\tstrength\tof\ta\ttruck\twhile\tfeaturing\tthe\tspeed\tof\ta\tsports\tcar.\nIn\t2022,\twe\talso\tbegan\tearly\tproduction\tand\tdeliveries\tof\ta\tcommercial\telectric\tvehicle,\tthe\tTesla\tSemi.\tWe\thave\tplanned\telectric\tvehicles\tto\naddress\tadditional\tvehicle\tmarkets,\tand\tto\tcontinue\tleveraging\tdevelopments\tin\tour\tproprietary\tFull\tSelf-Driving\t(“FSD”)\tCapability\tfeatures,\tbattery\tcell\nand\tother\ttechnologies.\nEnergy\tGeneration\tand\tStorage\nEnergy\tStorage\tProducts\nPowerwall\tand\tMegapack\tare\tour\tlithium-ion\tbattery\tenergy\tstorage\tproducts.', 'Table\tof\tContents\nSolar\tEnergy\tOfferings\nWe\tsell\tretrofit\tsolar\tenergy\tsystems\tto\tcustomers\tand\tchannel\tpartners\tand\talso\tmake\tthem\tavailable\tthrough\tpower\tpurchase\tagreement\t(“PPA”)\narrangements.\tWe\tpurchase\tmost\tof\tthe\tcomponents\tfor\tour\tretrofit\tsolar\tenergy\tsystems\tfrom\tmultiple\tsources\tto\tensure\tcompetitive\tpricing\tand\nadequate\tsupply.\tWe\talso\tdesign\tand\tmanufacture\tcertain\tcomponents\tfor\tour\tsolar\tenergy\tproducts.\nWe\tsell\tour\tSolar\tRoof,\twhich\tcombines\tpremium\tglass\troof\ttiles\twith\tenergy\tgeneration,\tdirectly\tto\tcustomers,\tas\twell\tas\tthrough\tchannel\ncustomers.\tWe\tcontinue\tto\timprove\tour\tinstallation\tcapability\tand\tefficiency,\tincluding\tthrough\tcollaboration\twith\treal\testate\tdevelopers\tand\tbuilders\ton\nnew\thomes.\nTechnology\nAutomotive\nBattery\tand\tPowertrain\nOur\tcore\tvehicle\ttechnology\tcompetencies\tinclude\tpowertrain\tengineering\tand\tmanufacturing\tand\tour\tability\tto\tdesign\tvehicles\tthat\tutilize\tthe\nunique\tadvantages\tof\tan\telectric\tpowertrain.\tWe\thave\tdesigned\tour\tproprietary\tpowertrain\tsystems\tto\tbe\tadaptable,\tefficient,\treliable\tand\tcost-effective\nwhile\twithstanding\tthe\trigors\tof\tan\tautomotive\tenvironment.\tWe\toffer\tdual\tmotor\tpowertrain\tvehicles,\twhich\tuse\ttwo\telectric\tmotors\tto\tmaximize\ttraction\nand\tperformance\tin\tan\tall-wheel\tdrive\tconfiguration,\tas\twell\tas\tvehicle\tpowertrain\ttechnology\tfeaturing\tthree\telectric\tmotors\tfor\tfurther\tincreased\nperformance\tin\tcertain\tversions\tof\tModel\tS\tand\tModel\tX,\tCybertruck\tand\tthe\tTesla\tSemi.\nWe\tmaintain\textensive\ttesting\tand\tR&D\tcapabilities\tfor\tbattery\tcells,\tpacks\tand\tsystems,\tand\thave\tbuilt\tan\texpansive\tbody\tof\tknowledge\ton\tlithium-\nion\tcell\tchemistry\ttypes\tand\tperformance\tcharacteristics.\tIn\torder\tto\tenable\ta\tgreater\tsupply\tof\tcells\tfor\tour\tproducts\twith\thigher\tenergy\tdensity\tat\tlower\ncosts,\twe\thave\tdeveloped\ta\tnew\tproprietary\tlithium-ion\tbattery\tcell\tand\timproved\tmanufacturing\tprocesses.\nVehicle\tControl\tand\tInfotainment\tSoftware\nThe\tperformance\tand\tsafety\tsystems\tof\tour\tvehicles\tand\ttheir\tbattery\tpacks\tutilize\tsophisticated\tcontrol\tsoftware.\tControl\tsystems\tin\tour\tvehicles\noptimize\tperformance,\tcustomize\tvehicle\tbehavior,\tmanage\tcharging\tand\tcontrol\tall\tinfotainment\tfunctions.\tWe\tdevelop\talmost\tall\tof\tthis\tsoftware,\nincluding\tmost\tof\tthe\tuser\tinterfaces,\tinternally\tand\tupdate\tour\tvehicles’\tsoftware\tregularly\tthrough\tover-the-air\tupdates.\nSelf-Driving\tDevelopment\tand\tArtificial\tIntelligence\nWe\thave\texpertise\tin\tdeveloping\ttechnologies,\tsystems\tand\tsoftware\tto\tenable\tself-driving\tvehicles\tusing\tprimarily\tvision-based\ttechnologies.\tOur\nFSD\tComputer\truns\tour\tneural\tnetworks\tin\tour\tvehicles,\tand\twe\tare\talso\tdeveloping\tadditional\tcomputer\thardware\tto\tbetter\tenable\tthe\tmassive\tamounts\nof\tfield\tdata\tcaptured\tby\tour\tvehicles\tto\tcontinually\ttrain\tand\timprove\tthese\tneural\tnetworks\tfor\treal-world\tperformance.\nCurrently,\twe\toffer\tin\tour\tvehicles\tcertain\tadvanced\tdriver\tassist\tsystems\tunder\tour\tAutopilot\tand\tFSD\tCapability\toptions.\tAlthough\tat\tpresent\tthe\ndriver\tis\tultimately\tresponsible\tfor\tcontrolling\tthe\tvehicle,\tour\tsystems\tprovide\tsafety\tand\tconvenience\tfunctionality\tthat\trelieves\tdrivers\tof\tthe\tmost\ntedious\tand\tpotentially\tdangerous\taspects\tof\troad\ttravel\tmuch\tlike\tthe\tsystem\tthat\tairplane\tpilots\tuse,\twhen\tconditions\tpermit.\tAs\twith\tother\tvehicle\nsystems,\twe\timprove\tthese\tfunctions\tin\tour\tvehicles\tover\ttime\tthrough\tover-the-air\tupdates.\nWe\tintend\tto\testablish\tin\tthe\tfuture\tan\tautonomous\tTesla\tride-hailing\tnetwork,\twhich\twe\texpect\twould\talso\tallow\tus\tto\taccess\ta\tnew\tcustomer\tbase\neven\tas\tmodes\tof\ttransportation\tevolve.', 'In\taddition,\tthe\tSEC\tmaintains\ta\twebsite\t(\nwww.sec.gov\n)\tthat\tcontains\nreports,\tproxy\tand\tinformation\tstatements,\tand\tother\tinformation\tregarding\tissuers\tthat\tfile\telectronically.\tOur\twebsite\tis\tlocated\tat\t\nwww.tesla.com\n,\tand\nour\treports,\tamendments\tthereto,\tproxy\tstatements\tand\tother\tinformation\tare\talso\tmade\tavailable,\tfree\tof\tcharge,\ton\tour\tinvestor\trelations\twebsite\tat\nir.tesla.com\n\tas\tsoon\tas\treasonably\tpracticable\tafter\twe\telectronically\tfile\tor\tfurnish\tsuch\tinformation\twith\tthe\tSEC.\tThe\tinformation\tposted\ton\tour\twebsite\nis\tnot\tincorporated\tby\treference\tinto\tthis\tAnnual\tReport\ton\tForm\t10-K.\nITEM\t1A.\tRISK\tFACTORS\nYou\tshould\tcarefully\tconsider\tthe\trisks\tdescribed\tbelow\ttogether\twith\tthe\tother\tinformation\tset\tforth\tin\tthis\treport,\twhich\tcould\tmaterially\taffect\tour\nbusiness,\tfinancial\tcondition\tand\tfuture\tresults.\tThe\trisks\tdescribed\tbelow\tare\tnot\tthe\tonly\trisks\tfacing\tour\tcompany.\tRisks\tand\tuncertainties\tnot\tcurrently\nknown\tto\tus\tor\tthat\twe\tcurrently\tdeem\tto\tbe\timmaterial\talso\tmay\tmaterially\tadversely\taffect\tour\tbusiness,\tfinancial\tcondition\tand\toperating\tresults.\nRisks\tRelated\tto\tOur\tAbility\tto\tGrow\tOur\tBusiness\nWe\tmay\texperience\tdelays\tin\tlaunching\tand\tramping\tthe\tproduction\tof\tour\tproducts\tand\tfeatures,\tor\twe\tmay\tbe\tunable\tto\tcontrol\nour\tmanufacturing\tcosts.\nWe\thave\tpreviously\texperienced\tand\tmay\tin\tthe\tfuture\texperience\tlaunch\tand\tproduction\tramp\tdelays\tfor\tnew\tproducts\tand\tfeatures.\tFor\texample,\nwe\tencountered\tunanticipated\tsupplier\tissues\tthat\tled\tto\tdelays\tduring\tthe\tinitial\tramp\tof\tour\tfirst\tModel\tX\tand\texperienced\tchallenges\twith\ta\tsupplier\tand\nwith\tramping\tfull\tautomation\tfor\tcertain\tof\tour\tinitial\tModel\t3\tmanufacturing\tprocesses.\tIn\taddition,\twe\tmay\tintroduce\tin\tthe\tfuture\tnew\tor\tunique\nmanufacturing\tprocesses\tand\tdesign\tfeatures\tfor\tour\tproducts.\tAs\twe\texpand\tour\tvehicle\tofferings\tand\tglobal\tfootprint,\tthere\tis\tno\tguarantee\tthat\twe\twill\nbe\table\tto\tsuccessfully\tand\ttimely\tintroduce\tand\tscale\tsuch\tprocesses\tor\tfeatures.\n14']","In 2022, we also began early production and deliveries of a commercial electric vehicle, the Tesla Semi.  
",Commercial electric Semi truck—early production and deliveries began 2022,1.0,0.4166666666458333,1.0
What energy storage products does Tesla offer?,"['In\t2022,\twe\talso\tbegan\tearly\tproduction\tand\tdeliveries\tof\ta\tcommercial\telectric\tvehicle,\tthe\tTesla\tSemi.\tWe\thave\tplanned\telectric\tvehicles\tto\naddress\tadditional\tvehicle\tmarkets,\tand\tto\tcontinue\tleveraging\tdevelopments\tin\tour\tproprietary\tFull\tSelf-Driving\t(“FSD”)\tCapability\tfeatures,\tbattery\tcell\nand\tother\ttechnologies.\nEnergy\tGeneration\tand\tStorage\nEnergy\tStorage\tProducts\nPowerwall\tand\tMegapack\tare\tour\tlithium-ion\tbattery\tenergy\tstorage\tproducts.\tPowerwall,\twhich\twe\tsell\tdirectly\tto\tcustomers,\tas\twell\tas\tthrough\nchannel\tpartners,\tis\tdesigned\tto\tstore\tenergy\tat\ta\thome\tor\tsmall\tcommercial\tfacility.\tMegapack\tis\tan\tenergy\tstorage\tsolution\tfor\tcommercial,\tindustrial,\nutility\tand\tenergy\tgeneration\tcustomers,\tmultiple\tof\twhich\tmay\tbe\tgrouped\ttogether\tto\tform\tlarger\tinstallations\tof\tgigawatt\thours\t(“GWh”)\tor\tgreater\ncapacity.\nWe\talso\tcontinue\tto\tdevelop\tsoftware\tcapabilities\tfor\tremotely\tcontrolling\tand\tdispatching\tour\tenergy\tstorage\tsystems\tacross\ta\twide\trange\tof\nmarkets\tand\tapplications,\tincluding\tthrough\tour\treal-time\tenergy\tcontrol\tand\toptimization\tplatforms.\n4', 'Table\tof\tContents\nEnergy\tGeneration\tand\tStorage\nEnergy\tStorage\tProducts\nWe\tleverage\tmany\tof\tthe\tcomponent-level\ttechnologies\tfrom\tour\tvehicles\tin\tour\tenergy\tstorage\tproducts.\tBy\ttaking\ta\tmodular\tapproach\tto\tthe\ndesign\tof\tbattery\tsystems,\twe\tcan\toptimize\tmanufacturing\tcapacity\tof\tour\tenergy\tstorage\tproducts.\tAdditionally,\tour\texpertise\tin\tpower\telectronics\nenables\tour\tbattery\tsystems\tto\tinterconnect\twith\telectricity\tgrids\twhile\tproviding\tfast-acting\tsystems\tfor\tpower\tinjection\tand\tabsorption.\tWe\thave\talso\ndeveloped\tsoftware\tto\tremotely\tcontrol\tand\tdispatch\tour\tenergy\tstorage\tsystems.\nSolar\tEnergy\tSystems\nWe\thave\tengineered\tSolar\tRoof\tover\tnumerous\titerations\tto\tcombine\taesthetic\tappeal\tand\tdurability\twith\tpower\tgeneration.\tThe\tefficiency\tof\tour\nsolar\tenergy\tproducts\tis\taided\tby\tour\town\tsolar\tinverter,\twhich\tincorporates\tour\tpower\telectronics\ttechnologies.\tWe\tdesigned\tboth\tproducts\tto\tintegrate\nwith\tPowerwall.\nDesign\tand\tEngineering\nAutomotive\nWe\thave\testablished\tsignificant\tin-house\tcapabilities\tin\tthe\tdesign\tand\ttest\tengineering\tof\telectric\tvehicles\tand\ttheir\tcomponents\tand\tsystems.\tOur\nteam\thas\tsignificant\texperience\tin\tcomputer-aided\tdesign\tas\twell\tas\tdurability,\tstrength\tand\tcrash\ttest\tsimulations,\twhich\treduces\tthe\tproduct\ndevelopment\ttime\tof\tnew\tmodels.\tWe\thave\talso\tachieved\tcomplex\tengineering\tfeats\tin\tstamping,\tcasting\tand\tthermal\tsystems,\tand\tdeveloped\ta\tmethod\nto\tintegrate\tbatteries\tdirectly\twith\tvehicle\tbody\tstructures\twithout\tseparate\tbattery\tpacks\tto\toptimize\tmanufacturability,\tweight,\trange\tand\tcost\ncharacteristics.\nWe\tare\talso\texpanding\tour\tmanufacturing\toperations\tglobally\twhile\ttaking\taction\tto\tlocalize\tour\tvehicle\tdesigns\tand\tproduction\tfor\tparticular\nmarkets,\tincluding\tcountry-specific\tmarket\tdemands\tand\tfactory\toptimizations\tfor\tlocal\tworkforces.\tAs\twe\tincrease\tour\tcapabilities,\tparticularly\tin\tthe\nareas\tof\tautomation,\tdie-making\tand\tline-building,\twe\tare\talso\tmaking\tstrides\tin\tthe\tsimulations\tmodeling\tthese\tcapabilities\tprior\tto\tconstruction.\nEnergy\tGeneration\tand\tStorage\nOur\texpertise\tin\telectrical,\tmechanical,\tcivil\tand\tsoftware\tengineering\tallows\tus\tto\tdesign,\tengineer,\tmanufacture\tand\tinstall\tenergy\tgenerating\tand\nstorage\tproducts\tand\tcomponents,\tincluding\tat\tthe\tresidential\tthrough\tutility\tscale.\tFor\texample,\tthe\tmodular\tdesign\tof\tour\tMegapack\tutility-scale\tbattery\nline\tis\tintended\tto\tsignificantly\treduce\tthe\tamount\tof\tassembly\trequired\tin\tthe\tfield.\tWe\talso\tcustomize\tsolutions\tincluding\tour\tenergy\tstorage\tproducts,\nsolar\tenergy\tsystems\tand/or\tSolar\tRoof\tfor\tcustomers\tto\tmeet\ttheir\tspecific\tneeds.\nSales\tand\tMarketing\nHistorically,\twe\thave\tbeen\table\tto\tachieve\tsales\twithout\ttraditional\tadvertising\tand\tat\trelatively\tlow\tmarketing\tcosts.\tWe\tcontinue\tto\tmonitor\tour\npublic\tnarrative\tand\tbrand,\tand\ttailor\tour\tmarketing\tefforts\taccordingly,\tincluding\tthrough\tinvestments\tin\tcustomer\teducation\tand\tadvertising\tas\nnecessary.\nAutomotive\nDirect\tSales\nOur\tvehicle\tsales\tchannels\tcurrently\tinclude\tour\twebsite\tand\tan\tinternational\tnetwork\tof\tcompany-owned\tstores.\tIn\tsome\tjurisdictions,\twe\talso\thave\ngalleries\tto\teducate\tand\tinform\tcustomers\tabout\tour\tproducts,\tbut\tsuch\tlocations\tdo\tnot\ttransact\tin\tthe\tsale\tof\tvehicles.\tWe\tbelieve\tthis\tinfrastructure\nenables\tus\tto\tbetter\tcontrol\tcosts\tof\tinventory,\tmanage\twarranty\tservice\tand\tpricing,\teducate\tconsumers\tabout\telectric\tvehicles,\tmake\tour\tvehicles\tmore\naffordable,\tmaintain\tand\tstrengthen\tthe\tTesla\tbrand\tand\tobtain\trapid\tcustomer\tfeedback.', 'We\texpect\tthat\tthis\tfunctionality\twill\talso\tallow\tus\tto\toffer\tcertain\toptions\tand\tfeatures\ton\ta\nsubscription\tbasis\tin\tthe\tfuture.\nEnergy\tGeneration\tand\tStorage\nWe\tmarket\tand\tsell\tour\tsolar\tand\tenergy\tstorage\tproducts\tto\tresidential,\tcommercial\tand\tindustrial\tcustomers\tand\tutilities\tthrough\ta\tvariety\tof\nchannels,\tincluding\tthrough\tour\twebsite,\tstores\tand\tgalleries,\tas\twell\tas\tthrough\tour\tnetwork\tof\tchannel\tpartners,\tand\tin\tthe\tcase\tof\tsome\tcommercial\ncustomers,\tthrough\tPPA\ttransactions.\tWe\temphasize\tsimplicity,\tstandardization\tand\taccessibility\tto\tmake\tit\teasy\tand\tcost-effective\tfor\tcustomers\tto\tadopt\nclean\tenergy,\twhile\treducing\tour\tcustomer\tacquisition\tcosts.\nService\tand\tWarranty\nAutomotive\nService\nWe\tprovide\tservice\tfor\tour\telectric\tvehicles\tat\tour\tcompany-owned\tservice\tlocations\tand\tthrough\tTesla\tMobile\tService\ttechnicians\twho\tperform\twork\nremotely\tat\tcustomers’\thomes\tor\tother\tlocations.\tServicing\tthe\tvehicles\tourselves\tallows\tus\tto\tidentify\tproblems\tand\timplement\tsolutions\tand\nimprovements\tfaster\tthan\ttraditional\tautomobile\tmanufacturers\tand\ttheir\tdealer\tnetworks.\tThe\tconnectivity\tof\tour\tvehicles\talso\tallows\tus\tto\tdiagnose\tand\nremedy\tmany\tproblems\tremotely\tand\tproactively.\nVehicle\tLimited\tWarranties\tand\tExtended\tService\tPlans\nWe\tprovide\ta\tmanufacturer’s\tlimited\twarranty\ton\tall\tnew\tand\tused\tTesla\tvehicles\twe\tsell\tdirectly\tto\tconsumers,\twhich\tmay\tinclude\tlimited\nwarranties\ton\tcertain\tcomponents,\tspecific\ttypes\tof\tdamage\tor\tbattery\tcapacity\tretention.\tWe\talso\tcurrently\toffer\toptional\textended\tservice\tplans\tthat\nprovide\tcoverage\tbeyond\tthe\tnew\tvehicle\tlimited\twarranties\tfor\tcertain\tmodels\tin\tspecified\tregions.\n7', 'Table\tof\tContents\nEnergy\tGeneration\tand\tStorage\nWe\tprovide\tservice\tand\trepairs\tto\tour\tenergy\tproduct\tcustomers,\tincluding\tunder\twarranty\twhere\tapplicable.\tWe\tgenerally\tprovide\tmanufacturer’s\nlimited\twarranties\twith\tour\tenergy\tstorage\tproducts\tand\toffer\tcertain\textended\tlimited\twarranties\tthat\tare\tavailable\tat\tthe\ttime\tof\tpurchase\tof\tthe\nsystem.\tIf\twe\tinstall\ta\tsystem,\twe\talso\tprovide\tcertain\tlimited\twarranties\ton\tour\tinstallation\tworkmanship.\nFor\tretrofit\tsolar\tenergy\tsystems,\twe\tprovide\tseparate\tlimited\twarranties\tfor\tworkmanship\tand\tagainst\troof\tleaks,\tand\tfor\tSolar\tRoof,\twe\talso\nprovide\tlimited\twarranties\tfor\tdefects\tand\tweatherization.\tFor\tcomponents\tnot\tmanufactured\tby\tus,\twe\tgenerally\tpass-through\tthe\tapplicable\nmanufacturers’\twarranties.\nAs\tpart\tof\tour\tsolar\tenergy\tsystem\tand\tenergy\tstorage\tcontracts,\twe\tmay\tprovide\tthe\tcustomer\twith\tperformance\tguarantees\tthat\tcommit\tthat\tthe\nunderlying\tsystem\twill\tmeet\tor\texceed\tthe\tminimum\tenergy\tgeneration\tor\tperformance\trequirements\tspecified\tin\tthe\tcontract.\nFinancial\tServices\nAutomotive\nPurchase\tFinancing\tand\tLeases\nWe\toffer\tleasing\tand/or\tloan\tfinancing\tarrangements\tfor\tour\tvehicles\tin\tcertain\tjurisdictions\tin\tNorth\tAmerica,\tEurope\tand\tAsia\tourselves\tand\nthrough\tvarious\tfinancial\tinstitutions.\tUnder\tcertain\tof\tsuch\tprograms,\twe\thave\tprovided\tresale\tvalue\tguarantees\tor\tbuyback\tguarantees\tthat\tmay\nobligate\tus\tto\tcover\ta\tresale\tloss\tup\tto\ta\tcertain\tlimit\tor\trepurchase\tthe\tsubject\tvehicles\tat\tpre-determined\tvalues.\nInsurance\nIn\t2021,\twe\tlaunched\tour\tinsurance\tproduct\tusing\treal-time\tdriving\tbehavior\tin\tselect\tstates,\twhich\toffers\trates\tthat\tare\toften\tbetter\tthan\tother\nalternatives\tand\tpromotes\tsafer\tdriving.\tOur\tinsurance\tproducts\tare\tcurrently\tavailable\tin\t12\tstates\tand\twe\tplan\tto\texpand\tthe\tmarkets\tin\twhich\twe\toffer\ninsurance\tproducts,\tas\tpart\tof\tour\tongoing\teffort\tto\tdecrease\tthe\ttotal\tcost\tof\townership\tfor\tour\tcustomers.\nEnergy\tGeneration\tand\tStorage\nWe\toffer\tcertain\tfinancing\toptions\tto\tour\tsolar\tcustomers,\twhich\tenable\tthe\tcustomer\tto\tpurchase\tand\town\ta\tsolar\tenergy\tsystem,\tSolar\tRoof\tor\nintegrated\tsolar\tand\tPowerwall\tsystem.\tOur\tsolar\tPPAs,\toffered\tprimarily\tto\tcommercial\tcustomers,\tcharge\ta\tfee\tper\tkilowatt-hour\tbased\ton\tthe\tamount\tof\nelectricity\tproduced\tby\tour\tsolar\tenergy\tsystems.\nManufacturing\nWe\tcurrently\thave\tmanufacturing\tfacilities\tin\tthe\tU.S.\tin\tNorthern\tCalifornia,\tin\tBuffalo,\tNew\tYork,\tGigafactory\tNew\tYork;\tin\tAustin,\tTexas,\nGigafactory\tTexas\tand\tnear\tReno,\tNevada,\tGigafactory\tNevada.\tAt\tthese\tfacilities,\twe\tmanufacture\tand\tassemble,\tamong\tother\tthings,\tvehicles,\tcertain\nvehicle\tparts\tand\tcomponents,\tsuch\tas\tour\tbattery\tpacks\tand\tbattery\tcells,\tenergy\tstorage\tcomponents\tand\tsolar\tproducts\tand\tcomponents.\nInternationally,\twe\talso\thave\tmanufacturing\tfacilities\tin\tChina\t(Gigafactory\tShanghai)\tand\tGermany\t(Gigafactory\tBerlin-Brandenburg),\twhich\tallows\nus\tto\tincrease\tthe\taffordability\tof\tour\tvehicles\tfor\tcustomers\tin\tlocal\tmarkets\tby\treducing\ttransportation\tand\tmanufacturing\tcosts\tand\teliminating\tthe\nimpact\tof\tunfavorable\ttariffs.\tIn\tMarch\t2023,\twe\tannounced\tthe\tlocation\tof\tour\tnext\tGigafactory\tin\tMonterrey,\tMexico.\tGenerally,\twe\tcontinue\tto\texpand\nproduction\tcapacity\tat\tour\texisting\tfacilities.', ""Table\tof\tContents\nWe\tbelieve\tthat\tthere\tis\talso\tincreasing\tcompetition\tfor\tour\tvehicle\tofferings\tas\ta\tplatform\tfor\tdelivering\tself-driving\ttechnologies,\tcharging\tsolutions\nand\tother\tfeatures\tand\tservices,\tand\twe\texpect\tto\tcompete\tin\tthis\tdeveloping\tmarket\tthrough\tcontinued\tprogress\ton\tour\tAutopilot,\tFSD\tand\tneural\nnetwork\tcapabilities,\tSupercharger\tnetwork\tand\tour\tinfotainment\tofferings.\nEnergy\tGeneration\tand\tStorage\nEnergy\tStorage\tSystems\nThe\tmarket\tfor\tenergy\tstorage\tproducts\tis\talso\thighly\tcompetitive,\tand\tboth\testablished\tand\temerging\tcompanies\thave\tintroduced\tproducts\tthat\tare\nsimilar\tto\tour\tproduct\tportfolio\tor\tthat\tare\talternatives\tto\tthe\telements\tof\tour\tsystems.\tWe\tcompete\twith\tthese\tcompanies\tbased\ton\tprice,\tenergy\tdensity\nand\tefficiency.\tWe\tbelieve\tthat\tthe\tspecifications\tand\tfeatures\tof\tour\tproducts,\tour\tstrong\tbrand\tand\tthe\tmodular,\tscalable\tnature\tof\tour\tenergy\tstorage\nproducts\tgive\tus\ta\tcompetitive\tadvantage\tin\tour\tmarkets.\nSolar\tEnergy\tSystems\nThe\tprimary\tcompetitors\tto\tour\tsolar\tenergy\tbusiness\tare\tthe\ttraditional\tlocal\tutility\tcompanies\tthat\tsupply\tenergy\tto\tour\tpotential\tcustomers.\tWe\ncompete\twith\tthese\ttraditional\tutility\tcompanies\tprimarily\tbased\ton\tprice\tand\tthe\tease\tby\twhich\tcustomers\tcan\tswitch\tto\telectricity\tgenerated\tby\tour\nsolar\tenergy\tsystems.\tWe\talso\tcompete\twith\tsolar\tenergy\tcompanies\tthat\tprovide\tproducts\tand\tservices\tsimilar\tto\tours.\tMany\tsolar\tenergy\tcompanies\nonly\tinstall\tsolar\tenergy\tsystems,\twhile\tothers\tonly\tprovide\tfinancing\tfor\tthese\tinstallations.\tWe\tbelieve\twe\thave\ta\tsignificant\texpansion\topportunity\twith\nour\tofferings\tand\tthat\tthe\tregulatory\tenvironment\tis\tincreasingly\tconducive\tto\tthe\tadoption\tof\trenewable\tenergy\tsystems.\nIntellectual\tProperty\nWe\tplace\ta\tstrong\temphasis\ton\tour\tinnovative\tapproach\tand\tproprietary\tdesigns\twhich\tbring\tintrinsic\tvalue\tand\tuniqueness\tto\tour\tproduct\tportfolio.\nAs\tpart\tof\tour\tbusiness,\twe\tseek\tto\tprotect\tthe\tunderlying\tintellectual\tproperty\trights\tof\tthese\tinnovations\tand\tdesigns\tsuch\tas\twith\trespect\tto\tpatents,\ntrademarks,\tcopyrights,\ttrade\tsecrets,\tconfidential\tinformation\tand\tother\tmeasures,\tincluding\tthrough\temployee\tand\tthird-party\tnondisclosure\nagreements\tand\tother\tcontractual\tarrangements.\tFor\texample,\twe\tplace\ta\thigh\tpriority\ton\tobtaining\tpatents\tto\tprovide\tthe\tbroadest\tand\tstrongest\npossible\tprotection\tto\tenable\tour\tfreedom\tto\toperate\tour\tinnovations\tand\tdesigns\tacross\tall\tof\tour\tproducts\tand\ttechnologies\tas\twell\tas\tto\tprotect\tand\ndefend\tour\tproduct\tportfolio.\tWe\thave\talso\tadopted\ta\tpatent\tpolicy\tin\twhich\twe\tirrevocably\tpledged\tthat\twe\twill\tnot\tinitiate\ta\tlawsuit\tagainst\tany\tparty\tfor\ninfringing\tour\tpatents\tthrough\tactivity\trelating\tto\telectric\tvehicles\tor\trelated\tequipment\tfor\tso\tlong\tas\tsuch\tparty\tis\tacting\tin\tgood\tfaith.\tWe\tmade\tthis\npledge\tin\torder\tto\tencourage\tthe\tadvancement\tof\ta\tcommon,\trapidly-evolving\tplatform\tfor\telectric\tvehicles,\tthereby\tbenefiting\tourselves,\tother\ncompanies\tmaking\telectric\tvehicles\tand\tthe\tworld.\nEnvironmental,\tSocial\tand\tGovernance\t(ESG)\tand\tHuman\tCapital\tResources\nESG\nThe\tvery\tpurpose\tof\tTesla's\texistence\tis\tto\taccelerate\tthe\tworld's\ttransition\tto\tsustainable\tenergy.\tWe\tbelieve\tthe\tworld\tcannot\treduce\tcarbon\nemissions\twithout\taddressing\tboth\tenergy\tgeneration\tand\tconsumption,\tand\twe\tare\tdesigning\tand\tmanufacturing\ta\tcomplete\tenergy\tand\ttransportation\necosystem\tto\tachieve\tthis\tgoal.""]","Tesla offers a range of energy storage products designed to meet the needs of both residential and commercial customers. 


",Powerwall and Megapack,1.0,0.99999999998,
What is Powerwall and what is it used for?,"['In\t2022,\twe\talso\tbegan\tearly\tproduction\tand\tdeliveries\tof\ta\tcommercial\telectric\tvehicle,\tthe\tTesla\tSemi.\tWe\thave\tplanned\telectric\tvehicles\tto\naddress\tadditional\tvehicle\tmarkets,\tand\tto\tcontinue\tleveraging\tdevelopments\tin\tour\tproprietary\tFull\tSelf-Driving\t(“FSD”)\tCapability\tfeatures,\tbattery\tcell\nand\tother\ttechnologies.\nEnergy\tGeneration\tand\tStorage\nEnergy\tStorage\tProducts\nPowerwall\tand\tMegapack\tare\tour\tlithium-ion\tbattery\tenergy\tstorage\tproducts.\tPowerwall,\twhich\twe\tsell\tdirectly\tto\tcustomers,\tas\twell\tas\tthrough\nchannel\tpartners,\tis\tdesigned\tto\tstore\tenergy\tat\ta\thome\tor\tsmall\tcommercial\tfacility.\tMegapack\tis\tan\tenergy\tstorage\tsolution\tfor\tcommercial,\tindustrial,\nutility\tand\tenergy\tgeneration\tcustomers,\tmultiple\tof\twhich\tmay\tbe\tgrouped\ttogether\tto\tform\tlarger\tinstallations\tof\tgigawatt\thours\t(“GWh”)\tor\tgreater\ncapacity.\nWe\talso\tcontinue\tto\tdevelop\tsoftware\tcapabilities\tfor\tremotely\tcontrolling\tand\tdispatching\tour\tenergy\tstorage\tsystems\tacross\ta\twide\trange\tof\nmarkets\tand\tapplications,\tincluding\tthrough\tour\treal-time\tenergy\tcontrol\tand\toptimization\tplatforms.\n4', 'Table\tof\tContents\nAny\tunauthorized\tcontrol\tor\tmanipulation\tof\tour\tproducts’\tsystems\tcould\tresult\tin\tloss\tof\tconfidence\tin\tus\tand\tour\tproducts.\nOur\tproducts\tcontain\tcomplex\tinformation\ttechnology\tsystems.\tFor\texample,\tour\tvehicles\tand\tenergy\tstorage\tproducts\tare\tdesigned\twith\tbuilt-in\ndata\tconnectivity\tto\taccept\tand\tinstall\tperiodic\tremote\tupdates\tfrom\tus\tto\timprove\tor\tupdate\ttheir\tfunctionality.\tWhile\twe\thave\timplemented\tsecurity\nmeasures\tintended\tto\tprevent\tunauthorized\taccess\tto\tour\tinformation\ttechnology\tnetworks,\tour\tproducts\tand\ttheir\tsystems,\tmalicious\tentities\thave\nreportedly\tattempted,\tand\tmay\tattempt\tin\tthe\tfuture,\tto\tgain\tunauthorized\taccess\tto\tmodify,\talter\tand\tuse\tsuch\tnetworks,\tproducts\tand\tsystems\tto\tgain\ncontrol\tof,\tor\tto\tchange,\tour\tproducts’\tfunctionality,\tuser\tinterface\tand\tperformance\tcharacteristics\tor\tto\tgain\taccess\tto\tdata\tstored\tin\tor\tgenerated\tby\tour\nproducts.\tWe\tencourage\treporting\tof\tpotential\tvulnerabilities\tin\tthe\tsecurity\tof\tour\tproducts\tthrough\tour\tsecurity\tvulnerability\treporting\tpolicy,\tand\twe\naim\tto\tremedy\tany\treported\tand\tverified\tvulnerability.\tHowever,\tthere\tcan\tbe\tno\tassurance\tthat\tany\tvulnerabilities\twill\tnot\tbe\texploited\tbefore\tthey\tcan\nbe\tidentified,\tor\tthat\tour\tremediation\tefforts\tare\tor\twill\tbe\tsuccessful.\nAny\tunauthorized\taccess\tto\tor\tcontrol\tof\tour\tproducts\tor\ttheir\tsystems\tor\tany\tloss\tof\tdata\tcould\tresult\tin\tlegal\tclaims\tor\tgovernment\tinvestigations.\nIn\taddition,\tregardless\tof\ttheir\tveracity,\treports\tof\tunauthorized\taccess\tto\tour\tproducts,\ttheir\tsystems\tor\tdata,\tas\twell\tas\tother\tfactors\tthat\tmay\tresult\tin\nthe\tperception\tthat\tour\tproducts,\ttheir\tsystems\tor\tdata\tare\tcapable\tof\tbeing\thacked,\tmay\tharm\tour\tbrand,\tprospects\tand\toperating\tresults.\tWe\thave\tbeen\nthe\tsubject\tof\tsuch\treports\tin\tthe\tpast.\nOur\tbusiness\tmay\tbe\tadversely\taffected\tby\tany\tdisruptions\tcaused\tby\tunion\tactivities.\nIt\tis\tnot\tuncommon\tfor\temployees\tof\tcertain\ttrades\tat\tcompanies\tsuch\tas\tours\tto\tbelong\tto\ta\tunion,\twhich\tcan\tresult\tin\thigher\temployee\tcosts\tand\nincreased\trisk\tof\twork\tstoppages.\tMoreover,\tregulations\tin\tsome\tjurisdictions\toutside\tof\tthe\tU.S.\tmandate\temployee\tparticipation\tin\tindustrial\tcollective\nbargaining\tagreements\tand\twork\tcouncils\twith\tcertain\tconsultation\trights\twith\trespect\tto\tthe\trelevant\tcompanies’\toperations.\tAlthough\twe\twork\tdiligently\nto\tprovide\tthe\tbest\tpossible\twork\tenvironment\tfor\tour\temployees,\tthey\tmay\tstill\tdecide\tto\tjoin\tor\tseek\trecognition\tto\tform\ta\tlabor\tunion,\tor\twe\tmay\tbe\nrequired\tto\tbecome\ta\tunion\tsignatory.\tFrom\ttime\tto\ttime,\tlabor\tunions\thave\tengaged\tin\tcampaigns\tto\torganize\tcertain\tof\tour\toperations,\tas\tpart\tof\twhich\nsuch\tunions\thave\tfiled\tunfair\tlabor\tpractice\tcharges\tagainst\tus\twith\tthe\tNational\tLabor\tRelations\tBoard\t(the\t“NLRB”),\tand\tthey\tmay\tdo\tso\tin\tthe\tfuture.\nAny\tunfavorable\tultimate\toutcome\tfor\tTesla\tmay\thave\ta\tnegative\timpact\ton\tthe\tperception\tof\tTesla’s\ttreatment\tof\tour\temployees.\tFurthermore,\twe\tare\ndirectly\tor\tindirectly\tdependent\tupon\tcompanies\twith\tunionized\twork\tforces,\tsuch\tas\tsuppliers\tand\ttrucking\tand\tfreight\tcompanies.\tAny\twork\tstoppages\tor\nstrikes\torganized\tby\tsuch\tunions\tcould\tdelay\tthe\tmanufacture\tand\tsale\tof\tour\tproducts\tand\tmay\tharm\tour\tbusiness\tand\toperating\tresults.\nWe\tmay\tchoose\tto\tor\tbe\tcompelled\tto\tundertake\tproduct\trecalls\tor\ttake\tother\tsimilar\tactions.\nAs\ta\tmanufacturing\tcompany,\twe\tmust\tmanage\tthe\trisk\tof\tproduct\trecalls\twith\trespect\tto\tour\tproducts.', 'This\tcould\tresult\tin\tincreased\tcosts\tto\tus\tand\tresult\tin\tsignificant\tlegal\tand\tfinancial\texposure\tand/or\treputational\tharm.\nWe\talso\trely\ton\tservice\tproviders,\tand\tsimilar\tincidents\trelating\tto\ttheir\tinformation\ttechnology\tsystems\tcould\talso\thave\ta\tmaterial\tadverse\teffect\ton\nour\tbusiness.\tThere\thave\tbeen\tand\tmay\tcontinue\tto\tbe\tsignificant\tsupply\tchain\tattacks.\tOur\tservice\tproviders,\tincluding\tour\tworkforce\tmanagement\nsoftware\tprovider,\thave\tbeen\tsubject\tto\transomware\tand\tother\tsecurity\tincidents,\tand\twe\tcannot\tguarantee\tthat\tour\tor\tour\tservice\tproviders’\tsystems\nhave\tnot\tbeen\tbreached\tor\tthat\tthey\tdo\tnot\tcontain\texploitable\tdefects,\tbugs,\tor\tvulnerabilities\tthat\tcould\tresult\tin\ta\tsecurity\tincident,\tor\tother\tdisruption\nto,\tour\tor\tour\tservice\tproviders’\tsystems.\tOur\tability\tto\tmonitor\tour\tservice\tproviders’\tsecurity\tmeasures\tis\tlimited,\tand,\tin\tany\tevent,\tmalicious\tthird\nparties\tmay\tbe\table\tto\tcircumvent\tthose\tsecurity\tmeasures.\nFurther,\tthe\timplementation,\tmaintenance,\tsegregation\tand\timprovement\tof\tthese\tsystems\trequire\tsignificant\tmanagement\ttime,\tsupport\tand\tcost,\nand\tthere\tare\tinherent\trisks\tassociated\twith\tdeveloping,\timproving\tand\texpanding\tour\tcore\tsystems\tas\twell\tas\timplementing\tnew\tsystems\tand\tupdating\ncurrent\tsystems,\tincluding\tdisruptions\tto\tthe\trelated\tareas\tof\tbusiness\toperation.\tThese\trisks\tmay\taffect\tour\tability\tto\tmanage\tour\tdata\tand\tinventory,\nprocure\tparts\tor\tsupplies\tor\tmanufacture,\tsell,\tdeliver\tand\tservice\tproducts,\tadequately\tprotect\tour\tintellectual\tproperty\tor\tachieve\tand\tmaintain\ncompliance\twith,\tor\trealize\tavailable\tbenefits\tunder,\ttax\tlaws\tand\tother\tapplicable\tregulations.\nMoreover,\tif\twe\tdo\tnot\tsuccessfully\timplement,\tmaintain\tor\texpand\tthese\tsystems\tas\tplanned,\tour\toperations\tmay\tbe\tdisrupted,\tour\tability\tto\naccurately\tand/or\ttimely\treport\tour\tfinancial\tresults\tcould\tbe\timpaired\tand\tdeficiencies\tmay\tarise\tin\tour\tinternal\tcontrol\tover\tfinancial\treporting,\twhich\nmay\timpact\tour\tability\tto\tcertify\tour\tfinancial\tresults.\tMoreover,\tour\tproprietary\tinformation,\tincluding\tintellectual\tproperty\tand\tpersonal\tinformation,\ncould\tbe\tcompromised\tor\tmisappropriated\tand\tour\treputation\tmay\tbe\tadversely\taffected.\tIf\tthese\tsystems\tor\ttheir\tfunctionality\tdo\tnot\toperate\tas\twe\nexpect\tthem\tto,\twe\tmay\tbe\trequired\tto\texpend\tsignificant\tresources\tto\tmake\tcorrections\tor\tfind\talternative\tsources\tfor\tperforming\tthese\tfunctions.\n21', 'The Company’s ability to compete successfully depends heavily on ensuring the continuing and timely introduction of innovative \nnew products, services and technologies to the marketplace. The Company designs and develops nearly the entire solution for \nits products, including the hardware, operating system, numerous software applications and related services. Principal \ncompetitive factors important to the Company include price, product and service features (including security features), relative \nprice and performance, product and service quality and reliability, design innovation, a strong third-party software and \naccessories ecosystem, marketing and distribution capability, service and support, and corporate reputation.\nThe Company is focused on expanding its market opportunities related to smartphones, personal computers, tablets, wearables \nand accessories, and services. The Company faces substantial competition in these markets from companies that have \nsignificant technical, marketing, distribution and other resources, as well as established hardware, software, and service offerings \nwith large customer bases. In addition, some of the Company’s competitors have broader product lines, lower-priced products \nand a larger installed base of active devices. Competition has been particularly intense as competitors have aggressively cut \nprices and lowered product margins. Certain competitors have the resources, experience or cost structures to provide products \nat little or no profit or even at a loss. The Company’s services compete with business models that provide content to users for \nfree and use illegitimate means to obtain third-party digital content and applications. The Company faces significant competition \nas competitors imitate the Company’s product features and applications within their products, or collaborate to offer integrated \nsolutions that are more competitive than those they currently offer.\nSupply of Components\nAlthough most components essential to the Company’s business are generally available from multiple sources, certain \ncomponents are currently obtained from single or limited sources. The Company also competes for various components with \nother participants in the markets for smartphones, personal computers, tablets, wearables and accessories. Therefore, many \ncomponents used by the Company, including those that are available from multiple sources, are at times subject to industry-wide \nshortage and significant commodity pricing fluctuations.\nThe Company uses some custom components that are not commonly used by its competitors, and new products introduced by \nthe Company often utilize custom components available from only one source. When a component or product uses new \ntechnologies, initial capacity constraints may exist until the suppliers’ yields have matured or their manufacturing capacities have \nincreased. The continued availability of these components at acceptable prices, or at all, may be affected if suppliers decide to \nconcentrate on the production of common components instead of components customized to meet the Company’s requirements.\nThe Company has entered into agreements for the supply of many components; however, there can be no guarantee that the \nCompany will be able to extend or renew these agreements on similar terms, or at all.\nResearch and Development\nBecause the industries in which the Company competes are characterized by rapid technological advances, the Company’s \nability to compete successfully depends heavily upon its ability to ensure a continual and timely flow of competitive products, \nservices and technologies to the marketplace. The Company continues to develop new technologies to enhance existing \nproducts and services, and to expand the range of its offerings through research and development (“R&D”), licensing of \nintellectual property and acquisition of third-party businesses and technology.\nIntellectual Property\nThe Company currently holds a broad collection of intellectual property rights relating to certain aspects of its hardware devices, \naccessories, software and services. This includes patents, designs, copyrights, trademarks and other forms of intellectual \nproperty rights in the U.S. and various foreign countries. Although the Company believes the ownership of such intellectual \nproperty rights is an important factor in differentiating its business and that its success does depend in part on such ownership, \nthe Company relies primarily on the innovative skills, technical competence and marketing abilities of its personnel.\nThe Company regularly files patent, design, copyright and trademark applications to protect innovations arising from its research, \ndevelopment, design and marketing, and is currently pursuing thousands of applications around the world. Over time, the \nCompany has accumulated a large portfolio of issued and registered intellectual property rights around the world. No single \nintellectual property right is solely responsible for protecting the Company’s products and services. The Company believes the \nduration of its intellectual property rights is adequate relative to the expected lives of its products and services.\nIn addition to Company-owned intellectual property, many of the Company’s products and services are designed to include \nintellectual property owned by third parties. It may be necessary in the future to seek or renew licenses relating to various \naspects of the Company’s products, processes and services. While the Company has generally been able to obtain such \nlicenses on commercially reasonable terms in the past, there is no guarantee that such licenses could be obtained in the future \non reasonable terms or at all.\nApple Inc. | 2023 Form 10-K | 3', '(1)\nIndicates\ta\tfiling\tof\tSolarCity\n(2)\nIndicates\ta\tfiling\tof\tMaxwell\tTechnologies,\tInc.\nITEM\t16.\tSUMMARY\nNone.\n111']","Powerwall is a lithium-ion battery energy storage product designed to store energy at a home or small commercial facility.  
",Home and small‑commercial lithium‑ion battery energy storage system,1.0,0.9999999999,1.0
What is Megapack and what applications does it serve?,"['In\t2022,\twe\talso\tbegan\tearly\tproduction\tand\tdeliveries\tof\ta\tcommercial\telectric\tvehicle,\tthe\tTesla\tSemi.\tWe\thave\tplanned\telectric\tvehicles\tto\naddress\tadditional\tvehicle\tmarkets,\tand\tto\tcontinue\tleveraging\tdevelopments\tin\tour\tproprietary\tFull\tSelf-Driving\t(“FSD”)\tCapability\tfeatures,\tbattery\tcell\nand\tother\ttechnologies.\nEnergy\tGeneration\tand\tStorage\nEnergy\tStorage\tProducts\nPowerwall\tand\tMegapack\tare\tour\tlithium-ion\tbattery\tenergy\tstorage\tproducts.\tPowerwall,\twhich\twe\tsell\tdirectly\tto\tcustomers,\tas\twell\tas\tthrough\nchannel\tpartners,\tis\tdesigned\tto\tstore\tenergy\tat\ta\thome\tor\tsmall\tcommercial\tfacility.\tMegapack\tis\tan\tenergy\tstorage\tsolution\tfor\tcommercial,\tindustrial,\nutility\tand\tenergy\tgeneration\tcustomers,\tmultiple\tof\twhich\tmay\tbe\tgrouped\ttogether\tto\tform\tlarger\tinstallations\tof\tgigawatt\thours\t(“GWh”)\tor\tgreater\ncapacity.\nWe\talso\tcontinue\tto\tdevelop\tsoftware\tcapabilities\tfor\tremotely\tcontrolling\tand\tdispatching\tour\tenergy\tstorage\tsystems\tacross\ta\twide\trange\tof\nmarkets\tand\tapplications,\tincluding\tthrough\tour\treal-time\tenergy\tcontrol\tand\toptimization\tplatforms.\n4', 'The Company’s ability to compete successfully depends heavily on ensuring the continuing and timely introduction of innovative \nnew products, services and technologies to the marketplace. The Company designs and develops nearly the entire solution for \nits products, including the hardware, operating system, numerous software applications and related services. Principal \ncompetitive factors important to the Company include price, product and service features (including security features), relative \nprice and performance, product and service quality and reliability, design innovation, a strong third-party software and \naccessories ecosystem, marketing and distribution capability, service and support, and corporate reputation.\nThe Company is focused on expanding its market opportunities related to smartphones, personal computers, tablets, wearables \nand accessories, and services. The Company faces substantial competition in these markets from companies that have \nsignificant technical, marketing, distribution and other resources, as well as established hardware, software, and service offerings \nwith large customer bases. In addition, some of the Company’s competitors have broader product lines, lower-priced products \nand a larger installed base of active devices. Competition has been particularly intense as competitors have aggressively cut \nprices and lowered product margins. Certain competitors have the resources, experience or cost structures to provide products \nat little or no profit or even at a loss. The Company’s services compete with business models that provide content to users for \nfree and use illegitimate means to obtain third-party digital content and applications. The Company faces significant competition \nas competitors imitate the Company’s product features and applications within their products, or collaborate to offer integrated \nsolutions that are more competitive than those they currently offer.\nSupply of Components\nAlthough most components essential to the Company’s business are generally available from multiple sources, certain \ncomponents are currently obtained from single or limited sources. The Company also competes for various components with \nother participants in the markets for smartphones, personal computers, tablets, wearables and accessories. Therefore, many \ncomponents used by the Company, including those that are available from multiple sources, are at times subject to industry-wide \nshortage and significant commodity pricing fluctuations.\nThe Company uses some custom components that are not commonly used by its competitors, and new products introduced by \nthe Company often utilize custom components available from only one source. When a component or product uses new \ntechnologies, initial capacity constraints may exist until the suppliers’ yields have matured or their manufacturing capacities have \nincreased. The continued availability of these components at acceptable prices, or at all, may be affected if suppliers decide to \nconcentrate on the production of common components instead of components customized to meet the Company’s requirements.\nThe Company has entered into agreements for the supply of many components; however, there can be no guarantee that the \nCompany will be able to extend or renew these agreements on similar terms, or at all.\nResearch and Development\nBecause the industries in which the Company competes are characterized by rapid technological advances, the Company’s \nability to compete successfully depends heavily upon its ability to ensure a continual and timely flow of competitive products, \nservices and technologies to the marketplace. The Company continues to develop new technologies to enhance existing \nproducts and services, and to expand the range of its offerings through research and development (“R&D”), licensing of \nintellectual property and acquisition of third-party businesses and technology.\nIntellectual Property\nThe Company currently holds a broad collection of intellectual property rights relating to certain aspects of its hardware devices, \naccessories, software and services. This includes patents, designs, copyrights, trademarks and other forms of intellectual \nproperty rights in the U.S. and various foreign countries. Although the Company believes the ownership of such intellectual \nproperty rights is an important factor in differentiating its business and that its success does depend in part on such ownership, \nthe Company relies primarily on the innovative skills, technical competence and marketing abilities of its personnel.\nThe Company regularly files patent, design, copyright and trademark applications to protect innovations arising from its research, \ndevelopment, design and marketing, and is currently pursuing thousands of applications around the world. Over time, the \nCompany has accumulated a large portfolio of issued and registered intellectual property rights around the world. No single \nintellectual property right is solely responsible for protecting the Company’s products and services. The Company believes the \nduration of its intellectual property rights is adequate relative to the expected lives of its products and services.\nIn addition to Company-owned intellectual property, many of the Company’s products and services are designed to include \nintellectual property owned by third parties. It may be necessary in the future to seek or renew licenses relating to various \naspects of the Company’s products, processes and services. While the Company has generally been able to obtain such \nlicenses on commercially reasonable terms in the past, there is no guarantee that such licenses could be obtained in the future \non reasonable terms or at all.\nApple Inc. | 2023 Form 10-K | 3', '(1)\nIndicates\ta\tfiling\tof\tSolarCity\n(2)\nIndicates\ta\tfiling\tof\tMaxwell\tTechnologies,\tInc.\nITEM\t16.\tSUMMARY\nNone.\n111', 'Services\nAdvertising\nThe Company’s advertising services include third-party licensing arrangements and the Company’s own advertising platforms.\nAppleCare\nThe Company offers a portfolio of fee-based service and support products under the AppleCare ® brand. The offerings provide \npriority access to Apple technical support, access to the global Apple authorized service network for repair and replacement \nservices, and in many cases additional coverage for instances of accidental damage or theft and loss, depending on the country \nand type of product.\nCloud Services\nThe Company’s cloud services store and keep customers’ content up-to-date and available across multiple Apple devices and \nWindows personal computers.\nDigital Content\nThe Company operates various platforms, including the App Store ®, that allow customers to discover and download applications \nand digital content, such as books, music, video, games and podcasts.\nThe Company also offers digital content through subscription-based services, including Apple Arcade ®, a game subscription \nservice; Apple Fitness+ SM, a personalized fitness service; Apple Music ®, which offers users a curated listening experience with \non-demand radio stations; Apple News+ ®, a subscription news and magazine service; and Apple TV+ ®, which offers exclusive \noriginal content and live sports.\nPayment Services\nThe Company offers payment services, including Apple Card ®, a co-branded credit card, and Apple Pay ®, a cashless payment \nservice.\nSegments\nThe Company manages its business primarily on a geographic basis. The Company’s reportable segments consist of the \nAmericas, Europe, Greater China, Japan and Rest of Asia Pacific. Americas includes both North and South America. Europe \nincludes European countries, as well as India, the Middle East and Africa. Greater China includes China mainland, Hong Kong \nand Taiwan. Rest of Asia Pacific includes Australia and those Asian countries not included in the Company’s other reportable \nsegments. Although the reportable segments provide similar hardware and software products and similar services, each one is \nmanaged separately to better align with the location of the Company’s customers and distribution partners and the unique market \ndynamics of each geographic region.\nMarkets and Distribution\nThe Company’s customers are primarily in the consumer, small and mid-sized business, education, enterprise and government \nmarkets. The Company sells its products and resells third-party products in most of its major markets directly to customers \nthrough its retail and online stores and its direct sales force. The Company also employs a variety of indirect distribution \nchannels, such as third-party cellular network carriers, wholesalers, retailers and resellers. During 2023, the Company’s net \nsales through its direct and indirect distribution channels accounted for 37% and 63%, respectively, of total net sales.\nCompetition\nThe markets for the Company’s products and services are highly competitive, and are characterized by aggressive price \ncompetition and resulting downward pressure on gross margins, frequent introduction of new products and services, short \nproduct life cycles, evolving industry standards, continual improvement in product price and performance characteristics, rapid \nadoption of technological advancements by competitors, and price sensitivity on the part of consumers and businesses. Many of \nthe Company’s competitors seek to compete primarily through aggressive pricing and very low cost structures, and by imitating \nthe Company’s products and infringing on its intellectual property.\nApple Inc. | 2023 Form 10-K | 2', 'The Company distributes third-party applications for its products through the App Store. For the vast majority of applications, \ndevelopers keep all of the revenue they generate on the App Store. The Company retains a commission from sales of \napplications and sales of digital services or goods initiated within an application. From time to time, the Company has made \nchanges to its App Store, including actions taken in response to competition, market conditions and legal and regulatory \nrequirements. The Company expects to make further business changes in the future, including as a result of legislative initiatives \nimpacting the App Store, such as the European Union (“EU”) Digital Markets Act, which the Company is required to comply with \nby March 2024. The Company is also subject to litigation and investigations relating to the App Store, which have resulted in \nchanges to the Company’s business practices, and may in the future result in further changes. Changes have included how \ndevelopers communicate with consumers outside the App Store regarding alternative purchasing mechanisms. Future changes \ncould also affect what the Company charges developers for access to its platforms, how it manages distribution of apps outside \nof the App Store, and how and to what extent it allows developers to communicate with consumers inside the App Store \nregarding alternative purchasing mechanisms. This could reduce the volume of sales, and the commission that the Company \nearns on those sales, would decrease. If the rate of the commission that the Company retains on such sales is reduced, or if it is \notherwise narrowed in scope or eliminated, the Company’s business, results of operations and financial condition could be \nmaterially adversely affected.\nFailure to obtain or create digital content that appeals to the Company’s customers, or to make such content available \non commercially reasonable terms, could have a material adverse impact on the Company’s business, results of \noperations and financial condition.\nThe Company contracts with numerous third parties to offer their digital content to customers. This includes the right to sell, or \noffer subscriptions to, third-party content, as well as the right to incorporate specific content into the Company’s own services. \nThe licensing or other distribution arrangements for this content can be for relatively short time periods and do not guarantee the \ncontinuation or renewal of these arrangements on commercially reasonable terms, or at all. Some third-party content providers \nand distributors currently or in the future may offer competing products and services, and can take actions to make it difficult or \nimpossible for the Company to license or otherwise distribute their content. Other content owners, providers or distributors may \nseek to limit the Company’s access to, or increase the cost of, such content. The Company may be unable to continue to offer a \nwide variety of content at commercially reasonable prices with acceptable usage rules.\nThe Company also produces its own digital content, which can be costly to produce due to intense and increasing competition for \ntalent, content and subscribers, and may fail to appeal to the Company’s customers.\nSome third-party digital content providers require the Company to provide digital rights management and other security solutions. \nIf requirements change, the Company may have to develop or license new technology to provide these solutions. There can be \nno assurance the Company will be able to develop or license such solutions at a reasonable cost and in a timely manner.\nThe Company’s success depends largely on the talents and efforts of its team members, the continued service and \navailability of highly skilled employees, including key personnel, and the Company’s ability to nurture its distinctive and \ninclusive culture.\nMuch of the Company’s future success depends on the talents and efforts of its team members and the continued availability and \nservice of key personnel, including its Chief Executive Officer, executive team and other highly skilled employees. Experienced \npersonnel in the technology industry are in high demand and competition for their talents is intense, especially in Silicon Valley, \nwhere most of the Company’s key personnel are located. In addition to intense competition for talent, workforce dynamics are \nconstantly evolving. If the Company does not manage changing workforce dynamics effectively, it could materially adversely \naffect the Company’s culture, reputation and operational flexibility.\nThe Company believes that its distinctive and inclusive culture is a significant driver of its success. If the Company is unable to \nnurture its culture, it could materially adversely affect the Company’s ability to recruit and retain the highly skilled employees who \nare critical to its success, and could otherwise materially adversely affect the Company’s business, reputation, results of \noperations and financial condition.\nThe Company depends on the performance of carriers, wholesalers, retailers and other resellers.\nThe Company distributes its products and certain of its services through cellular network carriers, wholesalers, retailers and \nresellers, many of which distribute products and services from competitors.']","Megapack is an energy storage solution designed for commercial, industrial, utility, and energy generation customers.  Multiple Megapack units can be grouped together to form larger installations capable of storing gigawatt-hours of energy. 


","Utility‑scale lithium‑ion battery storage solution for commercial, industrial and utility customers, scalable to gigawatt‑hour installations",1.0,0.9999999999,1.0
What solar energy offerings does Tesla provide?,"['Table\tof\tContents\nSolar\tEnergy\tOfferings\nWe\tsell\tretrofit\tsolar\tenergy\tsystems\tto\tcustomers\tand\tchannel\tpartners\tand\talso\tmake\tthem\tavailable\tthrough\tpower\tpurchase\tagreement\t(“PPA”)\narrangements.\tWe\tpurchase\tmost\tof\tthe\tcomponents\tfor\tour\tretrofit\tsolar\tenergy\tsystems\tfrom\tmultiple\tsources\tto\tensure\tcompetitive\tpricing\tand\nadequate\tsupply.\tWe\talso\tdesign\tand\tmanufacture\tcertain\tcomponents\tfor\tour\tsolar\tenergy\tproducts.\nWe\tsell\tour\tSolar\tRoof,\twhich\tcombines\tpremium\tglass\troof\ttiles\twith\tenergy\tgeneration,\tdirectly\tto\tcustomers,\tas\twell\tas\tthrough\tchannel\ncustomers.\tWe\tcontinue\tto\timprove\tour\tinstallation\tcapability\tand\tefficiency,\tincluding\tthrough\tcollaboration\twith\treal\testate\tdevelopers\tand\tbuilders\ton\nnew\thomes.\nTechnology\nAutomotive\nBattery\tand\tPowertrain\nOur\tcore\tvehicle\ttechnology\tcompetencies\tinclude\tpowertrain\tengineering\tand\tmanufacturing\tand\tour\tability\tto\tdesign\tvehicles\tthat\tutilize\tthe\nunique\tadvantages\tof\tan\telectric\tpowertrain.\tWe\thave\tdesigned\tour\tproprietary\tpowertrain\tsystems\tto\tbe\tadaptable,\tefficient,\treliable\tand\tcost-effective\nwhile\twithstanding\tthe\trigors\tof\tan\tautomotive\tenvironment.\tWe\toffer\tdual\tmotor\tpowertrain\tvehicles,\twhich\tuse\ttwo\telectric\tmotors\tto\tmaximize\ttraction\nand\tperformance\tin\tan\tall-wheel\tdrive\tconfiguration,\tas\twell\tas\tvehicle\tpowertrain\ttechnology\tfeaturing\tthree\telectric\tmotors\tfor\tfurther\tincreased\nperformance\tin\tcertain\tversions\tof\tModel\tS\tand\tModel\tX,\tCybertruck\tand\tthe\tTesla\tSemi.\nWe\tmaintain\textensive\ttesting\tand\tR&D\tcapabilities\tfor\tbattery\tcells,\tpacks\tand\tsystems,\tand\thave\tbuilt\tan\texpansive\tbody\tof\tknowledge\ton\tlithium-\nion\tcell\tchemistry\ttypes\tand\tperformance\tcharacteristics.\tIn\torder\tto\tenable\ta\tgreater\tsupply\tof\tcells\tfor\tour\tproducts\twith\thigher\tenergy\tdensity\tat\tlower\ncosts,\twe\thave\tdeveloped\ta\tnew\tproprietary\tlithium-ion\tbattery\tcell\tand\timproved\tmanufacturing\tprocesses.\nVehicle\tControl\tand\tInfotainment\tSoftware\nThe\tperformance\tand\tsafety\tsystems\tof\tour\tvehicles\tand\ttheir\tbattery\tpacks\tutilize\tsophisticated\tcontrol\tsoftware.\tControl\tsystems\tin\tour\tvehicles\noptimize\tperformance,\tcustomize\tvehicle\tbehavior,\tmanage\tcharging\tand\tcontrol\tall\tinfotainment\tfunctions.\tWe\tdevelop\talmost\tall\tof\tthis\tsoftware,\nincluding\tmost\tof\tthe\tuser\tinterfaces,\tinternally\tand\tupdate\tour\tvehicles’\tsoftware\tregularly\tthrough\tover-the-air\tupdates.\nSelf-Driving\tDevelopment\tand\tArtificial\tIntelligence\nWe\thave\texpertise\tin\tdeveloping\ttechnologies,\tsystems\tand\tsoftware\tto\tenable\tself-driving\tvehicles\tusing\tprimarily\tvision-based\ttechnologies.\tOur\nFSD\tComputer\truns\tour\tneural\tnetworks\tin\tour\tvehicles,\tand\twe\tare\talso\tdeveloping\tadditional\tcomputer\thardware\tto\tbetter\tenable\tthe\tmassive\tamounts\nof\tfield\tdata\tcaptured\tby\tour\tvehicles\tto\tcontinually\ttrain\tand\timprove\tthese\tneural\tnetworks\tfor\treal-world\tperformance.\nCurrently,\twe\toffer\tin\tour\tvehicles\tcertain\tadvanced\tdriver\tassist\tsystems\tunder\tour\tAutopilot\tand\tFSD\tCapability\toptions.\tAlthough\tat\tpresent\tthe\ndriver\tis\tultimately\tresponsible\tfor\tcontrolling\tthe\tvehicle,\tour\tsystems\tprovide\tsafety\tand\tconvenience\tfunctionality\tthat\trelieves\tdrivers\tof\tthe\tmost\ntedious\tand\tpotentially\tdangerous\taspects\tof\troad\ttravel\tmuch\tlike\tthe\tsystem\tthat\tairplane\tpilots\tuse,\twhen\tconditions\tpermit.\tAs\twith\tother\tvehicle\nsystems,\twe\timprove\tthese\tfunctions\tin\tour\tvehicles\tover\ttime\tthrough\tover-the-air\tupdates.\nWe\tintend\tto\testablish\tin\tthe\tfuture\tan\tautonomous\tTesla\tride-hailing\tnetwork,\twhich\twe\texpect\twould\talso\tallow\tus\tto\taccess\ta\tnew\tcustomer\tbase\neven\tas\tmodes\tof\ttransportation\tevolve.', 'We\texpect\tthat\tthis\tfunctionality\twill\talso\tallow\tus\tto\toffer\tcertain\toptions\tand\tfeatures\ton\ta\nsubscription\tbasis\tin\tthe\tfuture.\nEnergy\tGeneration\tand\tStorage\nWe\tmarket\tand\tsell\tour\tsolar\tand\tenergy\tstorage\tproducts\tto\tresidential,\tcommercial\tand\tindustrial\tcustomers\tand\tutilities\tthrough\ta\tvariety\tof\nchannels,\tincluding\tthrough\tour\twebsite,\tstores\tand\tgalleries,\tas\twell\tas\tthrough\tour\tnetwork\tof\tchannel\tpartners,\tand\tin\tthe\tcase\tof\tsome\tcommercial\ncustomers,\tthrough\tPPA\ttransactions.\tWe\temphasize\tsimplicity,\tstandardization\tand\taccessibility\tto\tmake\tit\teasy\tand\tcost-effective\tfor\tcustomers\tto\tadopt\nclean\tenergy,\twhile\treducing\tour\tcustomer\tacquisition\tcosts.\nService\tand\tWarranty\nAutomotive\nService\nWe\tprovide\tservice\tfor\tour\telectric\tvehicles\tat\tour\tcompany-owned\tservice\tlocations\tand\tthrough\tTesla\tMobile\tService\ttechnicians\twho\tperform\twork\nremotely\tat\tcustomers’\thomes\tor\tother\tlocations.\tServicing\tthe\tvehicles\tourselves\tallows\tus\tto\tidentify\tproblems\tand\timplement\tsolutions\tand\nimprovements\tfaster\tthan\ttraditional\tautomobile\tmanufacturers\tand\ttheir\tdealer\tnetworks.\tThe\tconnectivity\tof\tour\tvehicles\talso\tallows\tus\tto\tdiagnose\tand\nremedy\tmany\tproblems\tremotely\tand\tproactively.\nVehicle\tLimited\tWarranties\tand\tExtended\tService\tPlans\nWe\tprovide\ta\tmanufacturer’s\tlimited\twarranty\ton\tall\tnew\tand\tused\tTesla\tvehicles\twe\tsell\tdirectly\tto\tconsumers,\twhich\tmay\tinclude\tlimited\nwarranties\ton\tcertain\tcomponents,\tspecific\ttypes\tof\tdamage\tor\tbattery\tcapacity\tretention.\tWe\talso\tcurrently\toffer\toptional\textended\tservice\tplans\tthat\nprovide\tcoverage\tbeyond\tthe\tnew\tvehicle\tlimited\twarranties\tfor\tcertain\tmodels\tin\tspecified\tregions.\n7', 'Table\tof\tContents\nEnergy\tGeneration\tand\tStorage\nWe\tprovide\tservice\tand\trepairs\tto\tour\tenergy\tproduct\tcustomers,\tincluding\tunder\twarranty\twhere\tapplicable.\tWe\tgenerally\tprovide\tmanufacturer’s\nlimited\twarranties\twith\tour\tenergy\tstorage\tproducts\tand\toffer\tcertain\textended\tlimited\twarranties\tthat\tare\tavailable\tat\tthe\ttime\tof\tpurchase\tof\tthe\nsystem.\tIf\twe\tinstall\ta\tsystem,\twe\talso\tprovide\tcertain\tlimited\twarranties\ton\tour\tinstallation\tworkmanship.\nFor\tretrofit\tsolar\tenergy\tsystems,\twe\tprovide\tseparate\tlimited\twarranties\tfor\tworkmanship\tand\tagainst\troof\tleaks,\tand\tfor\tSolar\tRoof,\twe\talso\nprovide\tlimited\twarranties\tfor\tdefects\tand\tweatherization.\tFor\tcomponents\tnot\tmanufactured\tby\tus,\twe\tgenerally\tpass-through\tthe\tapplicable\nmanufacturers’\twarranties.\nAs\tpart\tof\tour\tsolar\tenergy\tsystem\tand\tenergy\tstorage\tcontracts,\twe\tmay\tprovide\tthe\tcustomer\twith\tperformance\tguarantees\tthat\tcommit\tthat\tthe\nunderlying\tsystem\twill\tmeet\tor\texceed\tthe\tminimum\tenergy\tgeneration\tor\tperformance\trequirements\tspecified\tin\tthe\tcontract.\nFinancial\tServices\nAutomotive\nPurchase\tFinancing\tand\tLeases\nWe\toffer\tleasing\tand/or\tloan\tfinancing\tarrangements\tfor\tour\tvehicles\tin\tcertain\tjurisdictions\tin\tNorth\tAmerica,\tEurope\tand\tAsia\tourselves\tand\nthrough\tvarious\tfinancial\tinstitutions.\tUnder\tcertain\tof\tsuch\tprograms,\twe\thave\tprovided\tresale\tvalue\tguarantees\tor\tbuyback\tguarantees\tthat\tmay\nobligate\tus\tto\tcover\ta\tresale\tloss\tup\tto\ta\tcertain\tlimit\tor\trepurchase\tthe\tsubject\tvehicles\tat\tpre-determined\tvalues.\nInsurance\nIn\t2021,\twe\tlaunched\tour\tinsurance\tproduct\tusing\treal-time\tdriving\tbehavior\tin\tselect\tstates,\twhich\toffers\trates\tthat\tare\toften\tbetter\tthan\tother\nalternatives\tand\tpromotes\tsafer\tdriving.\tOur\tinsurance\tproducts\tare\tcurrently\tavailable\tin\t12\tstates\tand\twe\tplan\tto\texpand\tthe\tmarkets\tin\twhich\twe\toffer\ninsurance\tproducts,\tas\tpart\tof\tour\tongoing\teffort\tto\tdecrease\tthe\ttotal\tcost\tof\townership\tfor\tour\tcustomers.\nEnergy\tGeneration\tand\tStorage\nWe\toffer\tcertain\tfinancing\toptions\tto\tour\tsolar\tcustomers,\twhich\tenable\tthe\tcustomer\tto\tpurchase\tand\town\ta\tsolar\tenergy\tsystem,\tSolar\tRoof\tor\nintegrated\tsolar\tand\tPowerwall\tsystem.\tOur\tsolar\tPPAs,\toffered\tprimarily\tto\tcommercial\tcustomers,\tcharge\ta\tfee\tper\tkilowatt-hour\tbased\ton\tthe\tamount\tof\nelectricity\tproduced\tby\tour\tsolar\tenergy\tsystems.\nManufacturing\nWe\tcurrently\thave\tmanufacturing\tfacilities\tin\tthe\tU.S.\tin\tNorthern\tCalifornia,\tin\tBuffalo,\tNew\tYork,\tGigafactory\tNew\tYork;\tin\tAustin,\tTexas,\nGigafactory\tTexas\tand\tnear\tReno,\tNevada,\tGigafactory\tNevada.\tAt\tthese\tfacilities,\twe\tmanufacture\tand\tassemble,\tamong\tother\tthings,\tvehicles,\tcertain\nvehicle\tparts\tand\tcomponents,\tsuch\tas\tour\tbattery\tpacks\tand\tbattery\tcells,\tenergy\tstorage\tcomponents\tand\tsolar\tproducts\tand\tcomponents.\nInternationally,\twe\talso\thave\tmanufacturing\tfacilities\tin\tChina\t(Gigafactory\tShanghai)\tand\tGermany\t(Gigafactory\tBerlin-Brandenburg),\twhich\tallows\nus\tto\tincrease\tthe\taffordability\tof\tour\tvehicles\tfor\tcustomers\tin\tlocal\tmarkets\tby\treducing\ttransportation\tand\tmanufacturing\tcosts\tand\teliminating\tthe\nimpact\tof\tunfavorable\ttariffs.\tIn\tMarch\t2023,\twe\tannounced\tthe\tlocation\tof\tour\tnext\tGigafactory\tin\tMonterrey,\tMexico.\tGenerally,\twe\tcontinue\tto\texpand\nproduction\tcapacity\tat\tour\texisting\tfacilities.', 'Table\tof\tContents\nEnergy\tGeneration\tand\tStorage\nEnergy\tStorage\tProducts\nWe\tleverage\tmany\tof\tthe\tcomponent-level\ttechnologies\tfrom\tour\tvehicles\tin\tour\tenergy\tstorage\tproducts.\tBy\ttaking\ta\tmodular\tapproach\tto\tthe\ndesign\tof\tbattery\tsystems,\twe\tcan\toptimize\tmanufacturing\tcapacity\tof\tour\tenergy\tstorage\tproducts.\tAdditionally,\tour\texpertise\tin\tpower\telectronics\nenables\tour\tbattery\tsystems\tto\tinterconnect\twith\telectricity\tgrids\twhile\tproviding\tfast-acting\tsystems\tfor\tpower\tinjection\tand\tabsorption.\tWe\thave\talso\ndeveloped\tsoftware\tto\tremotely\tcontrol\tand\tdispatch\tour\tenergy\tstorage\tsystems.\nSolar\tEnergy\tSystems\nWe\thave\tengineered\tSolar\tRoof\tover\tnumerous\titerations\tto\tcombine\taesthetic\tappeal\tand\tdurability\twith\tpower\tgeneration.\tThe\tefficiency\tof\tour\nsolar\tenergy\tproducts\tis\taided\tby\tour\town\tsolar\tinverter,\twhich\tincorporates\tour\tpower\telectronics\ttechnologies.\tWe\tdesigned\tboth\tproducts\tto\tintegrate\nwith\tPowerwall.\nDesign\tand\tEngineering\nAutomotive\nWe\thave\testablished\tsignificant\tin-house\tcapabilities\tin\tthe\tdesign\tand\ttest\tengineering\tof\telectric\tvehicles\tand\ttheir\tcomponents\tand\tsystems.\tOur\nteam\thas\tsignificant\texperience\tin\tcomputer-aided\tdesign\tas\twell\tas\tdurability,\tstrength\tand\tcrash\ttest\tsimulations,\twhich\treduces\tthe\tproduct\ndevelopment\ttime\tof\tnew\tmodels.\tWe\thave\talso\tachieved\tcomplex\tengineering\tfeats\tin\tstamping,\tcasting\tand\tthermal\tsystems,\tand\tdeveloped\ta\tmethod\nto\tintegrate\tbatteries\tdirectly\twith\tvehicle\tbody\tstructures\twithout\tseparate\tbattery\tpacks\tto\toptimize\tmanufacturability,\tweight,\trange\tand\tcost\ncharacteristics.\nWe\tare\talso\texpanding\tour\tmanufacturing\toperations\tglobally\twhile\ttaking\taction\tto\tlocalize\tour\tvehicle\tdesigns\tand\tproduction\tfor\tparticular\nmarkets,\tincluding\tcountry-specific\tmarket\tdemands\tand\tfactory\toptimizations\tfor\tlocal\tworkforces.\tAs\twe\tincrease\tour\tcapabilities,\tparticularly\tin\tthe\nareas\tof\tautomation,\tdie-making\tand\tline-building,\twe\tare\talso\tmaking\tstrides\tin\tthe\tsimulations\tmodeling\tthese\tcapabilities\tprior\tto\tconstruction.\nEnergy\tGeneration\tand\tStorage\nOur\texpertise\tin\telectrical,\tmechanical,\tcivil\tand\tsoftware\tengineering\tallows\tus\tto\tdesign,\tengineer,\tmanufacture\tand\tinstall\tenergy\tgenerating\tand\nstorage\tproducts\tand\tcomponents,\tincluding\tat\tthe\tresidential\tthrough\tutility\tscale.\tFor\texample,\tthe\tmodular\tdesign\tof\tour\tMegapack\tutility-scale\tbattery\nline\tis\tintended\tto\tsignificantly\treduce\tthe\tamount\tof\tassembly\trequired\tin\tthe\tfield.\tWe\talso\tcustomize\tsolutions\tincluding\tour\tenergy\tstorage\tproducts,\nsolar\tenergy\tsystems\tand/or\tSolar\tRoof\tfor\tcustomers\tto\tmeet\ttheir\tspecific\tneeds.\nSales\tand\tMarketing\nHistorically,\twe\thave\tbeen\table\tto\tachieve\tsales\twithout\ttraditional\tadvertising\tand\tat\trelatively\tlow\tmarketing\tcosts.\tWe\tcontinue\tto\tmonitor\tour\npublic\tnarrative\tand\tbrand,\tand\ttailor\tour\tmarketing\tefforts\taccordingly,\tincluding\tthrough\tinvestments\tin\tcustomer\teducation\tand\tadvertising\tas\nnecessary.\nAutomotive\nDirect\tSales\nOur\tvehicle\tsales\tchannels\tcurrently\tinclude\tour\twebsite\tand\tan\tinternational\tnetwork\tof\tcompany-owned\tstores.\tIn\tsome\tjurisdictions,\twe\talso\thave\ngalleries\tto\teducate\tand\tinform\tcustomers\tabout\tour\tproducts,\tbut\tsuch\tlocations\tdo\tnot\ttransact\tin\tthe\tsale\tof\tvehicles.\tWe\tbelieve\tthis\tinfrastructure\nenables\tus\tto\tbetter\tcontrol\tcosts\tof\tinventory,\tmanage\twarranty\tservice\tand\tpricing,\teducate\tconsumers\tabout\telectric\tvehicles,\tmake\tour\tvehicles\tmore\naffordable,\tmaintain\tand\tstrengthen\tthe\tTesla\tbrand\tand\tobtain\trapid\tcustomer\tfeedback.', 'Table\tof\tContents\nPART\tI\nITEM\t1.\tBUSINESS\nOverview\nWe\tdesign,\tdevelop,\tmanufacture,\tsell\tand\tlease\thigh-performance\tfully\telectric\tvehicles\tand\tenergy\tgeneration\tand\tstorage\tsystems,\tand\toffer\nservices\trelated\tto\tour\tproducts.\tWe\tgenerally\tsell\tour\tproducts\tdirectly\tto\tcustomers,\tand\tcontinue\tto\tgrow\tour\tcustomer-facing\tinfrastructure\tthrough\ta\nglobal\tnetwork\tof\tvehicle\tshowrooms\tand\tservice\tcenters,\tMobile\tService,\tbody\tshops,\tSupercharger\tstations\tand\tDestination\tChargers\tto\taccelerate\tthe\nwidespread\tadoption\tof\tour\tproducts.\tWe\temphasize\tperformance,\tattractive\tstyling\tand\tthe\tsafety\tof\tour\tusers\tand\tworkforce\tin\tthe\tdesign\tand\nmanufacture\tof\tour\tproducts\tand\tare\tcontinuing\tto\tdevelop\tfull\tself-driving\ttechnology\tfor\timproved\tsafety.\tWe\talso\tstrive\tto\tlower\tthe\tcost\tof\townership\nfor\tour\tcustomers\tthrough\tcontinuous\tefforts\tto\treduce\tmanufacturing\tcosts\tand\tby\toffering\tfinancial\tand\tother\tservices\ttailored\tto\tour\tproducts.\nOur\tmission\tis\tto\taccelerate\tthe\tworld’s\ttransition\tto\tsustainable\tenergy.\tWe\tbelieve\tthat\tthis\tmission,\talong\twith\tour\tengineering\texpertise,\nvertically\tintegrated\tbusiness\tmodel\tand\tfocus\ton\tuser\texperience\tdifferentiate\tus\tfrom\tother\tcompanies.\nSegment\tInformation\nWe\toperate\tas\ttwo\treportable\tsegments:\t(i)\tautomotive\tand\t(ii)\tenergy\tgeneration\tand\tstorage.\nThe\tautomotive\tsegment\tincludes\tthe\tdesign,\tdevelopment,\tmanufacturing,\tsales\tand\tleasing\tof\thigh-performance\tfully\telectric\tvehicles\tas\twell\tas\nsales\tof\tautomotive\tregulatory\tcredits.\tAdditionally,\tthe\tautomotive\tsegment\talso\tincludes\tservices\tand\tother,\twhich\tincludes\tsales\tof\tused\tvehicles,\tnon-\nwarranty\tafter-sales\tvehicle\tservices,\tbody\tshop\tand\tparts,\tpaid\tSupercharging,\tvehicle\tinsurance\trevenue\tand\tretail\tmerchandise.\tThe\tenergy\tgeneration\nand\tstorage\tsegment\tincludes\tthe\tdesign,\tmanufacture,\tinstallation,\tsales\tand\tleasing\tof\tsolar\tenergy\tgeneration\tand\tenergy\tstorage\tproducts\tand\trelated\nservices\tand\tsales\tof\tsolar\tenergy\tsystems\tincentives.\nOur\tProducts\tand\tServices\nAutomotive\nWe\tcurrently\tmanufacture\tfive\tdifferent\tconsumer\tvehicles\t–\tthe\tModel\t3,\tY,\tS,\tX\tand\tCybertruck.\tModel\t3\tis\ta\tfour-door\tmid-size\tsedan\tthat\twe\ndesigned\tfor\tmanufacturability\twith\ta\tbase\tprice\tfor\tmass-market\tappeal.\tModel\tY\tis\ta\tcompact\tsport\tutility\tvehicle\t(“SUV”)\tbuilt\ton\tthe\tModel\t3\tplatform\nwith\tseating\tfor\tup\tto\tseven\tadults.\tModel\tS\tis\ta\tfour-door\tfull-size\tsedan\tand\tModel\tX\tis\ta\tmid-size\tSUV\twith\tseating\tfor\tup\tto\tseven\tadults.\tModel\tS\tand\nModel\tX\tfeature\tthe\thighest\tperformance\tcharacteristics\tand\tlongest\tranges\tthat\twe\toffer\tin\ta\tsedan\tand\tSUV,\trespectively.\tIn\tNovember\t2023,\twe\nentered\tthe\tconsumer\tpickup\ttruck\tmarket\twith\tfirst\tdeliveries\tof\tthe\tCybertruck,\ta\tfull-size\telectric\tpickup\ttruck\twith\ta\tstainless\tsteel\texterior\tthat\thas\nthe\tutility\tand\tstrength\tof\ta\ttruck\twhile\tfeaturing\tthe\tspeed\tof\ta\tsports\tcar.\nIn\t2022,\twe\talso\tbegan\tearly\tproduction\tand\tdeliveries\tof\ta\tcommercial\telectric\tvehicle,\tthe\tTesla\tSemi.\tWe\thave\tplanned\telectric\tvehicles\tto\naddress\tadditional\tvehicle\tmarkets,\tand\tto\tcontinue\tleveraging\tdevelopments\tin\tour\tproprietary\tFull\tSelf-Driving\t(“FSD”)\tCapability\tfeatures,\tbattery\tcell\nand\tother\ttechnologies.\nEnergy\tGeneration\tand\tStorage\nEnergy\tStorage\tProducts\nPowerwall\tand\tMegapack\tare\tour\tlithium-ion\tbattery\tenergy\tstorage\tproducts.']","The text provided describes Tesla's automotive and energy generation and storage segments.  It details the company's electric vehicle offerings, including the Model 3, Y, S, X, and Cybertruck.  It also mentions Tesla's energy storage products, Powerwall and Megapack.  However, it does not mention any solar energy offerings. 


",Retrofit solar systems and Solar Roof,,0.99999999998,1.0
What is Solar Roof and how does it work?,"['Table\tof\tContents\nEnergy\tGeneration\tand\tStorage\nEnergy\tStorage\tProducts\nWe\tleverage\tmany\tof\tthe\tcomponent-level\ttechnologies\tfrom\tour\tvehicles\tin\tour\tenergy\tstorage\tproducts.\tBy\ttaking\ta\tmodular\tapproach\tto\tthe\ndesign\tof\tbattery\tsystems,\twe\tcan\toptimize\tmanufacturing\tcapacity\tof\tour\tenergy\tstorage\tproducts.\tAdditionally,\tour\texpertise\tin\tpower\telectronics\nenables\tour\tbattery\tsystems\tto\tinterconnect\twith\telectricity\tgrids\twhile\tproviding\tfast-acting\tsystems\tfor\tpower\tinjection\tand\tabsorption.\tWe\thave\talso\ndeveloped\tsoftware\tto\tremotely\tcontrol\tand\tdispatch\tour\tenergy\tstorage\tsystems.\nSolar\tEnergy\tSystems\nWe\thave\tengineered\tSolar\tRoof\tover\tnumerous\titerations\tto\tcombine\taesthetic\tappeal\tand\tdurability\twith\tpower\tgeneration.\tThe\tefficiency\tof\tour\nsolar\tenergy\tproducts\tis\taided\tby\tour\town\tsolar\tinverter,\twhich\tincorporates\tour\tpower\telectronics\ttechnologies.\tWe\tdesigned\tboth\tproducts\tto\tintegrate\nwith\tPowerwall.\nDesign\tand\tEngineering\nAutomotive\nWe\thave\testablished\tsignificant\tin-house\tcapabilities\tin\tthe\tdesign\tand\ttest\tengineering\tof\telectric\tvehicles\tand\ttheir\tcomponents\tand\tsystems.\tOur\nteam\thas\tsignificant\texperience\tin\tcomputer-aided\tdesign\tas\twell\tas\tdurability,\tstrength\tand\tcrash\ttest\tsimulations,\twhich\treduces\tthe\tproduct\ndevelopment\ttime\tof\tnew\tmodels.\tWe\thave\talso\tachieved\tcomplex\tengineering\tfeats\tin\tstamping,\tcasting\tand\tthermal\tsystems,\tand\tdeveloped\ta\tmethod\nto\tintegrate\tbatteries\tdirectly\twith\tvehicle\tbody\tstructures\twithout\tseparate\tbattery\tpacks\tto\toptimize\tmanufacturability,\tweight,\trange\tand\tcost\ncharacteristics.\nWe\tare\talso\texpanding\tour\tmanufacturing\toperations\tglobally\twhile\ttaking\taction\tto\tlocalize\tour\tvehicle\tdesigns\tand\tproduction\tfor\tparticular\nmarkets,\tincluding\tcountry-specific\tmarket\tdemands\tand\tfactory\toptimizations\tfor\tlocal\tworkforces.\tAs\twe\tincrease\tour\tcapabilities,\tparticularly\tin\tthe\nareas\tof\tautomation,\tdie-making\tand\tline-building,\twe\tare\talso\tmaking\tstrides\tin\tthe\tsimulations\tmodeling\tthese\tcapabilities\tprior\tto\tconstruction.\nEnergy\tGeneration\tand\tStorage\nOur\texpertise\tin\telectrical,\tmechanical,\tcivil\tand\tsoftware\tengineering\tallows\tus\tto\tdesign,\tengineer,\tmanufacture\tand\tinstall\tenergy\tgenerating\tand\nstorage\tproducts\tand\tcomponents,\tincluding\tat\tthe\tresidential\tthrough\tutility\tscale.\tFor\texample,\tthe\tmodular\tdesign\tof\tour\tMegapack\tutility-scale\tbattery\nline\tis\tintended\tto\tsignificantly\treduce\tthe\tamount\tof\tassembly\trequired\tin\tthe\tfield.\tWe\talso\tcustomize\tsolutions\tincluding\tour\tenergy\tstorage\tproducts,\nsolar\tenergy\tsystems\tand/or\tSolar\tRoof\tfor\tcustomers\tto\tmeet\ttheir\tspecific\tneeds.\nSales\tand\tMarketing\nHistorically,\twe\thave\tbeen\table\tto\tachieve\tsales\twithout\ttraditional\tadvertising\tand\tat\trelatively\tlow\tmarketing\tcosts.\tWe\tcontinue\tto\tmonitor\tour\npublic\tnarrative\tand\tbrand,\tand\ttailor\tour\tmarketing\tefforts\taccordingly,\tincluding\tthrough\tinvestments\tin\tcustomer\teducation\tand\tadvertising\tas\nnecessary.\nAutomotive\nDirect\tSales\nOur\tvehicle\tsales\tchannels\tcurrently\tinclude\tour\twebsite\tand\tan\tinternational\tnetwork\tof\tcompany-owned\tstores.\tIn\tsome\tjurisdictions,\twe\talso\thave\ngalleries\tto\teducate\tand\tinform\tcustomers\tabout\tour\tproducts,\tbut\tsuch\tlocations\tdo\tnot\ttransact\tin\tthe\tsale\tof\tvehicles.\tWe\tbelieve\tthis\tinfrastructure\nenables\tus\tto\tbetter\tcontrol\tcosts\tof\tinventory,\tmanage\twarranty\tservice\tand\tpricing,\teducate\tconsumers\tabout\telectric\tvehicles,\tmake\tour\tvehicles\tmore\naffordable,\tmaintain\tand\tstrengthen\tthe\tTesla\tbrand\tand\tobtain\trapid\tcustomer\tfeedback.', 'Table\tof\tContents\nSolar\tEnergy\tOfferings\nWe\tsell\tretrofit\tsolar\tenergy\tsystems\tto\tcustomers\tand\tchannel\tpartners\tand\talso\tmake\tthem\tavailable\tthrough\tpower\tpurchase\tagreement\t(“PPA”)\narrangements.\tWe\tpurchase\tmost\tof\tthe\tcomponents\tfor\tour\tretrofit\tsolar\tenergy\tsystems\tfrom\tmultiple\tsources\tto\tensure\tcompetitive\tpricing\tand\nadequate\tsupply.\tWe\talso\tdesign\tand\tmanufacture\tcertain\tcomponents\tfor\tour\tsolar\tenergy\tproducts.\nWe\tsell\tour\tSolar\tRoof,\twhich\tcombines\tpremium\tglass\troof\ttiles\twith\tenergy\tgeneration,\tdirectly\tto\tcustomers,\tas\twell\tas\tthrough\tchannel\ncustomers.\tWe\tcontinue\tto\timprove\tour\tinstallation\tcapability\tand\tefficiency,\tincluding\tthrough\tcollaboration\twith\treal\testate\tdevelopers\tand\tbuilders\ton\nnew\thomes.\nTechnology\nAutomotive\nBattery\tand\tPowertrain\nOur\tcore\tvehicle\ttechnology\tcompetencies\tinclude\tpowertrain\tengineering\tand\tmanufacturing\tand\tour\tability\tto\tdesign\tvehicles\tthat\tutilize\tthe\nunique\tadvantages\tof\tan\telectric\tpowertrain.\tWe\thave\tdesigned\tour\tproprietary\tpowertrain\tsystems\tto\tbe\tadaptable,\tefficient,\treliable\tand\tcost-effective\nwhile\twithstanding\tthe\trigors\tof\tan\tautomotive\tenvironment.\tWe\toffer\tdual\tmotor\tpowertrain\tvehicles,\twhich\tuse\ttwo\telectric\tmotors\tto\tmaximize\ttraction\nand\tperformance\tin\tan\tall-wheel\tdrive\tconfiguration,\tas\twell\tas\tvehicle\tpowertrain\ttechnology\tfeaturing\tthree\telectric\tmotors\tfor\tfurther\tincreased\nperformance\tin\tcertain\tversions\tof\tModel\tS\tand\tModel\tX,\tCybertruck\tand\tthe\tTesla\tSemi.\nWe\tmaintain\textensive\ttesting\tand\tR&D\tcapabilities\tfor\tbattery\tcells,\tpacks\tand\tsystems,\tand\thave\tbuilt\tan\texpansive\tbody\tof\tknowledge\ton\tlithium-\nion\tcell\tchemistry\ttypes\tand\tperformance\tcharacteristics.\tIn\torder\tto\tenable\ta\tgreater\tsupply\tof\tcells\tfor\tour\tproducts\twith\thigher\tenergy\tdensity\tat\tlower\ncosts,\twe\thave\tdeveloped\ta\tnew\tproprietary\tlithium-ion\tbattery\tcell\tand\timproved\tmanufacturing\tprocesses.\nVehicle\tControl\tand\tInfotainment\tSoftware\nThe\tperformance\tand\tsafety\tsystems\tof\tour\tvehicles\tand\ttheir\tbattery\tpacks\tutilize\tsophisticated\tcontrol\tsoftware.\tControl\tsystems\tin\tour\tvehicles\noptimize\tperformance,\tcustomize\tvehicle\tbehavior,\tmanage\tcharging\tand\tcontrol\tall\tinfotainment\tfunctions.\tWe\tdevelop\talmost\tall\tof\tthis\tsoftware,\nincluding\tmost\tof\tthe\tuser\tinterfaces,\tinternally\tand\tupdate\tour\tvehicles’\tsoftware\tregularly\tthrough\tover-the-air\tupdates.\nSelf-Driving\tDevelopment\tand\tArtificial\tIntelligence\nWe\thave\texpertise\tin\tdeveloping\ttechnologies,\tsystems\tand\tsoftware\tto\tenable\tself-driving\tvehicles\tusing\tprimarily\tvision-based\ttechnologies.\tOur\nFSD\tComputer\truns\tour\tneural\tnetworks\tin\tour\tvehicles,\tand\twe\tare\talso\tdeveloping\tadditional\tcomputer\thardware\tto\tbetter\tenable\tthe\tmassive\tamounts\nof\tfield\tdata\tcaptured\tby\tour\tvehicles\tto\tcontinually\ttrain\tand\timprove\tthese\tneural\tnetworks\tfor\treal-world\tperformance.\nCurrently,\twe\toffer\tin\tour\tvehicles\tcertain\tadvanced\tdriver\tassist\tsystems\tunder\tour\tAutopilot\tand\tFSD\tCapability\toptions.\tAlthough\tat\tpresent\tthe\ndriver\tis\tultimately\tresponsible\tfor\tcontrolling\tthe\tvehicle,\tour\tsystems\tprovide\tsafety\tand\tconvenience\tfunctionality\tthat\trelieves\tdrivers\tof\tthe\tmost\ntedious\tand\tpotentially\tdangerous\taspects\tof\troad\ttravel\tmuch\tlike\tthe\tsystem\tthat\tairplane\tpilots\tuse,\twhen\tconditions\tpermit.\tAs\twith\tother\tvehicle\nsystems,\twe\timprove\tthese\tfunctions\tin\tour\tvehicles\tover\ttime\tthrough\tover-the-air\tupdates.\nWe\tintend\tto\testablish\tin\tthe\tfuture\tan\tautonomous\tTesla\tride-hailing\tnetwork,\twhich\twe\texpect\twould\talso\tallow\tus\tto\taccess\ta\tnew\tcustomer\tbase\neven\tas\tmodes\tof\ttransportation\tevolve.', 'Table\tof\tContents\nEnergy\tGeneration\tand\tStorage\nWe\tprovide\tservice\tand\trepairs\tto\tour\tenergy\tproduct\tcustomers,\tincluding\tunder\twarranty\twhere\tapplicable.\tWe\tgenerally\tprovide\tmanufacturer’s\nlimited\twarranties\twith\tour\tenergy\tstorage\tproducts\tand\toffer\tcertain\textended\tlimited\twarranties\tthat\tare\tavailable\tat\tthe\ttime\tof\tpurchase\tof\tthe\nsystem.\tIf\twe\tinstall\ta\tsystem,\twe\talso\tprovide\tcertain\tlimited\twarranties\ton\tour\tinstallation\tworkmanship.\nFor\tretrofit\tsolar\tenergy\tsystems,\twe\tprovide\tseparate\tlimited\twarranties\tfor\tworkmanship\tand\tagainst\troof\tleaks,\tand\tfor\tSolar\tRoof,\twe\talso\nprovide\tlimited\twarranties\tfor\tdefects\tand\tweatherization.\tFor\tcomponents\tnot\tmanufactured\tby\tus,\twe\tgenerally\tpass-through\tthe\tapplicable\nmanufacturers’\twarranties.\nAs\tpart\tof\tour\tsolar\tenergy\tsystem\tand\tenergy\tstorage\tcontracts,\twe\tmay\tprovide\tthe\tcustomer\twith\tperformance\tguarantees\tthat\tcommit\tthat\tthe\nunderlying\tsystem\twill\tmeet\tor\texceed\tthe\tminimum\tenergy\tgeneration\tor\tperformance\trequirements\tspecified\tin\tthe\tcontract.\nFinancial\tServices\nAutomotive\nPurchase\tFinancing\tand\tLeases\nWe\toffer\tleasing\tand/or\tloan\tfinancing\tarrangements\tfor\tour\tvehicles\tin\tcertain\tjurisdictions\tin\tNorth\tAmerica,\tEurope\tand\tAsia\tourselves\tand\nthrough\tvarious\tfinancial\tinstitutions.\tUnder\tcertain\tof\tsuch\tprograms,\twe\thave\tprovided\tresale\tvalue\tguarantees\tor\tbuyback\tguarantees\tthat\tmay\nobligate\tus\tto\tcover\ta\tresale\tloss\tup\tto\ta\tcertain\tlimit\tor\trepurchase\tthe\tsubject\tvehicles\tat\tpre-determined\tvalues.\nInsurance\nIn\t2021,\twe\tlaunched\tour\tinsurance\tproduct\tusing\treal-time\tdriving\tbehavior\tin\tselect\tstates,\twhich\toffers\trates\tthat\tare\toften\tbetter\tthan\tother\nalternatives\tand\tpromotes\tsafer\tdriving.\tOur\tinsurance\tproducts\tare\tcurrently\tavailable\tin\t12\tstates\tand\twe\tplan\tto\texpand\tthe\tmarkets\tin\twhich\twe\toffer\ninsurance\tproducts,\tas\tpart\tof\tour\tongoing\teffort\tto\tdecrease\tthe\ttotal\tcost\tof\townership\tfor\tour\tcustomers.\nEnergy\tGeneration\tand\tStorage\nWe\toffer\tcertain\tfinancing\toptions\tto\tour\tsolar\tcustomers,\twhich\tenable\tthe\tcustomer\tto\tpurchase\tand\town\ta\tsolar\tenergy\tsystem,\tSolar\tRoof\tor\nintegrated\tsolar\tand\tPowerwall\tsystem.\tOur\tsolar\tPPAs,\toffered\tprimarily\tto\tcommercial\tcustomers,\tcharge\ta\tfee\tper\tkilowatt-hour\tbased\ton\tthe\tamount\tof\nelectricity\tproduced\tby\tour\tsolar\tenergy\tsystems.\nManufacturing\nWe\tcurrently\thave\tmanufacturing\tfacilities\tin\tthe\tU.S.\tin\tNorthern\tCalifornia,\tin\tBuffalo,\tNew\tYork,\tGigafactory\tNew\tYork;\tin\tAustin,\tTexas,\nGigafactory\tTexas\tand\tnear\tReno,\tNevada,\tGigafactory\tNevada.\tAt\tthese\tfacilities,\twe\tmanufacture\tand\tassemble,\tamong\tother\tthings,\tvehicles,\tcertain\nvehicle\tparts\tand\tcomponents,\tsuch\tas\tour\tbattery\tpacks\tand\tbattery\tcells,\tenergy\tstorage\tcomponents\tand\tsolar\tproducts\tand\tcomponents.\nInternationally,\twe\talso\thave\tmanufacturing\tfacilities\tin\tChina\t(Gigafactory\tShanghai)\tand\tGermany\t(Gigafactory\tBerlin-Brandenburg),\twhich\tallows\nus\tto\tincrease\tthe\taffordability\tof\tour\tvehicles\tfor\tcustomers\tin\tlocal\tmarkets\tby\treducing\ttransportation\tand\tmanufacturing\tcosts\tand\teliminating\tthe\nimpact\tof\tunfavorable\ttariffs.\tIn\tMarch\t2023,\twe\tannounced\tthe\tlocation\tof\tour\tnext\tGigafactory\tin\tMonterrey,\tMexico.\tGenerally,\twe\tcontinue\tto\texpand\nproduction\tcapacity\tat\tour\texisting\tfacilities.', 'Energy\tGeneration\tand\tStorage\tSegment\nEnergy\tGeneration\tand\tStorage\tSales\nEnergy\tgeneration\tand\tstorage\tsales\trevenue\tconsists\tof\tthe\tsale\tof\tsolar\tenergy\tsystems\tand\tenergy\tstorage\tsystems\tto\tresidential,\tsmall\ncommercial,\tlarge\tcommercial\tand\tutility\tgrade\tcustomers.\tSales\tof\tsolar\tenergy\tsystems\tto\tresidential\tand\tsmall\tscale\tcommercial\tcustomers\tconsist\tof\nthe\tengineering,\tdesign\tand\tinstallation\tof\tthe\tsystem.\tResidential\tand\tsmall\tscale\tcommercial\tcustomers\tpay\tthe\tfull\tpurchase\tprice\tof\tthe\tsolar\tenergy\nsystem\tupfront.\tRevenue\tfor\tthe\tdesign\tand\tinstallation\tobligation\tis\trecognized\twhen\tcontrol\ttransfers,\twhich\tis\twhen\twe\tinstall\ta\tsolar\tenergy\tsystem\nand\tthe\tsystem\tpasses\tinspection\tby\tthe\tutility\tor\tthe\tauthority\thaving\tjurisdiction.\tSales\tof\tenergy\tstorage\tsystems\tto\tresidential\tand\tsmall\tscale\ncommercial\tcustomers\tconsist\tof\tthe\tinstallation\tof\tthe\tenergy\tstorage\tsystem\tand\trevenue\tis\trecognized\twhen\tcontrol\ttransfers,\twhich\tis\twhen\tthe\nproduct\thas\tbeen\tdelivered\tor,\tif\twe\tare\tperforming\tinstallation,\twhen\tinstalled\tand\tcommissioned.\tPayment\tfor\tsuch\tstorage\tsystems\tis\tmade\tupon\ninvoice\tor\tin\taccordance\twith\tpayment\tterms\tcustomary\tto\tthe\tbusiness.\nFor\tlarge\tcommercial\tand\tutility\tgrade\tenergy\tstorage\tsystem\tsales\twhich\tconsist\tof\tthe\tengineering,\tdesign\tand\tinstallation\tof\tthe\tsystem,\ncustomers\tmake\tmilestone\tpayments\tthat\tare\tconsistent\twith\tcontract-specific\tphases\tof\ta\tproject.\tRevenue\tfrom\tsuch\tcontracts\tis\trecognized\tover\ttime\nusing\tthe\tpercentage\tof\tcompletion\tmethod\tbased\ton\tcost\tincurred\tas\ta\tpercentage\tof\ttotal\testimated\tcontract\tcosts\tfor\tenergy\tstorage\tsystem\tsales.\nIn\tinstances\twhere\tthere\tare\tmultiple\tperformance\tobligations\tin\ta\tsingle\tcontract,\twe\tallocate\tthe\tconsideration\tto\tthe\tvarious\tobligations\tin\tthe\ncontract\tbased\ton\tthe\trelative\tstandalone\tselling\tprice\tmethod.\tStandalone\tselling\tprices\tare\testimated\tbased\ton\testimated\tcosts\tplus\tmargin\tor\tby\tusing\nmarket\tdata\tfor\tcomparable\tproducts.\tCosts\tto\tobtain\ta\tcontract\trelate\tmainly\tto\tcommissions\tpaid\tto\tour\tsales\tpersonnel\trelated\tto\tthe\tsale\tof\tenergy\nstorage\tsystems.\tAs\tour\tcontract\tcosts\trelated\tto\tenergy\tstorage\tsystem\tsales\tare\ttypically\tfulfilled\twithin\tone\tyear,\tthe\tcosts\tto\tobtain\ta\tcontract\tare\nexpensed\tas\tincurred.\nAs\tpart\tof\tour\tenergy\tstorage\tsystem\tcontracts,\twe\tmay\tprovide\tthe\tcustomer\twith\tperformance\tguarantees\tthat\twarrant\tthat\tthe\tunderlying\tsystem\nwill\tmeet\tor\texceed\tthe\tminimum\tenergy\tperformance\trequirements\tspecified\tin\tthe\tcontract.\tIf\tan\tenergy\tstorage\tsystem\tdoes\tnot\tmeet\tthe\nperformance\tguarantee\trequirements,\twe\tmay\tbe\trequired\tto\tpay\tliquidated\tdamages.\tOther\tforms\tof\tvariable\tconsideration\trelated\tto\tour\tlarge\ncommercial\tand\tutility\tgrade\tenergy\tstorage\tsystem\tcontracts\tinclude\tvariable\tcustomer\tpayments\tthat\twill\tbe\tmade\tbased\ton\tour\tenergy\tmarket\nparticipation\tactivities.\tSuch\tguarantees\tand\tvariable\tcustomer\tpayments\trepresent\ta\tform\tof\tvariable\tconsideration\tand\tare\testimated\tat\tcontract\ninception\tat\ttheir\tmost\tlikely\tamount\tand\tupdated\tat\tthe\tend\tof\teach\treporting\tperiod\tas\tadditional\tperformance\tdata\tbecomes\tavailable.\tSuch\testimates\nare\tincluded\tin\tthe\ttransaction\tprice\tonly\tto\tthe\textent\tthat\tit\tis\tprobable\ta\tsignificant\treversal\tof\trevenue\twill\tnot\toccur.\nWe\trecord\tas\tdeferred\trevenue\tany\tnon-refundable\tamounts\tthat\tare\tcollected\tfrom\tcustomers\trelated\tto\tfees\tcharged\tfor\tprepayments,\twhich\tis\nrecognized\tas\trevenue\tratably\tover\tthe\trespective\tcustomer\tcontract\tterm.\tAs\tof\tDecember\t31,\t2023\tand\t2022,\tdeferred\trevenue\trelated\tto\tsuch\ncustomer\tpayments\tamounted\tto\t$\n1.60\n\tbillion\tand\t$\n863\n\tmillion,\trespectively,\tmainly\tdue\tto\tcontractual\tpayment\tterms.', 'Louis\tSolar\tMaster\tTenant\tI,\tLLC\nDelaware\nLouis\tSolar\tMT\tManager\tI,\tLLC\nDelaware\nLouis\tSolar\tOwner\tI,\tLLC\nDelaware\nLouis\tSolar\tOwner\tManager\tI,\tLLC\nDelaware\nMaster\tTenant\t2008-A,\tLLC\nDelaware\nMatterhorn\tSolar\tI,\tLLC\nDelaware\nMaxwell\tTechnologies,\tInc.\nDelaware\nMegalodon\tSolar,\tLLC\nDelaware\nMonte\tRosa\tSolar\tI,\tLLC\nDelaware\nMound\tSolar\tManager\tV,\tLLC\nDelaware\nMound\tSolar\tManager\tVI,\tLLC\nDelaware\nMound\tSolar\tManager\tX,\tLLC\nDelaware\nMound\tSolar\tManager\tXI,\tLLC\nDelaware\nMound\tSolar\tManager\tXII,\tLLC\nDelaware\nMound\tSolar\tMaster\tTenant\tIX,\tLLC\nDelaware\nMound\tSolar\tMaster\tTenant\tV,\tLLC\nCalifornia\nMound\tSolar\tMaster\tTenant\tVI,\tLLC\nDelaware\nMound\tSolar\tMaster\tTenant\tVII,\tLLC\nDelaware\nMound\tSolar\tMaster\tTenant\tVIII,\tLLC\nDelaware\nMound\tSolar\tMT\tManager\tIX,\tLLC\nDelaware\nMound\tSolar\tMT\tManager\tVII,\tLLC\nDelaware\nMound\tSolar\tMT\tManager\tVIII,\tLLC\nDelaware\nMound\tSolar\tOwner\tIX,\tLLC\nDelaware\nMound\tSolar\tOwner\tManager\tIX,\tLLC\nDelaware\nMound\tSolar\tOwner\tManager\tVII,\tLLC\nDelaware\nMound\tSolar\tOwner\tManager\tVIII,\tLLC\nDelaware\nMound\tSolar\tOwner\tV,\tLLC\nCalifornia\nMound\tSolar\tOwner\tVI,\tLLC\nDelaware\nMound\tSolar\tOwner\tVII,\tLLC\nDelaware\nMound\tSolar\tOwner\tVIII,\tLLC\nDelaware\nMound\tSolar\tPartnership\tX,\tLLC\nDelaware\nMound\tSolar\tPartnership\tXI,\tLLC\nDelaware\nMound\tSolar\tPartnership\tXII,\tLLC\nDelaware\nMS\tSolarCity\t2008,\tLLC\nDelaware\nMS\tSolarCity\tCommercial\t2008,\tLLC\nDelaware\nMS\tSolarCity\tResidential\t2008,\tLLC\nDelaware\nNew\tMexico\tSales\tand\tVehicle\tService\tLLC\nDelaware\nNBA\tSolarCity\tAFB,\tLLC\nCalifornia\nNBA\tSolarCity\tCommercial\tI,\tLLC\nCalifornia\nNBA\tSolarCity\tSolar\tPhoenix,\tLLC\nCalifornia\nNorthern\tNevada\tResearch\tCo.,\tLLC\nNevada\nOranje\tSolar\tI,\tLLC\nDelaware\nOranje\tSolar\tManager\tI,\tLLC\nDelaware\nPalmetto\tAuto\tRepair\tand\tService\tLLC\nDelaware\nParamount\tEnergy\tFund\tI\tLessee,\tLLC\nDelaware\nParamount\tEnergy\tFund\tI\tLessor,\tLLC\nDelaware\nPEF\tI\tMM,\tLLC\nDelaware\nPerbix\tMachine\tCompany,\tInc.\nMinnesota\nPresidio\tSolar\tI,\tLLC\nDelaware\nPresidio\tSolar\tII,\tLLC\nDelaware']","Solar Roof is a product that combines premium glass roof tiles with energy generation.  It is designed to be sold directly to customers and through channel partners.  
","Premium glass roof tiles that generate electricity, sold direct and via channel partners",,0.99999999995,
What proprietary lithium‑ion battery cell technology has Tesla developed?,"['Table\tof\tContents\nSolar\tEnergy\tOfferings\nWe\tsell\tretrofit\tsolar\tenergy\tsystems\tto\tcustomers\tand\tchannel\tpartners\tand\talso\tmake\tthem\tavailable\tthrough\tpower\tpurchase\tagreement\t(“PPA”)\narrangements.\tWe\tpurchase\tmost\tof\tthe\tcomponents\tfor\tour\tretrofit\tsolar\tenergy\tsystems\tfrom\tmultiple\tsources\tto\tensure\tcompetitive\tpricing\tand\nadequate\tsupply.\tWe\talso\tdesign\tand\tmanufacture\tcertain\tcomponents\tfor\tour\tsolar\tenergy\tproducts.\nWe\tsell\tour\tSolar\tRoof,\twhich\tcombines\tpremium\tglass\troof\ttiles\twith\tenergy\tgeneration,\tdirectly\tto\tcustomers,\tas\twell\tas\tthrough\tchannel\ncustomers.\tWe\tcontinue\tto\timprove\tour\tinstallation\tcapability\tand\tefficiency,\tincluding\tthrough\tcollaboration\twith\treal\testate\tdevelopers\tand\tbuilders\ton\nnew\thomes.\nTechnology\nAutomotive\nBattery\tand\tPowertrain\nOur\tcore\tvehicle\ttechnology\tcompetencies\tinclude\tpowertrain\tengineering\tand\tmanufacturing\tand\tour\tability\tto\tdesign\tvehicles\tthat\tutilize\tthe\nunique\tadvantages\tof\tan\telectric\tpowertrain.\tWe\thave\tdesigned\tour\tproprietary\tpowertrain\tsystems\tto\tbe\tadaptable,\tefficient,\treliable\tand\tcost-effective\nwhile\twithstanding\tthe\trigors\tof\tan\tautomotive\tenvironment.\tWe\toffer\tdual\tmotor\tpowertrain\tvehicles,\twhich\tuse\ttwo\telectric\tmotors\tto\tmaximize\ttraction\nand\tperformance\tin\tan\tall-wheel\tdrive\tconfiguration,\tas\twell\tas\tvehicle\tpowertrain\ttechnology\tfeaturing\tthree\telectric\tmotors\tfor\tfurther\tincreased\nperformance\tin\tcertain\tversions\tof\tModel\tS\tand\tModel\tX,\tCybertruck\tand\tthe\tTesla\tSemi.\nWe\tmaintain\textensive\ttesting\tand\tR&D\tcapabilities\tfor\tbattery\tcells,\tpacks\tand\tsystems,\tand\thave\tbuilt\tan\texpansive\tbody\tof\tknowledge\ton\tlithium-\nion\tcell\tchemistry\ttypes\tand\tperformance\tcharacteristics.\tIn\torder\tto\tenable\ta\tgreater\tsupply\tof\tcells\tfor\tour\tproducts\twith\thigher\tenergy\tdensity\tat\tlower\ncosts,\twe\thave\tdeveloped\ta\tnew\tproprietary\tlithium-ion\tbattery\tcell\tand\timproved\tmanufacturing\tprocesses.\nVehicle\tControl\tand\tInfotainment\tSoftware\nThe\tperformance\tand\tsafety\tsystems\tof\tour\tvehicles\tand\ttheir\tbattery\tpacks\tutilize\tsophisticated\tcontrol\tsoftware.\tControl\tsystems\tin\tour\tvehicles\noptimize\tperformance,\tcustomize\tvehicle\tbehavior,\tmanage\tcharging\tand\tcontrol\tall\tinfotainment\tfunctions.\tWe\tdevelop\talmost\tall\tof\tthis\tsoftware,\nincluding\tmost\tof\tthe\tuser\tinterfaces,\tinternally\tand\tupdate\tour\tvehicles’\tsoftware\tregularly\tthrough\tover-the-air\tupdates.\nSelf-Driving\tDevelopment\tand\tArtificial\tIntelligence\nWe\thave\texpertise\tin\tdeveloping\ttechnologies,\tsystems\tand\tsoftware\tto\tenable\tself-driving\tvehicles\tusing\tprimarily\tvision-based\ttechnologies.\tOur\nFSD\tComputer\truns\tour\tneural\tnetworks\tin\tour\tvehicles,\tand\twe\tare\talso\tdeveloping\tadditional\tcomputer\thardware\tto\tbetter\tenable\tthe\tmassive\tamounts\nof\tfield\tdata\tcaptured\tby\tour\tvehicles\tto\tcontinually\ttrain\tand\timprove\tthese\tneural\tnetworks\tfor\treal-world\tperformance.\nCurrently,\twe\toffer\tin\tour\tvehicles\tcertain\tadvanced\tdriver\tassist\tsystems\tunder\tour\tAutopilot\tand\tFSD\tCapability\toptions.\tAlthough\tat\tpresent\tthe\ndriver\tis\tultimately\tresponsible\tfor\tcontrolling\tthe\tvehicle,\tour\tsystems\tprovide\tsafety\tand\tconvenience\tfunctionality\tthat\trelieves\tdrivers\tof\tthe\tmost\ntedious\tand\tpotentially\tdangerous\taspects\tof\troad\ttravel\tmuch\tlike\tthe\tsystem\tthat\tairplane\tpilots\tuse,\twhen\tconditions\tpermit.\tAs\twith\tother\tvehicle\nsystems,\twe\timprove\tthese\tfunctions\tin\tour\tvehicles\tover\ttime\tthrough\tover-the-air\tupdates.\nWe\tintend\tto\testablish\tin\tthe\tfuture\tan\tautonomous\tTesla\tride-hailing\tnetwork,\twhich\twe\texpect\twould\talso\tallow\tus\tto\taccess\ta\tnew\tcustomer\tbase\neven\tas\tmodes\tof\ttransportation\tevolve.', 'In\t2022,\twe\talso\tbegan\tearly\tproduction\tand\tdeliveries\tof\ta\tcommercial\telectric\tvehicle,\tthe\tTesla\tSemi.\tWe\thave\tplanned\telectric\tvehicles\tto\naddress\tadditional\tvehicle\tmarkets,\tand\tto\tcontinue\tleveraging\tdevelopments\tin\tour\tproprietary\tFull\tSelf-Driving\t(“FSD”)\tCapability\tfeatures,\tbattery\tcell\nand\tother\ttechnologies.\nEnergy\tGeneration\tand\tStorage\nEnergy\tStorage\tProducts\nPowerwall\tand\tMegapack\tare\tour\tlithium-ion\tbattery\tenergy\tstorage\tproducts.\tPowerwall,\twhich\twe\tsell\tdirectly\tto\tcustomers,\tas\twell\tas\tthrough\nchannel\tpartners,\tis\tdesigned\tto\tstore\tenergy\tat\ta\thome\tor\tsmall\tcommercial\tfacility.\tMegapack\tis\tan\tenergy\tstorage\tsolution\tfor\tcommercial,\tindustrial,\nutility\tand\tenergy\tgeneration\tcustomers,\tmultiple\tof\twhich\tmay\tbe\tgrouped\ttogether\tto\tform\tlarger\tinstallations\tof\tgigawatt\thours\t(“GWh”)\tor\tgreater\ncapacity.\nWe\talso\tcontinue\tto\tdevelop\tsoftware\tcapabilities\tfor\tremotely\tcontrolling\tand\tdispatching\tour\tenergy\tstorage\tsystems\tacross\ta\twide\trange\tof\nmarkets\tand\tapplications,\tincluding\tthrough\tour\treal-time\tenergy\tcontrol\tand\toptimization\tplatforms.\n4', 'Table\tof\tContents\nEnergy\tGeneration\tand\tStorage\nEnergy\tStorage\tProducts\nWe\tleverage\tmany\tof\tthe\tcomponent-level\ttechnologies\tfrom\tour\tvehicles\tin\tour\tenergy\tstorage\tproducts.\tBy\ttaking\ta\tmodular\tapproach\tto\tthe\ndesign\tof\tbattery\tsystems,\twe\tcan\toptimize\tmanufacturing\tcapacity\tof\tour\tenergy\tstorage\tproducts.\tAdditionally,\tour\texpertise\tin\tpower\telectronics\nenables\tour\tbattery\tsystems\tto\tinterconnect\twith\telectricity\tgrids\twhile\tproviding\tfast-acting\tsystems\tfor\tpower\tinjection\tand\tabsorption.\tWe\thave\talso\ndeveloped\tsoftware\tto\tremotely\tcontrol\tand\tdispatch\tour\tenergy\tstorage\tsystems.\nSolar\tEnergy\tSystems\nWe\thave\tengineered\tSolar\tRoof\tover\tnumerous\titerations\tto\tcombine\taesthetic\tappeal\tand\tdurability\twith\tpower\tgeneration.\tThe\tefficiency\tof\tour\nsolar\tenergy\tproducts\tis\taided\tby\tour\town\tsolar\tinverter,\twhich\tincorporates\tour\tpower\telectronics\ttechnologies.\tWe\tdesigned\tboth\tproducts\tto\tintegrate\nwith\tPowerwall.\nDesign\tand\tEngineering\nAutomotive\nWe\thave\testablished\tsignificant\tin-house\tcapabilities\tin\tthe\tdesign\tand\ttest\tengineering\tof\telectric\tvehicles\tand\ttheir\tcomponents\tand\tsystems.\tOur\nteam\thas\tsignificant\texperience\tin\tcomputer-aided\tdesign\tas\twell\tas\tdurability,\tstrength\tand\tcrash\ttest\tsimulations,\twhich\treduces\tthe\tproduct\ndevelopment\ttime\tof\tnew\tmodels.\tWe\thave\talso\tachieved\tcomplex\tengineering\tfeats\tin\tstamping,\tcasting\tand\tthermal\tsystems,\tand\tdeveloped\ta\tmethod\nto\tintegrate\tbatteries\tdirectly\twith\tvehicle\tbody\tstructures\twithout\tseparate\tbattery\tpacks\tto\toptimize\tmanufacturability,\tweight,\trange\tand\tcost\ncharacteristics.\nWe\tare\talso\texpanding\tour\tmanufacturing\toperations\tglobally\twhile\ttaking\taction\tto\tlocalize\tour\tvehicle\tdesigns\tand\tproduction\tfor\tparticular\nmarkets,\tincluding\tcountry-specific\tmarket\tdemands\tand\tfactory\toptimizations\tfor\tlocal\tworkforces.\tAs\twe\tincrease\tour\tcapabilities,\tparticularly\tin\tthe\nareas\tof\tautomation,\tdie-making\tand\tline-building,\twe\tare\talso\tmaking\tstrides\tin\tthe\tsimulations\tmodeling\tthese\tcapabilities\tprior\tto\tconstruction.\nEnergy\tGeneration\tand\tStorage\nOur\texpertise\tin\telectrical,\tmechanical,\tcivil\tand\tsoftware\tengineering\tallows\tus\tto\tdesign,\tengineer,\tmanufacture\tand\tinstall\tenergy\tgenerating\tand\nstorage\tproducts\tand\tcomponents,\tincluding\tat\tthe\tresidential\tthrough\tutility\tscale.\tFor\texample,\tthe\tmodular\tdesign\tof\tour\tMegapack\tutility-scale\tbattery\nline\tis\tintended\tto\tsignificantly\treduce\tthe\tamount\tof\tassembly\trequired\tin\tthe\tfield.\tWe\talso\tcustomize\tsolutions\tincluding\tour\tenergy\tstorage\tproducts,\nsolar\tenergy\tsystems\tand/or\tSolar\tRoof\tfor\tcustomers\tto\tmeet\ttheir\tspecific\tneeds.\nSales\tand\tMarketing\nHistorically,\twe\thave\tbeen\table\tto\tachieve\tsales\twithout\ttraditional\tadvertising\tand\tat\trelatively\tlow\tmarketing\tcosts.\tWe\tcontinue\tto\tmonitor\tour\npublic\tnarrative\tand\tbrand,\tand\ttailor\tour\tmarketing\tefforts\taccordingly,\tincluding\tthrough\tinvestments\tin\tcustomer\teducation\tand\tadvertising\tas\nnecessary.\nAutomotive\nDirect\tSales\nOur\tvehicle\tsales\tchannels\tcurrently\tinclude\tour\twebsite\tand\tan\tinternational\tnetwork\tof\tcompany-owned\tstores.\tIn\tsome\tjurisdictions,\twe\talso\thave\ngalleries\tto\teducate\tand\tinform\tcustomers\tabout\tour\tproducts,\tbut\tsuch\tlocations\tdo\tnot\ttransact\tin\tthe\tsale\tof\tvehicles.\tWe\tbelieve\tthis\tinfrastructure\nenables\tus\tto\tbetter\tcontrol\tcosts\tof\tinventory,\tmanage\twarranty\tservice\tand\tpricing,\teducate\tconsumers\tabout\telectric\tvehicles,\tmake\tour\tvehicles\tmore\naffordable,\tmaintain\tand\tstrengthen\tthe\tTesla\tbrand\tand\tobtain\trapid\tcustomer\tfeedback.', 'Currently,\twe\trely\ton\tsuppliers\tsuch\tas\tPanasonic\tand\tContemporary\tAmperex\tTechnology\tCo.\nLimited\t(CATL)\tfor\tthese\tcells.\tWe\thave\tto\tdate\tfully\tqualified\tonly\ta\tvery\tlimited\tnumber\tof\tsuch\tsuppliers\tand\thave\tlimited\tflexibility\tin\tchanging\nsuppliers.\tAny\tdisruption\tin\tthe\tsupply\tof\tbattery\tcells\tfrom\tour\tsuppliers\tcould\tlimit\tproduction\tof\tour\tvehicles\tand\tenergy\tstorage\tproducts.\tIn\tthe\tlong\nterm,\twe\tintend\tto\tsupplement\tcells\tfrom\tour\tsuppliers\twith\tcells\tmanufactured\tby\tus,\twhich\twe\tbelieve\twill\tbe\tmore\tefficient,\tmanufacturable\tat\tgreater\nvolumes\tand\tmore\tcost-effective\tthan\tcurrently\tavailable\tcells.\tHowever,\tour\tefforts\tto\tdevelop\tand\tmanufacture\tsuch\tbattery\tcells\thave\trequired,\tand\nmay\tcontinue\tto\trequire,\tsignificant\tinvestments,\tand\tthere\tcan\tbe\tno\tassurance\tthat\twe\twill\tbe\table\tto\tachieve\tthese\ttargets\tin\tthe\ttimeframes\tthat\twe\nhave\tplanned\tor\tat\tall.\tIf\twe\tare\n16', 'Table\tof\tContents\nWe\talso\tface\tcompetition\tin\tour\tenergy\tgeneration\tand\tstorage\tbusiness\tfrom\tother\tmanufacturers,\tdevelopers,\tinstallers\tand\tservice\tproviders\tof\ncompeting\tenergy\ttechnologies,\tas\twell\tas\tfrom\tlarge\tutilities.\tDecreases\tin\tthe\tretail\tor\twholesale\tprices\tof\telectricity\tfrom\tutilities\tor\tother\trenewable\nenergy\tsources\tcould\tmake\tour\tproducts\tless\tattractive\tto\tcustomers\tand\tlead\tto\tan\tincreased\trate\tof\tcustomer\tdefaults.\nRisks\tRelated\tto\tOur\tOperations\nWe\tmay\texperience\tissues\twith\tlithium-ion\tcells\tor\tother\tcomponents\tmanufactured\tat\tour\tGigafactories,\twhich\tmay\tharm\tthe\nproduction\tand\tprofitability\tof\tour\tvehicle\tand\tenergy\tstorage\tproducts.\nOur\tplan\tto\tgrow\tthe\tvolume\tand\tprofitability\tof\tour\tvehicles\tand\tenergy\tstorage\tproducts\tdepends\ton\tsignificant\tlithium-ion\tbattery\tcell\tproduction,\nincluding\tby\tour\tpartner\tPanasonic\tat\tGigafactory\tNevada.\tWe\talso\tproduce\tseveral\tvehicle\tcomponents\tat\tour\tGigafactories,\tsuch\tas\tbattery\tmodules\tand\npacks\tand\tdrive\tunits,\tand\tmanufacture\tenergy\tstorage\tproducts.\tIf\twe\tare\tunable\tto\tor\totherwise\tdo\tnot\tmaintain\tand\tgrow\tour\trespective\toperations,\tor\nif\twe\tare\tunable\tto\tdo\tso\tcost-effectively\tor\thire\tand\tretain\thighly-skilled\tpersonnel\tthere,\tour\tability\tto\tmanufacture\tour\tproducts\tprofitably\twould\tbe\nlimited,\twhich\tmay\tharm\tour\tbusiness\tand\toperating\tresults.\nFinally,\tthe\thigh\tvolumes\tof\tlithium-ion\tcells\tand\tbattery\tmodules\tand\tpacks\tmanufactured\tby\tus\tand\tby\tour\tsuppliers\tare\tstored\tand\trecycled\tat\tour\nvarious\tfacilities.\tAny\tmishandling\tof\tthese\tproducts\tmay\tcause\tdisruption\tto\tthe\toperation\tof\tsuch\tfacilities.\tWhile\twe\thave\timplemented\tsafety\nprocedures\trelated\tto\tthe\thandling\tof\tthe\tcells,\tthere\tcan\tbe\tno\tassurance\tthat\ta\tsafety\tissue\tor\tfire\trelated\tto\tthe\tcells\twould\tnot\tdisrupt\tour\toperations.\nAny\tsuch\tdisruptions\tor\tissues\tmay\tharm\tour\tbrand\tand\tbusiness.\nWe\tface\trisks\tassociated\twith\tmaintaining\tand\texpanding\tour\tinternational\toperations,\tincluding\tunfavorable\tand\tuncertain\nregulatory,\tpolitical,\teconomic,\ttax\tand\tlabor\tconditions.\nWe\tare\tsubject\tto\tlegal\tand\tregulatory\trequirements,\tpolitical\tuncertainty\tand\tsocial,\tenvironmental\tand\teconomic\tconditions\tin\tnumerous\njurisdictions,\tincluding\tmarkets\tin\twhich\twe\tgenerate\tsignificant\tsales,\tover\twhich\twe\thave\tlittle\tcontrol\tand\twhich\tare\tinherently\tunpredictable.\tOur\noperations\tin\tsuch\tjurisdictions,\tparticularly\tas\ta\tcompany\tbased\tin\tthe\tU.S.,\tcreate\trisks\trelating\tto\tconforming\tour\tproducts\tto\tregulatory\tand\tsafety\nrequirements\tand\tcharging\tand\tother\telectric\tinfrastructures;\torganizing\tlocal\toperating\tentities;\testablishing,\tstaffing\tand\tmanaging\tforeign\tbusiness\nlocations;\tattracting\tlocal\tcustomers;\tnavigating\tforeign\tgovernment\ttaxes,\tregulations\tand\tpermit\trequirements;\tenforceability\tof\tour\tcontractual\trights;\ntrade\trestrictions,\tcustoms\tregulations,\ttariffs\tand\tprice\tor\texchange\tcontrols;\tand\tpreferences\tin\tforeign\tnations\tfor\tdomestically\tmanufactured\tproducts.\nFor\texample,\twe\tmonitor\ttax\tlegislation\tchanges\ton\ta\tglobal\tbasis,\tincluding\tchanges\tarising\tas\ta\tresult\tof\tthe\tOrganization\tfor\tEconomic\tCooperation\tand\nDevelopment’s\tmulti-jurisdictional\tplan\tof\taction\tto\taddress\tbase\terosion\tand\tprofit\tshifting.\tSuch\tconditions\tmay\tincrease\tour\tcosts,\timpact\tour\tability\tto\nsell\tour\tproducts\tand\trequire\tsignificant\tmanagement\tattention,\tand\tmay\tharm\tour\tbusiness\tif\twe\tare\tunable\tto\tmanage\tthem\teffectively.']","The provided text does not mention any specific proprietary lithium-ion battery cell technology developed by Tesla. 


",A new proprietary lithium‑ion battery cell chemistry and improved manufacturing processes for higher energy density at lower cost,0.0,0.99999999998,1.0
How does Tesla describe its Full Self‑Driving capability?,"['Although\tat\tpresent\tthe\ndriver\tis\tultimately\tresponsible\tfor\tcontrolling\tthe\tvehicle,\tour\tsystems\tprovide\tsafety\tand\tconvenience\tfunctionality\tthat\trelieves\tdrivers\tof\tthe\tmost\ntedious\tand\tpotentially\tdangerous\taspects\tof\troad\ttravel\tmuch\tlike\tthe\tsystem\tthat\tairplane\tpilots\tuse,\twhen\tconditions\tpermit.\tAs\twith\tother\tvehicle\nsystems,\twe\timprove\tthese\tfunctions\tin\tour\tvehicles\tover\ttime\tthrough\tover-the-air\tupdates.\nWe\tintend\tto\testablish\tin\tthe\tfuture\tan\tautonomous\tTesla\tride-hailing\tnetwork,\twhich\twe\texpect\twould\talso\tallow\tus\tto\taccess\ta\tnew\tcustomer\tbase\neven\tas\tmodes\tof\ttransportation\tevolve.\nWe\tare\talso\tapplying\tour\tartificial\tintelligence\tlearnings\tfrom\tself-driving\ttechnology\tto\tthe\tfield\tof\trobotics,\tsuch\tas\tthrough\tOptimus,\ta\trobotic\nhumanoid\tin\tdevelopment,\twhich\tis\tcontrolled\tby\tthe\tsame\tAI\tsystem.\n5', 'Table\tof\tContents\nSolar\tEnergy\tOfferings\nWe\tsell\tretrofit\tsolar\tenergy\tsystems\tto\tcustomers\tand\tchannel\tpartners\tand\talso\tmake\tthem\tavailable\tthrough\tpower\tpurchase\tagreement\t(“PPA”)\narrangements.\tWe\tpurchase\tmost\tof\tthe\tcomponents\tfor\tour\tretrofit\tsolar\tenergy\tsystems\tfrom\tmultiple\tsources\tto\tensure\tcompetitive\tpricing\tand\nadequate\tsupply.\tWe\talso\tdesign\tand\tmanufacture\tcertain\tcomponents\tfor\tour\tsolar\tenergy\tproducts.\nWe\tsell\tour\tSolar\tRoof,\twhich\tcombines\tpremium\tglass\troof\ttiles\twith\tenergy\tgeneration,\tdirectly\tto\tcustomers,\tas\twell\tas\tthrough\tchannel\ncustomers.\tWe\tcontinue\tto\timprove\tour\tinstallation\tcapability\tand\tefficiency,\tincluding\tthrough\tcollaboration\twith\treal\testate\tdevelopers\tand\tbuilders\ton\nnew\thomes.\nTechnology\nAutomotive\nBattery\tand\tPowertrain\nOur\tcore\tvehicle\ttechnology\tcompetencies\tinclude\tpowertrain\tengineering\tand\tmanufacturing\tand\tour\tability\tto\tdesign\tvehicles\tthat\tutilize\tthe\nunique\tadvantages\tof\tan\telectric\tpowertrain.\tWe\thave\tdesigned\tour\tproprietary\tpowertrain\tsystems\tto\tbe\tadaptable,\tefficient,\treliable\tand\tcost-effective\nwhile\twithstanding\tthe\trigors\tof\tan\tautomotive\tenvironment.\tWe\toffer\tdual\tmotor\tpowertrain\tvehicles,\twhich\tuse\ttwo\telectric\tmotors\tto\tmaximize\ttraction\nand\tperformance\tin\tan\tall-wheel\tdrive\tconfiguration,\tas\twell\tas\tvehicle\tpowertrain\ttechnology\tfeaturing\tthree\telectric\tmotors\tfor\tfurther\tincreased\nperformance\tin\tcertain\tversions\tof\tModel\tS\tand\tModel\tX,\tCybertruck\tand\tthe\tTesla\tSemi.\nWe\tmaintain\textensive\ttesting\tand\tR&D\tcapabilities\tfor\tbattery\tcells,\tpacks\tand\tsystems,\tand\thave\tbuilt\tan\texpansive\tbody\tof\tknowledge\ton\tlithium-\nion\tcell\tchemistry\ttypes\tand\tperformance\tcharacteristics.\tIn\torder\tto\tenable\ta\tgreater\tsupply\tof\tcells\tfor\tour\tproducts\twith\thigher\tenergy\tdensity\tat\tlower\ncosts,\twe\thave\tdeveloped\ta\tnew\tproprietary\tlithium-ion\tbattery\tcell\tand\timproved\tmanufacturing\tprocesses.\nVehicle\tControl\tand\tInfotainment\tSoftware\nThe\tperformance\tand\tsafety\tsystems\tof\tour\tvehicles\tand\ttheir\tbattery\tpacks\tutilize\tsophisticated\tcontrol\tsoftware.\tControl\tsystems\tin\tour\tvehicles\noptimize\tperformance,\tcustomize\tvehicle\tbehavior,\tmanage\tcharging\tand\tcontrol\tall\tinfotainment\tfunctions.\tWe\tdevelop\talmost\tall\tof\tthis\tsoftware,\nincluding\tmost\tof\tthe\tuser\tinterfaces,\tinternally\tand\tupdate\tour\tvehicles’\tsoftware\tregularly\tthrough\tover-the-air\tupdates.\nSelf-Driving\tDevelopment\tand\tArtificial\tIntelligence\nWe\thave\texpertise\tin\tdeveloping\ttechnologies,\tsystems\tand\tsoftware\tto\tenable\tself-driving\tvehicles\tusing\tprimarily\tvision-based\ttechnologies.\tOur\nFSD\tComputer\truns\tour\tneural\tnetworks\tin\tour\tvehicles,\tand\twe\tare\talso\tdeveloping\tadditional\tcomputer\thardware\tto\tbetter\tenable\tthe\tmassive\tamounts\nof\tfield\tdata\tcaptured\tby\tour\tvehicles\tto\tcontinually\ttrain\tand\timprove\tthese\tneural\tnetworks\tfor\treal-world\tperformance.\nCurrently,\twe\toffer\tin\tour\tvehicles\tcertain\tadvanced\tdriver\tassist\tsystems\tunder\tour\tAutopilot\tand\tFSD\tCapability\toptions.\tAlthough\tat\tpresent\tthe\ndriver\tis\tultimately\tresponsible\tfor\tcontrolling\tthe\tvehicle,\tour\tsystems\tprovide\tsafety\tand\tconvenience\tfunctionality\tthat\trelieves\tdrivers\tof\tthe\tmost\ntedious\tand\tpotentially\tdangerous\taspects\tof\troad\ttravel\tmuch\tlike\tthe\tsystem\tthat\tairplane\tpilots\tuse,\twhen\tconditions\tpermit.\tAs\twith\tother\tvehicle\nsystems,\twe\timprove\tthese\tfunctions\tin\tour\tvehicles\tover\ttime\tthrough\tover-the-air\tupdates.\nWe\tintend\tto\testablish\tin\tthe\tfuture\tan\tautonomous\tTesla\tride-hailing\tnetwork,\twhich\twe\texpect\twould\talso\tallow\tus\tto\taccess\ta\tnew\tcustomer\tbase\neven\tas\tmodes\tof\ttransportation\tevolve.', 'Table\tof\tContents\nPART\tI\nITEM\t1.\tBUSINESS\nOverview\nWe\tdesign,\tdevelop,\tmanufacture,\tsell\tand\tlease\thigh-performance\tfully\telectric\tvehicles\tand\tenergy\tgeneration\tand\tstorage\tsystems,\tand\toffer\nservices\trelated\tto\tour\tproducts.\tWe\tgenerally\tsell\tour\tproducts\tdirectly\tto\tcustomers,\tand\tcontinue\tto\tgrow\tour\tcustomer-facing\tinfrastructure\tthrough\ta\nglobal\tnetwork\tof\tvehicle\tshowrooms\tand\tservice\tcenters,\tMobile\tService,\tbody\tshops,\tSupercharger\tstations\tand\tDestination\tChargers\tto\taccelerate\tthe\nwidespread\tadoption\tof\tour\tproducts.\tWe\temphasize\tperformance,\tattractive\tstyling\tand\tthe\tsafety\tof\tour\tusers\tand\tworkforce\tin\tthe\tdesign\tand\nmanufacture\tof\tour\tproducts\tand\tare\tcontinuing\tto\tdevelop\tfull\tself-driving\ttechnology\tfor\timproved\tsafety.\tWe\talso\tstrive\tto\tlower\tthe\tcost\tof\townership\nfor\tour\tcustomers\tthrough\tcontinuous\tefforts\tto\treduce\tmanufacturing\tcosts\tand\tby\toffering\tfinancial\tand\tother\tservices\ttailored\tto\tour\tproducts.\nOur\tmission\tis\tto\taccelerate\tthe\tworld’s\ttransition\tto\tsustainable\tenergy.\tWe\tbelieve\tthat\tthis\tmission,\talong\twith\tour\tengineering\texpertise,\nvertically\tintegrated\tbusiness\tmodel\tand\tfocus\ton\tuser\texperience\tdifferentiate\tus\tfrom\tother\tcompanies.\nSegment\tInformation\nWe\toperate\tas\ttwo\treportable\tsegments:\t(i)\tautomotive\tand\t(ii)\tenergy\tgeneration\tand\tstorage.\nThe\tautomotive\tsegment\tincludes\tthe\tdesign,\tdevelopment,\tmanufacturing,\tsales\tand\tleasing\tof\thigh-performance\tfully\telectric\tvehicles\tas\twell\tas\nsales\tof\tautomotive\tregulatory\tcredits.\tAdditionally,\tthe\tautomotive\tsegment\talso\tincludes\tservices\tand\tother,\twhich\tincludes\tsales\tof\tused\tvehicles,\tnon-\nwarranty\tafter-sales\tvehicle\tservices,\tbody\tshop\tand\tparts,\tpaid\tSupercharging,\tvehicle\tinsurance\trevenue\tand\tretail\tmerchandise.\tThe\tenergy\tgeneration\nand\tstorage\tsegment\tincludes\tthe\tdesign,\tmanufacture,\tinstallation,\tsales\tand\tleasing\tof\tsolar\tenergy\tgeneration\tand\tenergy\tstorage\tproducts\tand\trelated\nservices\tand\tsales\tof\tsolar\tenergy\tsystems\tincentives.\nOur\tProducts\tand\tServices\nAutomotive\nWe\tcurrently\tmanufacture\tfive\tdifferent\tconsumer\tvehicles\t–\tthe\tModel\t3,\tY,\tS,\tX\tand\tCybertruck.\tModel\t3\tis\ta\tfour-door\tmid-size\tsedan\tthat\twe\ndesigned\tfor\tmanufacturability\twith\ta\tbase\tprice\tfor\tmass-market\tappeal.\tModel\tY\tis\ta\tcompact\tsport\tutility\tvehicle\t(“SUV”)\tbuilt\ton\tthe\tModel\t3\tplatform\nwith\tseating\tfor\tup\tto\tseven\tadults.\tModel\tS\tis\ta\tfour-door\tfull-size\tsedan\tand\tModel\tX\tis\ta\tmid-size\tSUV\twith\tseating\tfor\tup\tto\tseven\tadults.\tModel\tS\tand\nModel\tX\tfeature\tthe\thighest\tperformance\tcharacteristics\tand\tlongest\tranges\tthat\twe\toffer\tin\ta\tsedan\tand\tSUV,\trespectively.\tIn\tNovember\t2023,\twe\nentered\tthe\tconsumer\tpickup\ttruck\tmarket\twith\tfirst\tdeliveries\tof\tthe\tCybertruck,\ta\tfull-size\telectric\tpickup\ttruck\twith\ta\tstainless\tsteel\texterior\tthat\thas\nthe\tutility\tand\tstrength\tof\ta\ttruck\twhile\tfeaturing\tthe\tspeed\tof\ta\tsports\tcar.\nIn\t2022,\twe\talso\tbegan\tearly\tproduction\tand\tdeliveries\tof\ta\tcommercial\telectric\tvehicle,\tthe\tTesla\tSemi.\tWe\thave\tplanned\telectric\tvehicles\tto\naddress\tadditional\tvehicle\tmarkets,\tand\tto\tcontinue\tleveraging\tdevelopments\tin\tour\tproprietary\tFull\tSelf-Driving\t(“FSD”)\tCapability\tfeatures,\tbattery\tcell\nand\tother\ttechnologies.\nEnergy\tGeneration\tand\tStorage\nEnergy\tStorage\tProducts\nPowerwall\tand\tMegapack\tare\tour\tlithium-ion\tbattery\tenergy\tstorage\tproducts.', 'In\t2022,\twe\talso\tbegan\tearly\tproduction\tand\tdeliveries\tof\ta\tcommercial\telectric\tvehicle,\tthe\tTesla\tSemi.\tWe\thave\tplanned\telectric\tvehicles\tto\naddress\tadditional\tvehicle\tmarkets,\tand\tto\tcontinue\tleveraging\tdevelopments\tin\tour\tproprietary\tFull\tSelf-Driving\t(“FSD”)\tCapability\tfeatures,\tbattery\tcell\nand\tother\ttechnologies.\nEnergy\tGeneration\tand\tStorage\nEnergy\tStorage\tProducts\nPowerwall\tand\tMegapack\tare\tour\tlithium-ion\tbattery\tenergy\tstorage\tproducts.\tPowerwall,\twhich\twe\tsell\tdirectly\tto\tcustomers,\tas\twell\tas\tthrough\nchannel\tpartners,\tis\tdesigned\tto\tstore\tenergy\tat\ta\thome\tor\tsmall\tcommercial\tfacility.\tMegapack\tis\tan\tenergy\tstorage\tsolution\tfor\tcommercial,\tindustrial,\nutility\tand\tenergy\tgeneration\tcustomers,\tmultiple\tof\twhich\tmay\tbe\tgrouped\ttogether\tto\tform\tlarger\tinstallations\tof\tgigawatt\thours\t(“GWh”)\tor\tgreater\ncapacity.\nWe\talso\tcontinue\tto\tdevelop\tsoftware\tcapabilities\tfor\tremotely\tcontrolling\tand\tdispatching\tour\tenergy\tstorage\tsystems\tacross\ta\twide\trange\tof\nmarkets\tand\tapplications,\tincluding\tthrough\tour\treal-time\tenergy\tcontrol\tand\toptimization\tplatforms.\n4', 'Our\tvehicles\tsold\toutside\tof\tthe\tU.S.\tare\tsubject\tto\tsimilar\tforeign\tcompliance,\tsafety,\tenvironmental\tand\tother\tregulations.\tMany\tof\tthose\nregulations\tare\tdifferent\tfrom\tthose\tapplicable\tin\tthe\tU.S.\tand\tmay\trequire\tredesign\tand/or\tretesting.\tSome\tof\tthose\tregulations\timpact\tor\tprevent\tthe\nrollout\tof\tnew\tvehicle\tfeatures.\nSelf-Driving\tVehicles\nGenerally,\tlaws\tpertaining\tto\tself-driving\tvehicles\tare\tevolving\tglobally,\tand\tin\tsome\tcases\tmay\tcreate\trestrictions\ton\tfeatures\tor\tvehicle\tdesigns\nthat\twe\tdevelop.\tWhile\tthere\tare\tcurrently\tno\tfederal\tU.S.\tregulations\tpertaining\tspecifically\tto\tself-driving\tvehicles\tor\tself-driving\tequipment,\tNHTSA\thas\npublished\trecommended\tguidelines\ton\tself-driving\tvehicles,\tapart\tfrom\tthe\tFMVSS\tand\tmanufacturer\treporting\tobligations,\tand\tretains\tthe\tauthority\tto\ninvestigate\tand/or\ttake\taction\ton\tthe\tsafety\tor\tcompliance\tof\tany\tvehicle,\tequipment\tor\tfeatures\toperating\ton\tpublic\troads.\tCertain\tU.S.\tstates\talso\thave\nlegal\trestrictions\ton\tthe\toperation,\tregistration\tor\tlicensure\tof\tself-driving\tvehicles,\tand\tmany\tother\tstates\tare\tconsidering\tthem.\tThis\tregulatory\npatchwork\tincreases\tthe\tlegal\tcomplexity\twith\trespect\tto\tself-driving\tvehicles\tin\tthe\tU.S.\nIn\tmarkets\tthat\tfollow\tthe\tregulations\tof\tthe\tUnited\tNations\tEconomic\tCommission\tfor\tEurope\t(“\nECE\tmarkets\n”),\tsome\trequirements\trestrict\tthe\ndesign\tof\tadvanced\tdriver-assistance\tor\tself-driving\tfeatures,\twhich\tcan\tcompromise\tor\tprevent\ttheir\tuse\tentirely.\tOther\tapplicable\tlaws,\tboth\tcurrent\tand\nproposed,\tmay\thinder\tthe\tpath\tand\ttimeline\tto\tintroducing\tself-driving\tvehicles\tfor\tsale\tand\tuse\tin\tthe\tmarkets\twhere\tthey\tapply.\nOther\tkey\tmarkets,\tincluding\tChina,\tcontinue\tto\tconsider\tself-driving\tregulation.\tAny\timplemented\tregulations\tmay\tdiffer\tmaterially\tfrom\tthe\tU.S.\nand\tECE\tmarkets,\twhich\tmay\tfurther\tincrease\tthe\tlegal\tcomplexity\tof\tself-driving\tvehicles\tand\tlimit\tor\tprevent\tcertain\tfeatures.\n10']","Tesla describes its Full Self-Driving Capability as a feature that is still under development.  
","Vision‑based advanced driver‑assist under Autopilot/FSD, continuously improved via OTA neural‑network updates",1.0,0.999999999975,1.0
What manufacturing facilities does Tesla operate worldwide?,"['Internationally,\twe\talso\thave\tmanufacturing\tfacilities\tin\tChina\t(Gigafactory\tShanghai)\tand\tGermany\t(Gigafactory\tBerlin-Brandenburg),\twhich\tallows\nus\tto\tincrease\tthe\taffordability\tof\tour\tvehicles\tfor\tcustomers\tin\tlocal\tmarkets\tby\treducing\ttransportation\tand\tmanufacturing\tcosts\tand\teliminating\tthe\nimpact\tof\tunfavorable\ttariffs.\tIn\tMarch\t2023,\twe\tannounced\tthe\tlocation\tof\tour\tnext\tGigafactory\tin\tMonterrey,\tMexico.\tGenerally,\twe\tcontinue\tto\texpand\nproduction\tcapacity\tat\tour\texisting\tfacilities.\tWe\talso\tintend\tto\tfurther\tincrease\tcost-competitiveness\tin\tour\tsignificant\tmarkets\tby\tstrategically\tadding\nlocal\tmanufacturing.\nSupply\tChain\nOur\tproducts\tuse\tthousands\tof\tparts\tthat\tare\tsourced\tfrom\thundreds\tof\tsuppliers\tacross\tthe\tworld.\tWe\thave\tdeveloped\tclose\trelationships\twith\nvendors\tof\tkey\tparts\tsuch\tas\tbattery\tcells,\telectronics\tand\tcomplex\tvehicle\tassemblies.\tCertain\tcomponents\tpurchased\tfrom\tthese\tsuppliers\tare\tshared\tor\nare\tsimilar\tacross\tmany\tproduct\tlines,\tallowing\tus\tto\ttake\tadvantage\tof\tpricing\tefficiencies\tfrom\teconomies\tof\tscale.\n8', 'Management\tOpportunities,\tChallenges\tand\tUncertainties\tand\t2024\tOutlook\nAutomotive—Production\nThe\tfollowing\tis\ta\tsummary\tof\tthe\tstatus\tof\tproduction\tof\teach\tof\tour\tannounced\tvehicle\tmodels\tin\tproduction\tand\tunder\tdevelopment,\tas\tof\tthe\ndate\tof\tthis\tAnnual\tReport\ton\tForm\t10-K:\nProduction\tLocation\nVehicle\tModel(s)\nProduction\tStatus\nFremont\tFactory\nModel\tS\t/\tModel\tX\nActive\n\t\nModel\t3\t/\tModel\tY\nActive\nGigafactory\tShanghai\nModel\t3\t/\tModel\tY\nActive\nGigafactory\tBerlin-Brandenburg\nModel\tY\nActive\nGigafactory\tTexas\nModel\tY\nActive\n\t\nCybertruck\nActive\nGigafactory\tNevada\nTesla\tSemi\nPilot\tproduction\nVarious\nNext\tGeneration\tPlatform\nIn\tdevelopment\nTBD\nTesla\tRoadster\nIn\tdevelopment\nWe\tare\tfocused\ton\tgrowing\tour\tmanufacturing\tcapacity,\twhich\tincludes\tcapacity\tfor\tmanufacturing\tnew\tvehicle\tmodels\tsuch\tas\tour\tCybertruck\tand\nnext\tgeneration\tplatform,\tand\tramping\tall\tof\tour\tproduction\tvehicles\tto\ttheir\tinstalled\tproduction\tcapacities\tas\twell\tas\tincreasing\tproduction\trate\tand\nefficiency\tat\tour\tcurrent\tfactories.\tThe\tnext\tphase\tof\tproduction\tgrowth\twill\tdepend\ton\tthe\tcontinued\tramp\tat\tour\tfactories\tand\tthe\tintroduction\tof\tour\nnext\tgeneration\tplatform,\tas\twell\tas\tour\tability\tto\tadd\tto\tour\tavailable\tsources\tof\tbattery\tcell\tsupply\tby\tmanufacturing\tour\town\tcells\tthat\twe\tare\ndeveloping\tto\thave\thigh-volume\toutput,\tlower\tcapital\tand\tproduction\tcosts\tand\tlonger\trange.\tOur\tgoals\tare\tto\timprove\tvehicle\tperformance,\tdecrease\nproduction\tcosts\tand\tincrease\taffordability\tand\tcustomer\tawareness.\nThese\tplans\tare\tsubject\tto\tuncertainties\tinherent\tin\testablishing\tand\tramping\tmanufacturing\toperations,\twhich\tmay\tbe\texacerbated\tby\tnew\tproduct\nand\tmanufacturing\ttechnologies\twe\tintroduce,\tthe\tnumber\tof\tconcurrent\tinternational\tprojects,\tany\tindustry-wide\tcomponent\tconstraints,\tlabor\tshortages\nand\tany\tfuture\timpact\tfrom\tevents\toutside\tof\tour\tcontrol.\tFor\texample,\tduring\tthe\tthird\tquarter\tof\t2023,\twe\texperienced\ta\tsequential\tdecline\tin\nproduction\tvolumes\tdue\tto\tpre-planned\tshutdowns\tfor\tupgrades\tat\tvarious\tfactories.\tMoreover,\twe\thave\tset\tambitious\ttechnological\ttargets\twith\tour\nplans\tfor\tbattery\tcells\tas\twell\tas\tfor\titerative\tmanufacturing\tand\tdesign\timprovements\tfor\tour\tvehicles\twith\teach\tnew\tfactory.\nAutomotive—Demand,\tSales,\tDeliveries\tand\tInfrastructure\nOur\tcost\treduction\tefforts,\tcost\tinnovation\tstrategies,\tand\tadditional\tlocalized\tprocurement\tand\tmanufacturing\tare\tkey\tto\tour\tvehicles’\taffordability\nand\thave\tallowed\tus\tto\tcompetitively\tprice\tour\tvehicles.\tWe\twill\talso\tcontinue\tto\tgenerate\tdemand\tand\tbrand\tawareness\tby\timproving\tour\tvehicles’\nperformance\tand\tfunctionality,\tincluding\tthrough\tproducts\tbased\ton\tartificial\tintelligence\tsuch\tas\tAutopilot,\tFSD\tCapability,\tand\tother\tsoftware\tfeatures\nand\tdelivering\tnew\tvehicles,\tsuch\tas\tour\tCybertruck.\tMoreover,\twe\texpect\tto\tcontinue\tto\tbenefit\tfrom\tongoing\telectrification\tof\tthe\tautomotive\tsector\tand\nincreasing\tenvironmental\tregulations\tand\tinitiatives.\nHowever,\twe\toperate\tin\ta\tcyclical\tindustry\tthat\tis\tsensitive\tto\tpolitical\tand\tregulatory\tuncertainty,\tincluding\twith\trespect\tto\ttrade\tand\tthe\nenvironment,\tall\tof\twhich\tcan\tbe\tcompounded\tby\tinflationary\tpressures,\trising\tenergy\tprices,\tinterest\trate\tfluctuations\tand\tthe\tliquidity\tof\tenterprise\ncustomers.\tFor\texample,\tinflationary\tpressures\thave\tincreased\tacross\tthe\tmarkets\tin\twhich\twe\toperate.', 'Table\tof\tContents\nIn\tparticular,\tour\tfuture\tbusiness\tdepends\tin\tlarge\tpart\ton\tincreasing\tthe\tproduction\tof\tmass-market\tvehicles.\tIn\torder\tto\tbe\tsuccessful,\twe\twill\tneed\nto\timplement,\tmaintain\tand\tramp\tefficient\tand\tcost-effective\tmanufacturing\tcapabilities,\tprocesses\tand\tsupply\tchains\tand\tachieve\tthe\tdesign\ttolerances,\nhigh\tquality\tand\toutput\trates\twe\thave\tplanned\tat\tour\tmanufacturing\tfacilities\tin\tCalifornia,\tNevada,\tTexas,\tChina,\tGermany\tand\tany\tfuture\tsites\tsuch\tas\nMexico.\tWe\twill\talso\tneed\tto\thire,\ttrain\tand\tcompensate\tskilled\temployees\tto\toperate\tthese\tfacilities.\tBottlenecks\tand\tother\tunexpected\tchallenges\tsuch\nas\tthose\twe\texperienced\tin\tthe\tpast\tmay\tarise\tduring\tour\tproduction\tramps,\tand\twe\tmust\taddress\tthem\tpromptly\twhile\tcontinuing\tto\timprove\nmanufacturing\tprocesses\tand\treducing\tcosts.\tIf\twe\tare\tnot\tsuccessful\tin\tachieving\tthese\tgoals,\twe\tcould\tface\tdelays\tin\testablishing\tand/or\tsustaining\tour\nproduct\tramps\tor\tbe\tunable\tto\tmeet\tour\trelated\tcost\tand\tprofitability\ttargets.\nWe\thave\texperienced,\tand\tmay\talso\texperience\tsimilar\tfuture\tdelays\tin\tlaunching\tand/or\tramping\tproduction\tof\tour\tenergy\tstorage\tproducts\tand\nSolar\tRoof;\tnew\tproduct\tversions\tor\tvariants;\tnew\tvehicles;\tand\tfuture\tfeatures\tand\tservices\tbased\ton\tartificial\tintelligence.\tLikewise,\twe\tmay\tencounter\ndelays\twith\tthe\tdesign,\tconstruction\tand\tregulatory\tor\tother\tapprovals\tnecessary\tto\tbuild\tand\tbring\tonline\tfuture\tmanufacturing\tfacilities\tand\tproducts.\nAny\tdelay\tor\tother\tcomplication\tin\tramping\tthe\tproduction\tof\tour\tcurrent\tproducts\tor\tthe\tdevelopment,\tmanufacture,\tlaunch\tand\tproduction\tramp\tof\nour\tfuture\tproducts,\tfeatures\tand\tservices,\tor\tin\tdoing\tso\tcost-effectively\tand\twith\thigh\tquality,\tmay\tharm\tour\tbrand,\tbusiness,\tprospects,\tfinancial\ncondition\tand\toperating\tresults.\nOur\tsuppliers\tmay\tfail\tto\tdeliver\tcomponents\taccording\tto\tschedules,\tprices,\tquality\tand\tvolumes\tthat\tare\tacceptable\tto\tus,\tor\twe\nmay\tbe\tunable\tto\tmanage\tthese\tcomponents\teffectively.\nOur\tproducts\tcontain\tthousands\tof\tparts\tpurchased\tglobally\tfrom\thundreds\tof\tsuppliers,\tincluding\tsingle-source\tdirect\tsuppliers,\twhich\texposes\tus\tto\nmultiple\tpotential\tsources\tof\tcomponent\tshortages.\tUnexpected\tchanges\tin\tbusiness\tconditions,\tmaterials\tpricing,\tincluding\tinflation\tof\traw\tmaterial\ncosts,\tlabor\tissues,\twars,\ttrade\tpolicies,\tnatural\tdisasters,\thealth\tepidemics\tsuch\tas\tthe\tglobal\tCOVID-19\tpandemic,\ttrade\tand\tshipping\tdisruptions,\tport\ncongestions,\tcyberattacks\tand\tother\tfactors\tbeyond\tour\tor\tour\tsuppliers’\tcontrol\tcould\talso\taffect\tthese\tsuppliers’\tability\tto\tdeliver\tcomponents\tto\tus\tor\tto\nremain\tsolvent\tand\toperational.\tFor\texample,\ta\tglobal\tshortage\tof\tsemiconductors\tbeginning\tin\tearly\t2021\thas\tcaused\tchallenges\tin\tthe\tmanufacturing\nindustry\tand\timpacted\tour\tsupply\tchain\tand\tproduction.\tAdditionally,\tif\tour\tsuppliers\tdo\tnot\taccurately\tforecast\tand\teffectively\tallocate\tproduction\tor\tif\nthey\tare\tnot\twilling\tto\tallocate\tsufficient\tproduction\tto\tus,\tor\tface\tother\tchallenges\tsuch\tas\tinsolvency,\tit\tmay\treduce\tour\taccess\tto\tcomponents\tand\nrequire\tus\tto\tsearch\tfor\tnew\tsuppliers.\tThe\tunavailability\tof\tany\tcomponent\tor\tsupplier\tcould\tresult\tin\tproduction\tdelays,\tidle\tmanufacturing\tfacilities,\nproduct\tdesign\tchanges\tand\tloss\tof\taccess\tto\timportant\ttechnology\tand\ttools\tfor\tproducing\tand\tsupporting\tour\tproducts,\tas\twell\tas\timpact\tour\tcapacity\nexpansion\tand\tour\tability\tto\tfulfill\tour\tobligations\tunder\tcustomer\tcontracts.', 'Table\tof\tContents\nPART\tI\nITEM\t1.\tBUSINESS\nOverview\nWe\tdesign,\tdevelop,\tmanufacture,\tsell\tand\tlease\thigh-performance\tfully\telectric\tvehicles\tand\tenergy\tgeneration\tand\tstorage\tsystems,\tand\toffer\nservices\trelated\tto\tour\tproducts.\tWe\tgenerally\tsell\tour\tproducts\tdirectly\tto\tcustomers,\tand\tcontinue\tto\tgrow\tour\tcustomer-facing\tinfrastructure\tthrough\ta\nglobal\tnetwork\tof\tvehicle\tshowrooms\tand\tservice\tcenters,\tMobile\tService,\tbody\tshops,\tSupercharger\tstations\tand\tDestination\tChargers\tto\taccelerate\tthe\nwidespread\tadoption\tof\tour\tproducts.\tWe\temphasize\tperformance,\tattractive\tstyling\tand\tthe\tsafety\tof\tour\tusers\tand\tworkforce\tin\tthe\tdesign\tand\nmanufacture\tof\tour\tproducts\tand\tare\tcontinuing\tto\tdevelop\tfull\tself-driving\ttechnology\tfor\timproved\tsafety.\tWe\talso\tstrive\tto\tlower\tthe\tcost\tof\townership\nfor\tour\tcustomers\tthrough\tcontinuous\tefforts\tto\treduce\tmanufacturing\tcosts\tand\tby\toffering\tfinancial\tand\tother\tservices\ttailored\tto\tour\tproducts.\nOur\tmission\tis\tto\taccelerate\tthe\tworld’s\ttransition\tto\tsustainable\tenergy.\tWe\tbelieve\tthat\tthis\tmission,\talong\twith\tour\tengineering\texpertise,\nvertically\tintegrated\tbusiness\tmodel\tand\tfocus\ton\tuser\texperience\tdifferentiate\tus\tfrom\tother\tcompanies.\nSegment\tInformation\nWe\toperate\tas\ttwo\treportable\tsegments:\t(i)\tautomotive\tand\t(ii)\tenergy\tgeneration\tand\tstorage.\nThe\tautomotive\tsegment\tincludes\tthe\tdesign,\tdevelopment,\tmanufacturing,\tsales\tand\tleasing\tof\thigh-performance\tfully\telectric\tvehicles\tas\twell\tas\nsales\tof\tautomotive\tregulatory\tcredits.\tAdditionally,\tthe\tautomotive\tsegment\talso\tincludes\tservices\tand\tother,\twhich\tincludes\tsales\tof\tused\tvehicles,\tnon-\nwarranty\tafter-sales\tvehicle\tservices,\tbody\tshop\tand\tparts,\tpaid\tSupercharging,\tvehicle\tinsurance\trevenue\tand\tretail\tmerchandise.\tThe\tenergy\tgeneration\nand\tstorage\tsegment\tincludes\tthe\tdesign,\tmanufacture,\tinstallation,\tsales\tand\tleasing\tof\tsolar\tenergy\tgeneration\tand\tenergy\tstorage\tproducts\tand\trelated\nservices\tand\tsales\tof\tsolar\tenergy\tsystems\tincentives.\nOur\tProducts\tand\tServices\nAutomotive\nWe\tcurrently\tmanufacture\tfive\tdifferent\tconsumer\tvehicles\t–\tthe\tModel\t3,\tY,\tS,\tX\tand\tCybertruck.\tModel\t3\tis\ta\tfour-door\tmid-size\tsedan\tthat\twe\ndesigned\tfor\tmanufacturability\twith\ta\tbase\tprice\tfor\tmass-market\tappeal.\tModel\tY\tis\ta\tcompact\tsport\tutility\tvehicle\t(“SUV”)\tbuilt\ton\tthe\tModel\t3\tplatform\nwith\tseating\tfor\tup\tto\tseven\tadults.\tModel\tS\tis\ta\tfour-door\tfull-size\tsedan\tand\tModel\tX\tis\ta\tmid-size\tSUV\twith\tseating\tfor\tup\tto\tseven\tadults.\tModel\tS\tand\nModel\tX\tfeature\tthe\thighest\tperformance\tcharacteristics\tand\tlongest\tranges\tthat\twe\toffer\tin\ta\tsedan\tand\tSUV,\trespectively.\tIn\tNovember\t2023,\twe\nentered\tthe\tconsumer\tpickup\ttruck\tmarket\twith\tfirst\tdeliveries\tof\tthe\tCybertruck,\ta\tfull-size\telectric\tpickup\ttruck\twith\ta\tstainless\tsteel\texterior\tthat\thas\nthe\tutility\tand\tstrength\tof\ta\ttruck\twhile\tfeaturing\tthe\tspeed\tof\ta\tsports\tcar.\nIn\t2022,\twe\talso\tbegan\tearly\tproduction\tand\tdeliveries\tof\ta\tcommercial\telectric\tvehicle,\tthe\tTesla\tSemi.\tWe\thave\tplanned\telectric\tvehicles\tto\naddress\tadditional\tvehicle\tmarkets,\tand\tto\tcontinue\tleveraging\tdevelopments\tin\tour\tproprietary\tFull\tSelf-Driving\t(“FSD”)\tCapability\tfeatures,\tbattery\tcell\nand\tother\ttechnologies.\nEnergy\tGeneration\tand\tStorage\nEnergy\tStorage\tProducts\nPowerwall\tand\tMegapack\tare\tour\tlithium-ion\tbattery\tenergy\tstorage\tproducts.', 'Our\tcybersecurity\trisk\tmanagement\tand\tstrategy\tprocesses\tare\toverseen\tby\tleaders\tfrom\tour\tInformation\tSecurity,\tProduct\tSecurity,\tCompliance\nand\tLegal\tteams.\tSuch\tindividuals\thave\tan\taverage\tof\tover\t15\tyears\tof\tprior\twork\texperience\tin\tvarious\troles\tinvolving\tinformation\ttechnology,\tincluding\nsecurity,\tauditing,\tcompliance,\tsystems\tand\tprogramming.\tThese\tindividuals\tare\tinformed\tabout,\tand\tmonitor\tthe\tprevention,\tmitigation,\tdetection\tand\nremediation\tof\tcybersecurity\tincidents\tthrough\ttheir\tmanagement\tof,\tand\tparticipation\tin,\tthe\tcybersecurity\trisk\tmanagement\tand\tstrategy\tprocesses\ndescribed\tabove,\tincluding\tthe\toperation\tof\tour\tincident\tresponse\tplan,\tand\treport\tto\tthe\tAudit\tCommittee\ton\tany\tappropriate\titems.\nITEM\t2.\tPROPERTIES\nWe\tare\theadquartered\tin\tAustin,\tTexas.\tOur\tprincipal\tfacilities\tinclude\ta\tlarge\tnumber\tof\tproperties\tin\tNorth\tAmerica,\tEurope\tand\tAsia\tutilized\tfor\nmanufacturing\tand\tassembly,\twarehousing,\tengineering,\tretail\tand\tservice\tlocations,\tSupercharger\tsites\tand\tadministrative\tand\tsales\toffices.\tOur\tfacilities\nare\tused\tto\tsupport\tboth\tof\tour\treporting\tsegments,\tand\tare\tsuitable\tand\tadequate\tfor\tthe\tconduct\tof\tour\tbusiness.\tWe\tgenerally\tlease\tsuch\tfacilities\twith\nthe\tprimary\texception\tof\tsome\tmanufacturing\tfacilities.\tThe\tfollowing\ttable\tsets\tforth\tthe\tlocation\tof\tour\tprimary\towned\tand\tleased\tmanufacturing\nfacilities.\nPrimary\tManufacturing\tFacilities\nLocation\nOwned\tor\tLeased\nGigafactory\tTexas\nAustin,\tTexas\nOwned\nFremont\tFactory\nFremont,\tCalifornia\nOwned\nGigafactory\tNevada\nSparks,\tNevada\nOwned\nGigafactory\tBerlin-Brandenburg\nGrunheide,\tGermany\nOwned\nGigafactory\tShanghai\nShanghai,\tChina\n*\nGigafactory\tNew\tYork\nBuffalo,\tNew\tYork\nLeased\nMegafactory\nLathrop,\tCalifornia\nLeased\n*\nWe\town\tthe\tbuilding\tand\tthe\tland\tuse\trights\twith\tan\tinitial\tterm\tof\t50\tyears.\tThe\tland\tuse\trights\tare\ttreated\tas\toperating\tlease\tright-of-use\tassets.\nITEM\t3.\tLEGAL\tPROCEEDINGS\nFor\ta\tdescription\tof\tour\tmaterial\tpending\tlegal\tproceedings,\tplease\tsee\tNote\t15,\t\nCommitments\tand\tContingencies\n,\tto\tthe\tconsolidated\tfinancial\nstatements\tincluded\telsewhere\tin\tthis\tAnnual\tReport\ton\tForm\t10-K.\nIn\taddition,\teach\tof\tthe\tmatters\tbelow\tis\tbeing\tdisclosed\tpursuant\tto\tItem\t103\tof\tRegulation\tS-K\tbecause\tit\trelates\tto\tenvironmental\tregulations\tand\naggregate\tcivil\tpenalties\tthat\twe\tcurrently\tbelieve\tcould\tpotentially\texceed\t$1\tmillion.\tWe\tbelieve\tthat\tany\tproceeding\tthat\tis\tmaterial\tto\tour\tbusiness\tor\nfinancial\tcondition\tis\tlikely\tto\thave\tpotential\tpenalties\tfar\tin\texcess\tof\tsuch\tamount.\nDistrict\tattorneys\tin\tcertain\tCalifornia\tcounties\tconducted\tan\tinvestigation\tinto\tTesla’s\twaste\tsegregation\tpractices\tpursuant\tto\tCal.\tHealth\t&\tSaf.\nCode\t§\t25100\tet\tseq.\tand\tCal.\tCivil\tCode\t§\t1798.80.\tTesla\thas\timplemented\tvarious\tremedial\tmeasures,\tincluding\tconducting\ttraining\tand\taudits,\tand\nenhancements\tto\tits\tsite\twaste\tmanagement\tprograms,\tand\tsettlement\tdiscussions\tare\tongoing.\tWhile\tthe\toutcome\tof\tthis\tmatter\tcannot\tbe\tdetermined\nat\tthis\ttime,\tit\tis\tnot\tcurrently\texpected\tto\thave\ta\tmaterial\tadverse\timpact\ton\tour\tbusiness.\nITEM\t4.\tMINE\tSAFETY\tDISCLOSURES\nNot\tapplicable.\n30']","Tesla operates manufacturing facilities in Austin, Texas; Fremont, California; Sparks, Nevada; Grunheide, Germany; Shanghai, China; Buffalo, New York; and Lathrop, California.  
","Manufacturing in Northern CA, New York (Buffalo), Texas (Austin), Nevada (Reno), Shanghai, Berlin‑Brandenburg; next: Monterrey, Mexico",,0.99999999998,0.8571428571428571
Where are Tesla’s Gigafactories located?,"['Internationally,\twe\talso\thave\tmanufacturing\tfacilities\tin\tChina\t(Gigafactory\tShanghai)\tand\tGermany\t(Gigafactory\tBerlin-Brandenburg),\twhich\tallows\nus\tto\tincrease\tthe\taffordability\tof\tour\tvehicles\tfor\tcustomers\tin\tlocal\tmarkets\tby\treducing\ttransportation\tand\tmanufacturing\tcosts\tand\teliminating\tthe\nimpact\tof\tunfavorable\ttariffs.\tIn\tMarch\t2023,\twe\tannounced\tthe\tlocation\tof\tour\tnext\tGigafactory\tin\tMonterrey,\tMexico.\tGenerally,\twe\tcontinue\tto\texpand\nproduction\tcapacity\tat\tour\texisting\tfacilities.\tWe\talso\tintend\tto\tfurther\tincrease\tcost-competitiveness\tin\tour\tsignificant\tmarkets\tby\tstrategically\tadding\nlocal\tmanufacturing.\nSupply\tChain\nOur\tproducts\tuse\tthousands\tof\tparts\tthat\tare\tsourced\tfrom\thundreds\tof\tsuppliers\tacross\tthe\tworld.\tWe\thave\tdeveloped\tclose\trelationships\twith\nvendors\tof\tkey\tparts\tsuch\tas\tbattery\tcells,\telectronics\tand\tcomplex\tvehicle\tassemblies.\tCertain\tcomponents\tpurchased\tfrom\tthese\tsuppliers\tare\tshared\tor\nare\tsimilar\tacross\tmany\tproduct\tlines,\tallowing\tus\tto\ttake\tadvantage\tof\tpricing\tefficiencies\tfrom\teconomies\tof\tscale.\n8', 'Our\tcybersecurity\trisk\tmanagement\tand\tstrategy\tprocesses\tare\toverseen\tby\tleaders\tfrom\tour\tInformation\tSecurity,\tProduct\tSecurity,\tCompliance\nand\tLegal\tteams.\tSuch\tindividuals\thave\tan\taverage\tof\tover\t15\tyears\tof\tprior\twork\texperience\tin\tvarious\troles\tinvolving\tinformation\ttechnology,\tincluding\nsecurity,\tauditing,\tcompliance,\tsystems\tand\tprogramming.\tThese\tindividuals\tare\tinformed\tabout,\tand\tmonitor\tthe\tprevention,\tmitigation,\tdetection\tand\nremediation\tof\tcybersecurity\tincidents\tthrough\ttheir\tmanagement\tof,\tand\tparticipation\tin,\tthe\tcybersecurity\trisk\tmanagement\tand\tstrategy\tprocesses\ndescribed\tabove,\tincluding\tthe\toperation\tof\tour\tincident\tresponse\tplan,\tand\treport\tto\tthe\tAudit\tCommittee\ton\tany\tappropriate\titems.\nITEM\t2.\tPROPERTIES\nWe\tare\theadquartered\tin\tAustin,\tTexas.\tOur\tprincipal\tfacilities\tinclude\ta\tlarge\tnumber\tof\tproperties\tin\tNorth\tAmerica,\tEurope\tand\tAsia\tutilized\tfor\nmanufacturing\tand\tassembly,\twarehousing,\tengineering,\tretail\tand\tservice\tlocations,\tSupercharger\tsites\tand\tadministrative\tand\tsales\toffices.\tOur\tfacilities\nare\tused\tto\tsupport\tboth\tof\tour\treporting\tsegments,\tand\tare\tsuitable\tand\tadequate\tfor\tthe\tconduct\tof\tour\tbusiness.\tWe\tgenerally\tlease\tsuch\tfacilities\twith\nthe\tprimary\texception\tof\tsome\tmanufacturing\tfacilities.\tThe\tfollowing\ttable\tsets\tforth\tthe\tlocation\tof\tour\tprimary\towned\tand\tleased\tmanufacturing\nfacilities.\nPrimary\tManufacturing\tFacilities\nLocation\nOwned\tor\tLeased\nGigafactory\tTexas\nAustin,\tTexas\nOwned\nFremont\tFactory\nFremont,\tCalifornia\nOwned\nGigafactory\tNevada\nSparks,\tNevada\nOwned\nGigafactory\tBerlin-Brandenburg\nGrunheide,\tGermany\nOwned\nGigafactory\tShanghai\nShanghai,\tChina\n*\nGigafactory\tNew\tYork\nBuffalo,\tNew\tYork\nLeased\nMegafactory\nLathrop,\tCalifornia\nLeased\n*\nWe\town\tthe\tbuilding\tand\tthe\tland\tuse\trights\twith\tan\tinitial\tterm\tof\t50\tyears.\tThe\tland\tuse\trights\tare\ttreated\tas\toperating\tlease\tright-of-use\tassets.\nITEM\t3.\tLEGAL\tPROCEEDINGS\nFor\ta\tdescription\tof\tour\tmaterial\tpending\tlegal\tproceedings,\tplease\tsee\tNote\t15,\t\nCommitments\tand\tContingencies\n,\tto\tthe\tconsolidated\tfinancial\nstatements\tincluded\telsewhere\tin\tthis\tAnnual\tReport\ton\tForm\t10-K.\nIn\taddition,\teach\tof\tthe\tmatters\tbelow\tis\tbeing\tdisclosed\tpursuant\tto\tItem\t103\tof\tRegulation\tS-K\tbecause\tit\trelates\tto\tenvironmental\tregulations\tand\naggregate\tcivil\tpenalties\tthat\twe\tcurrently\tbelieve\tcould\tpotentially\texceed\t$1\tmillion.\tWe\tbelieve\tthat\tany\tproceeding\tthat\tis\tmaterial\tto\tour\tbusiness\tor\nfinancial\tcondition\tis\tlikely\tto\thave\tpotential\tpenalties\tfar\tin\texcess\tof\tsuch\tamount.\nDistrict\tattorneys\tin\tcertain\tCalifornia\tcounties\tconducted\tan\tinvestigation\tinto\tTesla’s\twaste\tsegregation\tpractices\tpursuant\tto\tCal.\tHealth\t&\tSaf.\nCode\t§\t25100\tet\tseq.\tand\tCal.\tCivil\tCode\t§\t1798.80.\tTesla\thas\timplemented\tvarious\tremedial\tmeasures,\tincluding\tconducting\ttraining\tand\taudits,\tand\nenhancements\tto\tits\tsite\twaste\tmanagement\tprograms,\tand\tsettlement\tdiscussions\tare\tongoing.\tWhile\tthe\toutcome\tof\tthis\tmatter\tcannot\tbe\tdetermined\nat\tthis\ttime,\tit\tis\tnot\tcurrently\texpected\tto\thave\ta\tmaterial\tadverse\timpact\ton\tour\tbusiness.\nITEM\t4.\tMINE\tSAFETY\tDISCLOSURES\nNot\tapplicable.\n30', 'Gigafactory\tNew\tYork—New\tYork\tState\tInvestment\tand\tLease\nWe\thave\ta\tlease\tthrough\tthe\tResearch\tFoundation\tfor\tthe\tSUNY\tFoundation\twith\trespect\tto\tGigafactory\tNew\tYork.\tUnder\tthe\tlease\tand\ta\trelated\nresearch\tand\tdevelopment\tagreement,\twe\tare\tcontinuing\tto\tdesignate\tfurther\tbuildouts\tat\tthe\tfacility.\tWe\tare\trequired\tto\tcomply\twith\tcertain\tcovenants,\nincluding\thiring\tand\tcumulative\tinvestment\ttargets.\tUnder\tthe\tterms\tof\tthe\tarrangement,\tthe\tSUNY\tFoundation\tpaid\tfor\ta\tmajority\tof\tthe\tconstruction\ncosts\trelated\tto\tthe\tmanufacturing\tfacility\tand\tthe\tacquisition\tand\tcommissioning\tof\tcertain\tmanufacturing\tequipment;\tand\twe\tare\tresponsible\tfor\tany\nconstruction\tor\tequipment\tcosts\tin\texcess\tof\tsuch\tamount\t(refer\tto\tNote\t15,\t\nCommitments\tand\tContingencies\n).\tThis\tincentive\treduces\tthe\trelated\tlease\ncosts\tof\tthe\tfacility\twithin\tthe\tEnergy\tgeneration\tand\tstorage\tcost\tof\trevenues\tand\toperating\texpense\tline\titems\tin\tour\tconsolidated\tstatements\tof\noperations.\nGigafactory\tShanghai—Land\tUse\tRights\tand\tEconomic\tBenefits\nWe\thave\tan\tagreement\twith\tthe\tlocal\tgovernment\tof\tShanghai\tfor\tland\tuse\trights\tat\tGigafactory\tShanghai.\tUnder\tthe\tterms\tof\tthe\tarrangement,\twe\nare\trequired\tto\tmeet\ta\tcumulative\tcapital\texpenditure\ttarget\tand\tan\tannual\ttax\trevenue\ttarget\tstarting\tat\tthe\tend\tof\t2023.\tIn\taddition,\tthe\tShanghai\ngovernment\thas\tgranted\tto\tour\tGigafactory\tShanghai\tsubsidiary\tcertain\tincentives\tto\tbe\tused\tin\tconnection\twith\teligible\tcapital\tinvestments\tat\nGigafactory\tShanghai\t(refer\tto\tNote\t15,\t\nCommitments\tand\tContingencies\n).\tFor\tthe\tyear\tended\tDecember\t31,\t2022,\twe\treceived\tgrant\tfunding\tof\t$\n76\nmillion.\tThese\tincentives\toffset\tthe\trelated\tcosts\tof\tour\tfacilities\tand\tare\trecorded\tas\ta\treduction\tof\tthe\tcost\tof\tthe\tcapital\tinvestment\twithin\tthe\tProperty,\nplant\tand\tequipment,\tnet\tline\titem\tin\tour\tconsolidated\tbalance\tsheets.\tThe\tincentive\ttherefore\treduces\tthe\tdepreciation\texpense\tover\tthe\tuseful\tlives\tof\nthe\trelated\tequipment.\nNevada\tTax\tIncentives\nIn\tconnection\twith\tthe\tconstruction\tof\tGigafactory\tNevada,\twe\tentered\tinto\tagreements\twith\tthe\tState\tof\tNevada\tand\tStorey\tCounty\tin\tNevada\tthat\nprovide\tabatements\tfor\tspecified\ttaxes,\tdiscounts\tto\tthe\tbase\ttariff\tenergy\trates\tand\ttransferable\ttax\tcredits\tof\tup\tto\t$\n195\n\tmillion\tin\tconsideration\tof\ncapital\tinvestment\tand\thiring\ttargets\tthat\twere\tmet\tat\tGigafactory\tNevada.\nGigafactory\tTexas\tTax\tIncentives\nIn\tconnection\twith\tthe\tconstruction\tof\tGigafactory\tTexas,\twe\tentered\tinto\ta\t\n20-year\n\tagreement\twith\tTravis\tCounty\tin\tTexas\tpursuant\tto\twhich\twe\nwould\treceive\tgrant\tfunding\tequal\tto\t\n70\n-\n80\n%\tof\tproperty\ttaxes\tpaid\tby\tus\tto\tTravis\tCounty\tand\ta\tseparate\t\n10-year\n\tagreement\twith\tthe\tDel\tValle\nIndependent\tSchool\tDistrict\tin\tTexas\tpursuant\tto\twhich\ta\tportion\tof\tthe\ttaxable\tvalue\tof\tour\tproperty\twould\tbe\tcapped\tat\ta\tspecified\tamount,\tin\teach\tcase\nsubject\tto\tour\tmeeting\tcertain\tminimum\teconomic\tdevelopment\tmetrics\tthrough\tour\tconstruction\tand\toperations\tat\tGigafactory\tTexas.\tThis\tincentive\tis\nrecorded\tas\ta\treduction\tof\tthe\trelated\texpenses\twithin\tthe\tCost\tof\tautomotive\trevenues\tand\toperating\texpense\tline\titems\tof\tour\tconsolidated\tstatements\nof\toperations.\n\tAs\tof\tDecember\t31,\t2023,\tthe\tgrant\tfunding\trelated\tto\tproperty\ttaxes\tpaid\twere\timmaterial.\nDefined\tContribution\tPlan\nWe\thave\ta\t401(k)\tsavings\tplan\tin\tthe\tU.S.', 'Table\tof\tContents\nPART\tI\nITEM\t1.\tBUSINESS\nOverview\nWe\tdesign,\tdevelop,\tmanufacture,\tsell\tand\tlease\thigh-performance\tfully\telectric\tvehicles\tand\tenergy\tgeneration\tand\tstorage\tsystems,\tand\toffer\nservices\trelated\tto\tour\tproducts.\tWe\tgenerally\tsell\tour\tproducts\tdirectly\tto\tcustomers,\tand\tcontinue\tto\tgrow\tour\tcustomer-facing\tinfrastructure\tthrough\ta\nglobal\tnetwork\tof\tvehicle\tshowrooms\tand\tservice\tcenters,\tMobile\tService,\tbody\tshops,\tSupercharger\tstations\tand\tDestination\tChargers\tto\taccelerate\tthe\nwidespread\tadoption\tof\tour\tproducts.\tWe\temphasize\tperformance,\tattractive\tstyling\tand\tthe\tsafety\tof\tour\tusers\tand\tworkforce\tin\tthe\tdesign\tand\nmanufacture\tof\tour\tproducts\tand\tare\tcontinuing\tto\tdevelop\tfull\tself-driving\ttechnology\tfor\timproved\tsafety.\tWe\talso\tstrive\tto\tlower\tthe\tcost\tof\townership\nfor\tour\tcustomers\tthrough\tcontinuous\tefforts\tto\treduce\tmanufacturing\tcosts\tand\tby\toffering\tfinancial\tand\tother\tservices\ttailored\tto\tour\tproducts.\nOur\tmission\tis\tto\taccelerate\tthe\tworld’s\ttransition\tto\tsustainable\tenergy.\tWe\tbelieve\tthat\tthis\tmission,\talong\twith\tour\tengineering\texpertise,\nvertically\tintegrated\tbusiness\tmodel\tand\tfocus\ton\tuser\texperience\tdifferentiate\tus\tfrom\tother\tcompanies.\nSegment\tInformation\nWe\toperate\tas\ttwo\treportable\tsegments:\t(i)\tautomotive\tand\t(ii)\tenergy\tgeneration\tand\tstorage.\nThe\tautomotive\tsegment\tincludes\tthe\tdesign,\tdevelopment,\tmanufacturing,\tsales\tand\tleasing\tof\thigh-performance\tfully\telectric\tvehicles\tas\twell\tas\nsales\tof\tautomotive\tregulatory\tcredits.\tAdditionally,\tthe\tautomotive\tsegment\talso\tincludes\tservices\tand\tother,\twhich\tincludes\tsales\tof\tused\tvehicles,\tnon-\nwarranty\tafter-sales\tvehicle\tservices,\tbody\tshop\tand\tparts,\tpaid\tSupercharging,\tvehicle\tinsurance\trevenue\tand\tretail\tmerchandise.\tThe\tenergy\tgeneration\nand\tstorage\tsegment\tincludes\tthe\tdesign,\tmanufacture,\tinstallation,\tsales\tand\tleasing\tof\tsolar\tenergy\tgeneration\tand\tenergy\tstorage\tproducts\tand\trelated\nservices\tand\tsales\tof\tsolar\tenergy\tsystems\tincentives.\nOur\tProducts\tand\tServices\nAutomotive\nWe\tcurrently\tmanufacture\tfive\tdifferent\tconsumer\tvehicles\t–\tthe\tModel\t3,\tY,\tS,\tX\tand\tCybertruck.\tModel\t3\tis\ta\tfour-door\tmid-size\tsedan\tthat\twe\ndesigned\tfor\tmanufacturability\twith\ta\tbase\tprice\tfor\tmass-market\tappeal.\tModel\tY\tis\ta\tcompact\tsport\tutility\tvehicle\t(“SUV”)\tbuilt\ton\tthe\tModel\t3\tplatform\nwith\tseating\tfor\tup\tto\tseven\tadults.\tModel\tS\tis\ta\tfour-door\tfull-size\tsedan\tand\tModel\tX\tis\ta\tmid-size\tSUV\twith\tseating\tfor\tup\tto\tseven\tadults.\tModel\tS\tand\nModel\tX\tfeature\tthe\thighest\tperformance\tcharacteristics\tand\tlongest\tranges\tthat\twe\toffer\tin\ta\tsedan\tand\tSUV,\trespectively.\tIn\tNovember\t2023,\twe\nentered\tthe\tconsumer\tpickup\ttruck\tmarket\twith\tfirst\tdeliveries\tof\tthe\tCybertruck,\ta\tfull-size\telectric\tpickup\ttruck\twith\ta\tstainless\tsteel\texterior\tthat\thas\nthe\tutility\tand\tstrength\tof\ta\ttruck\twhile\tfeaturing\tthe\tspeed\tof\ta\tsports\tcar.\nIn\t2022,\twe\talso\tbegan\tearly\tproduction\tand\tdeliveries\tof\ta\tcommercial\telectric\tvehicle,\tthe\tTesla\tSemi.\tWe\thave\tplanned\telectric\tvehicles\tto\naddress\tadditional\tvehicle\tmarkets,\tand\tto\tcontinue\tleveraging\tdevelopments\tin\tour\tproprietary\tFull\tSelf-Driving\t(“FSD”)\tCapability\tfeatures,\tbattery\tcell\nand\tother\ttechnologies.\nEnergy\tGeneration\tand\tStorage\nEnergy\tStorage\tProducts\nPowerwall\tand\tMegapack\tare\tour\tlithium-ion\tbattery\tenergy\tstorage\tproducts.', 'Management\tOpportunities,\tChallenges\tand\tUncertainties\tand\t2024\tOutlook\nAutomotive—Production\nThe\tfollowing\tis\ta\tsummary\tof\tthe\tstatus\tof\tproduction\tof\teach\tof\tour\tannounced\tvehicle\tmodels\tin\tproduction\tand\tunder\tdevelopment,\tas\tof\tthe\ndate\tof\tthis\tAnnual\tReport\ton\tForm\t10-K:\nProduction\tLocation\nVehicle\tModel(s)\nProduction\tStatus\nFremont\tFactory\nModel\tS\t/\tModel\tX\nActive\n\t\nModel\t3\t/\tModel\tY\nActive\nGigafactory\tShanghai\nModel\t3\t/\tModel\tY\nActive\nGigafactory\tBerlin-Brandenburg\nModel\tY\nActive\nGigafactory\tTexas\nModel\tY\nActive\n\t\nCybertruck\nActive\nGigafactory\tNevada\nTesla\tSemi\nPilot\tproduction\nVarious\nNext\tGeneration\tPlatform\nIn\tdevelopment\nTBD\nTesla\tRoadster\nIn\tdevelopment\nWe\tare\tfocused\ton\tgrowing\tour\tmanufacturing\tcapacity,\twhich\tincludes\tcapacity\tfor\tmanufacturing\tnew\tvehicle\tmodels\tsuch\tas\tour\tCybertruck\tand\nnext\tgeneration\tplatform,\tand\tramping\tall\tof\tour\tproduction\tvehicles\tto\ttheir\tinstalled\tproduction\tcapacities\tas\twell\tas\tincreasing\tproduction\trate\tand\nefficiency\tat\tour\tcurrent\tfactories.\tThe\tnext\tphase\tof\tproduction\tgrowth\twill\tdepend\ton\tthe\tcontinued\tramp\tat\tour\tfactories\tand\tthe\tintroduction\tof\tour\nnext\tgeneration\tplatform,\tas\twell\tas\tour\tability\tto\tadd\tto\tour\tavailable\tsources\tof\tbattery\tcell\tsupply\tby\tmanufacturing\tour\town\tcells\tthat\twe\tare\ndeveloping\tto\thave\thigh-volume\toutput,\tlower\tcapital\tand\tproduction\tcosts\tand\tlonger\trange.\tOur\tgoals\tare\tto\timprove\tvehicle\tperformance,\tdecrease\nproduction\tcosts\tand\tincrease\taffordability\tand\tcustomer\tawareness.\nThese\tplans\tare\tsubject\tto\tuncertainties\tinherent\tin\testablishing\tand\tramping\tmanufacturing\toperations,\twhich\tmay\tbe\texacerbated\tby\tnew\tproduct\nand\tmanufacturing\ttechnologies\twe\tintroduce,\tthe\tnumber\tof\tconcurrent\tinternational\tprojects,\tany\tindustry-wide\tcomponent\tconstraints,\tlabor\tshortages\nand\tany\tfuture\timpact\tfrom\tevents\toutside\tof\tour\tcontrol.\tFor\texample,\tduring\tthe\tthird\tquarter\tof\t2023,\twe\texperienced\ta\tsequential\tdecline\tin\nproduction\tvolumes\tdue\tto\tpre-planned\tshutdowns\tfor\tupgrades\tat\tvarious\tfactories.\tMoreover,\twe\thave\tset\tambitious\ttechnological\ttargets\twith\tour\nplans\tfor\tbattery\tcells\tas\twell\tas\tfor\titerative\tmanufacturing\tand\tdesign\timprovements\tfor\tour\tvehicles\twith\teach\tnew\tfactory.\nAutomotive—Demand,\tSales,\tDeliveries\tand\tInfrastructure\nOur\tcost\treduction\tefforts,\tcost\tinnovation\tstrategies,\tand\tadditional\tlocalized\tprocurement\tand\tmanufacturing\tare\tkey\tto\tour\tvehicles’\taffordability\nand\thave\tallowed\tus\tto\tcompetitively\tprice\tour\tvehicles.\tWe\twill\talso\tcontinue\tto\tgenerate\tdemand\tand\tbrand\tawareness\tby\timproving\tour\tvehicles’\nperformance\tand\tfunctionality,\tincluding\tthrough\tproducts\tbased\ton\tartificial\tintelligence\tsuch\tas\tAutopilot,\tFSD\tCapability,\tand\tother\tsoftware\tfeatures\nand\tdelivering\tnew\tvehicles,\tsuch\tas\tour\tCybertruck.\tMoreover,\twe\texpect\tto\tcontinue\tto\tbenefit\tfrom\tongoing\telectrification\tof\tthe\tautomotive\tsector\tand\nincreasing\tenvironmental\tregulations\tand\tinitiatives.\nHowever,\twe\toperate\tin\ta\tcyclical\tindustry\tthat\tis\tsensitive\tto\tpolitical\tand\tregulatory\tuncertainty,\tincluding\twith\trespect\tto\ttrade\tand\tthe\nenvironment,\tall\tof\twhich\tcan\tbe\tcompounded\tby\tinflationary\tpressures,\trising\tenergy\tprices,\tinterest\trate\tfluctuations\tand\tthe\tliquidity\tof\tenterprise\ncustomers.\tFor\texample,\tinflationary\tpressures\thave\tincreased\tacross\tthe\tmarkets\tin\twhich\twe\toperate.']","Tesla has Gigafactories in China, Germany, Nevada, Texas, and New York.  
","Gigafactories in NY, TX, NV, Shanghai, Berlin‑Brandenburg (and planned Mexico)",1.0,0.94999999997625,1.0
What supply chain risks does Tesla identify?,"['Any\tunfavorable\tultimate\toutcome\tfor\tTesla\tmay\thave\ta\tnegative\timpact\ton\tthe\tperception\tof\tTesla’s\ttreatment\tof\tour\temployees.\tFurthermore,\twe\tare\ndirectly\tor\tindirectly\tdependent\tupon\tcompanies\twith\tunionized\twork\tforces,\tsuch\tas\tsuppliers\tand\ttrucking\tand\tfreight\tcompanies.\tAny\twork\tstoppages\tor\nstrikes\torganized\tby\tsuch\tunions\tcould\tdelay\tthe\tmanufacture\tand\tsale\tof\tour\tproducts\tand\tmay\tharm\tour\tbusiness\tand\toperating\tresults.\nWe\tmay\tchoose\tto\tor\tbe\tcompelled\tto\tundertake\tproduct\trecalls\tor\ttake\tother\tsimilar\tactions.\nAs\ta\tmanufacturing\tcompany,\twe\tmust\tmanage\tthe\trisk\tof\tproduct\trecalls\twith\trespect\tto\tour\tproducts.\tRecalls\tfor\tour\tvehicles\thave\tresulted\tfrom\nvarious\thardware\tand\tsoftware-related\tsafety\tconcerns\tor\tnon-compliance\tdeterminations.\tIn\taddition\tto\trecalls\tinitiated\tby\tus\tfor\tvarious\tcauses,\ttesting\nof\tor\tinvestigations\tinto\tour\tproducts\tby\tgovernment\tregulators\tor\tindustry\tgroups\tmay\tcompel\tus\tto\tinitiate\tproduct\trecalls\tor\tmay\tresult\tin\tnegative\npublic\tperceptions\tabout\tthe\tsafety\tof\tour\tproducts,\teven\tif\twe\tdisagree\twith\tthe\tdefect\tdetermination\tor\thave\tdata\tthat\tcontradicts\tit.\tIn\tthe\tfuture,\twe\nmay\tvoluntarily\tor\tinvoluntarily\tinitiate\trecalls\tif\tany\tof\tour\tproducts\tare\tdetermined\tby\tus\tor\ta\tregulator\tto\tcontain\ta\tsafety\tdefect\tor\tbe\tnoncompliant\nwith\tapplicable\tlaws\tand\tregulations,\tsuch\tas\tU.S.\tFederal\tMotor\tVehicle\tSafety\tStandards.\tSuch\trecalls,\twhether\tvoluntary\tor\tinvoluntary\tor\tcaused\tby\nsystems\tor\tcomponents\tengineered\tor\tmanufactured\tby\tus\tor\tour\tsuppliers,\tcould\tresult\tin\tsignificant\texpense,\tsupply\tchain\tcomplications\tand\tservice\nburdens,\tand\tmay\tharm\tour\tbrand,\tbusiness,\tprospects,\tfinancial\tcondition\tand\toperating\tresults.\nOur\tcurrent\tand\tfuture\twarranty\treserves\tmay\tbe\tinsufficient\tto\tcover\tfuture\twarranty\tclaims.\nWe\tprovide\ta\tmanufacturer’s\twarranty\ton\tall\tnew\tand\tused\tTesla\tvehicles\twe\tsell\tdirectly\tto\tcustomers.\tWe\talso\tprovide\tcertain\twarranties\twith\nrespect\tto\tthe\tenergy\tgeneration\tand\tstorage\tsystems\twe\tsell,\tincluding\ton\ttheir\tinstallation\tand\tmaintenance.\tFor\tcomponents\tnot\tmanufactured\tby\tus,\nwe\tgenerally\tpass\tthrough\tto\tour\tcustomers\tthe\tapplicable\tmanufacturers’\twarranties,\tbut\tmay\tretain\tsome\twarranty\tresponsibilities\tfor\tsome\tor\tall\tof\tthe\nlife\tof\tsuch\tcomponents.\tAs\tpart\tof\tour\tenergy\tgeneration\tand\tstorage\tsystem\tcontracts,\twe\tmay\tprovide\tthe\tcustomer\twith\tperformance\tguarantees\tthat\nguarantee\tthat\tthe\tunderlying\tsystem\twill\tmeet\tor\texceed\tthe\tminimum\tenergy\tgeneration\tor\tother\tenergy\tperformance\trequirements\tspecified\tin\tthe\ncontract.\tUnder\tthese\tperformance\tguarantees,\twe\tgenerally\tbear\tthe\trisk\tof\telectricity\tproduction\tor\tother\tperformance\tshortfalls,\tincluding\tin\tsome\ncases\tshortfalls\tcaused\tby\tfailures\tin\tcomponents\tfrom\tthird\tparty\tmanufacturers.\tThese\trisks\tare\texacerbated\tin\tthe\tevent\tsuch\tmanufacturers\tcease\noperations\tor\tfail\tto\thonor\ttheir\twarranties.\n22', 'In\taddition,\tthe\tSEC\tmaintains\ta\twebsite\t(\nwww.sec.gov\n)\tthat\tcontains\nreports,\tproxy\tand\tinformation\tstatements,\tand\tother\tinformation\tregarding\tissuers\tthat\tfile\telectronically.\tOur\twebsite\tis\tlocated\tat\t\nwww.tesla.com\n,\tand\nour\treports,\tamendments\tthereto,\tproxy\tstatements\tand\tother\tinformation\tare\talso\tmade\tavailable,\tfree\tof\tcharge,\ton\tour\tinvestor\trelations\twebsite\tat\nir.tesla.com\n\tas\tsoon\tas\treasonably\tpracticable\tafter\twe\telectronically\tfile\tor\tfurnish\tsuch\tinformation\twith\tthe\tSEC.\tThe\tinformation\tposted\ton\tour\twebsite\nis\tnot\tincorporated\tby\treference\tinto\tthis\tAnnual\tReport\ton\tForm\t10-K.\nITEM\t1A.\tRISK\tFACTORS\nYou\tshould\tcarefully\tconsider\tthe\trisks\tdescribed\tbelow\ttogether\twith\tthe\tother\tinformation\tset\tforth\tin\tthis\treport,\twhich\tcould\tmaterially\taffect\tour\nbusiness,\tfinancial\tcondition\tand\tfuture\tresults.\tThe\trisks\tdescribed\tbelow\tare\tnot\tthe\tonly\trisks\tfacing\tour\tcompany.\tRisks\tand\tuncertainties\tnot\tcurrently\nknown\tto\tus\tor\tthat\twe\tcurrently\tdeem\tto\tbe\timmaterial\talso\tmay\tmaterially\tadversely\taffect\tour\tbusiness,\tfinancial\tcondition\tand\toperating\tresults.\nRisks\tRelated\tto\tOur\tAbility\tto\tGrow\tOur\tBusiness\nWe\tmay\texperience\tdelays\tin\tlaunching\tand\tramping\tthe\tproduction\tof\tour\tproducts\tand\tfeatures,\tor\twe\tmay\tbe\tunable\tto\tcontrol\nour\tmanufacturing\tcosts.\nWe\thave\tpreviously\texperienced\tand\tmay\tin\tthe\tfuture\texperience\tlaunch\tand\tproduction\tramp\tdelays\tfor\tnew\tproducts\tand\tfeatures.\tFor\texample,\nwe\tencountered\tunanticipated\tsupplier\tissues\tthat\tled\tto\tdelays\tduring\tthe\tinitial\tramp\tof\tour\tfirst\tModel\tX\tand\texperienced\tchallenges\twith\ta\tsupplier\tand\nwith\tramping\tfull\tautomation\tfor\tcertain\tof\tour\tinitial\tModel\t3\tmanufacturing\tprocesses.\tIn\taddition,\twe\tmay\tintroduce\tin\tthe\tfuture\tnew\tor\tunique\nmanufacturing\tprocesses\tand\tdesign\tfeatures\tfor\tour\tproducts.\tAs\twe\texpand\tour\tvehicle\tofferings\tand\tglobal\tfootprint,\tthere\tis\tno\tguarantee\tthat\twe\twill\nbe\table\tto\tsuccessfully\tand\ttimely\tintroduce\tand\tscale\tsuch\tprocesses\tor\tfeatures.\n14', 'Table\tof\tContents\nWe\talso\tface\tcompetition\tin\tour\tenergy\tgeneration\tand\tstorage\tbusiness\tfrom\tother\tmanufacturers,\tdevelopers,\tinstallers\tand\tservice\tproviders\tof\ncompeting\tenergy\ttechnologies,\tas\twell\tas\tfrom\tlarge\tutilities.\tDecreases\tin\tthe\tretail\tor\twholesale\tprices\tof\telectricity\tfrom\tutilities\tor\tother\trenewable\nenergy\tsources\tcould\tmake\tour\tproducts\tless\tattractive\tto\tcustomers\tand\tlead\tto\tan\tincreased\trate\tof\tcustomer\tdefaults.\nRisks\tRelated\tto\tOur\tOperations\nWe\tmay\texperience\tissues\twith\tlithium-ion\tcells\tor\tother\tcomponents\tmanufactured\tat\tour\tGigafactories,\twhich\tmay\tharm\tthe\nproduction\tand\tprofitability\tof\tour\tvehicle\tand\tenergy\tstorage\tproducts.\nOur\tplan\tto\tgrow\tthe\tvolume\tand\tprofitability\tof\tour\tvehicles\tand\tenergy\tstorage\tproducts\tdepends\ton\tsignificant\tlithium-ion\tbattery\tcell\tproduction,\nincluding\tby\tour\tpartner\tPanasonic\tat\tGigafactory\tNevada.\tWe\talso\tproduce\tseveral\tvehicle\tcomponents\tat\tour\tGigafactories,\tsuch\tas\tbattery\tmodules\tand\npacks\tand\tdrive\tunits,\tand\tmanufacture\tenergy\tstorage\tproducts.\tIf\twe\tare\tunable\tto\tor\totherwise\tdo\tnot\tmaintain\tand\tgrow\tour\trespective\toperations,\tor\nif\twe\tare\tunable\tto\tdo\tso\tcost-effectively\tor\thire\tand\tretain\thighly-skilled\tpersonnel\tthere,\tour\tability\tto\tmanufacture\tour\tproducts\tprofitably\twould\tbe\nlimited,\twhich\tmay\tharm\tour\tbusiness\tand\toperating\tresults.\nFinally,\tthe\thigh\tvolumes\tof\tlithium-ion\tcells\tand\tbattery\tmodules\tand\tpacks\tmanufactured\tby\tus\tand\tby\tour\tsuppliers\tare\tstored\tand\trecycled\tat\tour\nvarious\tfacilities.\tAny\tmishandling\tof\tthese\tproducts\tmay\tcause\tdisruption\tto\tthe\toperation\tof\tsuch\tfacilities.\tWhile\twe\thave\timplemented\tsafety\nprocedures\trelated\tto\tthe\thandling\tof\tthe\tcells,\tthere\tcan\tbe\tno\tassurance\tthat\ta\tsafety\tissue\tor\tfire\trelated\tto\tthe\tcells\twould\tnot\tdisrupt\tour\toperations.\nAny\tsuch\tdisruptions\tor\tissues\tmay\tharm\tour\tbrand\tand\tbusiness.\nWe\tface\trisks\tassociated\twith\tmaintaining\tand\texpanding\tour\tinternational\toperations,\tincluding\tunfavorable\tand\tuncertain\nregulatory,\tpolitical,\teconomic,\ttax\tand\tlabor\tconditions.\nWe\tare\tsubject\tto\tlegal\tand\tregulatory\trequirements,\tpolitical\tuncertainty\tand\tsocial,\tenvironmental\tand\teconomic\tconditions\tin\tnumerous\njurisdictions,\tincluding\tmarkets\tin\twhich\twe\tgenerate\tsignificant\tsales,\tover\twhich\twe\thave\tlittle\tcontrol\tand\twhich\tare\tinherently\tunpredictable.\tOur\noperations\tin\tsuch\tjurisdictions,\tparticularly\tas\ta\tcompany\tbased\tin\tthe\tU.S.,\tcreate\trisks\trelating\tto\tconforming\tour\tproducts\tto\tregulatory\tand\tsafety\nrequirements\tand\tcharging\tand\tother\telectric\tinfrastructures;\torganizing\tlocal\toperating\tentities;\testablishing,\tstaffing\tand\tmanaging\tforeign\tbusiness\nlocations;\tattracting\tlocal\tcustomers;\tnavigating\tforeign\tgovernment\ttaxes,\tregulations\tand\tpermit\trequirements;\tenforceability\tof\tour\tcontractual\trights;\ntrade\trestrictions,\tcustoms\tregulations,\ttariffs\tand\tprice\tor\texchange\tcontrols;\tand\tpreferences\tin\tforeign\tnations\tfor\tdomestically\tmanufactured\tproducts.\nFor\texample,\twe\tmonitor\ttax\tlegislation\tchanges\ton\ta\tglobal\tbasis,\tincluding\tchanges\tarising\tas\ta\tresult\tof\tthe\tOrganization\tfor\tEconomic\tCooperation\tand\nDevelopment’s\tmulti-jurisdictional\tplan\tof\taction\tto\taddress\tbase\terosion\tand\tprofit\tshifting.\tSuch\tconditions\tmay\tincrease\tour\tcosts,\timpact\tour\tability\tto\nsell\tour\tproducts\tand\trequire\tsignificant\tmanagement\tattention,\tand\tmay\tharm\tour\tbusiness\tif\twe\tare\tunable\tto\tmanage\tthem\teffectively.', 'Table\tof\tContents\nunable\tto\tdo\tso,\twe\tmay\thave\tto\tcurtail\tour\tplanned\tvehicle\tand\tenergy\tstorage\tproduct\tproduction\tor\tprocure\tadditional\tcells\tfrom\tsuppliers\tat\npotentially\tgreater\tcosts,\teither\tof\twhich\tmay\tharm\tour\tbusiness\tand\toperating\tresults.\nIn\taddition,\tthe\tcost\tand\tmass\tproduction\tof\tbattery\tcells,\twhether\tmanufactured\tby\tour\tsuppliers\tor\tby\tus,\tdepends\tin\tpart\tupon\tthe\tprices\tand\navailability\tof\traw\tmaterials\tsuch\tas\tlithium,\tnickel,\tcobalt\tand/or\tother\tmetals.\tThe\tprices\tfor\tthese\tmaterials\tfluctuate\tand\ttheir\tavailable\tsupply\tmay\tbe\nunstable,\tdepending\ton\tmarket\tconditions\tand\tglobal\tdemand\tfor\tthese\tmaterials.\tFor\texample,\tas\ta\tresult\tof\tincreased\tglobal\tproduction\tof\telectric\nvehicles\tand\tenergy\tstorage\tproducts,\tsuppliers\tof\tthese\traw\tmaterials\tmay\tbe\tunable\tto\tmeet\tour\tvolume\tneeds.\tAdditionally,\tour\tsuppliers\tmay\tnot\tbe\nwilling\tor\table\tto\treliably\tmeet\tour\ttimelines\tor\tour\tcost\tand\tquality\tneeds,\twhich\tmay\trequire\tus\tto\treplace\tthem\twith\tother\tsources.\tAny\treduced\navailability\tof\tthese\tmaterials\tmay\timpact\tour\taccess\tto\tcells\tand\tour\tgrowth,\tand\tany\tincreases\tin\ttheir\tprices\tmay\treduce\tour\tprofitability\tif\twe\tcannot\nrecoup\tsuch\tcosts\tthrough\tincreased\tprices.\tMoreover,\tour\tinability\tto\tmeet\tdemand\tand\tany\tproduct\tprice\tincreases\tmay\tharm\tour\tbrand,\tgrowth,\nprospects\tand\toperating\tresults.\nOur\tfuture\tgrowth\tand\tsuccess\tare\tdependent\tupon\tconsumers’\tdemand\tfor\telectric\tvehicles\tand\tspecifically\tour\tvehicles\tin\tan\nautomotive\tindustry\tthat\tis\tgenerally\tcompetitive,\tcyclical\tand\tvolatile.\nThough\twe\tcontinue\tto\tsee\tincreased\tinterest\tand\tadoption\tof\telectric\tvehicles,\tif\tthe\tmarket\tfor\telectric\tvehicles\tin\tgeneral\tand\tTesla\tvehicles\tin\nparticular\tdoes\tnot\tdevelop\tas\twe\texpect,\tdevelops\tmore\tslowly\tthan\twe\texpect,\tor\tif\tdemand\tfor\tour\tvehicles\tdecreases\tin\tour\tmarkets\tor\tour\tvehicles\ncompete\twith\teach\tother,\tour\tbusiness,\tprospects,\tfinancial\tcondition\tand\toperating\tresults\tmay\tbe\tharmed.\nIn\taddition,\telectric\tvehicles\tstill\tconstitute\ta\tsmall\tpercentage\tof\toverall\tvehicle\tsales.\tAs\ta\tresult,\tthe\tmarket\tfor\tour\tvehicles\tcould\tbe\tnegatively\naffected\tby\tnumerous\tfactors,\tsuch\tas:\n•\nperceptions\tabout\telectric\tvehicle\tfeatures,\tquality,\tsafety,\tperformance\tand\tcost;\n•\nperceptions\tabout\tthe\tlimited\trange\tover\twhich\telectric\tvehicles\tmay\tbe\tdriven\ton\ta\tsingle\tbattery\tcharge,\tand\taccess\tto\tcharging\tfacilities;\n•\ncompetition,\tincluding\tfrom\tother\ttypes\tof\talternative\tfuel\tvehicles,\tplug-in\thybrid\telectric\tvehicles\tand\thigh\tfuel-economy\tinternal\tcombustion\nengine\tvehicles;\n•\nvolatility\tin\tthe\tcost\tof\toil,\tgasoline\tand\tenergy;\n•\ngovernment\tregulations\tand\teconomic\tincentives\tand\tconditions;\tand\n•\nconcerns\tabout\tour\tfuture\tviability.\nThe\ttarget\tdemographics\tfor\tour\tvehicles\tare\thighly\tcompetitive.\tSales\tof\tvehicles\tin\tthe\tautomotive\tindustry\ttend\tto\tbe\tcyclical\tin\tmany\tmarkets,\nwhich\tmay\texpose\tus\tto\tfurther\tvolatility.\tWe\talso\tcannot\tpredict\tthe\tduration\tor\tdirection\tof\tcurrent\tglobal\ttrends\tor\ttheir\tsustained\timpact\ton\tconsumer\ndemand.\tUltimately,\twe\tcontinue\tto\tmonitor\tmacroeconomic\tconditions\tto\tremain\tflexible\tand\tto\toptimize\tand\tevolve\tour\tbusiness\tas\tappropriate,\tand\nattempt\tto\taccurately\tproject\tdemand\tand\tinfrastructure\trequirements\tglobally\tand\tdeploy\tour\tproduction,\tworkforce\tand\tother\tresources\taccordingly.', 'Additionally,\tif\tour\tsuppliers\tdo\tnot\taccurately\tforecast\tand\teffectively\tallocate\tproduction\tor\tif\nthey\tare\tnot\twilling\tto\tallocate\tsufficient\tproduction\tto\tus,\tor\tface\tother\tchallenges\tsuch\tas\tinsolvency,\tit\tmay\treduce\tour\taccess\tto\tcomponents\tand\nrequire\tus\tto\tsearch\tfor\tnew\tsuppliers.\tThe\tunavailability\tof\tany\tcomponent\tor\tsupplier\tcould\tresult\tin\tproduction\tdelays,\tidle\tmanufacturing\tfacilities,\nproduct\tdesign\tchanges\tand\tloss\tof\taccess\tto\timportant\ttechnology\tand\ttools\tfor\tproducing\tand\tsupporting\tour\tproducts,\tas\twell\tas\timpact\tour\tcapacity\nexpansion\tand\tour\tability\tto\tfulfill\tour\tobligations\tunder\tcustomer\tcontracts.\tMoreover,\tsignificant\tincreases\tin\tour\tproduction\tor\tproduct\tdesign\tchanges\nby\tus\thave\trequired\tand\tmay\tin\tthe\tfuture\trequire\tus\tto\tprocure\tadditional\tcomponents\tin\ta\tshort\tamount\tof\ttime.\tWe\thave\tfaced\tin\tthe\tpast,\tand\tmay\nface\tsuppliers\twho\tare\tunwilling\tor\tunable\tto\tsustainably\tmeet\tour\ttimelines\tor\tour\tcost,\tquality\tand\tvolume\tneeds,\twhich\tmay\tincrease\tour\tcosts\tor\nrequire\tus\tto\treplace\tthem\twith\tother\tsources.\tFinally,\tas\twe\tconstruct\tnew\tmanufacturing\tfacilities\tand\tadd\tproduction\tlines\tto\texisting\tfacilities,\twe\tmay\nexperience\tissues\tin\tcorrespondingly\tincreasing\tthe\tlevel\tof\tlocalized\tprocurement\tat\tthose\tfacilities.\tWhile\twe\tbelieve\tthat\twe\twill\tbe\table\tto\tsecure\nadditional\tor\talternate\tsources\tor\tdevelop\tour\town\treplacements\tfor\tmost\tof\tour\tcomponents,\tthere\tis\tno\tassurance\tthat\twe\twill\tbe\table\tto\tdo\tso\tquickly\nor\tat\tall.\tAdditionally,\twe\tmay\tbe\tunsuccessful\tin\tour\tcontinuous\tefforts\tto\tnegotiate\twith\texisting\tsuppliers\tto\tobtain\tcost\treductions\tand\tavoid\nunfavorable\tchanges\tto\tterms,\tsource\tless\texpensive\tsuppliers\tfor\tcertain\tparts\tand\tredesign\tcertain\tparts\tto\tmake\tthem\tless\texpensive\tto\tproduce,\nespecially\tin\tthe\tcase\tof\tincreases\tin\tmaterials\tpricing.\tAny\tof\tthese\toccurrences\tmay\tharm\tour\tbusiness,\tprospects,\tfinancial\tcondition\tand\toperating\nresults.\nAs\tthe\tscale\tof\tour\tvehicle\tproduction\tincreases,\twe\twill\talso\tneed\tto\taccurately\tforecast,\tpurchase,\twarehouse\tand\ttransport\tcomponents\tat\thigh\nvolumes\tto\tour\tmanufacturing\tfacilities\tand\tservicing\tlocations\tinternationally.\tIf\twe\tare\tunable\tto\taccurately\tmatch\tthe\ttiming\tand\tquantities\tof\ncomponent\tpurchases\tto\tour\tactual\tneeds\tor\tsuccessfully\timplement\tautomation,\tinventory\tmanagement\tand\tother\tsystems\tto\taccommodate\tthe\nincreased\tcomplexity\tin\tour\tsupply\tchain\tand\tparts\tmanagement,\twe\tmay\tincur\tunexpected\tproduction\tdisruption,\tstorage,\ttransportation\tand\twrite-off\ncosts,\twhich\tmay\tharm\tour\tbusiness\tand\toperating\tresults.\nWe\tmay\tbe\tunable\tto\tmeet\tour\tprojected\tconstruction\ttimelines,\tcosts\tand\tproduction\tramps\tat\tnew\tfactories,\tor\twe\tmay\nexperience\tdifficulties\tin\tgenerating\tand\tmaintaining\tdemand\tfor\tproducts\tmanufactured\tthere.\nOur\tability\tto\tincrease\tproduction\tof\tour\tvehicles\ton\ta\tsustained\tbasis,\tmake\tthem\taffordable\tglobally\tby\taccessing\tlocal\tsupply\tchains\tand\nworkforces\tand\tstreamline\tdelivery\tlogistics\tis\tdependent\ton\tthe\tconstruction\tand\tramp\tof\tour\tcurrent\tand\tfuture\tfactories.\tThe\tconstruction\tof\tand\ncommencement\tand\tramp\tof\tproduction\tat\tthese\tfactories\tare\tsubject\n15']","Tesla highlights the risk of suppliers not accurately forecasting and allocating production, potentially leading to component shortages. They also express concern about suppliers' ability to meet their demands for volume, timelines, cost, and quality, especially as production scales up.  Additionally, Tesla acknowledges the challenge of securing and managing a complex global supply chain, including the timely and accurate procurement, warehousing, and transportation of components.  

","Single‑source supplier dependence, potential production disruptions, supplier ramp‑up delays",1.0,0.99999999998,1.0
Which raw materials does Tesla rely on and what are the pricing considerations?,"['Table\tof\tContents\nAs\tis\tthe\tcase\tfor\tsome\tautomotive\tcompanies,\tsome\tof\tour\tprocured\tcomponents\tand\tsystems\tare\tsourced\tfrom\tsingle\tsuppliers.\tWhere\tmultiple\nsources\tare\tavailable\tfor\tcertain\tkey\tcomponents,\twe\twork\tto\tqualify\tmultiple\tsuppliers\tfor\tthem\twhere\tit\tis\tsensible\tto\tdo\tso\tin\torder\tto\tminimize\npotential\tproduction\trisks\tdue\tto\tdisruptions\tin\ttheir\tsupply.\tWe\talso\tmitigate\trisk\tby\tmaintaining\tsafety\tstock\tfor\tkey\tparts\tand\tassemblies\tand\tdie\tbanks\nfor\tcomponents\twith\tlengthy\tprocurement\tlead\ttimes.\nOur\tproducts\tuse\tvarious\traw\tmaterials\tincluding\taluminum,\tsteel,\tcobalt,\tlithium,\tnickel\tand\tcopper.\tPricing\tfor\tthese\tmaterials\tis\tgoverned\tby\nmarket\tconditions\tand\tmay\tfluctuate\tdue\tto\tvarious\tfactors\toutside\tof\tour\tcontrol,\tsuch\tas\tsupply\tand\tdemand\tand\tmarket\tspeculation.\tWe\tstrive\tto\nexecute\tlong-term\tsupply\tcontracts\tfor\tsuch\tmaterials\tat\tcompetitive\tpricing\twhen\tfeasible,\tand\twe\tcurrently\tbelieve\tthat\twe\thave\tadequate\taccess\tto\nraw\tmaterials\tsupplies\tto\tmeet\tthe\tneeds\tof\tour\toperations.\nGovernmental\tPrograms,\tIncentives\tand\tRegulations\nGlobally,\tthe\townership\tof\tour\tproducts\tby\tour\tcustomers\tis\timpacted\tby\tvarious\tgovernment\tcredits,\tincentives,\tand\tpolicies.\tOur\tbusiness\tand\nproducts\tare\talso\tsubject\tto\tnumerous\tgovernmental\tregulations\tthat\tvary\tamong\tjurisdictions.\nThe\toperation\tof\tour\tbusiness\tis\talso\timpacted\tby\tvarious\tgovernment\tprograms,\tincentives,\tand\tother\tarrangements.\tSee\tNote\t2,\t\nSummary\tof\nSignificant\tAccounting\tPolicies\n,\tto\tthe\tconsolidated\tfinancial\tstatements\tincluded\telsewhere\tin\tthis\tAnnual\tReport\ton\tForm\t10-K\tfor\tfurther\tdetails.\nPrograms\tand\tIncentives\nInflation\tReduction\tAct\nOn\tAugust\t16,\t2022,\tthe\tInflation\tReduction\tAct\tof\t2022\t(“IRA”)\twas\tenacted\tinto\tlaw\tand\tis\teffective\tfor\ttaxable\tyears\tbeginning\tafter\tDecember\n31,\t2022,\tand\tremains\tsubject\tto\tfuture\tguidance\treleases.\tThe\tIRA\tincludes\tmultiple\tincentives\tto\tpromote\tclean\tenergy,\telectric\tvehicles,\tbattery\tand\nenergy\tstorage\tmanufacture\tor\tpurchase,\tincluding\tthrough\tproviding\ttax\tcredits\tto\tconsumers.\tFor\texample,\tqualifying\tTesla\tcustomers\tmay\treceive\tup\nto\t$7,500\tin\tfederal\ttax\tcredits\tfor\tthe\tpurchase\tof\tqualified\telectric\tvehicles\tin\tthe\tU.S.\tthrough\t2032.\nAutomotive\tRegulatory\tCredits\nWe\tearn\ttradable\tcredits\tin\tthe\toperation\tof\tour\tbusiness\tunder\tvarious\tregulations\trelated\tto\tzero-emission\tvehicles\t(“ZEVs”),\tgreenhouse\tgas,\tfuel\neconomy\tand\tclean\tfuel.\tWe\tsell\tthese\tcredits\tto\tother\tregulated\tentities\twho\tcan\tuse\tthe\tcredits\tto\tcomply\twith\temission\tstandards\tand\tother\tregulatory\nrequirements.\tSales\tof\tthese\tcredits\tare\trecognized\twithin\tautomotive\tregulatory\tcredits\trevenue\tin\tour\tconsolidated\tstatements\tof\toperations\tincluded\nelsewhere\tin\tthis\tAnnual\tReport\ton\tForm\t10-K.\nEnergy\tStorage\tSystem\tIncentives\tand\tPolicies\nWhile\tthe\tregulatory\tregime\tfor\tenergy\tstorage\tprojects\tis\tstill\tunder\tdevelopment,\tthere\tare\tvarious\tpolicies,\tincentives\tand\tfinancial\tmechanisms\nat\tthe\tfederal,\tstate\tand\tlocal\tlevels\tthat\tsupport\tthe\tadoption\tof\tenergy\tstorage.\nFor\texample,\tenergy\tstorage\tsystems\tthat\tare\tcharged\tusing\tsolar\tenergy\tmay\tbe\teligible\tfor\tthe\tsolar\tenergy-related\tU.S.\tfederal\ttax\tcredits\ndescribed\tbelow.\tThe\tFederal\tEnergy\tRegulatory\tCommission\t(“FERC”)\thas\talso\ttaken\tsteps\tto\tenable\tthe\tparticipation\tof\tenergy\tstorage\tin\twholesale\nenergy\tmarkets.', 'Table\tof\tContents\nunable\tto\tdo\tso,\twe\tmay\thave\tto\tcurtail\tour\tplanned\tvehicle\tand\tenergy\tstorage\tproduct\tproduction\tor\tprocure\tadditional\tcells\tfrom\tsuppliers\tat\npotentially\tgreater\tcosts,\teither\tof\twhich\tmay\tharm\tour\tbusiness\tand\toperating\tresults.\nIn\taddition,\tthe\tcost\tand\tmass\tproduction\tof\tbattery\tcells,\twhether\tmanufactured\tby\tour\tsuppliers\tor\tby\tus,\tdepends\tin\tpart\tupon\tthe\tprices\tand\navailability\tof\traw\tmaterials\tsuch\tas\tlithium,\tnickel,\tcobalt\tand/or\tother\tmetals.\tThe\tprices\tfor\tthese\tmaterials\tfluctuate\tand\ttheir\tavailable\tsupply\tmay\tbe\nunstable,\tdepending\ton\tmarket\tconditions\tand\tglobal\tdemand\tfor\tthese\tmaterials.\tFor\texample,\tas\ta\tresult\tof\tincreased\tglobal\tproduction\tof\telectric\nvehicles\tand\tenergy\tstorage\tproducts,\tsuppliers\tof\tthese\traw\tmaterials\tmay\tbe\tunable\tto\tmeet\tour\tvolume\tneeds.\tAdditionally,\tour\tsuppliers\tmay\tnot\tbe\nwilling\tor\table\tto\treliably\tmeet\tour\ttimelines\tor\tour\tcost\tand\tquality\tneeds,\twhich\tmay\trequire\tus\tto\treplace\tthem\twith\tother\tsources.\tAny\treduced\navailability\tof\tthese\tmaterials\tmay\timpact\tour\taccess\tto\tcells\tand\tour\tgrowth,\tand\tany\tincreases\tin\ttheir\tprices\tmay\treduce\tour\tprofitability\tif\twe\tcannot\nrecoup\tsuch\tcosts\tthrough\tincreased\tprices.\tMoreover,\tour\tinability\tto\tmeet\tdemand\tand\tany\tproduct\tprice\tincreases\tmay\tharm\tour\tbrand,\tgrowth,\nprospects\tand\toperating\tresults.\nOur\tfuture\tgrowth\tand\tsuccess\tare\tdependent\tupon\tconsumers’\tdemand\tfor\telectric\tvehicles\tand\tspecifically\tour\tvehicles\tin\tan\nautomotive\tindustry\tthat\tis\tgenerally\tcompetitive,\tcyclical\tand\tvolatile.\nThough\twe\tcontinue\tto\tsee\tincreased\tinterest\tand\tadoption\tof\telectric\tvehicles,\tif\tthe\tmarket\tfor\telectric\tvehicles\tin\tgeneral\tand\tTesla\tvehicles\tin\nparticular\tdoes\tnot\tdevelop\tas\twe\texpect,\tdevelops\tmore\tslowly\tthan\twe\texpect,\tor\tif\tdemand\tfor\tour\tvehicles\tdecreases\tin\tour\tmarkets\tor\tour\tvehicles\ncompete\twith\teach\tother,\tour\tbusiness,\tprospects,\tfinancial\tcondition\tand\toperating\tresults\tmay\tbe\tharmed.\nIn\taddition,\telectric\tvehicles\tstill\tconstitute\ta\tsmall\tpercentage\tof\toverall\tvehicle\tsales.\tAs\ta\tresult,\tthe\tmarket\tfor\tour\tvehicles\tcould\tbe\tnegatively\naffected\tby\tnumerous\tfactors,\tsuch\tas:\n•\nperceptions\tabout\telectric\tvehicle\tfeatures,\tquality,\tsafety,\tperformance\tand\tcost;\n•\nperceptions\tabout\tthe\tlimited\trange\tover\twhich\telectric\tvehicles\tmay\tbe\tdriven\ton\ta\tsingle\tbattery\tcharge,\tand\taccess\tto\tcharging\tfacilities;\n•\ncompetition,\tincluding\tfrom\tother\ttypes\tof\talternative\tfuel\tvehicles,\tplug-in\thybrid\telectric\tvehicles\tand\thigh\tfuel-economy\tinternal\tcombustion\nengine\tvehicles;\n•\nvolatility\tin\tthe\tcost\tof\toil,\tgasoline\tand\tenergy;\n•\ngovernment\tregulations\tand\teconomic\tincentives\tand\tconditions;\tand\n•\nconcerns\tabout\tour\tfuture\tviability.\nThe\ttarget\tdemographics\tfor\tour\tvehicles\tare\thighly\tcompetitive.\tSales\tof\tvehicles\tin\tthe\tautomotive\tindustry\ttend\tto\tbe\tcyclical\tin\tmany\tmarkets,\nwhich\tmay\texpose\tus\tto\tfurther\tvolatility.\tWe\talso\tcannot\tpredict\tthe\tduration\tor\tdirection\tof\tcurrent\tglobal\ttrends\tor\ttheir\tsustained\timpact\ton\tconsumer\ndemand.\tUltimately,\twe\tcontinue\tto\tmonitor\tmacroeconomic\tconditions\tto\tremain\tflexible\tand\tto\toptimize\tand\tevolve\tour\tbusiness\tas\tappropriate,\tand\nattempt\tto\taccurately\tproject\tdemand\tand\tinfrastructure\trequirements\tglobally\tand\tdeploy\tour\tproduction,\tworkforce\tand\tother\tresources\taccordingly.', 'Table\tof\tContents\nSolar\tEnergy\tOfferings\nWe\tsell\tretrofit\tsolar\tenergy\tsystems\tto\tcustomers\tand\tchannel\tpartners\tand\talso\tmake\tthem\tavailable\tthrough\tpower\tpurchase\tagreement\t(“PPA”)\narrangements.\tWe\tpurchase\tmost\tof\tthe\tcomponents\tfor\tour\tretrofit\tsolar\tenergy\tsystems\tfrom\tmultiple\tsources\tto\tensure\tcompetitive\tpricing\tand\nadequate\tsupply.\tWe\talso\tdesign\tand\tmanufacture\tcertain\tcomponents\tfor\tour\tsolar\tenergy\tproducts.\nWe\tsell\tour\tSolar\tRoof,\twhich\tcombines\tpremium\tglass\troof\ttiles\twith\tenergy\tgeneration,\tdirectly\tto\tcustomers,\tas\twell\tas\tthrough\tchannel\ncustomers.\tWe\tcontinue\tto\timprove\tour\tinstallation\tcapability\tand\tefficiency,\tincluding\tthrough\tcollaboration\twith\treal\testate\tdevelopers\tand\tbuilders\ton\nnew\thomes.\nTechnology\nAutomotive\nBattery\tand\tPowertrain\nOur\tcore\tvehicle\ttechnology\tcompetencies\tinclude\tpowertrain\tengineering\tand\tmanufacturing\tand\tour\tability\tto\tdesign\tvehicles\tthat\tutilize\tthe\nunique\tadvantages\tof\tan\telectric\tpowertrain.\tWe\thave\tdesigned\tour\tproprietary\tpowertrain\tsystems\tto\tbe\tadaptable,\tefficient,\treliable\tand\tcost-effective\nwhile\twithstanding\tthe\trigors\tof\tan\tautomotive\tenvironment.\tWe\toffer\tdual\tmotor\tpowertrain\tvehicles,\twhich\tuse\ttwo\telectric\tmotors\tto\tmaximize\ttraction\nand\tperformance\tin\tan\tall-wheel\tdrive\tconfiguration,\tas\twell\tas\tvehicle\tpowertrain\ttechnology\tfeaturing\tthree\telectric\tmotors\tfor\tfurther\tincreased\nperformance\tin\tcertain\tversions\tof\tModel\tS\tand\tModel\tX,\tCybertruck\tand\tthe\tTesla\tSemi.\nWe\tmaintain\textensive\ttesting\tand\tR&D\tcapabilities\tfor\tbattery\tcells,\tpacks\tand\tsystems,\tand\thave\tbuilt\tan\texpansive\tbody\tof\tknowledge\ton\tlithium-\nion\tcell\tchemistry\ttypes\tand\tperformance\tcharacteristics.\tIn\torder\tto\tenable\ta\tgreater\tsupply\tof\tcells\tfor\tour\tproducts\twith\thigher\tenergy\tdensity\tat\tlower\ncosts,\twe\thave\tdeveloped\ta\tnew\tproprietary\tlithium-ion\tbattery\tcell\tand\timproved\tmanufacturing\tprocesses.\nVehicle\tControl\tand\tInfotainment\tSoftware\nThe\tperformance\tand\tsafety\tsystems\tof\tour\tvehicles\tand\ttheir\tbattery\tpacks\tutilize\tsophisticated\tcontrol\tsoftware.\tControl\tsystems\tin\tour\tvehicles\noptimize\tperformance,\tcustomize\tvehicle\tbehavior,\tmanage\tcharging\tand\tcontrol\tall\tinfotainment\tfunctions.\tWe\tdevelop\talmost\tall\tof\tthis\tsoftware,\nincluding\tmost\tof\tthe\tuser\tinterfaces,\tinternally\tand\tupdate\tour\tvehicles’\tsoftware\tregularly\tthrough\tover-the-air\tupdates.\nSelf-Driving\tDevelopment\tand\tArtificial\tIntelligence\nWe\thave\texpertise\tin\tdeveloping\ttechnologies,\tsystems\tand\tsoftware\tto\tenable\tself-driving\tvehicles\tusing\tprimarily\tvision-based\ttechnologies.\tOur\nFSD\tComputer\truns\tour\tneural\tnetworks\tin\tour\tvehicles,\tand\twe\tare\talso\tdeveloping\tadditional\tcomputer\thardware\tto\tbetter\tenable\tthe\tmassive\tamounts\nof\tfield\tdata\tcaptured\tby\tour\tvehicles\tto\tcontinually\ttrain\tand\timprove\tthese\tneural\tnetworks\tfor\treal-world\tperformance.\nCurrently,\twe\toffer\tin\tour\tvehicles\tcertain\tadvanced\tdriver\tassist\tsystems\tunder\tour\tAutopilot\tand\tFSD\tCapability\toptions.\tAlthough\tat\tpresent\tthe\ndriver\tis\tultimately\tresponsible\tfor\tcontrolling\tthe\tvehicle,\tour\tsystems\tprovide\tsafety\tand\tconvenience\tfunctionality\tthat\trelieves\tdrivers\tof\tthe\tmost\ntedious\tand\tpotentially\tdangerous\taspects\tof\troad\ttravel\tmuch\tlike\tthe\tsystem\tthat\tairplane\tpilots\tuse,\twhen\tconditions\tpermit.\tAs\twith\tother\tvehicle\nsystems,\twe\timprove\tthese\tfunctions\tin\tour\tvehicles\tover\ttime\tthrough\tover-the-air\tupdates.\nWe\tintend\tto\testablish\tin\tthe\tfuture\tan\tautonomous\tTesla\tride-hailing\tnetwork,\twhich\twe\texpect\twould\talso\tallow\tus\tto\taccess\ta\tnew\tcustomer\tbase\neven\tas\tmodes\tof\ttransportation\tevolve.', 'We\texpect\tthat\tthis\tfunctionality\twill\talso\tallow\tus\tto\toffer\tcertain\toptions\tand\tfeatures\ton\ta\nsubscription\tbasis\tin\tthe\tfuture.\nEnergy\tGeneration\tand\tStorage\nWe\tmarket\tand\tsell\tour\tsolar\tand\tenergy\tstorage\tproducts\tto\tresidential,\tcommercial\tand\tindustrial\tcustomers\tand\tutilities\tthrough\ta\tvariety\tof\nchannels,\tincluding\tthrough\tour\twebsite,\tstores\tand\tgalleries,\tas\twell\tas\tthrough\tour\tnetwork\tof\tchannel\tpartners,\tand\tin\tthe\tcase\tof\tsome\tcommercial\ncustomers,\tthrough\tPPA\ttransactions.\tWe\temphasize\tsimplicity,\tstandardization\tand\taccessibility\tto\tmake\tit\teasy\tand\tcost-effective\tfor\tcustomers\tto\tadopt\nclean\tenergy,\twhile\treducing\tour\tcustomer\tacquisition\tcosts.\nService\tand\tWarranty\nAutomotive\nService\nWe\tprovide\tservice\tfor\tour\telectric\tvehicles\tat\tour\tcompany-owned\tservice\tlocations\tand\tthrough\tTesla\tMobile\tService\ttechnicians\twho\tperform\twork\nremotely\tat\tcustomers’\thomes\tor\tother\tlocations.\tServicing\tthe\tvehicles\tourselves\tallows\tus\tto\tidentify\tproblems\tand\timplement\tsolutions\tand\nimprovements\tfaster\tthan\ttraditional\tautomobile\tmanufacturers\tand\ttheir\tdealer\tnetworks.\tThe\tconnectivity\tof\tour\tvehicles\talso\tallows\tus\tto\tdiagnose\tand\nremedy\tmany\tproblems\tremotely\tand\tproactively.\nVehicle\tLimited\tWarranties\tand\tExtended\tService\tPlans\nWe\tprovide\ta\tmanufacturer’s\tlimited\twarranty\ton\tall\tnew\tand\tused\tTesla\tvehicles\twe\tsell\tdirectly\tto\tconsumers,\twhich\tmay\tinclude\tlimited\nwarranties\ton\tcertain\tcomponents,\tspecific\ttypes\tof\tdamage\tor\tbattery\tcapacity\tretention.\tWe\talso\tcurrently\toffer\toptional\textended\tservice\tplans\tthat\nprovide\tcoverage\tbeyond\tthe\tnew\tvehicle\tlimited\twarranties\tfor\tcertain\tmodels\tin\tspecified\tregions.\n7', 'Table\tof\tContents\nPART\tI\nITEM\t1.\tBUSINESS\nOverview\nWe\tdesign,\tdevelop,\tmanufacture,\tsell\tand\tlease\thigh-performance\tfully\telectric\tvehicles\tand\tenergy\tgeneration\tand\tstorage\tsystems,\tand\toffer\nservices\trelated\tto\tour\tproducts.\tWe\tgenerally\tsell\tour\tproducts\tdirectly\tto\tcustomers,\tand\tcontinue\tto\tgrow\tour\tcustomer-facing\tinfrastructure\tthrough\ta\nglobal\tnetwork\tof\tvehicle\tshowrooms\tand\tservice\tcenters,\tMobile\tService,\tbody\tshops,\tSupercharger\tstations\tand\tDestination\tChargers\tto\taccelerate\tthe\nwidespread\tadoption\tof\tour\tproducts.\tWe\temphasize\tperformance,\tattractive\tstyling\tand\tthe\tsafety\tof\tour\tusers\tand\tworkforce\tin\tthe\tdesign\tand\nmanufacture\tof\tour\tproducts\tand\tare\tcontinuing\tto\tdevelop\tfull\tself-driving\ttechnology\tfor\timproved\tsafety.\tWe\talso\tstrive\tto\tlower\tthe\tcost\tof\townership\nfor\tour\tcustomers\tthrough\tcontinuous\tefforts\tto\treduce\tmanufacturing\tcosts\tand\tby\toffering\tfinancial\tand\tother\tservices\ttailored\tto\tour\tproducts.\nOur\tmission\tis\tto\taccelerate\tthe\tworld’s\ttransition\tto\tsustainable\tenergy.\tWe\tbelieve\tthat\tthis\tmission,\talong\twith\tour\tengineering\texpertise,\nvertically\tintegrated\tbusiness\tmodel\tand\tfocus\ton\tuser\texperience\tdifferentiate\tus\tfrom\tother\tcompanies.\nSegment\tInformation\nWe\toperate\tas\ttwo\treportable\tsegments:\t(i)\tautomotive\tand\t(ii)\tenergy\tgeneration\tand\tstorage.\nThe\tautomotive\tsegment\tincludes\tthe\tdesign,\tdevelopment,\tmanufacturing,\tsales\tand\tleasing\tof\thigh-performance\tfully\telectric\tvehicles\tas\twell\tas\nsales\tof\tautomotive\tregulatory\tcredits.\tAdditionally,\tthe\tautomotive\tsegment\talso\tincludes\tservices\tand\tother,\twhich\tincludes\tsales\tof\tused\tvehicles,\tnon-\nwarranty\tafter-sales\tvehicle\tservices,\tbody\tshop\tand\tparts,\tpaid\tSupercharging,\tvehicle\tinsurance\trevenue\tand\tretail\tmerchandise.\tThe\tenergy\tgeneration\nand\tstorage\tsegment\tincludes\tthe\tdesign,\tmanufacture,\tinstallation,\tsales\tand\tleasing\tof\tsolar\tenergy\tgeneration\tand\tenergy\tstorage\tproducts\tand\trelated\nservices\tand\tsales\tof\tsolar\tenergy\tsystems\tincentives.\nOur\tProducts\tand\tServices\nAutomotive\nWe\tcurrently\tmanufacture\tfive\tdifferent\tconsumer\tvehicles\t–\tthe\tModel\t3,\tY,\tS,\tX\tand\tCybertruck.\tModel\t3\tis\ta\tfour-door\tmid-size\tsedan\tthat\twe\ndesigned\tfor\tmanufacturability\twith\ta\tbase\tprice\tfor\tmass-market\tappeal.\tModel\tY\tis\ta\tcompact\tsport\tutility\tvehicle\t(“SUV”)\tbuilt\ton\tthe\tModel\t3\tplatform\nwith\tseating\tfor\tup\tto\tseven\tadults.\tModel\tS\tis\ta\tfour-door\tfull-size\tsedan\tand\tModel\tX\tis\ta\tmid-size\tSUV\twith\tseating\tfor\tup\tto\tseven\tadults.\tModel\tS\tand\nModel\tX\tfeature\tthe\thighest\tperformance\tcharacteristics\tand\tlongest\tranges\tthat\twe\toffer\tin\ta\tsedan\tand\tSUV,\trespectively.\tIn\tNovember\t2023,\twe\nentered\tthe\tconsumer\tpickup\ttruck\tmarket\twith\tfirst\tdeliveries\tof\tthe\tCybertruck,\ta\tfull-size\telectric\tpickup\ttruck\twith\ta\tstainless\tsteel\texterior\tthat\thas\nthe\tutility\tand\tstrength\tof\ta\ttruck\twhile\tfeaturing\tthe\tspeed\tof\ta\tsports\tcar.\nIn\t2022,\twe\talso\tbegan\tearly\tproduction\tand\tdeliveries\tof\ta\tcommercial\telectric\tvehicle,\tthe\tTesla\tSemi.\tWe\thave\tplanned\telectric\tvehicles\tto\naddress\tadditional\tvehicle\tmarkets,\tand\tto\tcontinue\tleveraging\tdevelopments\tin\tour\tproprietary\tFull\tSelf-Driving\t(“FSD”)\tCapability\tfeatures,\tbattery\tcell\nand\tother\ttechnologies.\nEnergy\tGeneration\tand\tStorage\nEnergy\tStorage\tProducts\nPowerwall\tand\tMegapack\tare\tour\tlithium-ion\tbattery\tenergy\tstorage\tproducts.']","Tesla uses various raw materials including aluminum, steel, cobalt, lithium, nickel, and copper. The pricing for these materials is influenced by market conditions and can fluctuate due to supply and demand, as well as market speculation.  
","Raw materials: aluminum, steel, cobalt, lithium, nickel, copper; prices driven by market conditions and managed via long‑term contracts",1.0,0.9999999999666667,
What governmental programs and incentives benefit Tesla?,"['Government\tAssistance\tPrograms\tand\tIncentives\nGlobally,\tthe\toperation\tof\tour\tbusiness\tis\timpacted\tby\tvarious\tgovernment\tprograms,\tincentives,\tand\tother\tarrangements.\tGovernment\tincentives\nare\trecorded\tin\tour\tconsolidated\tfinancial\tstatements\tin\taccordance\twith\ttheir\tpurpose\tas\ta\treduction\tof\texpense,\tor\tan\toffset\tto\tthe\trelated\tcapital\tasset.\nThe\tbenefit\tis\tgenerally\trecorded\twhen\tall\tconditions\tattached\tto\tthe\tincentive\thave\tbeen\tmet\tor\tare\texpected\tto\tbe\tmet\tand\tthere\tis\treasonable\nassurance\tof\ttheir\treceipt.\nThe\tIRA\tIncentives\nOn\tAugust\t16,\t2022,\tthe\tIRA\twas\tenacted\tinto\tlaw\tand\tis\teffective\tfor\ttaxable\tyears\tbeginning\tafter\tDecember\t31,\t2022.\tThe\tIRA\tincludes\tmultiple\nincentives\tto\tpromote\tclean\tenergy,\telectric\tvehicles,\tbattery\tand\tenergy\tstorage\tmanufacture\tor\tpurchase,\tin\taddition\tto\ta\tnew\tcorporate\talternative\nminimum\ttax\tof\t15%\ton\tadjusted\tfinancial\tstatement\tincome\tof\tcorporations\twith\tprofits\tgreater\tthan\t$1\tbillion.\tSome\tof\tthese\tmeasures\tare\texpected\tto\nmaterially\taffect\tour\tconsolidated\tfinancial\tstatements.\tFor\tthe\tyear\tended\tDecember\t31,\t2023,\tthe\timpact\tfrom\tour\tIRA\tincentive\twas\tprimarily\ta\nreduction\tof\tour\tmaterial\tcosts\tin\tour\tconsolidated\tstatement\tof\toperations.\tWe\twill\tcontinue\tto\tevaluate\tthe\teffects\tof\tthe\tIRA\tas\tmore\tguidance\tis\tissued\nand\tthe\trelevant\timplications\tto\tour\tconsolidated\tfinancial\tstatements.\n67', 'Such\ndevelopments\tcould\tnegatively\timpact\tdemand\tfor\tour\tvehicles,\tand\twe\tand\tour\tcustomers\tmay\thave\tto\tadjust\tto\tthem,\tincluding\tthrough\tpricing\nmodifications.\nIn\taddition,\tcertain\tgovernmental\trebates,\ttax\tcredits\tand\tother\tfinancial\tincentives\tthat\tare\tcurrently\tavailable\twith\trespect\tto\tour\tsolar\tand\tenergy\nstorage\tproduct\tbusinesses\tallow\tus\tto\tlower\tour\tcosts\tand\tencourage\tcustomers\tto\tbuy\tour\tproducts\tand\tinvestors\tto\tinvest\tin\tour\tsolar\tfinancing\tfunds.\nHowever,\tthese\tincentives\tmay\texpire\twhen\tthe\tallocated\tfunding\tis\texhausted,\treduced\tor\tterminated\tas\trenewable\tenergy\tadoption\trates\tincrease,\nsometimes\twithout\twarning.\tLikewise,\tin\tjurisdictions\twhere\tnet\tmetering\tis\tcurrently\tavailable,\tour\tcustomers\treceive\tbill\tcredits\tfrom\tutilities\tfor\tenergy\nthat\ttheir\tsolar\tenergy\tsystems\tgenerate\tand\texport\tto\tthe\tgrid\tin\texcess\tof\tthe\telectric\tload\tthey\tuse.\tThe\tbenefit\tavailable\tunder\tnet\tmetering\thas\tbeen\nor\thas\tbeen\tproposed\tto\tbe\treduced,\taltered\tor\teliminated\tin\tseveral\tjurisdictions,\tand\thas\talso\tbeen\tcontested\tand\tmay\tcontinue\tto\tbe\tcontested\tbefore\nthe\tFederal\tEnergy\tRegulatory\tCommission.\tAny\treductions\tor\tterminations\tof\tsuch\tincentives\tmay\tharm\tour\tbusiness,\tprospects,\tfinancial\tcondition\tand\noperating\tresults\tby\tmaking\tour\tproducts\tless\tcompetitive\tfor\tcustomers,\tincreasing\tour\tcost\tof\tcapital\tand\tadversely\timpacting\tour\tability\tto\tattract\ninvestment\tpartners\tand\tto\tform\tnew\tfinancing\tfunds\tfor\tour\tsolar\tand\tenergy\tstorage\tassets.\nFinally,\twe\tand\tour\tfund\tinvestors\tclaim\tthese\tU.S.\tfederal\ttax\tcredits\tand\tcertain\tstate\tincentives\tin\tamounts\tbased\ton\tindependently\tappraised\tfair\nmarket\tvalues\tof\tour\tsolar\tand\tenergy\tstorage\tsystems.\tSome\tgovernmental\tauthorities\thave\taudited\tsuch\tvalues\tand\tin\tcertain\tcases\thave\tdetermined\nthat\tthese\tvalues\tshould\tbe\tlower,\tand\tthey\tmay\tdo\tso\tagain\tin\tthe\tfuture.\tSuch\tdeterminations\tmay\tresult\tin\tadverse\ttax\tconsequences\tand/or\tour\nobligation\tto\tmake\tindemnification\tor\tother\tpayments\tto\tour\tfunds\tor\tfund\tinvestors.\nWe\tare\tsubject\tto\tevolving\tlaws\tand\tregulations\tthat\tcould\timpose\tsubstantial\tcosts,\tlegal\tprohibitions\tor\tunfavorable\tchanges\nupon\tour\toperations\tor\tproducts.\nAs\twe\tgrow\tour\tmanufacturing\toperations\tin\tadditional\tregions,\twe\tare\tor\twill\tbe\tsubject\tto\tcomplex\tenvironmental,\tmanufacturing,\thealth\tand\nsafety\tlaws\tand\tregulations\tat\tnumerous\tjurisdictional\tlevels\tin\tthe\tU.S.,\tChina,\tGermany\tand\tother\tlocations\tabroad,\tincluding\tlaws\trelating\tto\tthe\tuse,\nhandling,\tstorage,\trecycling,\tdisposal\tand/or\thuman\texposure\tto\thazardous\tmaterials,\tproduct\tmaterial\tinputs\tand\tpost-consumer\tproducts\tand\twith\nrespect\tto\tconstructing,\texpanding\tand\tmaintaining\tour\tfacilities.\tNew,\tor\tchanges\tin,\tenvironmental\tand\tclimate\tchange\tlaws,\tregulations\tor\trules\tcould\nalso\tlead\tto\tincreased\tcosts\tof\tcompliance,\tincluding\tremediations\tof\tany\tdiscovered\tissues,\tand\tchanges\tto\tour\toperations,\twhich\tmay\tbe\tsignificant,\tand\nany\tfailures\tto\tcomply\tcould\tresult\tin\tsignificant\texpenses,\tdelays\tor\tfines.\tIn\taddition,\tas\twe\thave\n25', 'Table\tof\tContents\nAs\tis\tthe\tcase\tfor\tsome\tautomotive\tcompanies,\tsome\tof\tour\tprocured\tcomponents\tand\tsystems\tare\tsourced\tfrom\tsingle\tsuppliers.\tWhere\tmultiple\nsources\tare\tavailable\tfor\tcertain\tkey\tcomponents,\twe\twork\tto\tqualify\tmultiple\tsuppliers\tfor\tthem\twhere\tit\tis\tsensible\tto\tdo\tso\tin\torder\tto\tminimize\npotential\tproduction\trisks\tdue\tto\tdisruptions\tin\ttheir\tsupply.\tWe\talso\tmitigate\trisk\tby\tmaintaining\tsafety\tstock\tfor\tkey\tparts\tand\tassemblies\tand\tdie\tbanks\nfor\tcomponents\twith\tlengthy\tprocurement\tlead\ttimes.\nOur\tproducts\tuse\tvarious\traw\tmaterials\tincluding\taluminum,\tsteel,\tcobalt,\tlithium,\tnickel\tand\tcopper.\tPricing\tfor\tthese\tmaterials\tis\tgoverned\tby\nmarket\tconditions\tand\tmay\tfluctuate\tdue\tto\tvarious\tfactors\toutside\tof\tour\tcontrol,\tsuch\tas\tsupply\tand\tdemand\tand\tmarket\tspeculation.\tWe\tstrive\tto\nexecute\tlong-term\tsupply\tcontracts\tfor\tsuch\tmaterials\tat\tcompetitive\tpricing\twhen\tfeasible,\tand\twe\tcurrently\tbelieve\tthat\twe\thave\tadequate\taccess\tto\nraw\tmaterials\tsupplies\tto\tmeet\tthe\tneeds\tof\tour\toperations.\nGovernmental\tPrograms,\tIncentives\tand\tRegulations\nGlobally,\tthe\townership\tof\tour\tproducts\tby\tour\tcustomers\tis\timpacted\tby\tvarious\tgovernment\tcredits,\tincentives,\tand\tpolicies.\tOur\tbusiness\tand\nproducts\tare\talso\tsubject\tto\tnumerous\tgovernmental\tregulations\tthat\tvary\tamong\tjurisdictions.\nThe\toperation\tof\tour\tbusiness\tis\talso\timpacted\tby\tvarious\tgovernment\tprograms,\tincentives,\tand\tother\tarrangements.\tSee\tNote\t2,\t\nSummary\tof\nSignificant\tAccounting\tPolicies\n,\tto\tthe\tconsolidated\tfinancial\tstatements\tincluded\telsewhere\tin\tthis\tAnnual\tReport\ton\tForm\t10-K\tfor\tfurther\tdetails.\nPrograms\tand\tIncentives\nInflation\tReduction\tAct\nOn\tAugust\t16,\t2022,\tthe\tInflation\tReduction\tAct\tof\t2022\t(“IRA”)\twas\tenacted\tinto\tlaw\tand\tis\teffective\tfor\ttaxable\tyears\tbeginning\tafter\tDecember\n31,\t2022,\tand\tremains\tsubject\tto\tfuture\tguidance\treleases.\tThe\tIRA\tincludes\tmultiple\tincentives\tto\tpromote\tclean\tenergy,\telectric\tvehicles,\tbattery\tand\nenergy\tstorage\tmanufacture\tor\tpurchase,\tincluding\tthrough\tproviding\ttax\tcredits\tto\tconsumers.\tFor\texample,\tqualifying\tTesla\tcustomers\tmay\treceive\tup\nto\t$7,500\tin\tfederal\ttax\tcredits\tfor\tthe\tpurchase\tof\tqualified\telectric\tvehicles\tin\tthe\tU.S.\tthrough\t2032.\nAutomotive\tRegulatory\tCredits\nWe\tearn\ttradable\tcredits\tin\tthe\toperation\tof\tour\tbusiness\tunder\tvarious\tregulations\trelated\tto\tzero-emission\tvehicles\t(“ZEVs”),\tgreenhouse\tgas,\tfuel\neconomy\tand\tclean\tfuel.\tWe\tsell\tthese\tcredits\tto\tother\tregulated\tentities\twho\tcan\tuse\tthe\tcredits\tto\tcomply\twith\temission\tstandards\tand\tother\tregulatory\nrequirements.\tSales\tof\tthese\tcredits\tare\trecognized\twithin\tautomotive\tregulatory\tcredits\trevenue\tin\tour\tconsolidated\tstatements\tof\toperations\tincluded\nelsewhere\tin\tthis\tAnnual\tReport\ton\tForm\t10-K.\nEnergy\tStorage\tSystem\tIncentives\tand\tPolicies\nWhile\tthe\tregulatory\tregime\tfor\tenergy\tstorage\tprojects\tis\tstill\tunder\tdevelopment,\tthere\tare\tvarious\tpolicies,\tincentives\tand\tfinancial\tmechanisms\nat\tthe\tfederal,\tstate\tand\tlocal\tlevels\tthat\tsupport\tthe\tadoption\tof\tenergy\tstorage.\nFor\texample,\tenergy\tstorage\tsystems\tthat\tare\tcharged\tusing\tsolar\tenergy\tmay\tbe\teligible\tfor\tthe\tsolar\tenergy-related\tU.S.\tfederal\ttax\tcredits\ndescribed\tbelow.\tThe\tFederal\tEnergy\tRegulatory\tCommission\t(“FERC”)\thas\talso\ttaken\tsteps\tto\tenable\tthe\tparticipation\tof\tenergy\tstorage\tin\twholesale\nenergy\tmarkets.', 'Table\tof\tContents\nSolar\tEnergy\tSystem\tIncentives\tand\tPolicies\nU.S.\tfederal,\tstate\tand\tlocal\tgovernments\thave\testablished\tvarious\tpolicies,\tincentives\tand\tfinancial\tmechanisms\tto\treduce\tthe\tcost\tof\tsolar\tenergy\nand\tto\taccelerate\tthe\tadoption\tof\tsolar\tenergy.\tThese\tincentives\tinclude\ttax\tcredits,\tcash\tgrants,\ttax\tabatements\tand\trebates.\nIn\tparticular,\tpursuant\tto\tthe\tIRA,\tSections\t48,\t48E\tand\t25D\tof\tthe\tIRC\tprovides\ta\ttax\tcredit\tbetween\t6%\tand\t70%\tof\tqualified\tcommercial\tor\nresidential\texpenditures\tfor\tsolar\tenergy\tsystems,\twhich\tmay\tbe\tclaimed\tby\tour\tcustomers\tfor\tsystems\tthey\tpurchase,\tor\tby\tus\tfor\tarrangements\twhere\nwe\town\tthe\tsystems\tfor\tproperties\tthat\tmeet\tstatutory\trequirements.\tThese\ttax\tcredits\tare\tprimarily\tfor\tthe\tdirect\tbenefit\tof\tour\tcustomers\tand\tare\ncurrently\tscheduled\tto\tphase-out\tstarting\tin\t2032\tor\tlater.\nRegulations\nVehicle\tSafety\tand\tTesting\nIn\tthe\tU.S.,\tour\tvehicles\tare\tsubject\tto\tregulation\tby\tthe\tNational\tHighway\tTraffic\tSafety\tAdministration\t(“NHTSA”),\tincluding\tall\tapplicable\tFederal\nMotor\tVehicle\tSafety\tStandards\t(“FMVSS”)\tand\tthe\tNHTSA\tbumper\tstandard.\tNumerous\tFMVSS\tapply\tto\tour\tvehicles,\tsuch\tas\tcrash-worthiness\tand\noccupant\tprotection\trequirements.\tOur\tcurrent\tvehicles\tfully\tcomply\tand\twe\texpect\tthat\tour\tvehicles\tin\tthe\tfuture\twill\tfully\tcomply\twith\tall\tapplicable\nFMVSS\twith\tlimited\tor\tno\texemptions,\thowever,\tFMVSS\tare\tsubject\tto\tchange\tfrom\ttime\tto\ttime.\tAs\ta\tmanufacturer,\twe\tmust\tself-certify\tthat\tour\tvehicles\nmeet\tall\tapplicable\tFMVSS\tand\tthe\tNHTSA\tbumper\tstandard,\tor\totherwise\tare\texempt,\tbefore\tthe\tvehicles\tmay\tbe\timported\tor\tsold\tin\tthe\tU.S.\nWe\tare\talso\trequired\tto\tcomply\twith\tother\tfederal\tlaws\tadministered\tby\tNHTSA,\tincluding\tthe\tCorporate\tAverage\tFuel\tEconomy\tstandards,\tTheft\nPrevention\tAct\trequirements,\tlabeling\trequirements\tand\tother\tinformation\tprovided\tto\tcustomers\tin\twriting,\tEarly\tWarning\tReporting\trequirements\nregarding\twarranty\tclaims,\tfield\treports,\tdeath\tand\tinjury\treports\tand\tforeign\trecalls,\ta\tStanding\tGeneral\tOrder\trequiring\treports\tregarding\tcrashes\ninvolving\tvehicles\tequipped\twith\tadvanced\tdriver\tassistance\tsystems,\tand\tadditional\trequirements\tfor\tcooperating\twith\tcompliance\tand\tsafety\ninvestigations\tand\trecall\treporting.\tThe\tU.S.\tAutomobile\tInformation\tand\tDisclosure\tAct\talso\trequires\tmanufacturers\tof\tmotor\tvehicles\tto\tdisclose\tcertain\ninformation\tregarding\tthe\tmanufacturer’s\tsuggested\tretail\tprice,\toptional\tequipment\tand\tpricing.\tIn\taddition,\tfederal\tlaw\trequires\tinclusion\tof\tfuel\neconomy\tratings,\tas\tdetermined\tby\tthe\tU.S.\tDepartment\tof\tTransportation\tand\tthe\tEnvironmental\tProtection\tAgency\t(the\t“EPA”),\tand\tNew\tCar\nAssessment\tProgram\tratings\tas\tdetermined\tby\tNHTSA,\tif\tavailable.\nOur\tvehicles\tsold\toutside\tof\tthe\tU.S.\tare\tsubject\tto\tsimilar\tforeign\tcompliance,\tsafety,\tenvironmental\tand\tother\tregulations.\tMany\tof\tthose\nregulations\tare\tdifferent\tfrom\tthose\tapplicable\tin\tthe\tU.S.\tand\tmay\trequire\tredesign\tand/or\tretesting.\tSome\tof\tthose\tregulations\timpact\tor\tprevent\tthe\nrollout\tof\tnew\tvehicle\tfeatures.\nSelf-Driving\tVehicles\nGenerally,\tlaws\tpertaining\tto\tself-driving\tvehicles\tare\tevolving\tglobally,\tand\tin\tsome\tcases\tmay\tcreate\trestrictions\ton\tfeatures\tor\tvehicle\tdesigns\nthat\twe\tdevelop.\tWhile\tthere\tare\tcurrently\tno\tfederal\tU.S.', 'Our\t(benefit\tfrom)\tprovision\tfor\tincome\ttaxes\tchanged\tby\t$6.13\tbillion\tin\tthe\tyear\tended\tDecember\t31,\t2023\tas\tcompared\tto\tthe\tyear\tended\nDecember\t31,\t2022,\tprimarily\tdue\tto\tthe\trelease\tof\t$6.54\tbillion\tof\tour\tvaluation\tallowance\tassociated\twith\tthe\tU.S.\tfederal\tand\tcertain\tstate\tdeferred\ttax\nassets.\nOur\teffective\ttax\trate\tchanged\tfrom\tan\texpense\tof\t8%\tto\ta\tbenefit\tof\t50%\tin\tthe\tyear\tended\tDecember\t31,\t2023\tas\tcompared\tto\tthe\tyear\tended\nDecember\t31,\t2022,\tprimarily\tdue\tto\tthe\trelease\tof\tthe\tvaluation\tallowance\tregarding\tour\tU.S.\tfederal\tand\tcertain\tstate\tdeferred\ttax\tassets.\nSee\tNote\t14,\t\nIncome\tTaxes\n,\tto\tthe\tconsolidated\tfinancial\tstatements\tincluded\telsewhere\tin\tthis\tAnnual\tReport\ton\tForm\t10-K\tfor\tfurther\tdetails.\nLiquidity\tand\tCapital\tResources\nWe\texpect\tto\tcontinue\tto\tgenerate\tnet\tpositive\toperating\tcash\tflow\tas\twe\thave\tdone\tin\tthe\tlast\tfive\tfiscal\tyears.\tThe\tcash\twe\tgenerate\tfrom\tour\tcore\noperations\tenables\tus\tto\tfund\tongoing\toperations\tand\tproduction,\tour\tresearch\tand\tdevelopment\tprojects\tfor\tnew\tproducts\tand\ttechnologies\tincluding\tour\nproprietary\tbattery\tcells,\tadditional\tmanufacturing\tramps\tat\texisting\tmanufacturing\tfacilities,\tthe\tconstruction\tof\tfuture\tfactories,\tand\tthe\tcontinued\nexpansion\tof\tour\tretail\tand\tservice\tlocations,\tbody\tshops,\tMobile\tService\tfleet,\tSupercharger,\tincluding\tto\tsupport\tNACS,\tenergy\tproduct\tinstallation\ncapabilities\tand\tautonomy\tand\tother\tartificial\tintelligence\tenabled\tproducts.\n42']","The provided text does not contain information about governmental programs and incentives that benefit Tesla.  
","Federal, state and local credits, incentives, tax rebates for EVs, batteries, solar, and storage",0.0,0.999999999975,1.0
How does the Inflation Reduction Act affect Tesla?,"['Moreover,\twe\texpect\tto\tcontinue\tto\tbenefit\tfrom\tongoing\telectrification\tof\tthe\tautomotive\tsector\tand\nincreasing\tenvironmental\tregulations\tand\tinitiatives.\nHowever,\twe\toperate\tin\ta\tcyclical\tindustry\tthat\tis\tsensitive\tto\tpolitical\tand\tregulatory\tuncertainty,\tincluding\twith\trespect\tto\ttrade\tand\tthe\nenvironment,\tall\tof\twhich\tcan\tbe\tcompounded\tby\tinflationary\tpressures,\trising\tenergy\tprices,\tinterest\trate\tfluctuations\tand\tthe\tliquidity\tof\tenterprise\ncustomers.\tFor\texample,\tinflationary\tpressures\thave\tincreased\tacross\tthe\tmarkets\tin\twhich\twe\toperate.\tIn\tan\teffort\tto\tcurb\tthis\ttrend,\tcentral\tbanks\tin\ndeveloped\tcountries\traised\tinterest\trates\trapidly\tand\tsubstantially,\timpacting\tthe\taffordability\tof\tvehicle\tlease\tand\tfinance\tarrangements.\tFurther,\tsales\tof\nvehicles\tin\tthe\tautomotive\tindustry\talso\ttend\tto\tbe\tcyclical\tin\tmany\tmarkets,\twhich\tmay\texpose\tus\tto\tincreased\tvolatility\tas\twe\texpand\tand\tadjust\tour\noperations.\tMoreover,\tas\tadditional\tcompetitors\tenter\tthe\tmarketplace\tand\thelp\tbring\tthe\tworld\tcloser\tto\tsustainable\ttransportation,\twe\twill\thave\tto\nadjust\tand\tcontinue\tto\texecute\twell\tto\tmaintain\tour\tmomentum.\tAdditionally,\tour\tsuppliers’\tliquidity\tand\tallocation\tplans\tmay\tbe\taffected\tby\tcurrent\nchallenges\tin\tthe\tNorth\tAmerican\tautomotive\tindustry,\twhich\tcould\treduce\tour\taccess\tto\tcomponents\tor\tresult\tin\tunfavorable\tchanges\tto\tcost.\tThese\nmacroeconomic\tand\tindustry\ttrends\thave\thad,\tand\twill\tlikely\tcontinue\tto\thave,\tan\timpact\ton\tthe\tpricing\tof,\tand\torder\trate\tfor\tour\tvehicles,\tand\tin\tturn\tour\noperating\tmargin.\tChanges\tin\tgovernment\tand\teconomic\tincentives\tin\trelation\tto\telectric\tvehicles\tmay\talso\timpact\tour\tsales.\tWe\twill\tcontinue\tto\tadjust\naccordingly\tto\tsuch\tdevelopments,\tand\twe\tbelieve\tour\tongoing\tcost\treduction,\tincluding\timproved\tproduction\tinnovation\tand\tefficiency\tat\tour\tnewest\nfactories\tand\tlower\tlogistics\tcosts,\tand\tfocus\ton\toperating\tleverage\twill\tcontinue\tto\tbenefit\tus\tin\trelation\tto\tour\tcompetitors,\twhile\tour\tnew\tproducts\twill\nhelp\tenable\tfuture\tgrowth.\n34', 'Such\ndevelopments\tcould\tnegatively\timpact\tdemand\tfor\tour\tvehicles,\tand\twe\tand\tour\tcustomers\tmay\thave\tto\tadjust\tto\tthem,\tincluding\tthrough\tpricing\nmodifications.\nIn\taddition,\tcertain\tgovernmental\trebates,\ttax\tcredits\tand\tother\tfinancial\tincentives\tthat\tare\tcurrently\tavailable\twith\trespect\tto\tour\tsolar\tand\tenergy\nstorage\tproduct\tbusinesses\tallow\tus\tto\tlower\tour\tcosts\tand\tencourage\tcustomers\tto\tbuy\tour\tproducts\tand\tinvestors\tto\tinvest\tin\tour\tsolar\tfinancing\tfunds.\nHowever,\tthese\tincentives\tmay\texpire\twhen\tthe\tallocated\tfunding\tis\texhausted,\treduced\tor\tterminated\tas\trenewable\tenergy\tadoption\trates\tincrease,\nsometimes\twithout\twarning.\tLikewise,\tin\tjurisdictions\twhere\tnet\tmetering\tis\tcurrently\tavailable,\tour\tcustomers\treceive\tbill\tcredits\tfrom\tutilities\tfor\tenergy\nthat\ttheir\tsolar\tenergy\tsystems\tgenerate\tand\texport\tto\tthe\tgrid\tin\texcess\tof\tthe\telectric\tload\tthey\tuse.\tThe\tbenefit\tavailable\tunder\tnet\tmetering\thas\tbeen\nor\thas\tbeen\tproposed\tto\tbe\treduced,\taltered\tor\teliminated\tin\tseveral\tjurisdictions,\tand\thas\talso\tbeen\tcontested\tand\tmay\tcontinue\tto\tbe\tcontested\tbefore\nthe\tFederal\tEnergy\tRegulatory\tCommission.\tAny\treductions\tor\tterminations\tof\tsuch\tincentives\tmay\tharm\tour\tbusiness,\tprospects,\tfinancial\tcondition\tand\noperating\tresults\tby\tmaking\tour\tproducts\tless\tcompetitive\tfor\tcustomers,\tincreasing\tour\tcost\tof\tcapital\tand\tadversely\timpacting\tour\tability\tto\tattract\ninvestment\tpartners\tand\tto\tform\tnew\tfinancing\tfunds\tfor\tour\tsolar\tand\tenergy\tstorage\tassets.\nFinally,\twe\tand\tour\tfund\tinvestors\tclaim\tthese\tU.S.\tfederal\ttax\tcredits\tand\tcertain\tstate\tincentives\tin\tamounts\tbased\ton\tindependently\tappraised\tfair\nmarket\tvalues\tof\tour\tsolar\tand\tenergy\tstorage\tsystems.\tSome\tgovernmental\tauthorities\thave\taudited\tsuch\tvalues\tand\tin\tcertain\tcases\thave\tdetermined\nthat\tthese\tvalues\tshould\tbe\tlower,\tand\tthey\tmay\tdo\tso\tagain\tin\tthe\tfuture.\tSuch\tdeterminations\tmay\tresult\tin\tadverse\ttax\tconsequences\tand/or\tour\nobligation\tto\tmake\tindemnification\tor\tother\tpayments\tto\tour\tfunds\tor\tfund\tinvestors.\nWe\tare\tsubject\tto\tevolving\tlaws\tand\tregulations\tthat\tcould\timpose\tsubstantial\tcosts,\tlegal\tprohibitions\tor\tunfavorable\tchanges\nupon\tour\toperations\tor\tproducts.\nAs\twe\tgrow\tour\tmanufacturing\toperations\tin\tadditional\tregions,\twe\tare\tor\twill\tbe\tsubject\tto\tcomplex\tenvironmental,\tmanufacturing,\thealth\tand\nsafety\tlaws\tand\tregulations\tat\tnumerous\tjurisdictional\tlevels\tin\tthe\tU.S.,\tChina,\tGermany\tand\tother\tlocations\tabroad,\tincluding\tlaws\trelating\tto\tthe\tuse,\nhandling,\tstorage,\trecycling,\tdisposal\tand/or\thuman\texposure\tto\thazardous\tmaterials,\tproduct\tmaterial\tinputs\tand\tpost-consumer\tproducts\tand\twith\nrespect\tto\tconstructing,\texpanding\tand\tmaintaining\tour\tfacilities.\tNew,\tor\tchanges\tin,\tenvironmental\tand\tclimate\tchange\tlaws,\tregulations\tor\trules\tcould\nalso\tlead\tto\tincreased\tcosts\tof\tcompliance,\tincluding\tremediations\tof\tany\tdiscovered\tissues,\tand\tchanges\tto\tour\toperations,\twhich\tmay\tbe\tsignificant,\tand\nany\tfailures\tto\tcomply\tcould\tresult\tin\tsignificant\texpenses,\tdelays\tor\tfines.\tIn\taddition,\tas\twe\thave\n25', 'Table\tof\tContents\nAs\tis\tthe\tcase\tfor\tsome\tautomotive\tcompanies,\tsome\tof\tour\tprocured\tcomponents\tand\tsystems\tare\tsourced\tfrom\tsingle\tsuppliers.\tWhere\tmultiple\nsources\tare\tavailable\tfor\tcertain\tkey\tcomponents,\twe\twork\tto\tqualify\tmultiple\tsuppliers\tfor\tthem\twhere\tit\tis\tsensible\tto\tdo\tso\tin\torder\tto\tminimize\npotential\tproduction\trisks\tdue\tto\tdisruptions\tin\ttheir\tsupply.\tWe\talso\tmitigate\trisk\tby\tmaintaining\tsafety\tstock\tfor\tkey\tparts\tand\tassemblies\tand\tdie\tbanks\nfor\tcomponents\twith\tlengthy\tprocurement\tlead\ttimes.\nOur\tproducts\tuse\tvarious\traw\tmaterials\tincluding\taluminum,\tsteel,\tcobalt,\tlithium,\tnickel\tand\tcopper.\tPricing\tfor\tthese\tmaterials\tis\tgoverned\tby\nmarket\tconditions\tand\tmay\tfluctuate\tdue\tto\tvarious\tfactors\toutside\tof\tour\tcontrol,\tsuch\tas\tsupply\tand\tdemand\tand\tmarket\tspeculation.\tWe\tstrive\tto\nexecute\tlong-term\tsupply\tcontracts\tfor\tsuch\tmaterials\tat\tcompetitive\tpricing\twhen\tfeasible,\tand\twe\tcurrently\tbelieve\tthat\twe\thave\tadequate\taccess\tto\nraw\tmaterials\tsupplies\tto\tmeet\tthe\tneeds\tof\tour\toperations.\nGovernmental\tPrograms,\tIncentives\tand\tRegulations\nGlobally,\tthe\townership\tof\tour\tproducts\tby\tour\tcustomers\tis\timpacted\tby\tvarious\tgovernment\tcredits,\tincentives,\tand\tpolicies.\tOur\tbusiness\tand\nproducts\tare\talso\tsubject\tto\tnumerous\tgovernmental\tregulations\tthat\tvary\tamong\tjurisdictions.\nThe\toperation\tof\tour\tbusiness\tis\talso\timpacted\tby\tvarious\tgovernment\tprograms,\tincentives,\tand\tother\tarrangements.\tSee\tNote\t2,\t\nSummary\tof\nSignificant\tAccounting\tPolicies\n,\tto\tthe\tconsolidated\tfinancial\tstatements\tincluded\telsewhere\tin\tthis\tAnnual\tReport\ton\tForm\t10-K\tfor\tfurther\tdetails.\nPrograms\tand\tIncentives\nInflation\tReduction\tAct\nOn\tAugust\t16,\t2022,\tthe\tInflation\tReduction\tAct\tof\t2022\t(“IRA”)\twas\tenacted\tinto\tlaw\tand\tis\teffective\tfor\ttaxable\tyears\tbeginning\tafter\tDecember\n31,\t2022,\tand\tremains\tsubject\tto\tfuture\tguidance\treleases.\tThe\tIRA\tincludes\tmultiple\tincentives\tto\tpromote\tclean\tenergy,\telectric\tvehicles,\tbattery\tand\nenergy\tstorage\tmanufacture\tor\tpurchase,\tincluding\tthrough\tproviding\ttax\tcredits\tto\tconsumers.\tFor\texample,\tqualifying\tTesla\tcustomers\tmay\treceive\tup\nto\t$7,500\tin\tfederal\ttax\tcredits\tfor\tthe\tpurchase\tof\tqualified\telectric\tvehicles\tin\tthe\tU.S.\tthrough\t2032.\nAutomotive\tRegulatory\tCredits\nWe\tearn\ttradable\tcredits\tin\tthe\toperation\tof\tour\tbusiness\tunder\tvarious\tregulations\trelated\tto\tzero-emission\tvehicles\t(“ZEVs”),\tgreenhouse\tgas,\tfuel\neconomy\tand\tclean\tfuel.\tWe\tsell\tthese\tcredits\tto\tother\tregulated\tentities\twho\tcan\tuse\tthe\tcredits\tto\tcomply\twith\temission\tstandards\tand\tother\tregulatory\nrequirements.\tSales\tof\tthese\tcredits\tare\trecognized\twithin\tautomotive\tregulatory\tcredits\trevenue\tin\tour\tconsolidated\tstatements\tof\toperations\tincluded\nelsewhere\tin\tthis\tAnnual\tReport\ton\tForm\t10-K.\nEnergy\tStorage\tSystem\tIncentives\tand\tPolicies\nWhile\tthe\tregulatory\tregime\tfor\tenergy\tstorage\tprojects\tis\tstill\tunder\tdevelopment,\tthere\tare\tvarious\tpolicies,\tincentives\tand\tfinancial\tmechanisms\nat\tthe\tfederal,\tstate\tand\tlocal\tlevels\tthat\tsupport\tthe\tadoption\tof\tenergy\tstorage.\nFor\texample,\tenergy\tstorage\tsystems\tthat\tare\tcharged\tusing\tsolar\tenergy\tmay\tbe\teligible\tfor\tthe\tsolar\tenergy-related\tU.S.\tfederal\ttax\tcredits\ndescribed\tbelow.\tThe\tFederal\tEnergy\tRegulatory\tCommission\t(“FERC”)\thas\talso\ttaken\tsteps\tto\tenable\tthe\tparticipation\tof\tenergy\tstorage\tin\twholesale\nenergy\tmarkets.', 'Our\t(benefit\tfrom)\tprovision\tfor\tincome\ttaxes\tchanged\tby\t$6.13\tbillion\tin\tthe\tyear\tended\tDecember\t31,\t2023\tas\tcompared\tto\tthe\tyear\tended\nDecember\t31,\t2022,\tprimarily\tdue\tto\tthe\trelease\tof\t$6.54\tbillion\tof\tour\tvaluation\tallowance\tassociated\twith\tthe\tU.S.\tfederal\tand\tcertain\tstate\tdeferred\ttax\nassets.\nOur\teffective\ttax\trate\tchanged\tfrom\tan\texpense\tof\t8%\tto\ta\tbenefit\tof\t50%\tin\tthe\tyear\tended\tDecember\t31,\t2023\tas\tcompared\tto\tthe\tyear\tended\nDecember\t31,\t2022,\tprimarily\tdue\tto\tthe\trelease\tof\tthe\tvaluation\tallowance\tregarding\tour\tU.S.\tfederal\tand\tcertain\tstate\tdeferred\ttax\tassets.\nSee\tNote\t14,\t\nIncome\tTaxes\n,\tto\tthe\tconsolidated\tfinancial\tstatements\tincluded\telsewhere\tin\tthis\tAnnual\tReport\ton\tForm\t10-K\tfor\tfurther\tdetails.\nLiquidity\tand\tCapital\tResources\nWe\texpect\tto\tcontinue\tto\tgenerate\tnet\tpositive\toperating\tcash\tflow\tas\twe\thave\tdone\tin\tthe\tlast\tfive\tfiscal\tyears.\tThe\tcash\twe\tgenerate\tfrom\tour\tcore\noperations\tenables\tus\tto\tfund\tongoing\toperations\tand\tproduction,\tour\tresearch\tand\tdevelopment\tprojects\tfor\tnew\tproducts\tand\ttechnologies\tincluding\tour\nproprietary\tbattery\tcells,\tadditional\tmanufacturing\tramps\tat\texisting\tmanufacturing\tfacilities,\tthe\tconstruction\tof\tfuture\tfactories,\tand\tthe\tcontinued\nexpansion\tof\tour\tretail\tand\tservice\tlocations,\tbody\tshops,\tMobile\tService\tfleet,\tSupercharger,\tincluding\tto\tsupport\tNACS,\tenergy\tproduct\tinstallation\ncapabilities\tand\tautonomy\tand\tother\tartificial\tintelligence\tenabled\tproducts.\n42', 'The\testimates\tused\tfor,\tbut\tnot\tlimited\tto,\ndetermining\tsignificant\teconomic\tincentive\tfor\tresale\tvalue\tguarantee\tarrangements,\tsales\treturn\treserves,\tincome\ttaxes,\tthe\tcollectability\tof\taccounts\nand\tfinance\treceivables,\tinventory\tvaluation,\twarranties,\tfair\tvalue\tof\tlong-lived\tassets,\tgoodwill,\tfair\tvalue\tof\tfinancial\tinstruments,\tfair\tvalue\tand\tresidual\nvalue\tof\toperating\tlease\tvehicles\tand\tsolar\tenergy\tsystems\tsubject\tto\tleases\tcould\tbe\timpacted.\tWe\thave\tassessed\tthe\timpact\tand\tare\tnot\taware\tof\tany\nspecific\tevents\tor\tcircumstances\tthat\trequired\tan\tupdate\tto\tour\testimates\tand\tassumptions\tor\tmaterially\taffected\tthe\tcarrying\tvalue\tof\tour\tassets\tor\nliabilities\tas\tof\tthe\tdate\tof\tissuance\tof\tthis\tAnnual\tReport\ton\tForm\t10-K.\tThese\testimates\tmay\tchange\tas\tnew\tevents\toccur\tand\tadditional\tinformation\tis\nobtained.\tActual\tresults\tcould\tdiffer\tmaterially\tfrom\tthese\testimates\tunder\tdifferent\tassumptions\tor\tconditions.\nReclassifications\nCertain\tprior\tperiod\tbalances\thave\tbeen\treclassified\tto\tconform\tto\tthe\tcurrent\tperiod\tpresentation\tin\tthe\tconsolidated\tfinancial\tstatements\tand\tthe\naccompanying\tnotes.\n54']","The Inflation Reduction Act provides tax credits to consumers who purchase qualifying electric vehicles, including Tesla vehicles, up to $7,500 through 2032.  
","IRA provides up to $7,500 federal tax credit for qualifying EV purchases through 2032",,0.3333333333,1.0
What automotive regulatory credits does Tesla earn and sell?,"['These\tdeliveries\tare\tvehicles\tthat\tare\tnot\tsubject\tto\tlease\taccounting.\nAutomotive\tregulatory\tcredits\tincludes\tsales\tof\tregulatory\tcredits\tto\tother\tautomotive\tmanufacturers.\tOur\trevenue\tfrom\tautomotive\tregulatory\ncredits\tis\tdirectly\trelated\tto\tour\tnew\tvehicle\tproduction,\tsales\tand\tpricing\tnegotiated\twith\tour\tcustomers.\tWe\tmonetize\tthem\tproactively\tas\tnew\tvehicles\nare\tsold\tbased\ton\tstanding\tarrangements\twith\tbuyers\tof\tsuch\tcredits,\ttypically\tas\tclose\tas\tpossible\tto\tthe\tproduction\tand\tdelivery\tof\tthe\tvehicle\tor\nchanges\tin\tregulation\timpacting\tthe\tcredits.\nAutomotive\tleasing\trevenue\tincludes\tthe\tamortization\tof\trevenue\tfor\tvehicles\tunder\tdirect\toperating\tlease\tagreements.\tAdditionally,\tautomotive\nleasing\trevenue\tincludes\tdirect\tsales-type\tleasing\tprograms\twhere\twe\trecognize\tall\trevenue\tassociated\twith\tthe\tsales-type\tlease\tupon\tdelivery\tto\tthe\ncustomer.\nServices\tand\tother\trevenue\tconsists\tof\tsales\tof\tused\tvehicles,\tnon-warranty\tafter-sales\tvehicle\tservices,\tbody\tshop\tand\tparts,\tpaid\tSupercharging,\nvehicle\tinsurance\trevenue\tand\tretail\tmerchandise.\n2023\tcompared\tto\t2022\nAutomotive\tsales\trevenue\tincreased\t$11.30\tbillion,\tor\t17%,\tin\tthe\tyear\tended\tDecember\t31,\t2023\tas\tcompared\tto\tthe\tyear\tended\tDecember\t31,\n2022,\tprimarily\tdue\tto\tan\tincrease\tof\t473,382\tcombined\tModel\t3\tand\tModel\tY\tcash\tdeliveries\tfrom\tproduction\tramping\tof\tModel\tY\tglobally.\tThe\tincrease\nwas\tpartially\toffset\tby\ta\tlower\taverage\tselling\tprice\ton\tour\tvehicles\tdriven\tby\toverall\tprice\treductions\tyear\tover\tyear,\tsales\tmix,\tand\ta\tnegative\timpact\nfrom\tthe\tUnited\tStates\tdollar\tstrengthening\tagainst\tother\tforeign\tcurrencies\tin\tthe\tyear\tended\tDecember\t31,\t2023\tcompared\tto\tthe\tprior\tyear.\nAutomotive\tregulatory\tcredits\trevenue\tincreased\t$14\tmillion,\tor\t1%,\tin\tthe\tyear\tended\tDecember\t31,\t2023\tas\tcompared\tto\tthe\tyear\tended\nDecember\t31,\t2022.\n38', 'The\tremaining\tbalance\twill\tbe\nrecognized\tat\tthe\ttime\tof\ttransfer\tof\tcontrol\tof\tthe\tproduct\tor\tover\tthe\tperformance\tperiod\tas\tdiscussed\tabove\tin\tAutomotive\tSales.\nWe\thave\tbeen\tproviding\tloans\tfor\tfinancing\tour\tautomotive\tdeliveries\tin\tvolume\tsince\tfiscal\tyear\t2022.\tAs\tof\tDecember\t31,\t2023\tand\t2022,\twe\thave\nrecorded\tnet\tfinancing\treceivables\ton\tthe\tconsolidated\tbalance\tsheets,\tof\twhich\t$\n242\n\tmillion\tand\t$\n128\n\tmillion,\trespectively,\tis\trecorded\twithin\tAccounts\nreceivable,\tnet,\tfor\tthe\tcurrent\tportion\tand\t$\n1.04\n\tbillion\tand\t$\n665\n\tmillion,\trespectively,\tis\trecorded\twithin\tOther\tnon-current\tassets\tfor\tthe\tlong-term\nportion.\nAutomotive\tRegulatory\tCredits\nWe\tearn\ttradable\tcredits\tin\tthe\toperation\tof\tour\tautomotive\tbusiness\tunder\tvarious\tregulations\trelated\tto\tZEVs,\tgreenhouse\tgas,\tfuel\teconomy\tand\nclean\tfuel.\tWe\tsell\tthese\tcredits\tto\tother\tregulated\tentities\twho\tcan\tuse\tthe\tcredits\tto\tcomply\twith\temission\tstandards\tand\tother\tregulatory\trequirements.\nPayments\tfor\tautomotive\tregulatory\tcredits\tare\ttypically\treceived\tat\tthe\tpoint\tcontrol\ttransfers\tto\tthe\tcustomer,\tor\tin\taccordance\twith\tpayment\nterms\tcustomary\tto\tthe\tbusiness.\tWe\trecognize\trevenue\ton\tthe\tsale\tof\tautomotive\tregulatory\tcredits,\twhich\thave\tnegligible\tincremental\tcosts\tassociated\nwith\tthem,\tat\tthe\ttime\tcontrol\tof\tthe\tregulatory\tcredits\tis\ttransferred\tto\tthe\tpurchasing\tparty.\tDeferred\trevenue\trelated\tto\tsales\tof\tautomotive\tregulatory\ncredits\twas\timmaterial\tas\tof\tDecember\t31,\t2023\tand\t2022.\tRevenue\trecognized\tfrom\tthe\tdeferred\trevenue\tbalance\tas\tof\tDecember\t31,\t2022\tand\t2021\nwas\timmaterial\tfor\tthe\tyears\tended\tDecember\t31,\t2023\tand\t2022.\tDuring\tthe\tyear\tended\tDecember\t31,\t2022,\twe\thad\talso\trecognized\t$\n288\n\tmillion\tin\nrevenue\tdue\tto\tchanges\tin\tregulation\twhich\tentitled\tus\tto\tadditional\tconsideration\tfor\tcredits\tsold\tpreviously.\n56', 'Table\tof\tContents\nAs\tis\tthe\tcase\tfor\tsome\tautomotive\tcompanies,\tsome\tof\tour\tprocured\tcomponents\tand\tsystems\tare\tsourced\tfrom\tsingle\tsuppliers.\tWhere\tmultiple\nsources\tare\tavailable\tfor\tcertain\tkey\tcomponents,\twe\twork\tto\tqualify\tmultiple\tsuppliers\tfor\tthem\twhere\tit\tis\tsensible\tto\tdo\tso\tin\torder\tto\tminimize\npotential\tproduction\trisks\tdue\tto\tdisruptions\tin\ttheir\tsupply.\tWe\talso\tmitigate\trisk\tby\tmaintaining\tsafety\tstock\tfor\tkey\tparts\tand\tassemblies\tand\tdie\tbanks\nfor\tcomponents\twith\tlengthy\tprocurement\tlead\ttimes.\nOur\tproducts\tuse\tvarious\traw\tmaterials\tincluding\taluminum,\tsteel,\tcobalt,\tlithium,\tnickel\tand\tcopper.\tPricing\tfor\tthese\tmaterials\tis\tgoverned\tby\nmarket\tconditions\tand\tmay\tfluctuate\tdue\tto\tvarious\tfactors\toutside\tof\tour\tcontrol,\tsuch\tas\tsupply\tand\tdemand\tand\tmarket\tspeculation.\tWe\tstrive\tto\nexecute\tlong-term\tsupply\tcontracts\tfor\tsuch\tmaterials\tat\tcompetitive\tpricing\twhen\tfeasible,\tand\twe\tcurrently\tbelieve\tthat\twe\thave\tadequate\taccess\tto\nraw\tmaterials\tsupplies\tto\tmeet\tthe\tneeds\tof\tour\toperations.\nGovernmental\tPrograms,\tIncentives\tand\tRegulations\nGlobally,\tthe\townership\tof\tour\tproducts\tby\tour\tcustomers\tis\timpacted\tby\tvarious\tgovernment\tcredits,\tincentives,\tand\tpolicies.\tOur\tbusiness\tand\nproducts\tare\talso\tsubject\tto\tnumerous\tgovernmental\tregulations\tthat\tvary\tamong\tjurisdictions.\nThe\toperation\tof\tour\tbusiness\tis\talso\timpacted\tby\tvarious\tgovernment\tprograms,\tincentives,\tand\tother\tarrangements.\tSee\tNote\t2,\t\nSummary\tof\nSignificant\tAccounting\tPolicies\n,\tto\tthe\tconsolidated\tfinancial\tstatements\tincluded\telsewhere\tin\tthis\tAnnual\tReport\ton\tForm\t10-K\tfor\tfurther\tdetails.\nPrograms\tand\tIncentives\nInflation\tReduction\tAct\nOn\tAugust\t16,\t2022,\tthe\tInflation\tReduction\tAct\tof\t2022\t(“IRA”)\twas\tenacted\tinto\tlaw\tand\tis\teffective\tfor\ttaxable\tyears\tbeginning\tafter\tDecember\n31,\t2022,\tand\tremains\tsubject\tto\tfuture\tguidance\treleases.\tThe\tIRA\tincludes\tmultiple\tincentives\tto\tpromote\tclean\tenergy,\telectric\tvehicles,\tbattery\tand\nenergy\tstorage\tmanufacture\tor\tpurchase,\tincluding\tthrough\tproviding\ttax\tcredits\tto\tconsumers.\tFor\texample,\tqualifying\tTesla\tcustomers\tmay\treceive\tup\nto\t$7,500\tin\tfederal\ttax\tcredits\tfor\tthe\tpurchase\tof\tqualified\telectric\tvehicles\tin\tthe\tU.S.\tthrough\t2032.\nAutomotive\tRegulatory\tCredits\nWe\tearn\ttradable\tcredits\tin\tthe\toperation\tof\tour\tbusiness\tunder\tvarious\tregulations\trelated\tto\tzero-emission\tvehicles\t(“ZEVs”),\tgreenhouse\tgas,\tfuel\neconomy\tand\tclean\tfuel.\tWe\tsell\tthese\tcredits\tto\tother\tregulated\tentities\twho\tcan\tuse\tthe\tcredits\tto\tcomply\twith\temission\tstandards\tand\tother\tregulatory\nrequirements.\tSales\tof\tthese\tcredits\tare\trecognized\twithin\tautomotive\tregulatory\tcredits\trevenue\tin\tour\tconsolidated\tstatements\tof\toperations\tincluded\nelsewhere\tin\tthis\tAnnual\tReport\ton\tForm\t10-K.\nEnergy\tStorage\tSystem\tIncentives\tand\tPolicies\nWhile\tthe\tregulatory\tregime\tfor\tenergy\tstorage\tprojects\tis\tstill\tunder\tdevelopment,\tthere\tare\tvarious\tpolicies,\tincentives\tand\tfinancial\tmechanisms\nat\tthe\tfederal,\tstate\tand\tlocal\tlevels\tthat\tsupport\tthe\tadoption\tof\tenergy\tstorage.\nFor\texample,\tenergy\tstorage\tsystems\tthat\tare\tcharged\tusing\tsolar\tenergy\tmay\tbe\teligible\tfor\tthe\tsolar\tenergy-related\tU.S.\tfederal\ttax\tcredits\ndescribed\tbelow.\tThe\tFederal\tEnergy\tRegulatory\tCommission\t(“FERC”)\thas\talso\ttaken\tsteps\tto\tenable\tthe\tparticipation\tof\tenergy\tstorage\tin\twholesale\nenergy\tmarkets.', 'Revenue\tRecognition\nRevenue\tby\tsource\nThe\tfollowing\ttable\tdisaggregates\tour\trevenue\tby\tmajor\tsource\t(in\tmillions):\nYear\tEnded\tDecember\t31,\n2023\n2022\n2021\nAutomotive\tsales\n$\n78,509\n\t\n$\n67,210\n\t\n$\n44,125\n\t\nAutomotive\tregulatory\tcredits\n1,790\n\t\n1,776\n\t\n1,465\n\t\nEnergy\tgeneration\tand\tstorage\tsales\n5,515\n\t\n3,376\n\t\n2,279\n\t\nServices\tand\tother\n8,319\n\t\n6,091\n\t\n3,802\n\t\nTotal\trevenues\tfrom\tsales\tand\tservices\n94,133\n\t\n78,453\n\t\n51,671\n\t\nAutomotive\tleasing\n2,120\n\t\n2,476\n\t\n1,642\n\t\nEnergy\tgeneration\tand\tstorage\tleasing\n520\n\t\n533\n\t\n510\n\t\nTotal\trevenues\n$\n96,773\n\t\n$\n81,462\n\t\n$\n53,823\n\t\nAutomotive\tSegment\nAutomotive\tSales\nAutomotive\tsales\trevenue\tincludes\trevenues\trelated\tto\tcash\tand\tfinancing\tdeliveries\tof\tnew\tvehicles,\tand\tspecific\tother\tfeatures\tand\tservices\tthat\nmeet\tthe\tdefinition\tof\ta\tperformance\tobligation\tunder\tASC\t606,\tincluding\taccess\tto\tour\tFSD\tCapability\tfeatures\tand\ttheir\tongoing\tmaintenance,\tinternet\nconnectivity,\tfree\tSupercharging\tprograms\tand\tover-the-air\tsoftware\tupdates.\tWe\trecognize\trevenue\ton\tautomotive\tsales\tupon\tdelivery\tto\tthe\tcustomer,\nwhich\tis\twhen\tthe\tcontrol\tof\ta\tvehicle\ttransfers.\tPayments\tare\ttypically\treceived\tat\tthe\tpoint\tcontrol\ttransfers\tor\tin\taccordance\twith\tpayment\tterms\ncustomary\tto\tthe\tbusiness,\texcept\tsales\twe\tfinance\tfor\twhich\tpayments\tare\tcollected\tover\tthe\tcontractual\tloan\tterm.\tWe\talso\trecognize\ta\tsales\treturn\nreserve\tbased\ton\thistorical\texperience\tplus\tconsideration\tfor\texpected\tfuture\tmarket\tvalues,\twhen\twe\toffer\tresale\tvalue\tguarantees\tor\tsimilar\tbuyback\nterms.\tOther\tfeatures\tand\tservices\tsuch\tas\taccess\tto\tour\tinternet\tconnectivity,\tunlimited\tfree\tSupercharging\tand\tover-the-air\tsoftware\tupdates\tare\nprovisioned\tupon\tcontrol\ttransfer\tof\ta\tvehicle\tand\trecognized\tover\ttime\ton\ta\tstraight-line\tbasis\tas\twe\thave\ta\tstand-ready\tobligation\tto\tdeliver\tsuch\nservices\tto\tthe\tcustomer.\tOther\tlimited\tfree\tSupercharging\tincentives\tare\trecognized\tbased\ton\tactual\tusage\tor\texpiration,\twhichever\tis\tearlier.\tWe\nrecognize\trevenue\trelated\tto\tthese\tother\tfeatures\tand\tservices\tover\tthe\tperformance\tperiod,\twhich\tis\tgenerally\tthe\texpected\townership\tlife\tof\tthe\tvehicle.\nRevenue\trelated\tto\tFSD\tCapability\tfeatures\tis\trecognized\twhen\tfunctionality\tis\tdelivered\tto\tthe\tcustomer\tand\ttheir\tongoing\tmaintenance\tis\trecognized\nover\ttime.\tFor\tour\tobligations\trelated\tto\tautomotive\tsales,\twe\testimate\tstandalone\tselling\tprice\tby\tconsidering\tcosts\tused\tto\tdevelop\tand\tdeliver\tthe\nservice,\tthird-party\tpricing\tof\tsimilar\toptions\tand\tother\tinformation\tthat\tmay\tbe\tavailable.\nAny\tfees\tthat\tare\tpaid\tor\tpayable\tby\tus\tto\ta\tcustomer’s\tlender\twhen\twe\tarrange\tthe\tfinancing\tare\trecognized\tas\tan\toffset\tagainst\tautomotive\tsales\nrevenue.\tCosts\tto\tobtain\ta\tcontract\tmainly\trelate\tto\tcommissions\tpaid\tto\tour\tsales\tpersonnel\tfor\tthe\tsale\tof\tvehicles.\tAs\tour\tcontract\tcosts\trelated\tto\nautomotive\tsales\tare\ttypically\tfulfilled\twithin\tone\tyear,\tthe\tcosts\tto\tobtain\ta\tcontract\tare\texpensed\tas\tincurred.\tAmounts\tbilled\tto\tcustomers\trelated\tto\nshipping\tand\thandling\tare\tclassified\tas\tautomotive\tsales\trevenue,\tand\twe\thave\telected\tto\trecognize\tthe\tcost\tfor\tfreight\tand\tshipping\twhen\tcontrol\tover\nvehicles,\tparts\tor\taccessories\thave\ttransferred\tto\tthe\tcustomer\tas\tan\texpense\tin\tcost\tof\tautomotive\tsales\trevenue.\tOur\tpolicy\tis\tto\texclude\ttaxes\ncollected\tfrom\ta\tcustomer\tfrom\tthe\ttransaction\tprice\tof\tautomotive\tcontracts.\n55', 'Table\tof\tContents\nSolar\tEnergy\tSystem\tIncentives\tand\tPolicies\nU.S.\tfederal,\tstate\tand\tlocal\tgovernments\thave\testablished\tvarious\tpolicies,\tincentives\tand\tfinancial\tmechanisms\tto\treduce\tthe\tcost\tof\tsolar\tenergy\nand\tto\taccelerate\tthe\tadoption\tof\tsolar\tenergy.\tThese\tincentives\tinclude\ttax\tcredits,\tcash\tgrants,\ttax\tabatements\tand\trebates.\nIn\tparticular,\tpursuant\tto\tthe\tIRA,\tSections\t48,\t48E\tand\t25D\tof\tthe\tIRC\tprovides\ta\ttax\tcredit\tbetween\t6%\tand\t70%\tof\tqualified\tcommercial\tor\nresidential\texpenditures\tfor\tsolar\tenergy\tsystems,\twhich\tmay\tbe\tclaimed\tby\tour\tcustomers\tfor\tsystems\tthey\tpurchase,\tor\tby\tus\tfor\tarrangements\twhere\nwe\town\tthe\tsystems\tfor\tproperties\tthat\tmeet\tstatutory\trequirements.\tThese\ttax\tcredits\tare\tprimarily\tfor\tthe\tdirect\tbenefit\tof\tour\tcustomers\tand\tare\ncurrently\tscheduled\tto\tphase-out\tstarting\tin\t2032\tor\tlater.\nRegulations\nVehicle\tSafety\tand\tTesting\nIn\tthe\tU.S.,\tour\tvehicles\tare\tsubject\tto\tregulation\tby\tthe\tNational\tHighway\tTraffic\tSafety\tAdministration\t(“NHTSA”),\tincluding\tall\tapplicable\tFederal\nMotor\tVehicle\tSafety\tStandards\t(“FMVSS”)\tand\tthe\tNHTSA\tbumper\tstandard.\tNumerous\tFMVSS\tapply\tto\tour\tvehicles,\tsuch\tas\tcrash-worthiness\tand\noccupant\tprotection\trequirements.\tOur\tcurrent\tvehicles\tfully\tcomply\tand\twe\texpect\tthat\tour\tvehicles\tin\tthe\tfuture\twill\tfully\tcomply\twith\tall\tapplicable\nFMVSS\twith\tlimited\tor\tno\texemptions,\thowever,\tFMVSS\tare\tsubject\tto\tchange\tfrom\ttime\tto\ttime.\tAs\ta\tmanufacturer,\twe\tmust\tself-certify\tthat\tour\tvehicles\nmeet\tall\tapplicable\tFMVSS\tand\tthe\tNHTSA\tbumper\tstandard,\tor\totherwise\tare\texempt,\tbefore\tthe\tvehicles\tmay\tbe\timported\tor\tsold\tin\tthe\tU.S.\nWe\tare\talso\trequired\tto\tcomply\twith\tother\tfederal\tlaws\tadministered\tby\tNHTSA,\tincluding\tthe\tCorporate\tAverage\tFuel\tEconomy\tstandards,\tTheft\nPrevention\tAct\trequirements,\tlabeling\trequirements\tand\tother\tinformation\tprovided\tto\tcustomers\tin\twriting,\tEarly\tWarning\tReporting\trequirements\nregarding\twarranty\tclaims,\tfield\treports,\tdeath\tand\tinjury\treports\tand\tforeign\trecalls,\ta\tStanding\tGeneral\tOrder\trequiring\treports\tregarding\tcrashes\ninvolving\tvehicles\tequipped\twith\tadvanced\tdriver\tassistance\tsystems,\tand\tadditional\trequirements\tfor\tcooperating\twith\tcompliance\tand\tsafety\ninvestigations\tand\trecall\treporting.\tThe\tU.S.\tAutomobile\tInformation\tand\tDisclosure\tAct\talso\trequires\tmanufacturers\tof\tmotor\tvehicles\tto\tdisclose\tcertain\ninformation\tregarding\tthe\tmanufacturer’s\tsuggested\tretail\tprice,\toptional\tequipment\tand\tpricing.\tIn\taddition,\tfederal\tlaw\trequires\tinclusion\tof\tfuel\neconomy\tratings,\tas\tdetermined\tby\tthe\tU.S.\tDepartment\tof\tTransportation\tand\tthe\tEnvironmental\tProtection\tAgency\t(the\t“EPA”),\tand\tNew\tCar\nAssessment\tProgram\tratings\tas\tdetermined\tby\tNHTSA,\tif\tavailable.\nOur\tvehicles\tsold\toutside\tof\tthe\tU.S.\tare\tsubject\tto\tsimilar\tforeign\tcompliance,\tsafety,\tenvironmental\tand\tother\tregulations.\tMany\tof\tthose\nregulations\tare\tdifferent\tfrom\tthose\tapplicable\tin\tthe\tU.S.\tand\tmay\trequire\tredesign\tand/or\tretesting.\tSome\tof\tthose\tregulations\timpact\tor\tprevent\tthe\nrollout\tof\tnew\tvehicle\tfeatures.\nSelf-Driving\tVehicles\nGenerally,\tlaws\tpertaining\tto\tself-driving\tvehicles\tare\tevolving\tglobally,\tand\tin\tsome\tcases\tmay\tcreate\trestrictions\ton\tfeatures\tor\tvehicle\tdesigns\nthat\twe\tdevelop.\tWhile\tthere\tare\tcurrently\tno\tfederal\tU.S.']","Tesla earns tradable credits in the operation of its business under various regulations related to zero-emission vehicles (ZEVs), greenhouse gas, fuel economy, and clean fuel.  
",Tradable zero‑emission and clean‑fuel credits earned and sold under various regulations,,,1.0
What federal tax credits apply to Tesla’s energy storage systems?,"['Energy\tStorage\tSystem\tIncentives\tand\tPolicies\nWhile\tthe\tregulatory\tregime\tfor\tenergy\tstorage\tprojects\tis\tstill\tunder\tdevelopment,\tthere\tare\tvarious\tpolicies,\tincentives\tand\tfinancial\tmechanisms\nat\tthe\tfederal,\tstate\tand\tlocal\tlevels\tthat\tsupport\tthe\tadoption\tof\tenergy\tstorage.\nFor\texample,\tenergy\tstorage\tsystems\tthat\tare\tcharged\tusing\tsolar\tenergy\tmay\tbe\teligible\tfor\tthe\tsolar\tenergy-related\tU.S.\tfederal\ttax\tcredits\ndescribed\tbelow.\tThe\tFederal\tEnergy\tRegulatory\tCommission\t(“FERC”)\thas\talso\ttaken\tsteps\tto\tenable\tthe\tparticipation\tof\tenergy\tstorage\tin\twholesale\nenergy\tmarkets.\tIn\taddition,\tCalifornia\tand\ta\tnumber\tof\tother\tstates\thave\tadopted\tprocurement\ttargets\tfor\tenergy\tstorage,\tand\tbehind-the-meter\tenergy\nstorage\tsystems\tqualify\tfor\tfunding\tunder\tthe\tCalifornia\tSelf\tGeneration\tIncentive\tProgram.\tOur\tcustomers\tprimarily\tbenefit\tdirectly\tunder\tthese\nprograms.\tIn\tcertain\tinstances\tour\tcustomers\tmay\ttransfer\tsuch\tcredits\tto\tus\tas\tcontract\tconsideration.\tIn\tsuch\ttransactions,\tthey\tare\tincluded\tas\ta\ncomponent\tof\tenergy\tgeneration\tand\tstorage\trevenues\tin\tour\tconsolidated\tstatements\tof\toperations\tincluded\telsewhere\tin\tthis\tAnnual\tReport\ton\tForm\n10-K.\nPursuant\tto\tthe\tIRA,\tunder\tSections\t48,\t48E\tand\t25D\tof\tthe\tInternal\tRevenue\tCode\t(”IRC”),\tstandalone\tenergy\tstorage\ttechnology\tis\teligible\tfor\ta\ttax\ncredit\tbetween\t6%\tand\t50%\tof\tqualified\texpenditures,\tregardless\tof\tthe\tsource\tof\tenergy,\twhich\tmay\tbe\tclaimed\tby\tour\tcustomers\tfor\tstorage\tsystems\nthey\tpurchase\tor\tby\tus\tfor\tarrangements\twhere\twe\town\tthe\tsystems.\tThese\ttax\tcredits\tare\tprimarily\tfor\tthe\tbenefit\tof\tour\tcustomers\tand\tare\tcurrently\nscheduled\tto\tphase-out\tstarting\tin\t2032\tor\tlater.\n9', 'Such\ndevelopments\tcould\tnegatively\timpact\tdemand\tfor\tour\tvehicles,\tand\twe\tand\tour\tcustomers\tmay\thave\tto\tadjust\tto\tthem,\tincluding\tthrough\tpricing\nmodifications.\nIn\taddition,\tcertain\tgovernmental\trebates,\ttax\tcredits\tand\tother\tfinancial\tincentives\tthat\tare\tcurrently\tavailable\twith\trespect\tto\tour\tsolar\tand\tenergy\nstorage\tproduct\tbusinesses\tallow\tus\tto\tlower\tour\tcosts\tand\tencourage\tcustomers\tto\tbuy\tour\tproducts\tand\tinvestors\tto\tinvest\tin\tour\tsolar\tfinancing\tfunds.\nHowever,\tthese\tincentives\tmay\texpire\twhen\tthe\tallocated\tfunding\tis\texhausted,\treduced\tor\tterminated\tas\trenewable\tenergy\tadoption\trates\tincrease,\nsometimes\twithout\twarning.\tLikewise,\tin\tjurisdictions\twhere\tnet\tmetering\tis\tcurrently\tavailable,\tour\tcustomers\treceive\tbill\tcredits\tfrom\tutilities\tfor\tenergy\nthat\ttheir\tsolar\tenergy\tsystems\tgenerate\tand\texport\tto\tthe\tgrid\tin\texcess\tof\tthe\telectric\tload\tthey\tuse.\tThe\tbenefit\tavailable\tunder\tnet\tmetering\thas\tbeen\nor\thas\tbeen\tproposed\tto\tbe\treduced,\taltered\tor\teliminated\tin\tseveral\tjurisdictions,\tand\thas\talso\tbeen\tcontested\tand\tmay\tcontinue\tto\tbe\tcontested\tbefore\nthe\tFederal\tEnergy\tRegulatory\tCommission.\tAny\treductions\tor\tterminations\tof\tsuch\tincentives\tmay\tharm\tour\tbusiness,\tprospects,\tfinancial\tcondition\tand\noperating\tresults\tby\tmaking\tour\tproducts\tless\tcompetitive\tfor\tcustomers,\tincreasing\tour\tcost\tof\tcapital\tand\tadversely\timpacting\tour\tability\tto\tattract\ninvestment\tpartners\tand\tto\tform\tnew\tfinancing\tfunds\tfor\tour\tsolar\tand\tenergy\tstorage\tassets.\nFinally,\twe\tand\tour\tfund\tinvestors\tclaim\tthese\tU.S.\tfederal\ttax\tcredits\tand\tcertain\tstate\tincentives\tin\tamounts\tbased\ton\tindependently\tappraised\tfair\nmarket\tvalues\tof\tour\tsolar\tand\tenergy\tstorage\tsystems.\tSome\tgovernmental\tauthorities\thave\taudited\tsuch\tvalues\tand\tin\tcertain\tcases\thave\tdetermined\nthat\tthese\tvalues\tshould\tbe\tlower,\tand\tthey\tmay\tdo\tso\tagain\tin\tthe\tfuture.\tSuch\tdeterminations\tmay\tresult\tin\tadverse\ttax\tconsequences\tand/or\tour\nobligation\tto\tmake\tindemnification\tor\tother\tpayments\tto\tour\tfunds\tor\tfund\tinvestors.\nWe\tare\tsubject\tto\tevolving\tlaws\tand\tregulations\tthat\tcould\timpose\tsubstantial\tcosts,\tlegal\tprohibitions\tor\tunfavorable\tchanges\nupon\tour\toperations\tor\tproducts.\nAs\twe\tgrow\tour\tmanufacturing\toperations\tin\tadditional\tregions,\twe\tare\tor\twill\tbe\tsubject\tto\tcomplex\tenvironmental,\tmanufacturing,\thealth\tand\nsafety\tlaws\tand\tregulations\tat\tnumerous\tjurisdictional\tlevels\tin\tthe\tU.S.,\tChina,\tGermany\tand\tother\tlocations\tabroad,\tincluding\tlaws\trelating\tto\tthe\tuse,\nhandling,\tstorage,\trecycling,\tdisposal\tand/or\thuman\texposure\tto\thazardous\tmaterials,\tproduct\tmaterial\tinputs\tand\tpost-consumer\tproducts\tand\twith\nrespect\tto\tconstructing,\texpanding\tand\tmaintaining\tour\tfacilities.\tNew,\tor\tchanges\tin,\tenvironmental\tand\tclimate\tchange\tlaws,\tregulations\tor\trules\tcould\nalso\tlead\tto\tincreased\tcosts\tof\tcompliance,\tincluding\tremediations\tof\tany\tdiscovered\tissues,\tand\tchanges\tto\tour\toperations,\twhich\tmay\tbe\tsignificant,\tand\nany\tfailures\tto\tcomply\tcould\tresult\tin\tsignificant\texpenses,\tdelays\tor\tfines.\tIn\taddition,\tas\twe\thave\n25', 'Table\tof\tContents\nSolar\tEnergy\tSystem\tIncentives\tand\tPolicies\nU.S.\tfederal,\tstate\tand\tlocal\tgovernments\thave\testablished\tvarious\tpolicies,\tincentives\tand\tfinancial\tmechanisms\tto\treduce\tthe\tcost\tof\tsolar\tenergy\nand\tto\taccelerate\tthe\tadoption\tof\tsolar\tenergy.\tThese\tincentives\tinclude\ttax\tcredits,\tcash\tgrants,\ttax\tabatements\tand\trebates.\nIn\tparticular,\tpursuant\tto\tthe\tIRA,\tSections\t48,\t48E\tand\t25D\tof\tthe\tIRC\tprovides\ta\ttax\tcredit\tbetween\t6%\tand\t70%\tof\tqualified\tcommercial\tor\nresidential\texpenditures\tfor\tsolar\tenergy\tsystems,\twhich\tmay\tbe\tclaimed\tby\tour\tcustomers\tfor\tsystems\tthey\tpurchase,\tor\tby\tus\tfor\tarrangements\twhere\nwe\town\tthe\tsystems\tfor\tproperties\tthat\tmeet\tstatutory\trequirements.\tThese\ttax\tcredits\tare\tprimarily\tfor\tthe\tdirect\tbenefit\tof\tour\tcustomers\tand\tare\ncurrently\tscheduled\tto\tphase-out\tstarting\tin\t2032\tor\tlater.\nRegulations\nVehicle\tSafety\tand\tTesting\nIn\tthe\tU.S.,\tour\tvehicles\tare\tsubject\tto\tregulation\tby\tthe\tNational\tHighway\tTraffic\tSafety\tAdministration\t(“NHTSA”),\tincluding\tall\tapplicable\tFederal\nMotor\tVehicle\tSafety\tStandards\t(“FMVSS”)\tand\tthe\tNHTSA\tbumper\tstandard.\tNumerous\tFMVSS\tapply\tto\tour\tvehicles,\tsuch\tas\tcrash-worthiness\tand\noccupant\tprotection\trequirements.\tOur\tcurrent\tvehicles\tfully\tcomply\tand\twe\texpect\tthat\tour\tvehicles\tin\tthe\tfuture\twill\tfully\tcomply\twith\tall\tapplicable\nFMVSS\twith\tlimited\tor\tno\texemptions,\thowever,\tFMVSS\tare\tsubject\tto\tchange\tfrom\ttime\tto\ttime.\tAs\ta\tmanufacturer,\twe\tmust\tself-certify\tthat\tour\tvehicles\nmeet\tall\tapplicable\tFMVSS\tand\tthe\tNHTSA\tbumper\tstandard,\tor\totherwise\tare\texempt,\tbefore\tthe\tvehicles\tmay\tbe\timported\tor\tsold\tin\tthe\tU.S.\nWe\tare\talso\trequired\tto\tcomply\twith\tother\tfederal\tlaws\tadministered\tby\tNHTSA,\tincluding\tthe\tCorporate\tAverage\tFuel\tEconomy\tstandards,\tTheft\nPrevention\tAct\trequirements,\tlabeling\trequirements\tand\tother\tinformation\tprovided\tto\tcustomers\tin\twriting,\tEarly\tWarning\tReporting\trequirements\nregarding\twarranty\tclaims,\tfield\treports,\tdeath\tand\tinjury\treports\tand\tforeign\trecalls,\ta\tStanding\tGeneral\tOrder\trequiring\treports\tregarding\tcrashes\ninvolving\tvehicles\tequipped\twith\tadvanced\tdriver\tassistance\tsystems,\tand\tadditional\trequirements\tfor\tcooperating\twith\tcompliance\tand\tsafety\ninvestigations\tand\trecall\treporting.\tThe\tU.S.\tAutomobile\tInformation\tand\tDisclosure\tAct\talso\trequires\tmanufacturers\tof\tmotor\tvehicles\tto\tdisclose\tcertain\ninformation\tregarding\tthe\tmanufacturer’s\tsuggested\tretail\tprice,\toptional\tequipment\tand\tpricing.\tIn\taddition,\tfederal\tlaw\trequires\tinclusion\tof\tfuel\neconomy\tratings,\tas\tdetermined\tby\tthe\tU.S.\tDepartment\tof\tTransportation\tand\tthe\tEnvironmental\tProtection\tAgency\t(the\t“EPA”),\tand\tNew\tCar\nAssessment\tProgram\tratings\tas\tdetermined\tby\tNHTSA,\tif\tavailable.\nOur\tvehicles\tsold\toutside\tof\tthe\tU.S.\tare\tsubject\tto\tsimilar\tforeign\tcompliance,\tsafety,\tenvironmental\tand\tother\tregulations.\tMany\tof\tthose\nregulations\tare\tdifferent\tfrom\tthose\tapplicable\tin\tthe\tU.S.\tand\tmay\trequire\tredesign\tand/or\tretesting.\tSome\tof\tthose\tregulations\timpact\tor\tprevent\tthe\nrollout\tof\tnew\tvehicle\tfeatures.\nSelf-Driving\tVehicles\nGenerally,\tlaws\tpertaining\tto\tself-driving\tvehicles\tare\tevolving\tglobally,\tand\tin\tsome\tcases\tmay\tcreate\trestrictions\ton\tfeatures\tor\tvehicle\tdesigns\nthat\twe\tdevelop.\tWhile\tthere\tare\tcurrently\tno\tfederal\tU.S.', 'Table\tof\tContents\nAs\tis\tthe\tcase\tfor\tsome\tautomotive\tcompanies,\tsome\tof\tour\tprocured\tcomponents\tand\tsystems\tare\tsourced\tfrom\tsingle\tsuppliers.\tWhere\tmultiple\nsources\tare\tavailable\tfor\tcertain\tkey\tcomponents,\twe\twork\tto\tqualify\tmultiple\tsuppliers\tfor\tthem\twhere\tit\tis\tsensible\tto\tdo\tso\tin\torder\tto\tminimize\npotential\tproduction\trisks\tdue\tto\tdisruptions\tin\ttheir\tsupply.\tWe\talso\tmitigate\trisk\tby\tmaintaining\tsafety\tstock\tfor\tkey\tparts\tand\tassemblies\tand\tdie\tbanks\nfor\tcomponents\twith\tlengthy\tprocurement\tlead\ttimes.\nOur\tproducts\tuse\tvarious\traw\tmaterials\tincluding\taluminum,\tsteel,\tcobalt,\tlithium,\tnickel\tand\tcopper.\tPricing\tfor\tthese\tmaterials\tis\tgoverned\tby\nmarket\tconditions\tand\tmay\tfluctuate\tdue\tto\tvarious\tfactors\toutside\tof\tour\tcontrol,\tsuch\tas\tsupply\tand\tdemand\tand\tmarket\tspeculation.\tWe\tstrive\tto\nexecute\tlong-term\tsupply\tcontracts\tfor\tsuch\tmaterials\tat\tcompetitive\tpricing\twhen\tfeasible,\tand\twe\tcurrently\tbelieve\tthat\twe\thave\tadequate\taccess\tto\nraw\tmaterials\tsupplies\tto\tmeet\tthe\tneeds\tof\tour\toperations.\nGovernmental\tPrograms,\tIncentives\tand\tRegulations\nGlobally,\tthe\townership\tof\tour\tproducts\tby\tour\tcustomers\tis\timpacted\tby\tvarious\tgovernment\tcredits,\tincentives,\tand\tpolicies.\tOur\tbusiness\tand\nproducts\tare\talso\tsubject\tto\tnumerous\tgovernmental\tregulations\tthat\tvary\tamong\tjurisdictions.\nThe\toperation\tof\tour\tbusiness\tis\talso\timpacted\tby\tvarious\tgovernment\tprograms,\tincentives,\tand\tother\tarrangements.\tSee\tNote\t2,\t\nSummary\tof\nSignificant\tAccounting\tPolicies\n,\tto\tthe\tconsolidated\tfinancial\tstatements\tincluded\telsewhere\tin\tthis\tAnnual\tReport\ton\tForm\t10-K\tfor\tfurther\tdetails.\nPrograms\tand\tIncentives\nInflation\tReduction\tAct\nOn\tAugust\t16,\t2022,\tthe\tInflation\tReduction\tAct\tof\t2022\t(“IRA”)\twas\tenacted\tinto\tlaw\tand\tis\teffective\tfor\ttaxable\tyears\tbeginning\tafter\tDecember\n31,\t2022,\tand\tremains\tsubject\tto\tfuture\tguidance\treleases.\tThe\tIRA\tincludes\tmultiple\tincentives\tto\tpromote\tclean\tenergy,\telectric\tvehicles,\tbattery\tand\nenergy\tstorage\tmanufacture\tor\tpurchase,\tincluding\tthrough\tproviding\ttax\tcredits\tto\tconsumers.\tFor\texample,\tqualifying\tTesla\tcustomers\tmay\treceive\tup\nto\t$7,500\tin\tfederal\ttax\tcredits\tfor\tthe\tpurchase\tof\tqualified\telectric\tvehicles\tin\tthe\tU.S.\tthrough\t2032.\nAutomotive\tRegulatory\tCredits\nWe\tearn\ttradable\tcredits\tin\tthe\toperation\tof\tour\tbusiness\tunder\tvarious\tregulations\trelated\tto\tzero-emission\tvehicles\t(“ZEVs”),\tgreenhouse\tgas,\tfuel\neconomy\tand\tclean\tfuel.\tWe\tsell\tthese\tcredits\tto\tother\tregulated\tentities\twho\tcan\tuse\tthe\tcredits\tto\tcomply\twith\temission\tstandards\tand\tother\tregulatory\nrequirements.\tSales\tof\tthese\tcredits\tare\trecognized\twithin\tautomotive\tregulatory\tcredits\trevenue\tin\tour\tconsolidated\tstatements\tof\toperations\tincluded\nelsewhere\tin\tthis\tAnnual\tReport\ton\tForm\t10-K.\nEnergy\tStorage\tSystem\tIncentives\tand\tPolicies\nWhile\tthe\tregulatory\tregime\tfor\tenergy\tstorage\tprojects\tis\tstill\tunder\tdevelopment,\tthere\tare\tvarious\tpolicies,\tincentives\tand\tfinancial\tmechanisms\nat\tthe\tfederal,\tstate\tand\tlocal\tlevels\tthat\tsupport\tthe\tadoption\tof\tenergy\tstorage.\nFor\texample,\tenergy\tstorage\tsystems\tthat\tare\tcharged\tusing\tsolar\tenergy\tmay\tbe\teligible\tfor\tthe\tsolar\tenergy-related\tU.S.\tfederal\ttax\tcredits\ndescribed\tbelow.\tThe\tFederal\tEnergy\tRegulatory\tCommission\t(“FERC”)\thas\talso\ttaken\tsteps\tto\tenable\tthe\tparticipation\tof\tenergy\tstorage\tin\twholesale\nenergy\tmarkets.', 'Federal\tand\tstate\tlaws\tcan\timpose\tsubstantial\nrestrictions\ton\tthe\tutilization\tof\tnet\toperating\tloss\tand\ttax\tcredit\tcarry-forwards\tin\tthe\tevent\tof\tan\t“ownership\tchange,”\tas\tdefined\tin\tSection\t382\tof\tthe\nInternal\tRevenue\tCode.\tWe\thave\tdetermined\tthat\tno\tsignificant\tlimitation\twould\tbe\tplaced\ton\tthe\tutilization\tof\tour\tnet\toperating\tloss\tand\ttax\tcredit\tcarry-\nforwards\tdue\tto\tprior\townership\tchanges\tor\texpirations.\nAs\tof\tDecember\t31,\t2023,\twe\thad\tfederal\tresearch\tand\tdevelopment\ttax\tcredits\tof\t$\n1.10\n\tbillion,\tfederal\trenewable\tenergy\ttax\tcredits\tof\n$\n605\n\tmillion,\tand\tstate\tresearch\tand\tdevelopment\ttax\tcredits\tof\t$\n923\n\tmillion.\tMost\tof\tour\tstate\tresearch\tand\tdevelopment\ttax\tcredits\twere\tin\tthe\tstate\tof\nCalifornia.\tIf\tnot\tutilized,\tsome\tof\tthe\tfederal\ttax\tcredits\tmay\texpire\tin\tvarious\tamounts\tbeginning\tin\t\n2036\n.\tHowever,\tCalifornia\tresearch\tand\tdevelopment\ntax\tcredits\tcan\tbe\tcarried\tforward\tindefinitely.\n85']","Energy storage systems that are charged using solar energy may be eligible for the solar energy-related U.S. federal tax credits.  Pursuant to the IRA, Sections 48, 48E and 25D of the Internal Revenue Code (”IRC”) provide a tax credit between 6% and 50% of qualified expenditures for energy storage systems.  
",Standalone energy storage eligible for 6–50% tax credit on qualified expenditures under IRC §§ 48/48E/25D,1.0,0.99999999998,1.0
What solar energy system incentives are available under current law?,"['Such\ndevelopments\tcould\tnegatively\timpact\tdemand\tfor\tour\tvehicles,\tand\twe\tand\tour\tcustomers\tmay\thave\tto\tadjust\tto\tthem,\tincluding\tthrough\tpricing\nmodifications.\nIn\taddition,\tcertain\tgovernmental\trebates,\ttax\tcredits\tand\tother\tfinancial\tincentives\tthat\tare\tcurrently\tavailable\twith\trespect\tto\tour\tsolar\tand\tenergy\nstorage\tproduct\tbusinesses\tallow\tus\tto\tlower\tour\tcosts\tand\tencourage\tcustomers\tto\tbuy\tour\tproducts\tand\tinvestors\tto\tinvest\tin\tour\tsolar\tfinancing\tfunds.\nHowever,\tthese\tincentives\tmay\texpire\twhen\tthe\tallocated\tfunding\tis\texhausted,\treduced\tor\tterminated\tas\trenewable\tenergy\tadoption\trates\tincrease,\nsometimes\twithout\twarning.\tLikewise,\tin\tjurisdictions\twhere\tnet\tmetering\tis\tcurrently\tavailable,\tour\tcustomers\treceive\tbill\tcredits\tfrom\tutilities\tfor\tenergy\nthat\ttheir\tsolar\tenergy\tsystems\tgenerate\tand\texport\tto\tthe\tgrid\tin\texcess\tof\tthe\telectric\tload\tthey\tuse.\tThe\tbenefit\tavailable\tunder\tnet\tmetering\thas\tbeen\nor\thas\tbeen\tproposed\tto\tbe\treduced,\taltered\tor\teliminated\tin\tseveral\tjurisdictions,\tand\thas\talso\tbeen\tcontested\tand\tmay\tcontinue\tto\tbe\tcontested\tbefore\nthe\tFederal\tEnergy\tRegulatory\tCommission.\tAny\treductions\tor\tterminations\tof\tsuch\tincentives\tmay\tharm\tour\tbusiness,\tprospects,\tfinancial\tcondition\tand\noperating\tresults\tby\tmaking\tour\tproducts\tless\tcompetitive\tfor\tcustomers,\tincreasing\tour\tcost\tof\tcapital\tand\tadversely\timpacting\tour\tability\tto\tattract\ninvestment\tpartners\tand\tto\tform\tnew\tfinancing\tfunds\tfor\tour\tsolar\tand\tenergy\tstorage\tassets.\nFinally,\twe\tand\tour\tfund\tinvestors\tclaim\tthese\tU.S.\tfederal\ttax\tcredits\tand\tcertain\tstate\tincentives\tin\tamounts\tbased\ton\tindependently\tappraised\tfair\nmarket\tvalues\tof\tour\tsolar\tand\tenergy\tstorage\tsystems.\tSome\tgovernmental\tauthorities\thave\taudited\tsuch\tvalues\tand\tin\tcertain\tcases\thave\tdetermined\nthat\tthese\tvalues\tshould\tbe\tlower,\tand\tthey\tmay\tdo\tso\tagain\tin\tthe\tfuture.\tSuch\tdeterminations\tmay\tresult\tin\tadverse\ttax\tconsequences\tand/or\tour\nobligation\tto\tmake\tindemnification\tor\tother\tpayments\tto\tour\tfunds\tor\tfund\tinvestors.\nWe\tare\tsubject\tto\tevolving\tlaws\tand\tregulations\tthat\tcould\timpose\tsubstantial\tcosts,\tlegal\tprohibitions\tor\tunfavorable\tchanges\nupon\tour\toperations\tor\tproducts.\nAs\twe\tgrow\tour\tmanufacturing\toperations\tin\tadditional\tregions,\twe\tare\tor\twill\tbe\tsubject\tto\tcomplex\tenvironmental,\tmanufacturing,\thealth\tand\nsafety\tlaws\tand\tregulations\tat\tnumerous\tjurisdictional\tlevels\tin\tthe\tU.S.,\tChina,\tGermany\tand\tother\tlocations\tabroad,\tincluding\tlaws\trelating\tto\tthe\tuse,\nhandling,\tstorage,\trecycling,\tdisposal\tand/or\thuman\texposure\tto\thazardous\tmaterials,\tproduct\tmaterial\tinputs\tand\tpost-consumer\tproducts\tand\twith\nrespect\tto\tconstructing,\texpanding\tand\tmaintaining\tour\tfacilities.\tNew,\tor\tchanges\tin,\tenvironmental\tand\tclimate\tchange\tlaws,\tregulations\tor\trules\tcould\nalso\tlead\tto\tincreased\tcosts\tof\tcompliance,\tincluding\tremediations\tof\tany\tdiscovered\tissues,\tand\tchanges\tto\tour\toperations,\twhich\tmay\tbe\tsignificant,\tand\nany\tfailures\tto\tcomply\tcould\tresult\tin\tsignificant\texpenses,\tdelays\tor\tfines.\tIn\taddition,\tas\twe\thave\n25', 'Table\tof\tContents\nSolar\tEnergy\tSystem\tIncentives\tand\tPolicies\nU.S.\tfederal,\tstate\tand\tlocal\tgovernments\thave\testablished\tvarious\tpolicies,\tincentives\tand\tfinancial\tmechanisms\tto\treduce\tthe\tcost\tof\tsolar\tenergy\nand\tto\taccelerate\tthe\tadoption\tof\tsolar\tenergy.\tThese\tincentives\tinclude\ttax\tcredits,\tcash\tgrants,\ttax\tabatements\tand\trebates.\nIn\tparticular,\tpursuant\tto\tthe\tIRA,\tSections\t48,\t48E\tand\t25D\tof\tthe\tIRC\tprovides\ta\ttax\tcredit\tbetween\t6%\tand\t70%\tof\tqualified\tcommercial\tor\nresidential\texpenditures\tfor\tsolar\tenergy\tsystems,\twhich\tmay\tbe\tclaimed\tby\tour\tcustomers\tfor\tsystems\tthey\tpurchase,\tor\tby\tus\tfor\tarrangements\twhere\nwe\town\tthe\tsystems\tfor\tproperties\tthat\tmeet\tstatutory\trequirements.\tThese\ttax\tcredits\tare\tprimarily\tfor\tthe\tdirect\tbenefit\tof\tour\tcustomers\tand\tare\ncurrently\tscheduled\tto\tphase-out\tstarting\tin\t2032\tor\tlater.\nRegulations\nVehicle\tSafety\tand\tTesting\nIn\tthe\tU.S.,\tour\tvehicles\tare\tsubject\tto\tregulation\tby\tthe\tNational\tHighway\tTraffic\tSafety\tAdministration\t(“NHTSA”),\tincluding\tall\tapplicable\tFederal\nMotor\tVehicle\tSafety\tStandards\t(“FMVSS”)\tand\tthe\tNHTSA\tbumper\tstandard.\tNumerous\tFMVSS\tapply\tto\tour\tvehicles,\tsuch\tas\tcrash-worthiness\tand\noccupant\tprotection\trequirements.\tOur\tcurrent\tvehicles\tfully\tcomply\tand\twe\texpect\tthat\tour\tvehicles\tin\tthe\tfuture\twill\tfully\tcomply\twith\tall\tapplicable\nFMVSS\twith\tlimited\tor\tno\texemptions,\thowever,\tFMVSS\tare\tsubject\tto\tchange\tfrom\ttime\tto\ttime.\tAs\ta\tmanufacturer,\twe\tmust\tself-certify\tthat\tour\tvehicles\nmeet\tall\tapplicable\tFMVSS\tand\tthe\tNHTSA\tbumper\tstandard,\tor\totherwise\tare\texempt,\tbefore\tthe\tvehicles\tmay\tbe\timported\tor\tsold\tin\tthe\tU.S.\nWe\tare\talso\trequired\tto\tcomply\twith\tother\tfederal\tlaws\tadministered\tby\tNHTSA,\tincluding\tthe\tCorporate\tAverage\tFuel\tEconomy\tstandards,\tTheft\nPrevention\tAct\trequirements,\tlabeling\trequirements\tand\tother\tinformation\tprovided\tto\tcustomers\tin\twriting,\tEarly\tWarning\tReporting\trequirements\nregarding\twarranty\tclaims,\tfield\treports,\tdeath\tand\tinjury\treports\tand\tforeign\trecalls,\ta\tStanding\tGeneral\tOrder\trequiring\treports\tregarding\tcrashes\ninvolving\tvehicles\tequipped\twith\tadvanced\tdriver\tassistance\tsystems,\tand\tadditional\trequirements\tfor\tcooperating\twith\tcompliance\tand\tsafety\ninvestigations\tand\trecall\treporting.\tThe\tU.S.\tAutomobile\tInformation\tand\tDisclosure\tAct\talso\trequires\tmanufacturers\tof\tmotor\tvehicles\tto\tdisclose\tcertain\ninformation\tregarding\tthe\tmanufacturer’s\tsuggested\tretail\tprice,\toptional\tequipment\tand\tpricing.\tIn\taddition,\tfederal\tlaw\trequires\tinclusion\tof\tfuel\neconomy\tratings,\tas\tdetermined\tby\tthe\tU.S.\tDepartment\tof\tTransportation\tand\tthe\tEnvironmental\tProtection\tAgency\t(the\t“EPA”),\tand\tNew\tCar\nAssessment\tProgram\tratings\tas\tdetermined\tby\tNHTSA,\tif\tavailable.\nOur\tvehicles\tsold\toutside\tof\tthe\tU.S.\tare\tsubject\tto\tsimilar\tforeign\tcompliance,\tsafety,\tenvironmental\tand\tother\tregulations.\tMany\tof\tthose\nregulations\tare\tdifferent\tfrom\tthose\tapplicable\tin\tthe\tU.S.\tand\tmay\trequire\tredesign\tand/or\tretesting.\tSome\tof\tthose\tregulations\timpact\tor\tprevent\tthe\nrollout\tof\tnew\tvehicle\tfeatures.\nSelf-Driving\tVehicles\nGenerally,\tlaws\tpertaining\tto\tself-driving\tvehicles\tare\tevolving\tglobally,\tand\tin\tsome\tcases\tmay\tcreate\trestrictions\ton\tfeatures\tor\tvehicle\tdesigns\nthat\twe\tdevelop.\tWhile\tthere\tare\tcurrently\tno\tfederal\tU.S.', 'Energy\tStorage\tSystem\tIncentives\tand\tPolicies\nWhile\tthe\tregulatory\tregime\tfor\tenergy\tstorage\tprojects\tis\tstill\tunder\tdevelopment,\tthere\tare\tvarious\tpolicies,\tincentives\tand\tfinancial\tmechanisms\nat\tthe\tfederal,\tstate\tand\tlocal\tlevels\tthat\tsupport\tthe\tadoption\tof\tenergy\tstorage.\nFor\texample,\tenergy\tstorage\tsystems\tthat\tare\tcharged\tusing\tsolar\tenergy\tmay\tbe\teligible\tfor\tthe\tsolar\tenergy-related\tU.S.\tfederal\ttax\tcredits\ndescribed\tbelow.\tThe\tFederal\tEnergy\tRegulatory\tCommission\t(“FERC”)\thas\talso\ttaken\tsteps\tto\tenable\tthe\tparticipation\tof\tenergy\tstorage\tin\twholesale\nenergy\tmarkets.\tIn\taddition,\tCalifornia\tand\ta\tnumber\tof\tother\tstates\thave\tadopted\tprocurement\ttargets\tfor\tenergy\tstorage,\tand\tbehind-the-meter\tenergy\nstorage\tsystems\tqualify\tfor\tfunding\tunder\tthe\tCalifornia\tSelf\tGeneration\tIncentive\tProgram.\tOur\tcustomers\tprimarily\tbenefit\tdirectly\tunder\tthese\nprograms.\tIn\tcertain\tinstances\tour\tcustomers\tmay\ttransfer\tsuch\tcredits\tto\tus\tas\tcontract\tconsideration.\tIn\tsuch\ttransactions,\tthey\tare\tincluded\tas\ta\ncomponent\tof\tenergy\tgeneration\tand\tstorage\trevenues\tin\tour\tconsolidated\tstatements\tof\toperations\tincluded\telsewhere\tin\tthis\tAnnual\tReport\ton\tForm\n10-K.\nPursuant\tto\tthe\tIRA,\tunder\tSections\t48,\t48E\tand\t25D\tof\tthe\tInternal\tRevenue\tCode\t(”IRC”),\tstandalone\tenergy\tstorage\ttechnology\tis\teligible\tfor\ta\ttax\ncredit\tbetween\t6%\tand\t50%\tof\tqualified\texpenditures,\tregardless\tof\tthe\tsource\tof\tenergy,\twhich\tmay\tbe\tclaimed\tby\tour\tcustomers\tfor\tstorage\tsystems\nthey\tpurchase\tor\tby\tus\tfor\tarrangements\twhere\twe\town\tthe\tsystems.\tThese\ttax\tcredits\tare\tprimarily\tfor\tthe\tbenefit\tof\tour\tcustomers\tand\tare\tcurrently\nscheduled\tto\tphase-out\tstarting\tin\t2032\tor\tlater.\n9', 'Net\tInvestment\tin\tSales-type\tLeases\nNet\tinvestment\tin\tsales-type\tleases,\twhich\tis\tthe\tsum\tof\tthe\tpresent\tvalue\tof\tthe\tfuture\tcontractual\tlease\tpayments,\tis\tpresented\ton\tthe\nconsolidated\tbalance\tsheets\tas\ta\tcomponent\tof\tPrepaid\texpenses\tand\tother\tcurrent\tassets\tfor\tthe\tcurrent\tportion\tand\tas\tOther\tnon-current\tassets\tfor\tthe\nlong-term\tportion.\tLease\treceivables\trelating\tto\tsales-type\tleases\tare\tpresented\ton\tthe\tconsolidated\tbalance\tsheets\tas\tfollows\t(in\tmillions):\nDecember\t31,\t2023\nDecember\t31,\t2022\nGross\tlease\treceivables\n$\n780\n\t\n$\n837\n\t\nUnearned\tinterest\tincome\n(\n78\n)\n(\n95\n)\nAllowance\tfor\texpected\tcredit\tlosses\n(\n6\n)\n(\n4\n)\nNet\tinvestment\tin\tsales-type\tleases\n$\n696\n\t\n$\n738\n\t\n\t\nReported\tas:\nPrepaid\texpenses\tand\tother\tcurrent\tassets\n$\n189\n\t\n$\n164\n\t\nOther\tnon-current\tassets\n507\n\t\n574\n\t\nNet\tinvestment\tin\tsales-type\tleases\n$\n696\n\t\n$\n738\n\t\nLease\tPass-Through\tFinancing\tObligation\nAs\tof\tDecember\t31,\t2023,\twe\thave\t\nfive\n\ttransactions\treferred\tto\tas\t“lease\tpass-through\tfund\tarrangements.”\tUnder\tthese\tarrangements,\tour\twholly\nowned\tsubsidiaries\tfinance\tthe\tcost\tof\tsolar\tenergy\tsystems\twith\tinvestors\tthrough\tarrangements\tcontractually\tstructured\tas\tmaster\tleases\tfor\tan\tinitial\nterm\tranging\tbetween\t\n10\n\tand\t\n25\n\tyears.\tThese\tsolar\tenergy\tsystems\tare\tsubject\tto\tlease\tor\tPPAs\twith\tcustomers\twith\tan\tinitial\tterm\tnot\texceeding\t\n25\nyears.\nUnder\ta\tlease\tpass-through\tfund\tarrangement,\tthe\tinvestor\tmakes\ta\tlarge\tupfront\tpayment\tto\tthe\tlessor,\twhich\tis\tone\tof\tour\tsubsidiaries,\tand\tin\nsome\tcases,\tsubsequent\tperiodic\tpayments.\t\nAs\tof\tDecember\t31,\t2023,\tthe\tfuture\tminimum\tmaster\tlease\tpayments\tto\tbe\treceived\tfrom\tinvestors,\tfor\neach\tof\tthe\tnext\tfive\tyears\tand\tthereafter,\twere\tas\tfollows\t(in\tmillions):\n2024\n$\n18\n\t\n2025\n27\n\t\n2026\n28\n\t\n2027\n29\n\t\n2028\n29\n\t\nThereafter\n337\n\t\nTotal\n$\n468\n\t\nNote\t13\t–\t\nEquity\tIncentive\tPlans\nIn\tJune\t2019,\twe\tadopted\tthe\t2019\tEquity\tIncentive\tPlan\t(the\t“2019\tPlan”).\tThe\t2019\tPlan\tprovides\tfor\tthe\tgrant\tof\tstock\toptions,\trestricted\tstock,\nRSUs,\tstock\tappreciation\trights,\tperformance\tunits\tand\tperformance\tshares\tto\tour\temployees,\tdirectors\tand\tconsultants.\tStock\toptions\tgranted\tunder\tthe\n2019\tPlan\tmay\tbe\teither\tincentive\tstock\toptions\tor\tnonstatutory\tstock\toptions.\tIncentive\tstock\toptions\tmay\tonly\tbe\tgranted\tto\tour\temployees.\nNonstatutory\tstock\toptions\tmay\tbe\tgranted\tto\tour\temployees,\tdirectors\tand\tconsultants.\tGenerally,\tour\tstock\toptions\tand\tRSUs\tvest\tover\t\nfour\tyears\n\tand\nour\tstock\toptions\tare\texercisable\tover\ta\tmaximum\tperiod\tof\t\n10\n\tyears\tfrom\ttheir\tgrant\tdates.\tVesting\ttypically\tterminates\twhen\tthe\temployment\tor\nconsulting\trelationship\tends.\nAs\tof\tDecember\t31,\t2023,\t\n131.1\n\tmillion\tshares\twere\treserved\tand\tavailable\tfor\tissuance\tunder\tthe\t2019\tPlan.\n80', 'Energy\tGeneration\tand\tStorage\tSegment\nEnergy\tGeneration\tand\tStorage\tSales\nEnergy\tgeneration\tand\tstorage\tsales\trevenue\tconsists\tof\tthe\tsale\tof\tsolar\tenergy\tsystems\tand\tenergy\tstorage\tsystems\tto\tresidential,\tsmall\ncommercial,\tlarge\tcommercial\tand\tutility\tgrade\tcustomers.\tSales\tof\tsolar\tenergy\tsystems\tto\tresidential\tand\tsmall\tscale\tcommercial\tcustomers\tconsist\tof\nthe\tengineering,\tdesign\tand\tinstallation\tof\tthe\tsystem.\tResidential\tand\tsmall\tscale\tcommercial\tcustomers\tpay\tthe\tfull\tpurchase\tprice\tof\tthe\tsolar\tenergy\nsystem\tupfront.\tRevenue\tfor\tthe\tdesign\tand\tinstallation\tobligation\tis\trecognized\twhen\tcontrol\ttransfers,\twhich\tis\twhen\twe\tinstall\ta\tsolar\tenergy\tsystem\nand\tthe\tsystem\tpasses\tinspection\tby\tthe\tutility\tor\tthe\tauthority\thaving\tjurisdiction.\tSales\tof\tenergy\tstorage\tsystems\tto\tresidential\tand\tsmall\tscale\ncommercial\tcustomers\tconsist\tof\tthe\tinstallation\tof\tthe\tenergy\tstorage\tsystem\tand\trevenue\tis\trecognized\twhen\tcontrol\ttransfers,\twhich\tis\twhen\tthe\nproduct\thas\tbeen\tdelivered\tor,\tif\twe\tare\tperforming\tinstallation,\twhen\tinstalled\tand\tcommissioned.\tPayment\tfor\tsuch\tstorage\tsystems\tis\tmade\tupon\ninvoice\tor\tin\taccordance\twith\tpayment\tterms\tcustomary\tto\tthe\tbusiness.\nFor\tlarge\tcommercial\tand\tutility\tgrade\tenergy\tstorage\tsystem\tsales\twhich\tconsist\tof\tthe\tengineering,\tdesign\tand\tinstallation\tof\tthe\tsystem,\ncustomers\tmake\tmilestone\tpayments\tthat\tare\tconsistent\twith\tcontract-specific\tphases\tof\ta\tproject.\tRevenue\tfrom\tsuch\tcontracts\tis\trecognized\tover\ttime\nusing\tthe\tpercentage\tof\tcompletion\tmethod\tbased\ton\tcost\tincurred\tas\ta\tpercentage\tof\ttotal\testimated\tcontract\tcosts\tfor\tenergy\tstorage\tsystem\tsales.\nIn\tinstances\twhere\tthere\tare\tmultiple\tperformance\tobligations\tin\ta\tsingle\tcontract,\twe\tallocate\tthe\tconsideration\tto\tthe\tvarious\tobligations\tin\tthe\ncontract\tbased\ton\tthe\trelative\tstandalone\tselling\tprice\tmethod.\tStandalone\tselling\tprices\tare\testimated\tbased\ton\testimated\tcosts\tplus\tmargin\tor\tby\tusing\nmarket\tdata\tfor\tcomparable\tproducts.\tCosts\tto\tobtain\ta\tcontract\trelate\tmainly\tto\tcommissions\tpaid\tto\tour\tsales\tpersonnel\trelated\tto\tthe\tsale\tof\tenergy\nstorage\tsystems.\tAs\tour\tcontract\tcosts\trelated\tto\tenergy\tstorage\tsystem\tsales\tare\ttypically\tfulfilled\twithin\tone\tyear,\tthe\tcosts\tto\tobtain\ta\tcontract\tare\nexpensed\tas\tincurred.\nAs\tpart\tof\tour\tenergy\tstorage\tsystem\tcontracts,\twe\tmay\tprovide\tthe\tcustomer\twith\tperformance\tguarantees\tthat\twarrant\tthat\tthe\tunderlying\tsystem\nwill\tmeet\tor\texceed\tthe\tminimum\tenergy\tperformance\trequirements\tspecified\tin\tthe\tcontract.\tIf\tan\tenergy\tstorage\tsystem\tdoes\tnot\tmeet\tthe\nperformance\tguarantee\trequirements,\twe\tmay\tbe\trequired\tto\tpay\tliquidated\tdamages.\tOther\tforms\tof\tvariable\tconsideration\trelated\tto\tour\tlarge\ncommercial\tand\tutility\tgrade\tenergy\tstorage\tsystem\tcontracts\tinclude\tvariable\tcustomer\tpayments\tthat\twill\tbe\tmade\tbased\ton\tour\tenergy\tmarket\nparticipation\tactivities.\tSuch\tguarantees\tand\tvariable\tcustomer\tpayments\trepresent\ta\tform\tof\tvariable\tconsideration\tand\tare\testimated\tat\tcontract\ninception\tat\ttheir\tmost\tlikely\tamount\tand\tupdated\tat\tthe\tend\tof\teach\treporting\tperiod\tas\tadditional\tperformance\tdata\tbecomes\tavailable.\tSuch\testimates\nare\tincluded\tin\tthe\ttransaction\tprice\tonly\tto\tthe\textent\tthat\tit\tis\tprobable\ta\tsignificant\treversal\tof\trevenue\twill\tnot\toccur.\nWe\trecord\tas\tdeferred\trevenue\tany\tnon-refundable\tamounts\tthat\tare\tcollected\tfrom\tcustomers\trelated\tto\tfees\tcharged\tfor\tprepayments,\twhich\tis\nrecognized\tas\trevenue\tratably\tover\tthe\trespective\tcustomer\tcontract\tterm.\tAs\tof\tDecember\t31,\t2023\tand\t2022,\tdeferred\trevenue\trelated\tto\tsuch\ncustomer\tpayments\tamounted\tto\t$\n1.60\n\tbillion\tand\t$\n863\n\tmillion,\trespectively,\tmainly\tdue\tto\tcontractual\tpayment\tterms.']","The provided text does not contain information about solar energy system incentives available under current law.  
",Solar energy systems eligible for 6–70% tax credit on qualified expenditures under IRC §§ 48/48E/25D,,0.999999999975,
What key regulations impact Tesla’s vehicle safety and testing?,"['Table\tof\tContents\nincreased\tour\temployee\theadcount\tand\toperations,\twe\tare\tand\tmay\tcontinue\tto\tbe\tsubject\tto\tincreased\tscrutiny,\tincluding\tlitigation\tand\tgovernment\ninvestigations,\tthat\twe\twill\tneed\tto\tdefend\tagainst.\tIf\twe\tare\tunable\tto\tsuccessfully\tdefend\tourselves\tin\tsuch\tlitigation\tor\tgovernment\tinvestigations,\tit\nmay\tharm\tour\tbrand,\tability\tto\tattract\tand\tretain\tqualified\temployees,\tbusiness\tand\tfinancial\tcondition.\tWe\tare\talso\tsubject\tto\tlaws\tand\tregulations\napplicable\tto\tthe\tsupply,\tmanufacture,\timport,\tsale,\tservice\tand\tperformance\tof\tour\tproducts\tboth\tdomestically\tand\tabroad.\tFor\texample,\tin\tcountries\noutside\tof\tthe\tU.S.,\twe\tare\trequired\tto\tmeet\tstandards\trelating\tto\tvehicle\tsafety,\tfuel\teconomy\tand\temissions\tthat\tare\toften\tmaterially\tdifferent\tfrom\nequivalent\trequirements\tin\tthe\tU.S.,\tthus\tresulting\tin\tadditional\tinvestment\tinto\tthe\tvehicles\tand\tsystems\tto\tensure\tregulatory\tcompliance\tin\tall\tcountries.\nThis\tprocess\tmay\tinclude\tofficial\treview\tand\tcertification\tof\tour\tvehicles\tby\tforeign\tregulatory\tagencies\tprior\tto\tmarket\tentry,\tas\twell\tas\tcompliance\twith\nforeign\treporting\tand\trecall\tmanagement\tsystems\trequirements.\nIn\tparticular,\twe\toffer\tin\tour\tvehicles\tin\tcertain\tmarkets\tAutopilot\tand\tFSD\tCapability\tfeatures\tthat\ttoday\tassist\tdrivers\twith\tcertain\ttedious\tand\npotentially\tdangerous\taspects\tof\troad\ttravel,\tbut\twhich\tcurrently\trequire\tdrivers\tto\tremain\tfully\tengaged\tin\tthe\tdriving\toperation.\tWe\tare\tcontinuing\tto\ndevelop\tour\tAutopilot\tand\tFSD\tCapability\ttechnology.\tThere\tare\ta\tvariety\tof\tinternational,\tfederal\tand\tstate\tregulations\tthat\tmay\tapply\tto,\tand\tmay\nadversely\taffect,\tthe\tdesign\tand\tperformance,\tsale,\tmarketing,\tregistration\tand\toperation\tof\tAutopilot\tand\tFSD\tCapability,\tand\tfuture\tcapability,\tincluding\nfull\tself-driving\tvehicles\tthat\tmay\tnot\tbe\toperated\tby\ta\thuman\tdriver.\tThis\tincludes\tmany\texisting\tvehicle\tstandards\tthat\twere\tnot\toriginally\tintended\tto\napply\tto\tvehicles\tthat\tmay\tnot\tbe\toperated\tby\ta\thuman\tdriver.\tSuch\tregulations\tcontinue\tto\trapidly\tchange,\twhich\tincreases\tthe\tlikelihood\tof\ta\tpatchwork\nof\tcomplex\tor\tconflicting\tregulations,\tor\tmay\tdelay,\trestrict\tor\tprohibit\tthe\tavailability\tof\tcertain\tfunctionalities\tand\tvehicle\tdesigns,\twhich\tcould\tadversely\naffect\tour\tbusiness.\nFinally,\tas\ta\tmanufacturer,\tinstaller\tand\tservice\tprovider\twith\trespect\tto\tsolar\tgeneration\tand\tenergy\tstorage\tsystems,\ta\tsupplier\tof\telectricity\ngenerated\tand\tstored\tby\tcertain\tof\tthe\tsolar\tenergy\tand\tenergy\tstorage\tsystems\twe\tinstall\tfor\tcustomers,\tand\ta\tprovider\tof\tgrid\tservices\tthrough\tvirtual\npower\tplant\tmodels,\twe\tare\timpacted\tby\tfederal,\tstate\tand\tlocal\tregulations\tand\tpolicies\tconcerning\tthe\timport\tor\texport\tof\tcomponents,\telectricity\npricing,\tthe\tinterconnection\tof\telectricity\tgeneration\tand\tstorage\tequipment\twith\tthe\telectrical\tgrid\tand\tthe\tsale\tof\telectricity\tgenerated\tby\tthird\tparty-\nowned\tsystems.\tIf\tregulations\tand\tpolicies\tare\tintroduced\tthat\tadversely\timpact\tthe\timport\tor\texport\tof\tcomponents,\tor\tthe\tinterconnection,\tmaintenance\nor\tuse\tof\tour\tsolar\tand\tenergy\tstorage\tsystems,\tthey\tcould\tdeter\tpotential\tcustomers\tfrom\tpurchasing\tour\tsolar\tand\tenergy\tstorage\tproducts\tand\nservices,\tthreaten\tthe\teconomics\tof\tour\texisting\tcontracts\tand\tcause\tus\tto\tcease\tsolar\tand\tenergy\tstorage\tsystem\tsales\tand\tservices\tin\tthe\trelevant\njurisdictions,\twhich\tmay\tharm\tour\tbusiness,\tfinancial\tcondition\tand\toperating\tresults.\nAny\tfailure\tby\tus\tto\tcomply\twith\ta\tvariety\tof\tU.S.\tand\tinternational\tprivacy\tand\tconsumer\tprotection\tlaws\tmay\tharm\tus.', 'For\texample,\twe\tmonitor\ttax\tlegislation\tchanges\ton\ta\tglobal\tbasis,\tincluding\tchanges\tarising\tas\ta\tresult\tof\tthe\tOrganization\tfor\tEconomic\tCooperation\tand\nDevelopment’s\tmulti-jurisdictional\tplan\tof\taction\tto\taddress\tbase\terosion\tand\tprofit\tshifting.\tSuch\tconditions\tmay\tincrease\tour\tcosts,\timpact\tour\tability\tto\nsell\tour\tproducts\tand\trequire\tsignificant\tmanagement\tattention,\tand\tmay\tharm\tour\tbusiness\tif\twe\tare\tunable\tto\tmanage\tthem\teffectively.\nOur\tbusiness\tmay\tsuffer\tif\tour\tproducts\tor\tfeatures\tcontain\tdefects,\tfail\tto\tperform\tas\texpected\tor\ttake\tlonger\tthan\texpected\tto\nbecome\tfully\tfunctional.\nIf\tour\tproducts\tcontain\tdesign\tor\tmanufacturing\tdefects,\twhether\trelating\tto\tour\tsoftware\tor\thardware,\tthat\tcause\tthem\tnot\tto\tperform\tas\tdesigned\nor\tintended\tor\tthat\trequire\trepair,\tor\tcertain\tfeatures\tof\tour\tvehicles\tsuch\tas\tnew\tAutopilot\tor\tFSD\tCapability\tfeatures\ttake\tlonger\tthan\texpected\tto\nbecome\tenabled,\tare\tlegally\trestricted\tor\tbecome\tsubject\tto\tonerous\tregulation,\tour\tability\tto\tdevelop,\tmarket\tand\tsell\tour\tproducts\tand\tservices\tmay\tbe\nharmed,\tand\twe\tmay\texperience\tdelivery\tdelays,\tproduct\trecalls,\tallegations\tof\tproduct\tliability,\tbreach\tof\twarranty\tand\trelated\tconsumer\tprotection\nclaims\tand\tsignificant\twarranty\tand\tother\texpenses.\tWhile\twe\tare\tcontinuously\tworking\tto\tdevelop\tand\timprove\tour\tproducts’\tcapability\tand\tperformance,\nthere\tis\tno\tguarantee\tthat\tany\tincremental\tchanges\tin\tthe\tspecific\tsoftware\tor\tequipment\twe\tdeploy\tin\tour\tvehicles\tover\ttime\twill\tnot\tresult\tin\tinitial\nfunctional\tdisparities\tfrom\tprior\titerations\tor\twill\tperform\tas\tforecast\tin\tthe\ttimeframe\twe\tanticipate,\tor\tat\tall.\tAlthough\twe\tattempt\tto\tremedy\tany\tissues\nwe\tobserve\tin\tour\tproducts\tas\teffectively\tand\trapidly\tas\tpossible,\tsuch\tefforts\tmay\tnot\tbe\ttimely,\tmay\thamper\tproduction\tor\tmay\tnot\tcompletely\tsatisfy\nour\tcustomers.\tWe\thave\tperformed,\tand\tcontinue\tto\tperform,\textensive\tinternal\ttesting\ton\tour\tproducts\tand\tfeatures,\tthough,\tlike\tthe\trest\tof\tthe\tindustry,\nwe\tcurrently\thave\ta\tlimited\tframe\tof\treference\tby\twhich\tto\tevaluate\tcertain\taspects\tof\ttheir\tlong-term\tquality,\treliability,\tdurability\tand\tperformance\ncharacteristics,\tincluding\texposure\tto\tor\tconsequence\tof\texternal\tattacks.\tWhile\twe\tattempt\tto\tidentify\tand\taddress\tor\tremedy\tdefects\twe\tidentify\tpre-\nproduction\tand\tsale,\tthere\tmay\tbe\tlatent\tdefects\tthat\twe\tmay\tbe\tunable\tto\tdetect\tor\tcontrol\tfor\tin\tour\tproducts,\tand\tthereby\taddress,\tprior\tto\ttheir\tsale\tto\nor\tinstallation\tfor\tcustomers.\n18', 'Our\tvehicles\tsold\toutside\tof\tthe\tU.S.\tare\tsubject\tto\tsimilar\tforeign\tcompliance,\tsafety,\tenvironmental\tand\tother\tregulations.\tMany\tof\tthose\nregulations\tare\tdifferent\tfrom\tthose\tapplicable\tin\tthe\tU.S.\tand\tmay\trequire\tredesign\tand/or\tretesting.\tSome\tof\tthose\tregulations\timpact\tor\tprevent\tthe\nrollout\tof\tnew\tvehicle\tfeatures.\nSelf-Driving\tVehicles\nGenerally,\tlaws\tpertaining\tto\tself-driving\tvehicles\tare\tevolving\tglobally,\tand\tin\tsome\tcases\tmay\tcreate\trestrictions\ton\tfeatures\tor\tvehicle\tdesigns\nthat\twe\tdevelop.\tWhile\tthere\tare\tcurrently\tno\tfederal\tU.S.\tregulations\tpertaining\tspecifically\tto\tself-driving\tvehicles\tor\tself-driving\tequipment,\tNHTSA\thas\npublished\trecommended\tguidelines\ton\tself-driving\tvehicles,\tapart\tfrom\tthe\tFMVSS\tand\tmanufacturer\treporting\tobligations,\tand\tretains\tthe\tauthority\tto\ninvestigate\tand/or\ttake\taction\ton\tthe\tsafety\tor\tcompliance\tof\tany\tvehicle,\tequipment\tor\tfeatures\toperating\ton\tpublic\troads.\tCertain\tU.S.\tstates\talso\thave\nlegal\trestrictions\ton\tthe\toperation,\tregistration\tor\tlicensure\tof\tself-driving\tvehicles,\tand\tmany\tother\tstates\tare\tconsidering\tthem.\tThis\tregulatory\npatchwork\tincreases\tthe\tlegal\tcomplexity\twith\trespect\tto\tself-driving\tvehicles\tin\tthe\tU.S.\nIn\tmarkets\tthat\tfollow\tthe\tregulations\tof\tthe\tUnited\tNations\tEconomic\tCommission\tfor\tEurope\t(“\nECE\tmarkets\n”),\tsome\trequirements\trestrict\tthe\ndesign\tof\tadvanced\tdriver-assistance\tor\tself-driving\tfeatures,\twhich\tcan\tcompromise\tor\tprevent\ttheir\tuse\tentirely.\tOther\tapplicable\tlaws,\tboth\tcurrent\tand\nproposed,\tmay\thinder\tthe\tpath\tand\ttimeline\tto\tintroducing\tself-driving\tvehicles\tfor\tsale\tand\tuse\tin\tthe\tmarkets\twhere\tthey\tapply.\nOther\tkey\tmarkets,\tincluding\tChina,\tcontinue\tto\tconsider\tself-driving\tregulation.\tAny\timplemented\tregulations\tmay\tdiffer\tmaterially\tfrom\tthe\tU.S.\nand\tECE\tmarkets,\twhich\tmay\tfurther\tincrease\tthe\tlegal\tcomplexity\tof\tself-driving\tvehicles\tand\tlimit\tor\tprevent\tcertain\tfeatures.\n10', 'Any\tunfavorable\tultimate\toutcome\tfor\tTesla\tmay\thave\ta\tnegative\timpact\ton\tthe\tperception\tof\tTesla’s\ttreatment\tof\tour\temployees.\tFurthermore,\twe\tare\ndirectly\tor\tindirectly\tdependent\tupon\tcompanies\twith\tunionized\twork\tforces,\tsuch\tas\tsuppliers\tand\ttrucking\tand\tfreight\tcompanies.\tAny\twork\tstoppages\tor\nstrikes\torganized\tby\tsuch\tunions\tcould\tdelay\tthe\tmanufacture\tand\tsale\tof\tour\tproducts\tand\tmay\tharm\tour\tbusiness\tand\toperating\tresults.\nWe\tmay\tchoose\tto\tor\tbe\tcompelled\tto\tundertake\tproduct\trecalls\tor\ttake\tother\tsimilar\tactions.\nAs\ta\tmanufacturing\tcompany,\twe\tmust\tmanage\tthe\trisk\tof\tproduct\trecalls\twith\trespect\tto\tour\tproducts.\tRecalls\tfor\tour\tvehicles\thave\tresulted\tfrom\nvarious\thardware\tand\tsoftware-related\tsafety\tconcerns\tor\tnon-compliance\tdeterminations.\tIn\taddition\tto\trecalls\tinitiated\tby\tus\tfor\tvarious\tcauses,\ttesting\nof\tor\tinvestigations\tinto\tour\tproducts\tby\tgovernment\tregulators\tor\tindustry\tgroups\tmay\tcompel\tus\tto\tinitiate\tproduct\trecalls\tor\tmay\tresult\tin\tnegative\npublic\tperceptions\tabout\tthe\tsafety\tof\tour\tproducts,\teven\tif\twe\tdisagree\twith\tthe\tdefect\tdetermination\tor\thave\tdata\tthat\tcontradicts\tit.\tIn\tthe\tfuture,\twe\nmay\tvoluntarily\tor\tinvoluntarily\tinitiate\trecalls\tif\tany\tof\tour\tproducts\tare\tdetermined\tby\tus\tor\ta\tregulator\tto\tcontain\ta\tsafety\tdefect\tor\tbe\tnoncompliant\nwith\tapplicable\tlaws\tand\tregulations,\tsuch\tas\tU.S.\tFederal\tMotor\tVehicle\tSafety\tStandards.\tSuch\trecalls,\twhether\tvoluntary\tor\tinvoluntary\tor\tcaused\tby\nsystems\tor\tcomponents\tengineered\tor\tmanufactured\tby\tus\tor\tour\tsuppliers,\tcould\tresult\tin\tsignificant\texpense,\tsupply\tchain\tcomplications\tand\tservice\nburdens,\tand\tmay\tharm\tour\tbrand,\tbusiness,\tprospects,\tfinancial\tcondition\tand\toperating\tresults.\nOur\tcurrent\tand\tfuture\twarranty\treserves\tmay\tbe\tinsufficient\tto\tcover\tfuture\twarranty\tclaims.\nWe\tprovide\ta\tmanufacturer’s\twarranty\ton\tall\tnew\tand\tused\tTesla\tvehicles\twe\tsell\tdirectly\tto\tcustomers.\tWe\talso\tprovide\tcertain\twarranties\twith\nrespect\tto\tthe\tenergy\tgeneration\tand\tstorage\tsystems\twe\tsell,\tincluding\ton\ttheir\tinstallation\tand\tmaintenance.\tFor\tcomponents\tnot\tmanufactured\tby\tus,\nwe\tgenerally\tpass\tthrough\tto\tour\tcustomers\tthe\tapplicable\tmanufacturers’\twarranties,\tbut\tmay\tretain\tsome\twarranty\tresponsibilities\tfor\tsome\tor\tall\tof\tthe\nlife\tof\tsuch\tcomponents.\tAs\tpart\tof\tour\tenergy\tgeneration\tand\tstorage\tsystem\tcontracts,\twe\tmay\tprovide\tthe\tcustomer\twith\tperformance\tguarantees\tthat\nguarantee\tthat\tthe\tunderlying\tsystem\twill\tmeet\tor\texceed\tthe\tminimum\tenergy\tgeneration\tor\tother\tenergy\tperformance\trequirements\tspecified\tin\tthe\ncontract.\tUnder\tthese\tperformance\tguarantees,\twe\tgenerally\tbear\tthe\trisk\tof\telectricity\tproduction\tor\tother\tperformance\tshortfalls,\tincluding\tin\tsome\ncases\tshortfalls\tcaused\tby\tfailures\tin\tcomponents\tfrom\tthird\tparty\tmanufacturers.\tThese\trisks\tare\texacerbated\tin\tthe\tevent\tsuch\tmanufacturers\tcease\noperations\tor\tfail\tto\thonor\ttheir\twarranties.\n22', 'Table\tof\tContents\nWe\tmay\tbe\trequired\tto\tdefend\tor\tinsure\tagainst\tproduct\tliability\tclaims.\nThe\tautomobile\tindustry\tgenerally\texperiences\tsignificant\tproduct\tliability\tclaims,\tand\tas\tsuch\twe\tface\tthe\trisk\tof\tsuch\tclaims\tin\tthe\tevent\tour\nvehicles\tdo\tnot\tperform\tor\tare\tclaimed\tto\tnot\thave\tperformed\tas\texpected.\tAs\tis\ttrue\tfor\tother\tautomakers,\tour\tvehicles\thave\tbeen\tinvolved\tand\twe\nexpect\tin\tthe\tfuture\twill\tbe\tinvolved\tin\taccidents\tresulting\tin\tdeath\tor\tpersonal\tinjury,\tand\tsuch\taccidents\twhere\tAutopilot,\tEnhanced\tAutopilot\tor\tFSD\nCapability\tfeatures\tare\tengaged\tare\tthe\tsubject\tof\tsignificant\tpublic\tattention,\tespecially\tin\tlight\tof\tNHTSA’s\tStanding\tGeneral\tOrder\trequiring\treports\nregarding\tcrashes\tinvolving\tvehicles\twith\tadvanced\tdriver\tassistance\tsystems.\tWe\thave\texperienced,\tand\twe\texpect\tto\tcontinue\tto\tface,\tclaims\tand\nregulatory\tscrutiny\tarising\tfrom\tor\trelated\tto\tmisuse\tor\tclaimed\tfailures\tor\talleged\tmisrepresentations\tof\tsuch\tnew\ttechnologies\tthat\twe\tare\tpioneering.\tIn\naddition,\tthe\tbattery\tpacks\tthat\twe\tproduce\tmake\tuse\tof\tlithium-ion\tcells.\tOn\trare\toccasions,\tlithium-ion\tcells\tcan\trapidly\trelease\tthe\tenergy\tthey\tcontain\nby\tventing\tsmoke\tand\tflames\tin\ta\tmanner\tthat\tcan\tignite\tnearby\tmaterials\tas\twell\tas\tother\tlithium-ion\tcells.\tWhile\twe\thave\tdesigned\tour\tbattery\tpacks\tto\npassively\tcontain\tany\tsingle\tcell’s\trelease\tof\tenergy\twithout\tspreading\tto\tneighboring\tcells,\tthere\tcan\tbe\tno\tassurance\tthat\ta\tfield\tor\ttesting\tfailure\tof\tour\nvehicles\tor\tother\tbattery\tpacks\tthat\twe\tproduce\twill\tnot\toccur,\tin\tparticular\tdue\tto\ta\thigh-speed\tcrash.\tLikewise,\tas\tour\tsolar\tenergy\tsystems\tand\tenergy\nstorage\tproducts\tgenerate\tand\tstore\telectricity,\tthey\thave\tthe\tpotential\tto\tfail\tor\tcause\tinjury\tto\tpeople\tor\tproperty.\tAny\tproduct\tliability\tclaim\tmay\nsubject\tus\tto\tlawsuits\tand\tsubstantial\tmonetary\tdamages,\tproduct\trecalls\tor\tredesign\tefforts,\tand\teven\ta\tmeritless\tclaim\tmay\trequire\tus\tto\tdefend\tit,\tall\tof\nwhich\tmay\tgenerate\tnegative\tpublicity\tand\tbe\texpensive\tand\ttime-consuming.\tIn\tmost\tjurisdictions,\twe\tgenerally\tself-insure\tagainst\tthe\trisk\tof\tproduct\nliability\tclaims\tfor\tvehicle\texposure,\tmeaning\tthat\tany\tproduct\tliability\tclaims\twill\tlikely\thave\tto\tbe\tpaid\tfrom\tcompany\tfunds\tand\tnot\tby\tinsurance.\nWe\twill\tneed\tto\tmaintain\tpublic\tcredibility\tand\tconfidence\tin\tour\tlong-term\tbusiness\tprospects\tin\torder\tto\tsucceed.\nIn\torder\tto\tmaintain\tand\tgrow\tour\tbusiness,\twe\tmust\tmaintain\tcredibility\tand\tconfidence\tamong\tcustomers,\tsuppliers,\tanalysts,\tinvestors,\tratings\nagencies\tand\tother\tparties\tin\tour\tlong-term\tfinancial\tviability\tand\tbusiness\tprospects.\tMaintaining\tsuch\tconfidence\tmay\tbe\tchallenging\tdue\tto\tour\tlimited\noperating\thistory\trelative\tto\testablished\tcompetitors;\tcustomer\tunfamiliarity\twith\tour\tproducts;\tany\tdelays\twe\tmay\texperience\tin\tscaling\tmanufacturing,\ndelivery\tand\tservice\toperations\tto\tmeet\tdemand;\tcompetition\tand\tuncertainty\tregarding\tthe\tfuture\tof\telectric\tvehicles\tor\tour\tother\tproducts\tand\tservices;\nour\tquarterly\tproduction\tand\tsales\tperformance\tcompared\twith\tmarket\texpectations;\tand\tother\tfactors\tincluding\tthose\tover\twhich\twe\thave\tno\tcontrol.\tIn\nparticular,\tTesla’s\tproducts,\tbusiness,\tresults\tof\toperations,\tand\tstatements\tand\tactions\tof\tTesla\tand\tits\tmanagement\tare\tsubject\tto\tsignificant\tamounts\tof\ncommentary\tby\ta\trange\tof\tthird\tparties.']","Tesla's vehicle safety and testing are impacted by regulations such as those pertaining to vehicle safety, fuel economy, and emissions, which vary in different countries and may require redesigns and retesting.  
","NHTSA’s FMVSS crash‑worthiness, occupant protection, bumper standards, self‑certification requirements",,0.8041666666465626,1.0
Which NHTSA standards must Tesla comply with?,"['Table\tof\tContents\nincreased\tour\temployee\theadcount\tand\toperations,\twe\tare\tand\tmay\tcontinue\tto\tbe\tsubject\tto\tincreased\tscrutiny,\tincluding\tlitigation\tand\tgovernment\ninvestigations,\tthat\twe\twill\tneed\tto\tdefend\tagainst.\tIf\twe\tare\tunable\tto\tsuccessfully\tdefend\tourselves\tin\tsuch\tlitigation\tor\tgovernment\tinvestigations,\tit\nmay\tharm\tour\tbrand,\tability\tto\tattract\tand\tretain\tqualified\temployees,\tbusiness\tand\tfinancial\tcondition.\tWe\tare\talso\tsubject\tto\tlaws\tand\tregulations\napplicable\tto\tthe\tsupply,\tmanufacture,\timport,\tsale,\tservice\tand\tperformance\tof\tour\tproducts\tboth\tdomestically\tand\tabroad.\tFor\texample,\tin\tcountries\noutside\tof\tthe\tU.S.,\twe\tare\trequired\tto\tmeet\tstandards\trelating\tto\tvehicle\tsafety,\tfuel\teconomy\tand\temissions\tthat\tare\toften\tmaterially\tdifferent\tfrom\nequivalent\trequirements\tin\tthe\tU.S.,\tthus\tresulting\tin\tadditional\tinvestment\tinto\tthe\tvehicles\tand\tsystems\tto\tensure\tregulatory\tcompliance\tin\tall\tcountries.\nThis\tprocess\tmay\tinclude\tofficial\treview\tand\tcertification\tof\tour\tvehicles\tby\tforeign\tregulatory\tagencies\tprior\tto\tmarket\tentry,\tas\twell\tas\tcompliance\twith\nforeign\treporting\tand\trecall\tmanagement\tsystems\trequirements.\nIn\tparticular,\twe\toffer\tin\tour\tvehicles\tin\tcertain\tmarkets\tAutopilot\tand\tFSD\tCapability\tfeatures\tthat\ttoday\tassist\tdrivers\twith\tcertain\ttedious\tand\npotentially\tdangerous\taspects\tof\troad\ttravel,\tbut\twhich\tcurrently\trequire\tdrivers\tto\tremain\tfully\tengaged\tin\tthe\tdriving\toperation.\tWe\tare\tcontinuing\tto\ndevelop\tour\tAutopilot\tand\tFSD\tCapability\ttechnology.\tThere\tare\ta\tvariety\tof\tinternational,\tfederal\tand\tstate\tregulations\tthat\tmay\tapply\tto,\tand\tmay\nadversely\taffect,\tthe\tdesign\tand\tperformance,\tsale,\tmarketing,\tregistration\tand\toperation\tof\tAutopilot\tand\tFSD\tCapability,\tand\tfuture\tcapability,\tincluding\nfull\tself-driving\tvehicles\tthat\tmay\tnot\tbe\toperated\tby\ta\thuman\tdriver.\tThis\tincludes\tmany\texisting\tvehicle\tstandards\tthat\twere\tnot\toriginally\tintended\tto\napply\tto\tvehicles\tthat\tmay\tnot\tbe\toperated\tby\ta\thuman\tdriver.\tSuch\tregulations\tcontinue\tto\trapidly\tchange,\twhich\tincreases\tthe\tlikelihood\tof\ta\tpatchwork\nof\tcomplex\tor\tconflicting\tregulations,\tor\tmay\tdelay,\trestrict\tor\tprohibit\tthe\tavailability\tof\tcertain\tfunctionalities\tand\tvehicle\tdesigns,\twhich\tcould\tadversely\naffect\tour\tbusiness.\nFinally,\tas\ta\tmanufacturer,\tinstaller\tand\tservice\tprovider\twith\trespect\tto\tsolar\tgeneration\tand\tenergy\tstorage\tsystems,\ta\tsupplier\tof\telectricity\ngenerated\tand\tstored\tby\tcertain\tof\tthe\tsolar\tenergy\tand\tenergy\tstorage\tsystems\twe\tinstall\tfor\tcustomers,\tand\ta\tprovider\tof\tgrid\tservices\tthrough\tvirtual\npower\tplant\tmodels,\twe\tare\timpacted\tby\tfederal,\tstate\tand\tlocal\tregulations\tand\tpolicies\tconcerning\tthe\timport\tor\texport\tof\tcomponents,\telectricity\npricing,\tthe\tinterconnection\tof\telectricity\tgeneration\tand\tstorage\tequipment\twith\tthe\telectrical\tgrid\tand\tthe\tsale\tof\telectricity\tgenerated\tby\tthird\tparty-\nowned\tsystems.\tIf\tregulations\tand\tpolicies\tare\tintroduced\tthat\tadversely\timpact\tthe\timport\tor\texport\tof\tcomponents,\tor\tthe\tinterconnection,\tmaintenance\nor\tuse\tof\tour\tsolar\tand\tenergy\tstorage\tsystems,\tthey\tcould\tdeter\tpotential\tcustomers\tfrom\tpurchasing\tour\tsolar\tand\tenergy\tstorage\tproducts\tand\nservices,\tthreaten\tthe\teconomics\tof\tour\texisting\tcontracts\tand\tcause\tus\tto\tcease\tsolar\tand\tenergy\tstorage\tsystem\tsales\tand\tservices\tin\tthe\trelevant\njurisdictions,\twhich\tmay\tharm\tour\tbusiness,\tfinancial\tcondition\tand\toperating\tresults.\nAny\tfailure\tby\tus\tto\tcomply\twith\ta\tvariety\tof\tU.S.\tand\tinternational\tprivacy\tand\tconsumer\tprotection\tlaws\tmay\tharm\tus.', 'Table\tof\tContents\nSolar\tEnergy\tSystem\tIncentives\tand\tPolicies\nU.S.\tfederal,\tstate\tand\tlocal\tgovernments\thave\testablished\tvarious\tpolicies,\tincentives\tand\tfinancial\tmechanisms\tto\treduce\tthe\tcost\tof\tsolar\tenergy\nand\tto\taccelerate\tthe\tadoption\tof\tsolar\tenergy.\tThese\tincentives\tinclude\ttax\tcredits,\tcash\tgrants,\ttax\tabatements\tand\trebates.\nIn\tparticular,\tpursuant\tto\tthe\tIRA,\tSections\t48,\t48E\tand\t25D\tof\tthe\tIRC\tprovides\ta\ttax\tcredit\tbetween\t6%\tand\t70%\tof\tqualified\tcommercial\tor\nresidential\texpenditures\tfor\tsolar\tenergy\tsystems,\twhich\tmay\tbe\tclaimed\tby\tour\tcustomers\tfor\tsystems\tthey\tpurchase,\tor\tby\tus\tfor\tarrangements\twhere\nwe\town\tthe\tsystems\tfor\tproperties\tthat\tmeet\tstatutory\trequirements.\tThese\ttax\tcredits\tare\tprimarily\tfor\tthe\tdirect\tbenefit\tof\tour\tcustomers\tand\tare\ncurrently\tscheduled\tto\tphase-out\tstarting\tin\t2032\tor\tlater.\nRegulations\nVehicle\tSafety\tand\tTesting\nIn\tthe\tU.S.,\tour\tvehicles\tare\tsubject\tto\tregulation\tby\tthe\tNational\tHighway\tTraffic\tSafety\tAdministration\t(“NHTSA”),\tincluding\tall\tapplicable\tFederal\nMotor\tVehicle\tSafety\tStandards\t(“FMVSS”)\tand\tthe\tNHTSA\tbumper\tstandard.\tNumerous\tFMVSS\tapply\tto\tour\tvehicles,\tsuch\tas\tcrash-worthiness\tand\noccupant\tprotection\trequirements.\tOur\tcurrent\tvehicles\tfully\tcomply\tand\twe\texpect\tthat\tour\tvehicles\tin\tthe\tfuture\twill\tfully\tcomply\twith\tall\tapplicable\nFMVSS\twith\tlimited\tor\tno\texemptions,\thowever,\tFMVSS\tare\tsubject\tto\tchange\tfrom\ttime\tto\ttime.\tAs\ta\tmanufacturer,\twe\tmust\tself-certify\tthat\tour\tvehicles\nmeet\tall\tapplicable\tFMVSS\tand\tthe\tNHTSA\tbumper\tstandard,\tor\totherwise\tare\texempt,\tbefore\tthe\tvehicles\tmay\tbe\timported\tor\tsold\tin\tthe\tU.S.\nWe\tare\talso\trequired\tto\tcomply\twith\tother\tfederal\tlaws\tadministered\tby\tNHTSA,\tincluding\tthe\tCorporate\tAverage\tFuel\tEconomy\tstandards,\tTheft\nPrevention\tAct\trequirements,\tlabeling\trequirements\tand\tother\tinformation\tprovided\tto\tcustomers\tin\twriting,\tEarly\tWarning\tReporting\trequirements\nregarding\twarranty\tclaims,\tfield\treports,\tdeath\tand\tinjury\treports\tand\tforeign\trecalls,\ta\tStanding\tGeneral\tOrder\trequiring\treports\tregarding\tcrashes\ninvolving\tvehicles\tequipped\twith\tadvanced\tdriver\tassistance\tsystems,\tand\tadditional\trequirements\tfor\tcooperating\twith\tcompliance\tand\tsafety\ninvestigations\tand\trecall\treporting.\tThe\tU.S.\tAutomobile\tInformation\tand\tDisclosure\tAct\talso\trequires\tmanufacturers\tof\tmotor\tvehicles\tto\tdisclose\tcertain\ninformation\tregarding\tthe\tmanufacturer’s\tsuggested\tretail\tprice,\toptional\tequipment\tand\tpricing.\tIn\taddition,\tfederal\tlaw\trequires\tinclusion\tof\tfuel\neconomy\tratings,\tas\tdetermined\tby\tthe\tU.S.\tDepartment\tof\tTransportation\tand\tthe\tEnvironmental\tProtection\tAgency\t(the\t“EPA”),\tand\tNew\tCar\nAssessment\tProgram\tratings\tas\tdetermined\tby\tNHTSA,\tif\tavailable.\nOur\tvehicles\tsold\toutside\tof\tthe\tU.S.\tare\tsubject\tto\tsimilar\tforeign\tcompliance,\tsafety,\tenvironmental\tand\tother\tregulations.\tMany\tof\tthose\nregulations\tare\tdifferent\tfrom\tthose\tapplicable\tin\tthe\tU.S.\tand\tmay\trequire\tredesign\tand/or\tretesting.\tSome\tof\tthose\tregulations\timpact\tor\tprevent\tthe\nrollout\tof\tnew\tvehicle\tfeatures.\nSelf-Driving\tVehicles\nGenerally,\tlaws\tpertaining\tto\tself-driving\tvehicles\tare\tevolving\tglobally,\tand\tin\tsome\tcases\tmay\tcreate\trestrictions\ton\tfeatures\tor\tvehicle\tdesigns\nthat\twe\tdevelop.\tWhile\tthere\tare\tcurrently\tno\tfederal\tU.S.', 'Our\tvehicles\tsold\toutside\tof\tthe\tU.S.\tare\tsubject\tto\tsimilar\tforeign\tcompliance,\tsafety,\tenvironmental\tand\tother\tregulations.\tMany\tof\tthose\nregulations\tare\tdifferent\tfrom\tthose\tapplicable\tin\tthe\tU.S.\tand\tmay\trequire\tredesign\tand/or\tretesting.\tSome\tof\tthose\tregulations\timpact\tor\tprevent\tthe\nrollout\tof\tnew\tvehicle\tfeatures.\nSelf-Driving\tVehicles\nGenerally,\tlaws\tpertaining\tto\tself-driving\tvehicles\tare\tevolving\tglobally,\tand\tin\tsome\tcases\tmay\tcreate\trestrictions\ton\tfeatures\tor\tvehicle\tdesigns\nthat\twe\tdevelop.\tWhile\tthere\tare\tcurrently\tno\tfederal\tU.S.\tregulations\tpertaining\tspecifically\tto\tself-driving\tvehicles\tor\tself-driving\tequipment,\tNHTSA\thas\npublished\trecommended\tguidelines\ton\tself-driving\tvehicles,\tapart\tfrom\tthe\tFMVSS\tand\tmanufacturer\treporting\tobligations,\tand\tretains\tthe\tauthority\tto\ninvestigate\tand/or\ttake\taction\ton\tthe\tsafety\tor\tcompliance\tof\tany\tvehicle,\tequipment\tor\tfeatures\toperating\ton\tpublic\troads.\tCertain\tU.S.\tstates\talso\thave\nlegal\trestrictions\ton\tthe\toperation,\tregistration\tor\tlicensure\tof\tself-driving\tvehicles,\tand\tmany\tother\tstates\tare\tconsidering\tthem.\tThis\tregulatory\npatchwork\tincreases\tthe\tlegal\tcomplexity\twith\trespect\tto\tself-driving\tvehicles\tin\tthe\tU.S.\nIn\tmarkets\tthat\tfollow\tthe\tregulations\tof\tthe\tUnited\tNations\tEconomic\tCommission\tfor\tEurope\t(“\nECE\tmarkets\n”),\tsome\trequirements\trestrict\tthe\ndesign\tof\tadvanced\tdriver-assistance\tor\tself-driving\tfeatures,\twhich\tcan\tcompromise\tor\tprevent\ttheir\tuse\tentirely.\tOther\tapplicable\tlaws,\tboth\tcurrent\tand\nproposed,\tmay\thinder\tthe\tpath\tand\ttimeline\tto\tintroducing\tself-driving\tvehicles\tfor\tsale\tand\tuse\tin\tthe\tmarkets\twhere\tthey\tapply.\nOther\tkey\tmarkets,\tincluding\tChina,\tcontinue\tto\tconsider\tself-driving\tregulation.\tAny\timplemented\tregulations\tmay\tdiffer\tmaterially\tfrom\tthe\tU.S.\nand\tECE\tmarkets,\twhich\tmay\tfurther\tincrease\tthe\tlegal\tcomplexity\tof\tself-driving\tvehicles\tand\tlimit\tor\tprevent\tcertain\tfeatures.\n10', 'Table\tof\tContents\nWe\tmay\tbe\trequired\tto\tdefend\tor\tinsure\tagainst\tproduct\tliability\tclaims.\nThe\tautomobile\tindustry\tgenerally\texperiences\tsignificant\tproduct\tliability\tclaims,\tand\tas\tsuch\twe\tface\tthe\trisk\tof\tsuch\tclaims\tin\tthe\tevent\tour\nvehicles\tdo\tnot\tperform\tor\tare\tclaimed\tto\tnot\thave\tperformed\tas\texpected.\tAs\tis\ttrue\tfor\tother\tautomakers,\tour\tvehicles\thave\tbeen\tinvolved\tand\twe\nexpect\tin\tthe\tfuture\twill\tbe\tinvolved\tin\taccidents\tresulting\tin\tdeath\tor\tpersonal\tinjury,\tand\tsuch\taccidents\twhere\tAutopilot,\tEnhanced\tAutopilot\tor\tFSD\nCapability\tfeatures\tare\tengaged\tare\tthe\tsubject\tof\tsignificant\tpublic\tattention,\tespecially\tin\tlight\tof\tNHTSA’s\tStanding\tGeneral\tOrder\trequiring\treports\nregarding\tcrashes\tinvolving\tvehicles\twith\tadvanced\tdriver\tassistance\tsystems.\tWe\thave\texperienced,\tand\twe\texpect\tto\tcontinue\tto\tface,\tclaims\tand\nregulatory\tscrutiny\tarising\tfrom\tor\trelated\tto\tmisuse\tor\tclaimed\tfailures\tor\talleged\tmisrepresentations\tof\tsuch\tnew\ttechnologies\tthat\twe\tare\tpioneering.\tIn\naddition,\tthe\tbattery\tpacks\tthat\twe\tproduce\tmake\tuse\tof\tlithium-ion\tcells.\tOn\trare\toccasions,\tlithium-ion\tcells\tcan\trapidly\trelease\tthe\tenergy\tthey\tcontain\nby\tventing\tsmoke\tand\tflames\tin\ta\tmanner\tthat\tcan\tignite\tnearby\tmaterials\tas\twell\tas\tother\tlithium-ion\tcells.\tWhile\twe\thave\tdesigned\tour\tbattery\tpacks\tto\npassively\tcontain\tany\tsingle\tcell’s\trelease\tof\tenergy\twithout\tspreading\tto\tneighboring\tcells,\tthere\tcan\tbe\tno\tassurance\tthat\ta\tfield\tor\ttesting\tfailure\tof\tour\nvehicles\tor\tother\tbattery\tpacks\tthat\twe\tproduce\twill\tnot\toccur,\tin\tparticular\tdue\tto\ta\thigh-speed\tcrash.\tLikewise,\tas\tour\tsolar\tenergy\tsystems\tand\tenergy\nstorage\tproducts\tgenerate\tand\tstore\telectricity,\tthey\thave\tthe\tpotential\tto\tfail\tor\tcause\tinjury\tto\tpeople\tor\tproperty.\tAny\tproduct\tliability\tclaim\tmay\nsubject\tus\tto\tlawsuits\tand\tsubstantial\tmonetary\tdamages,\tproduct\trecalls\tor\tredesign\tefforts,\tand\teven\ta\tmeritless\tclaim\tmay\trequire\tus\tto\tdefend\tit,\tall\tof\nwhich\tmay\tgenerate\tnegative\tpublicity\tand\tbe\texpensive\tand\ttime-consuming.\tIn\tmost\tjurisdictions,\twe\tgenerally\tself-insure\tagainst\tthe\trisk\tof\tproduct\nliability\tclaims\tfor\tvehicle\texposure,\tmeaning\tthat\tany\tproduct\tliability\tclaims\twill\tlikely\thave\tto\tbe\tpaid\tfrom\tcompany\tfunds\tand\tnot\tby\tinsurance.\nWe\twill\tneed\tto\tmaintain\tpublic\tcredibility\tand\tconfidence\tin\tour\tlong-term\tbusiness\tprospects\tin\torder\tto\tsucceed.\nIn\torder\tto\tmaintain\tand\tgrow\tour\tbusiness,\twe\tmust\tmaintain\tcredibility\tand\tconfidence\tamong\tcustomers,\tsuppliers,\tanalysts,\tinvestors,\tratings\nagencies\tand\tother\tparties\tin\tour\tlong-term\tfinancial\tviability\tand\tbusiness\tprospects.\tMaintaining\tsuch\tconfidence\tmay\tbe\tchallenging\tdue\tto\tour\tlimited\noperating\thistory\trelative\tto\testablished\tcompetitors;\tcustomer\tunfamiliarity\twith\tour\tproducts;\tany\tdelays\twe\tmay\texperience\tin\tscaling\tmanufacturing,\ndelivery\tand\tservice\toperations\tto\tmeet\tdemand;\tcompetition\tand\tuncertainty\tregarding\tthe\tfuture\tof\telectric\tvehicles\tor\tour\tother\tproducts\tand\tservices;\nour\tquarterly\tproduction\tand\tsales\tperformance\tcompared\twith\tmarket\texpectations;\tand\tother\tfactors\tincluding\tthose\tover\twhich\twe\thave\tno\tcontrol.\tIn\nparticular,\tTesla’s\tproducts,\tbusiness,\tresults\tof\toperations,\tand\tstatements\tand\tactions\tof\tTesla\tand\tits\tmanagement\tare\tsubject\tto\tsignificant\tamounts\tof\ncommentary\tby\ta\trange\tof\tthird\tparties.', 'Any\tunfavorable\tultimate\toutcome\tfor\tTesla\tmay\thave\ta\tnegative\timpact\ton\tthe\tperception\tof\tTesla’s\ttreatment\tof\tour\temployees.\tFurthermore,\twe\tare\ndirectly\tor\tindirectly\tdependent\tupon\tcompanies\twith\tunionized\twork\tforces,\tsuch\tas\tsuppliers\tand\ttrucking\tand\tfreight\tcompanies.\tAny\twork\tstoppages\tor\nstrikes\torganized\tby\tsuch\tunions\tcould\tdelay\tthe\tmanufacture\tand\tsale\tof\tour\tproducts\tand\tmay\tharm\tour\tbusiness\tand\toperating\tresults.\nWe\tmay\tchoose\tto\tor\tbe\tcompelled\tto\tundertake\tproduct\trecalls\tor\ttake\tother\tsimilar\tactions.\nAs\ta\tmanufacturing\tcompany,\twe\tmust\tmanage\tthe\trisk\tof\tproduct\trecalls\twith\trespect\tto\tour\tproducts.\tRecalls\tfor\tour\tvehicles\thave\tresulted\tfrom\nvarious\thardware\tand\tsoftware-related\tsafety\tconcerns\tor\tnon-compliance\tdeterminations.\tIn\taddition\tto\trecalls\tinitiated\tby\tus\tfor\tvarious\tcauses,\ttesting\nof\tor\tinvestigations\tinto\tour\tproducts\tby\tgovernment\tregulators\tor\tindustry\tgroups\tmay\tcompel\tus\tto\tinitiate\tproduct\trecalls\tor\tmay\tresult\tin\tnegative\npublic\tperceptions\tabout\tthe\tsafety\tof\tour\tproducts,\teven\tif\twe\tdisagree\twith\tthe\tdefect\tdetermination\tor\thave\tdata\tthat\tcontradicts\tit.\tIn\tthe\tfuture,\twe\nmay\tvoluntarily\tor\tinvoluntarily\tinitiate\trecalls\tif\tany\tof\tour\tproducts\tare\tdetermined\tby\tus\tor\ta\tregulator\tto\tcontain\ta\tsafety\tdefect\tor\tbe\tnoncompliant\nwith\tapplicable\tlaws\tand\tregulations,\tsuch\tas\tU.S.\tFederal\tMotor\tVehicle\tSafety\tStandards.\tSuch\trecalls,\twhether\tvoluntary\tor\tinvoluntary\tor\tcaused\tby\nsystems\tor\tcomponents\tengineered\tor\tmanufactured\tby\tus\tor\tour\tsuppliers,\tcould\tresult\tin\tsignificant\texpense,\tsupply\tchain\tcomplications\tand\tservice\nburdens,\tand\tmay\tharm\tour\tbrand,\tbusiness,\tprospects,\tfinancial\tcondition\tand\toperating\tresults.\nOur\tcurrent\tand\tfuture\twarranty\treserves\tmay\tbe\tinsufficient\tto\tcover\tfuture\twarranty\tclaims.\nWe\tprovide\ta\tmanufacturer’s\twarranty\ton\tall\tnew\tand\tused\tTesla\tvehicles\twe\tsell\tdirectly\tto\tcustomers.\tWe\talso\tprovide\tcertain\twarranties\twith\nrespect\tto\tthe\tenergy\tgeneration\tand\tstorage\tsystems\twe\tsell,\tincluding\ton\ttheir\tinstallation\tand\tmaintenance.\tFor\tcomponents\tnot\tmanufactured\tby\tus,\nwe\tgenerally\tpass\tthrough\tto\tour\tcustomers\tthe\tapplicable\tmanufacturers’\twarranties,\tbut\tmay\tretain\tsome\twarranty\tresponsibilities\tfor\tsome\tor\tall\tof\tthe\nlife\tof\tsuch\tcomponents.\tAs\tpart\tof\tour\tenergy\tgeneration\tand\tstorage\tsystem\tcontracts,\twe\tmay\tprovide\tthe\tcustomer\twith\tperformance\tguarantees\tthat\nguarantee\tthat\tthe\tunderlying\tsystem\twill\tmeet\tor\texceed\tthe\tminimum\tenergy\tgeneration\tor\tother\tenergy\tperformance\trequirements\tspecified\tin\tthe\ncontract.\tUnder\tthese\tperformance\tguarantees,\twe\tgenerally\tbear\tthe\trisk\tof\telectricity\tproduction\tor\tother\tperformance\tshortfalls,\tincluding\tin\tsome\ncases\tshortfalls\tcaused\tby\tfailures\tin\tcomponents\tfrom\tthird\tparty\tmanufacturers.\tThese\trisks\tare\texacerbated\tin\tthe\tevent\tsuch\tmanufacturers\tcease\noperations\tor\tfail\tto\thonor\ttheir\twarranties.\n22']","Tesla must comply with all applicable Federal Motor Vehicle Safety Standards (FMVSS).  
",Full compliance with all applicable FMVSS and bumper standards; EPA fuel economy and NCAP ratings disclosures,1.0,0.94999999997625,1.0
How does Tesla describe the legal and regulatory landscape for self‑driving vehicles?,"['Our\tvehicles\tsold\toutside\tof\tthe\tU.S.\tare\tsubject\tto\tsimilar\tforeign\tcompliance,\tsafety,\tenvironmental\tand\tother\tregulations.\tMany\tof\tthose\nregulations\tare\tdifferent\tfrom\tthose\tapplicable\tin\tthe\tU.S.\tand\tmay\trequire\tredesign\tand/or\tretesting.\tSome\tof\tthose\tregulations\timpact\tor\tprevent\tthe\nrollout\tof\tnew\tvehicle\tfeatures.\nSelf-Driving\tVehicles\nGenerally,\tlaws\tpertaining\tto\tself-driving\tvehicles\tare\tevolving\tglobally,\tand\tin\tsome\tcases\tmay\tcreate\trestrictions\ton\tfeatures\tor\tvehicle\tdesigns\nthat\twe\tdevelop.\tWhile\tthere\tare\tcurrently\tno\tfederal\tU.S.\tregulations\tpertaining\tspecifically\tto\tself-driving\tvehicles\tor\tself-driving\tequipment,\tNHTSA\thas\npublished\trecommended\tguidelines\ton\tself-driving\tvehicles,\tapart\tfrom\tthe\tFMVSS\tand\tmanufacturer\treporting\tobligations,\tand\tretains\tthe\tauthority\tto\ninvestigate\tand/or\ttake\taction\ton\tthe\tsafety\tor\tcompliance\tof\tany\tvehicle,\tequipment\tor\tfeatures\toperating\ton\tpublic\troads.\tCertain\tU.S.\tstates\talso\thave\nlegal\trestrictions\ton\tthe\toperation,\tregistration\tor\tlicensure\tof\tself-driving\tvehicles,\tand\tmany\tother\tstates\tare\tconsidering\tthem.\tThis\tregulatory\npatchwork\tincreases\tthe\tlegal\tcomplexity\twith\trespect\tto\tself-driving\tvehicles\tin\tthe\tU.S.\nIn\tmarkets\tthat\tfollow\tthe\tregulations\tof\tthe\tUnited\tNations\tEconomic\tCommission\tfor\tEurope\t(“\nECE\tmarkets\n”),\tsome\trequirements\trestrict\tthe\ndesign\tof\tadvanced\tdriver-assistance\tor\tself-driving\tfeatures,\twhich\tcan\tcompromise\tor\tprevent\ttheir\tuse\tentirely.\tOther\tapplicable\tlaws,\tboth\tcurrent\tand\nproposed,\tmay\thinder\tthe\tpath\tand\ttimeline\tto\tintroducing\tself-driving\tvehicles\tfor\tsale\tand\tuse\tin\tthe\tmarkets\twhere\tthey\tapply.\nOther\tkey\tmarkets,\tincluding\tChina,\tcontinue\tto\tconsider\tself-driving\tregulation.\tAny\timplemented\tregulations\tmay\tdiffer\tmaterially\tfrom\tthe\tU.S.\nand\tECE\tmarkets,\twhich\tmay\tfurther\tincrease\tthe\tlegal\tcomplexity\tof\tself-driving\tvehicles\tand\tlimit\tor\tprevent\tcertain\tfeatures.\n10', 'Table\tof\tContents\nincreased\tour\temployee\theadcount\tand\toperations,\twe\tare\tand\tmay\tcontinue\tto\tbe\tsubject\tto\tincreased\tscrutiny,\tincluding\tlitigation\tand\tgovernment\ninvestigations,\tthat\twe\twill\tneed\tto\tdefend\tagainst.\tIf\twe\tare\tunable\tto\tsuccessfully\tdefend\tourselves\tin\tsuch\tlitigation\tor\tgovernment\tinvestigations,\tit\nmay\tharm\tour\tbrand,\tability\tto\tattract\tand\tretain\tqualified\temployees,\tbusiness\tand\tfinancial\tcondition.\tWe\tare\talso\tsubject\tto\tlaws\tand\tregulations\napplicable\tto\tthe\tsupply,\tmanufacture,\timport,\tsale,\tservice\tand\tperformance\tof\tour\tproducts\tboth\tdomestically\tand\tabroad.\tFor\texample,\tin\tcountries\noutside\tof\tthe\tU.S.,\twe\tare\trequired\tto\tmeet\tstandards\trelating\tto\tvehicle\tsafety,\tfuel\teconomy\tand\temissions\tthat\tare\toften\tmaterially\tdifferent\tfrom\nequivalent\trequirements\tin\tthe\tU.S.,\tthus\tresulting\tin\tadditional\tinvestment\tinto\tthe\tvehicles\tand\tsystems\tto\tensure\tregulatory\tcompliance\tin\tall\tcountries.\nThis\tprocess\tmay\tinclude\tofficial\treview\tand\tcertification\tof\tour\tvehicles\tby\tforeign\tregulatory\tagencies\tprior\tto\tmarket\tentry,\tas\twell\tas\tcompliance\twith\nforeign\treporting\tand\trecall\tmanagement\tsystems\trequirements.\nIn\tparticular,\twe\toffer\tin\tour\tvehicles\tin\tcertain\tmarkets\tAutopilot\tand\tFSD\tCapability\tfeatures\tthat\ttoday\tassist\tdrivers\twith\tcertain\ttedious\tand\npotentially\tdangerous\taspects\tof\troad\ttravel,\tbut\twhich\tcurrently\trequire\tdrivers\tto\tremain\tfully\tengaged\tin\tthe\tdriving\toperation.\tWe\tare\tcontinuing\tto\ndevelop\tour\tAutopilot\tand\tFSD\tCapability\ttechnology.\tThere\tare\ta\tvariety\tof\tinternational,\tfederal\tand\tstate\tregulations\tthat\tmay\tapply\tto,\tand\tmay\nadversely\taffect,\tthe\tdesign\tand\tperformance,\tsale,\tmarketing,\tregistration\tand\toperation\tof\tAutopilot\tand\tFSD\tCapability,\tand\tfuture\tcapability,\tincluding\nfull\tself-driving\tvehicles\tthat\tmay\tnot\tbe\toperated\tby\ta\thuman\tdriver.\tThis\tincludes\tmany\texisting\tvehicle\tstandards\tthat\twere\tnot\toriginally\tintended\tto\napply\tto\tvehicles\tthat\tmay\tnot\tbe\toperated\tby\ta\thuman\tdriver.\tSuch\tregulations\tcontinue\tto\trapidly\tchange,\twhich\tincreases\tthe\tlikelihood\tof\ta\tpatchwork\nof\tcomplex\tor\tconflicting\tregulations,\tor\tmay\tdelay,\trestrict\tor\tprohibit\tthe\tavailability\tof\tcertain\tfunctionalities\tand\tvehicle\tdesigns,\twhich\tcould\tadversely\naffect\tour\tbusiness.\nFinally,\tas\ta\tmanufacturer,\tinstaller\tand\tservice\tprovider\twith\trespect\tto\tsolar\tgeneration\tand\tenergy\tstorage\tsystems,\ta\tsupplier\tof\telectricity\ngenerated\tand\tstored\tby\tcertain\tof\tthe\tsolar\tenergy\tand\tenergy\tstorage\tsystems\twe\tinstall\tfor\tcustomers,\tand\ta\tprovider\tof\tgrid\tservices\tthrough\tvirtual\npower\tplant\tmodels,\twe\tare\timpacted\tby\tfederal,\tstate\tand\tlocal\tregulations\tand\tpolicies\tconcerning\tthe\timport\tor\texport\tof\tcomponents,\telectricity\npricing,\tthe\tinterconnection\tof\telectricity\tgeneration\tand\tstorage\tequipment\twith\tthe\telectrical\tgrid\tand\tthe\tsale\tof\telectricity\tgenerated\tby\tthird\tparty-\nowned\tsystems.\tIf\tregulations\tand\tpolicies\tare\tintroduced\tthat\tadversely\timpact\tthe\timport\tor\texport\tof\tcomponents,\tor\tthe\tinterconnection,\tmaintenance\nor\tuse\tof\tour\tsolar\tand\tenergy\tstorage\tsystems,\tthey\tcould\tdeter\tpotential\tcustomers\tfrom\tpurchasing\tour\tsolar\tand\tenergy\tstorage\tproducts\tand\nservices,\tthreaten\tthe\teconomics\tof\tour\texisting\tcontracts\tand\tcause\tus\tto\tcease\tsolar\tand\tenergy\tstorage\tsystem\tsales\tand\tservices\tin\tthe\trelevant\njurisdictions,\twhich\tmay\tharm\tour\tbusiness,\tfinancial\tcondition\tand\toperating\tresults.\nAny\tfailure\tby\tus\tto\tcomply\twith\ta\tvariety\tof\tU.S.\tand\tinternational\tprivacy\tand\tconsumer\tprotection\tlaws\tmay\tharm\tus.', 'Although\tat\tpresent\tthe\ndriver\tis\tultimately\tresponsible\tfor\tcontrolling\tthe\tvehicle,\tour\tsystems\tprovide\tsafety\tand\tconvenience\tfunctionality\tthat\trelieves\tdrivers\tof\tthe\tmost\ntedious\tand\tpotentially\tdangerous\taspects\tof\troad\ttravel\tmuch\tlike\tthe\tsystem\tthat\tairplane\tpilots\tuse,\twhen\tconditions\tpermit.\tAs\twith\tother\tvehicle\nsystems,\twe\timprove\tthese\tfunctions\tin\tour\tvehicles\tover\ttime\tthrough\tover-the-air\tupdates.\nWe\tintend\tto\testablish\tin\tthe\tfuture\tan\tautonomous\tTesla\tride-hailing\tnetwork,\twhich\twe\texpect\twould\talso\tallow\tus\tto\taccess\ta\tnew\tcustomer\tbase\neven\tas\tmodes\tof\ttransportation\tevolve.\nWe\tare\talso\tapplying\tour\tartificial\tintelligence\tlearnings\tfrom\tself-driving\ttechnology\tto\tthe\tfield\tof\trobotics,\tsuch\tas\tthrough\tOptimus,\ta\trobotic\nhumanoid\tin\tdevelopment,\twhich\tis\tcontrolled\tby\tthe\tsame\tAI\tsystem.\n5', 'Table\tof\tContents\nAutomobile\tManufacturer\tand\tDealer\tRegulation\nIn\tthe\tU.S.,\tstate\tlaws\tregulate\tthe\tmanufacture,\tdistribution,\tsale\tand\tservice\tof\tautomobiles,\tand\tgenerally\trequire\tmotor\tvehicle\tmanufacturers\nand\tdealers\tto\tbe\tlicensed\tin\torder\tto\tsell\tvehicles\tdirectly\tto\tresidents.\tCertain\tstates\thave\tasserted\tthat\tthe\tlaws\tin\tsuch\tstates\tdo\tnot\tpermit\tautomobile\nmanufacturers\tto\tbe\tlicensed\tas\tdealers\tor\tto\tact\tin\tthe\tcapacity\tof\ta\tdealer,\tor\tthat\tthey\totherwise\trestrict\ta\tmanufacturer’s\tability\tto\tdeliver\tor\tperform\nwarranty\trepairs\ton\tvehicles.\tTo\tsell\tvehicles\tto\tresidents\tof\tstates\twhere\twe\tare\tnot\tlicensed\tas\ta\tdealer,\twe\tgenerally\tconduct\tthe\tsale\tout\tof\tthe\tstate.\nIn\tcertain\tsuch\tstates,\twe\thave\topened\t“galleries”\tthat\tserve\tan\teducational\tpurpose\tand\twhere\tsales\tmay\tnot\toccur.\nSome\tautomobile\tdealer\ttrade\tassociations\thave\tboth\tchallenged\tthe\tlegality\tof\tour\toperations\tin\tcourt\tand\tused\tadministrative\tand\tlegislative\nprocesses\tto\tattempt\tto\tprohibit\tor\tlimit\tour\tability\tto\toperate\texisting\tstores\tor\texpand\tto\tnew\tlocations.\tCertain\tdealer\tassociations\thave\talso\tactively\nlobbied\tstate\tlicensing\tagencies\tand\tlegislators\tto\tinterpret\texisting\tlaws\tor\tenact\tnew\tlaws\tin\tways\tnot\tfavorable\tto\tour\townership\tand\toperation\tof\tour\nown\tretail\tand\tservice\tlocations.\tWe\texpect\tsuch\tchallenges\tto\tcontinue,\tand\twe\tintend\tto\tactively\tfight\tany\tsuch\tefforts.\nBattery\tSafety\tand\tTesting\nOur\tbattery\tpacks\tare\tsubject\tto\tvarious\tU.S.\tand\tinternational\tregulations\tthat\tgovern\ttransport\tof\t“dangerous\tgoods,”\tdefined\tto\tinclude\tlithium-\nion\tbatteries,\twhich\tmay\tpresent\ta\trisk\tin\ttransportation.\tWe\tconduct\ttesting\tto\tdemonstrate\tour\tcompliance\twith\tsuch\tregulations.\nWe\tuse\tlithium-ion\tcells\tin\tour\thigh\tvoltage\tbattery\tpacks\tin\tour\tvehicles\tand\tenergy\tstorage\tproducts.\tThe\tuse,\tstorage\tand\tdisposal\tof\tour\tbattery\npacks\tare\tregulated\tunder\texisting\tlaws\tand\tare\tthe\tsubject\tof\tongoing\tregulatory\tchanges\tthat\tmay\tadd\tadditional\trequirements\tin\tthe\tfuture.\tWe\thave\nagreements\twith\tthird\tparty\tbattery\trecycling\tcompanies\tto\trecycle\tour\tbattery\tpacks,\tand\twe\tare\talso\tpiloting\tour\town\trecycling\ttechnology.\nSolar\tEnergy—General\nWe\tare\tsubject\tto\tcertain\tstate\tand\tfederal\tregulations\tapplicable\tto\tsolar\tand\tbattery\tstorage\tproviders\tand\tsellers\tof\telectricity.\tTo\toperate\tour\nsystems,\twe\tenter\tinto\tstandard\tinterconnection\tagreements\twith\tapplicable\tutilities.\tSales\tof\telectricity\tand\tnon-sale\tequipment\tleases\tby\tthird\tparties,\nsuch\tas\tour\tleases\tand\tPPAs,\thave\tfaced\tregulatory\tchallenges\tin\tsome\tstates\tand\tjurisdictions.\nSolar\tEnergy—Net\tMetering\nMost\tstates\tin\tthe\tU.S.\tmake\tnet\tenergy\tmetering,\tor\tnet\tmetering,\tavailable\tto\tsolar\tcustomers.\tNet\tmetering\ttypically\tallows\tsolar\tcustomers\tto\ninterconnect\ttheir\tsolar\tenergy\tsystems\tto\tthe\tutility\tgrid\tand\toffset\ttheir\tutility\telectricity\tpurchases\tby\treceiving\ta\tbill\tcredit\tfor\texcess\tenergy\tgenerated\nby\ttheir\tsolar\tenergy\tsystem\tthat\tis\texported\tto\tthe\tgrid.\tIn\tcertain\tjurisdictions,\tregulators\tor\tutilities\thave\treduced\tor\teliminated\tthe\tbenefit\tavailable\nunder\tnet\tmetering\tor\thave\tproposed\tto\tdo\tso.\nCompetition\nAutomotive\nThe\tworldwide\tautomotive\tmarket\tis\thighly\tcompetitive\tand\twe\texpect\tit\twill\tbecome\teven\tmore\tcompetitive\tin\tthe\tfuture\tas\ta\tsignificant\tand\ngrowing\tnumber\tof\testablished\tand\tnew\tautomobile\tmanufacturers,\tas\twell\tas\tother\tcompanies,\thave\tentered,\tor\tare\treported\tto\thave\tplans\tto\tenter\tthe\nelectric\tvehicle\tmarket.', 'Table\tof\tContents\nSolar\tEnergy\tOfferings\nWe\tsell\tretrofit\tsolar\tenergy\tsystems\tto\tcustomers\tand\tchannel\tpartners\tand\talso\tmake\tthem\tavailable\tthrough\tpower\tpurchase\tagreement\t(“PPA”)\narrangements.\tWe\tpurchase\tmost\tof\tthe\tcomponents\tfor\tour\tretrofit\tsolar\tenergy\tsystems\tfrom\tmultiple\tsources\tto\tensure\tcompetitive\tpricing\tand\nadequate\tsupply.\tWe\talso\tdesign\tand\tmanufacture\tcertain\tcomponents\tfor\tour\tsolar\tenergy\tproducts.\nWe\tsell\tour\tSolar\tRoof,\twhich\tcombines\tpremium\tglass\troof\ttiles\twith\tenergy\tgeneration,\tdirectly\tto\tcustomers,\tas\twell\tas\tthrough\tchannel\ncustomers.\tWe\tcontinue\tto\timprove\tour\tinstallation\tcapability\tand\tefficiency,\tincluding\tthrough\tcollaboration\twith\treal\testate\tdevelopers\tand\tbuilders\ton\nnew\thomes.\nTechnology\nAutomotive\nBattery\tand\tPowertrain\nOur\tcore\tvehicle\ttechnology\tcompetencies\tinclude\tpowertrain\tengineering\tand\tmanufacturing\tand\tour\tability\tto\tdesign\tvehicles\tthat\tutilize\tthe\nunique\tadvantages\tof\tan\telectric\tpowertrain.\tWe\thave\tdesigned\tour\tproprietary\tpowertrain\tsystems\tto\tbe\tadaptable,\tefficient,\treliable\tand\tcost-effective\nwhile\twithstanding\tthe\trigors\tof\tan\tautomotive\tenvironment.\tWe\toffer\tdual\tmotor\tpowertrain\tvehicles,\twhich\tuse\ttwo\telectric\tmotors\tto\tmaximize\ttraction\nand\tperformance\tin\tan\tall-wheel\tdrive\tconfiguration,\tas\twell\tas\tvehicle\tpowertrain\ttechnology\tfeaturing\tthree\telectric\tmotors\tfor\tfurther\tincreased\nperformance\tin\tcertain\tversions\tof\tModel\tS\tand\tModel\tX,\tCybertruck\tand\tthe\tTesla\tSemi.\nWe\tmaintain\textensive\ttesting\tand\tR&D\tcapabilities\tfor\tbattery\tcells,\tpacks\tand\tsystems,\tand\thave\tbuilt\tan\texpansive\tbody\tof\tknowledge\ton\tlithium-\nion\tcell\tchemistry\ttypes\tand\tperformance\tcharacteristics.\tIn\torder\tto\tenable\ta\tgreater\tsupply\tof\tcells\tfor\tour\tproducts\twith\thigher\tenergy\tdensity\tat\tlower\ncosts,\twe\thave\tdeveloped\ta\tnew\tproprietary\tlithium-ion\tbattery\tcell\tand\timproved\tmanufacturing\tprocesses.\nVehicle\tControl\tand\tInfotainment\tSoftware\nThe\tperformance\tand\tsafety\tsystems\tof\tour\tvehicles\tand\ttheir\tbattery\tpacks\tutilize\tsophisticated\tcontrol\tsoftware.\tControl\tsystems\tin\tour\tvehicles\noptimize\tperformance,\tcustomize\tvehicle\tbehavior,\tmanage\tcharging\tand\tcontrol\tall\tinfotainment\tfunctions.\tWe\tdevelop\talmost\tall\tof\tthis\tsoftware,\nincluding\tmost\tof\tthe\tuser\tinterfaces,\tinternally\tand\tupdate\tour\tvehicles’\tsoftware\tregularly\tthrough\tover-the-air\tupdates.\nSelf-Driving\tDevelopment\tand\tArtificial\tIntelligence\nWe\thave\texpertise\tin\tdeveloping\ttechnologies,\tsystems\tand\tsoftware\tto\tenable\tself-driving\tvehicles\tusing\tprimarily\tvision-based\ttechnologies.\tOur\nFSD\tComputer\truns\tour\tneural\tnetworks\tin\tour\tvehicles,\tand\twe\tare\talso\tdeveloping\tadditional\tcomputer\thardware\tto\tbetter\tenable\tthe\tmassive\tamounts\nof\tfield\tdata\tcaptured\tby\tour\tvehicles\tto\tcontinually\ttrain\tand\timprove\tthese\tneural\tnetworks\tfor\treal-world\tperformance.\nCurrently,\twe\toffer\tin\tour\tvehicles\tcertain\tadvanced\tdriver\tassist\tsystems\tunder\tour\tAutopilot\tand\tFSD\tCapability\toptions.\tAlthough\tat\tpresent\tthe\ndriver\tis\tultimately\tresponsible\tfor\tcontrolling\tthe\tvehicle,\tour\tsystems\tprovide\tsafety\tand\tconvenience\tfunctionality\tthat\trelieves\tdrivers\tof\tthe\tmost\ntedious\tand\tpotentially\tdangerous\taspects\tof\troad\ttravel\tmuch\tlike\tthe\tsystem\tthat\tairplane\tpilots\tuse,\twhen\tconditions\tpermit.\tAs\twith\tother\tvehicle\nsystems,\twe\timprove\tthese\tfunctions\tin\tour\tvehicles\tover\ttime\tthrough\tover-the-air\tupdates.\nWe\tintend\tto\testablish\tin\tthe\tfuture\tan\tautonomous\tTesla\tride-hailing\tnetwork,\twhich\twe\texpect\twould\talso\tallow\tus\tto\taccess\ta\tnew\tcustomer\tbase\neven\tas\tmodes\tof\ttransportation\tevolve.']","Tesla discusses their self-driving technology and its potential future applications, including a ride-hailing network. They emphasize their expertise in developing vision-based technologies and their commitment to continuous improvement through over-the-air updates.  They also mention that their advanced driver-assist systems, Autopilot and FSD Capability, provide safety and convenience features that alleviate drivers of certain tasks, similar to systems used in airplanes. 


",No federal self‑driving regs yet; NHTSA guidelines; patchwork of state and ECE restrictions on ADAS/self‑driving features,0.875,0.9999999999666667,1.0
What dealer‑model regulatory challenges does Tesla face?,"['For\texample,\twe\tmonitor\ttax\tlegislation\tchanges\ton\ta\tglobal\tbasis,\tincluding\tchanges\tarising\tas\ta\tresult\tof\tthe\tOrganization\tfor\tEconomic\tCooperation\tand\nDevelopment’s\tmulti-jurisdictional\tplan\tof\taction\tto\taddress\tbase\terosion\tand\tprofit\tshifting.\tSuch\tconditions\tmay\tincrease\tour\tcosts,\timpact\tour\tability\tto\nsell\tour\tproducts\tand\trequire\tsignificant\tmanagement\tattention,\tand\tmay\tharm\tour\tbusiness\tif\twe\tare\tunable\tto\tmanage\tthem\teffectively.\nOur\tbusiness\tmay\tsuffer\tif\tour\tproducts\tor\tfeatures\tcontain\tdefects,\tfail\tto\tperform\tas\texpected\tor\ttake\tlonger\tthan\texpected\tto\nbecome\tfully\tfunctional.\nIf\tour\tproducts\tcontain\tdesign\tor\tmanufacturing\tdefects,\twhether\trelating\tto\tour\tsoftware\tor\thardware,\tthat\tcause\tthem\tnot\tto\tperform\tas\tdesigned\nor\tintended\tor\tthat\trequire\trepair,\tor\tcertain\tfeatures\tof\tour\tvehicles\tsuch\tas\tnew\tAutopilot\tor\tFSD\tCapability\tfeatures\ttake\tlonger\tthan\texpected\tto\nbecome\tenabled,\tare\tlegally\trestricted\tor\tbecome\tsubject\tto\tonerous\tregulation,\tour\tability\tto\tdevelop,\tmarket\tand\tsell\tour\tproducts\tand\tservices\tmay\tbe\nharmed,\tand\twe\tmay\texperience\tdelivery\tdelays,\tproduct\trecalls,\tallegations\tof\tproduct\tliability,\tbreach\tof\twarranty\tand\trelated\tconsumer\tprotection\nclaims\tand\tsignificant\twarranty\tand\tother\texpenses.\tWhile\twe\tare\tcontinuously\tworking\tto\tdevelop\tand\timprove\tour\tproducts’\tcapability\tand\tperformance,\nthere\tis\tno\tguarantee\tthat\tany\tincremental\tchanges\tin\tthe\tspecific\tsoftware\tor\tequipment\twe\tdeploy\tin\tour\tvehicles\tover\ttime\twill\tnot\tresult\tin\tinitial\nfunctional\tdisparities\tfrom\tprior\titerations\tor\twill\tperform\tas\tforecast\tin\tthe\ttimeframe\twe\tanticipate,\tor\tat\tall.\tAlthough\twe\tattempt\tto\tremedy\tany\tissues\nwe\tobserve\tin\tour\tproducts\tas\teffectively\tand\trapidly\tas\tpossible,\tsuch\tefforts\tmay\tnot\tbe\ttimely,\tmay\thamper\tproduction\tor\tmay\tnot\tcompletely\tsatisfy\nour\tcustomers.\tWe\thave\tperformed,\tand\tcontinue\tto\tperform,\textensive\tinternal\ttesting\ton\tour\tproducts\tand\tfeatures,\tthough,\tlike\tthe\trest\tof\tthe\tindustry,\nwe\tcurrently\thave\ta\tlimited\tframe\tof\treference\tby\twhich\tto\tevaluate\tcertain\taspects\tof\ttheir\tlong-term\tquality,\treliability,\tdurability\tand\tperformance\ncharacteristics,\tincluding\texposure\tto\tor\tconsequence\tof\texternal\tattacks.\tWhile\twe\tattempt\tto\tidentify\tand\taddress\tor\tremedy\tdefects\twe\tidentify\tpre-\nproduction\tand\tsale,\tthere\tmay\tbe\tlatent\tdefects\tthat\twe\tmay\tbe\tunable\tto\tdetect\tor\tcontrol\tfor\tin\tour\tproducts,\tand\tthereby\taddress,\tprior\tto\ttheir\tsale\tto\nor\tinstallation\tfor\tcustomers.\n18', 'Table\tof\tContents\nincreased\tour\temployee\theadcount\tand\toperations,\twe\tare\tand\tmay\tcontinue\tto\tbe\tsubject\tto\tincreased\tscrutiny,\tincluding\tlitigation\tand\tgovernment\ninvestigations,\tthat\twe\twill\tneed\tto\tdefend\tagainst.\tIf\twe\tare\tunable\tto\tsuccessfully\tdefend\tourselves\tin\tsuch\tlitigation\tor\tgovernment\tinvestigations,\tit\nmay\tharm\tour\tbrand,\tability\tto\tattract\tand\tretain\tqualified\temployees,\tbusiness\tand\tfinancial\tcondition.\tWe\tare\talso\tsubject\tto\tlaws\tand\tregulations\napplicable\tto\tthe\tsupply,\tmanufacture,\timport,\tsale,\tservice\tand\tperformance\tof\tour\tproducts\tboth\tdomestically\tand\tabroad.\tFor\texample,\tin\tcountries\noutside\tof\tthe\tU.S.,\twe\tare\trequired\tto\tmeet\tstandards\trelating\tto\tvehicle\tsafety,\tfuel\teconomy\tand\temissions\tthat\tare\toften\tmaterially\tdifferent\tfrom\nequivalent\trequirements\tin\tthe\tU.S.,\tthus\tresulting\tin\tadditional\tinvestment\tinto\tthe\tvehicles\tand\tsystems\tto\tensure\tregulatory\tcompliance\tin\tall\tcountries.\nThis\tprocess\tmay\tinclude\tofficial\treview\tand\tcertification\tof\tour\tvehicles\tby\tforeign\tregulatory\tagencies\tprior\tto\tmarket\tentry,\tas\twell\tas\tcompliance\twith\nforeign\treporting\tand\trecall\tmanagement\tsystems\trequirements.\nIn\tparticular,\twe\toffer\tin\tour\tvehicles\tin\tcertain\tmarkets\tAutopilot\tand\tFSD\tCapability\tfeatures\tthat\ttoday\tassist\tdrivers\twith\tcertain\ttedious\tand\npotentially\tdangerous\taspects\tof\troad\ttravel,\tbut\twhich\tcurrently\trequire\tdrivers\tto\tremain\tfully\tengaged\tin\tthe\tdriving\toperation.\tWe\tare\tcontinuing\tto\ndevelop\tour\tAutopilot\tand\tFSD\tCapability\ttechnology.\tThere\tare\ta\tvariety\tof\tinternational,\tfederal\tand\tstate\tregulations\tthat\tmay\tapply\tto,\tand\tmay\nadversely\taffect,\tthe\tdesign\tand\tperformance,\tsale,\tmarketing,\tregistration\tand\toperation\tof\tAutopilot\tand\tFSD\tCapability,\tand\tfuture\tcapability,\tincluding\nfull\tself-driving\tvehicles\tthat\tmay\tnot\tbe\toperated\tby\ta\thuman\tdriver.\tThis\tincludes\tmany\texisting\tvehicle\tstandards\tthat\twere\tnot\toriginally\tintended\tto\napply\tto\tvehicles\tthat\tmay\tnot\tbe\toperated\tby\ta\thuman\tdriver.\tSuch\tregulations\tcontinue\tto\trapidly\tchange,\twhich\tincreases\tthe\tlikelihood\tof\ta\tpatchwork\nof\tcomplex\tor\tconflicting\tregulations,\tor\tmay\tdelay,\trestrict\tor\tprohibit\tthe\tavailability\tof\tcertain\tfunctionalities\tand\tvehicle\tdesigns,\twhich\tcould\tadversely\naffect\tour\tbusiness.\nFinally,\tas\ta\tmanufacturer,\tinstaller\tand\tservice\tprovider\twith\trespect\tto\tsolar\tgeneration\tand\tenergy\tstorage\tsystems,\ta\tsupplier\tof\telectricity\ngenerated\tand\tstored\tby\tcertain\tof\tthe\tsolar\tenergy\tand\tenergy\tstorage\tsystems\twe\tinstall\tfor\tcustomers,\tand\ta\tprovider\tof\tgrid\tservices\tthrough\tvirtual\npower\tplant\tmodels,\twe\tare\timpacted\tby\tfederal,\tstate\tand\tlocal\tregulations\tand\tpolicies\tconcerning\tthe\timport\tor\texport\tof\tcomponents,\telectricity\npricing,\tthe\tinterconnection\tof\telectricity\tgeneration\tand\tstorage\tequipment\twith\tthe\telectrical\tgrid\tand\tthe\tsale\tof\telectricity\tgenerated\tby\tthird\tparty-\nowned\tsystems.\tIf\tregulations\tand\tpolicies\tare\tintroduced\tthat\tadversely\timpact\tthe\timport\tor\texport\tof\tcomponents,\tor\tthe\tinterconnection,\tmaintenance\nor\tuse\tof\tour\tsolar\tand\tenergy\tstorage\tsystems,\tthey\tcould\tdeter\tpotential\tcustomers\tfrom\tpurchasing\tour\tsolar\tand\tenergy\tstorage\tproducts\tand\nservices,\tthreaten\tthe\teconomics\tof\tour\texisting\tcontracts\tand\tcause\tus\tto\tcease\tsolar\tand\tenergy\tstorage\tsystem\tsales\tand\tservices\tin\tthe\trelevant\njurisdictions,\twhich\tmay\tharm\tour\tbusiness,\tfinancial\tcondition\tand\toperating\tresults.\nAny\tfailure\tby\tus\tto\tcomply\twith\ta\tvariety\tof\tU.S.\tand\tinternational\tprivacy\tand\tconsumer\tprotection\tlaws\tmay\tharm\tus.', 'In\nparticular,\tTesla’s\tproducts,\tbusiness,\tresults\tof\toperations,\tand\tstatements\tand\tactions\tof\tTesla\tand\tits\tmanagement\tare\tsubject\tto\tsignificant\tamounts\tof\ncommentary\tby\ta\trange\tof\tthird\tparties.\tSuch\tattention\tcan\tinclude\tcriticism,\twhich\tmay\tbe\texaggerated\tor\tunfounded,\tsuch\tas\tspeculation\tregarding\tthe\nsufficiency\tor\tstability\tof\tour\tmanagement\tteam.\tAny\tsuch\tnegative\tperceptions,\twhether\tcaused\tby\tus\tor\tnot,\tmay\tharm\tour\tbusiness\tand\tmake\tit\tmore\ndifficult\tto\traise\tadditional\tfunds\tif\tneeded.\nWe\tmay\tbe\tunable\tto\teffectively\tgrow,\tor\tmanage\tthe\tcompliance,\tresidual\tvalue,\tfinancing\tand\tcredit\trisks\trelated\tto,\tour\tvarious\nfinancing\tprograms.\nWe\toffer\tfinancing\tarrangements\tfor\tour\tvehicles\tin\tNorth\tAmerica,\tEurope\tand\tAsia\tprimarily\tourselves\tand\tthrough\tvarious\tfinancial\tinstitutions.\nWe\talso\tcurrently\toffer\tvehicle\tfinancing\tarrangements\tdirectly\tthrough\tour\tlocal\tsubsidiaries\tin\tcertain\tmarkets.\tDepending\ton\tthe\tcountry,\tsuch\narrangements\tare\tavailable\tfor\tspecified\tmodels\tand\tmay\tinclude\toperating\tleases\tdirectly\twith\tus\tunder\twhich\twe\ttypically\treceive\tonly\ta\tvery\tsmall\nportion\tof\tthe\ttotal\tvehicle\tpurchase\tprice\tat\tthe\ttime\tof\tlease,\tfollowed\tby\ta\tstream\tof\tpayments\tover\tthe\tterm\tof\tthe\tlease.\tWe\thave\talso\toffered\tvarious\narrangements\tfor\tcustomers\tof\tour\tsolar\tenergy\tsystems\twhereby\tthey\tpay\tus\ta\tfixed\tpayment\tto\tlease\tor\tfinance\tthe\tpurchase\tof\tsuch\tsystems\tor\npurchase\telectricity\tgenerated\tby\tthem.\tIf\twe\tdo\tnot\tsuccessfully\tmonitor\tand\tcomply\twith\tapplicable\tnational,\tstate\tand/or\tlocal\tfinancial\tregulations\tand\nconsumer\tprotection\tlaws\tgoverning\tthese\ttransactions,\twe\tmay\tbecome\tsubject\tto\tenforcement\tactions\tor\tpenalties.\nThe\tprofitability\tof\tany\tdirectly-leased\tvehicles\treturned\tto\tus\tat\tthe\tend\tof\ttheir\tleases\tdepends\ton\tour\tability\tto\taccurately\tproject\tour\tvehicles’\nresidual\tvalues\tat\tthe\toutset\tof\tthe\tleases,\tand\tsuch\tvalues\tmay\tfluctuate\tprior\tto\tthe\tend\tof\ttheir\tterms\tdepending\ton\tvarious\tfactors\tsuch\tas\tsupply\tand\ndemand\tof\tour\tused\tvehicles,\teconomic\tcycles\tand\tthe\tpricing\tof\tnew\tvehicles.\tWe\thave\tmade\tin\tthe\tpast\tand\tmay\tmake\tin\tthe\tfuture\tcertain\tadjustments\nto\tour\tprices\tfrom\ttime\tto\ttime\tin\tthe\tordinary\tcourse\tof\tbusiness,\twhich\tmay\timpact\tthe\tresidual\tvalues\tof\tour\tvehicles\tand\treduce\tthe\tprofitability\tof\tour\nvehicle\tleasing\tprogram.\tThe\tfunding\tand\tgrowth\tof\tthis\tprogram\talso\trely\ton\tour\tability\tto\tsecure\tadequate\tfinancing\tand/or\tbusiness\tpartners.\tIf\twe\tare\nunable\tto\tadequately\tfund\tour\tleasing\tprogram\tthrough\tinternal\tfunds,\tpartners\tor\tother\tfinancing\tsources,\tand\tcompelling\talternative\tfinancing\tprograms\nare\tnot\tavailable\tfor\tour\tcustomers\twho\tmay\texpect\tor\tneed\tsuch\toptions,\twe\tmay\tbe\tunable\tto\tgrow\tour\tvehicle\tdeliveries.\tFurthermore,\tif\tour\tvehicle\nleasing\tbusiness\tgrows\tsubstantially,\tour\tbusiness\tmay\tsuffer\tif\twe\tcannot\teffectively\tmanage\tthe\tresulting\tgreater\tlevels\tof\tresidual\trisk.\n19', 'Table\tof\tContents\nauthority\tinvestigations,\tlegal\tproceedings\tby\tinternational\tgovernmental\tentities\tor\tothers\tresulting\tin\tmandated\tdisclosure\tof\tsensitive\tdata\tor\tother\ncommercially\tunfavorable\tterms.\tNotwithstanding\tour\tefforts\tto\tprotect\tthe\tsecurity\tand\tintegrity\tof\tour\tcustomers’\tpersonal\tinformation,\twe\tmay\tbe\nrequired\tto\texpend\tsignificant\tresources\tto\tcomply\twith\tdata\tbreach\trequirements\tif,\tfor\texample,\tthird\tparties\timproperly\tobtain\tand\tuse\tthe\tpersonal\ninformation\tof\tour\tcustomers\tor\twe\totherwise\texperience\ta\tdata\tloss\twith\trespect\tto\tthe\tpersonal\tinformation\twe\tprocess\tand\thandle.\tA\tmajor\tbreach\tof\nour\tnetwork\tsecurity\tand\tsystems\tmay\toccur\tdespite\tdefensive\tmeasures,\tand\tmay\tresult\tin\tfines,\tpenalties\tand\tdamages\tand\tharm\tour\tbrand,\tprospects\nand\toperating\tresults.\nWe\tcould\tbe\tsubject\tto\tliability,\tpenalties\tand\tother\trestrictive\tsanctions\tand\tadverse\tconsequences\tarising\tout\tof\tcertain\ngovernmental\tinvestigations\tand\tproceedings.\nWe\tare\tcooperating\twith\tcertain\tgovernment\tinvestigations\tas\tdiscussed\tin\tNote\t15,\t\nCommitments\tand\tContingencies\n,\tto\tthe\tconsolidated\tfinancial\nstatements\tincluded\telsewhere\tin\tthis\tAnnual\tReport\ton\tForm\t10-K.\tTo\tour\tknowledge,\tno\tgovernment\tagency\tin\tany\tsuch\tongoing\tinvestigation\thas\nconcluded\tthat\tany\twrongdoing\toccurred.\tHowever,\twe\tcannot\tpredict\tthe\toutcome\tor\timpact\tof\tany\tsuch\tongoing\tmatters,\tand\tthere\texists\tthe\tpossibility\nthat\twe\tcould\tbe\tsubject\tto\tliability,\tpenalties\tand\tother\trestrictive\tsanctions\tand\tadverse\tconsequences\tif\tthe\tSEC,\tthe\tU.S.\tDepartment\tof\tJustice\tor\tany\nother\tgovernment\tagency\twere\tto\tpursue\tlegal\taction\tin\tthe\tfuture.\tMoreover,\twe\texpect\tto\tincur\tcosts\tin\tresponding\tto\trelated\trequests\tfor\tinformation\nand\tsubpoenas,\tand\tif\tinstituted,\tin\tdefending\tagainst\tany\tgovernmental\tproceedings.\nWe\tmay\tface\tregulatory\tchallenges\tto\tor\tlimitations\ton\tour\tability\tto\tsell\tvehicles\tdirectly.\nWhile\twe\tintend\tto\tcontinue\tto\tleverage\tour\tmost\teffective\tsales\tstrategies,\tincluding\tsales\tthrough\tour\twebsite,\twe\tmay\tnot\tbe\table\tto\tsell\tour\nvehicles\tthrough\tour\town\tstores\tin\tcertain\tstates\tin\tthe\tU.S.\twith\tlaws\tthat\tmay\tbe\tinterpreted\tto\timpose\tlimitations\ton\tthis\tdirect-to-consumer\tsales\nmodel.\tIt\thas\talso\tbeen\tasserted\tthat\tthe\tlaws\tin\tsome\tstates\tlimit\tour\tability\tto\tobtain\tdealer\tlicenses\tfrom\tstate\tmotor\tvehicle\tregulators,\tand\tsuch\nassertions\tpersist.\tIn\tcertain\tlocations,\tdecisions\tby\tregulators\tpermitting\tus\tto\tsell\tvehicles\thave\tbeen,\tand\tmay\tbe,\tchallenged\tby\tdealer\tassociations\nand\tothers\tas\tto\twhether\tsuch\tdecisions\tcomply\twith\tapplicable\tstate\tmotor\tvehicle\tindustry\tlaws.\tWe\thave\tprevailed\tin\tmany\tof\tthese\tlawsuits\tand\tsuch\nresults\thave\treinforced\tour\tcontinuing\tbelief\tthat\tstate\tfranchise\tlaws\twere\tnot\tintended\tto\tapply\tto\ta\tmanufacturer\tthat\tdoes\tnot\thave\tfranchise\tdealers\nanywhere\tin\tthe\tworld.\tIn\tsome\tstates,\tthere\thave\talso\tbeen\tregulatory\tand\tlegislative\tefforts\tby\tdealer\tassociations\tto\tpropose\tlaws\tthat,\tif\tenacted,\nwould\tprevent\tus\tfrom\tobtaining\tdealer\tlicenses\tin\ttheir\tstates\tgiven\tour\tcurrent\tsales\tmodel.\tA\tfew\tstates\thave\tpassed\tlegislation\tthat\tclarifies\tour\tability\nto\toperate,\tbut\tat\tthe\tsame\ttime\tlimits\tthe\tnumber\tof\tdealer\tlicenses\twe\tcan\tobtain\tor\tstores\tthat\twe\tcan\toperate.\tThe\tapplication\tof\tstate\tlaws\tapplicable\nto\tour\toperations\tcontinues\tto\tbe\tdifficult\tto\tpredict.', 'Table\tof\tContents\nAutomobile\tManufacturer\tand\tDealer\tRegulation\nIn\tthe\tU.S.,\tstate\tlaws\tregulate\tthe\tmanufacture,\tdistribution,\tsale\tand\tservice\tof\tautomobiles,\tand\tgenerally\trequire\tmotor\tvehicle\tmanufacturers\nand\tdealers\tto\tbe\tlicensed\tin\torder\tto\tsell\tvehicles\tdirectly\tto\tresidents.\tCertain\tstates\thave\tasserted\tthat\tthe\tlaws\tin\tsuch\tstates\tdo\tnot\tpermit\tautomobile\nmanufacturers\tto\tbe\tlicensed\tas\tdealers\tor\tto\tact\tin\tthe\tcapacity\tof\ta\tdealer,\tor\tthat\tthey\totherwise\trestrict\ta\tmanufacturer’s\tability\tto\tdeliver\tor\tperform\nwarranty\trepairs\ton\tvehicles.\tTo\tsell\tvehicles\tto\tresidents\tof\tstates\twhere\twe\tare\tnot\tlicensed\tas\ta\tdealer,\twe\tgenerally\tconduct\tthe\tsale\tout\tof\tthe\tstate.\nIn\tcertain\tsuch\tstates,\twe\thave\topened\t“galleries”\tthat\tserve\tan\teducational\tpurpose\tand\twhere\tsales\tmay\tnot\toccur.\nSome\tautomobile\tdealer\ttrade\tassociations\thave\tboth\tchallenged\tthe\tlegality\tof\tour\toperations\tin\tcourt\tand\tused\tadministrative\tand\tlegislative\nprocesses\tto\tattempt\tto\tprohibit\tor\tlimit\tour\tability\tto\toperate\texisting\tstores\tor\texpand\tto\tnew\tlocations.\tCertain\tdealer\tassociations\thave\talso\tactively\nlobbied\tstate\tlicensing\tagencies\tand\tlegislators\tto\tinterpret\texisting\tlaws\tor\tenact\tnew\tlaws\tin\tways\tnot\tfavorable\tto\tour\townership\tand\toperation\tof\tour\nown\tretail\tand\tservice\tlocations.\tWe\texpect\tsuch\tchallenges\tto\tcontinue,\tand\twe\tintend\tto\tactively\tfight\tany\tsuch\tefforts.\nBattery\tSafety\tand\tTesting\nOur\tbattery\tpacks\tare\tsubject\tto\tvarious\tU.S.\tand\tinternational\tregulations\tthat\tgovern\ttransport\tof\t“dangerous\tgoods,”\tdefined\tto\tinclude\tlithium-\nion\tbatteries,\twhich\tmay\tpresent\ta\trisk\tin\ttransportation.\tWe\tconduct\ttesting\tto\tdemonstrate\tour\tcompliance\twith\tsuch\tregulations.\nWe\tuse\tlithium-ion\tcells\tin\tour\thigh\tvoltage\tbattery\tpacks\tin\tour\tvehicles\tand\tenergy\tstorage\tproducts.\tThe\tuse,\tstorage\tand\tdisposal\tof\tour\tbattery\npacks\tare\tregulated\tunder\texisting\tlaws\tand\tare\tthe\tsubject\tof\tongoing\tregulatory\tchanges\tthat\tmay\tadd\tadditional\trequirements\tin\tthe\tfuture.\tWe\thave\nagreements\twith\tthird\tparty\tbattery\trecycling\tcompanies\tto\trecycle\tour\tbattery\tpacks,\tand\twe\tare\talso\tpiloting\tour\town\trecycling\ttechnology.\nSolar\tEnergy—General\nWe\tare\tsubject\tto\tcertain\tstate\tand\tfederal\tregulations\tapplicable\tto\tsolar\tand\tbattery\tstorage\tproviders\tand\tsellers\tof\telectricity.\tTo\toperate\tour\nsystems,\twe\tenter\tinto\tstandard\tinterconnection\tagreements\twith\tapplicable\tutilities.\tSales\tof\telectricity\tand\tnon-sale\tequipment\tleases\tby\tthird\tparties,\nsuch\tas\tour\tleases\tand\tPPAs,\thave\tfaced\tregulatory\tchallenges\tin\tsome\tstates\tand\tjurisdictions.\nSolar\tEnergy—Net\tMetering\nMost\tstates\tin\tthe\tU.S.\tmake\tnet\tenergy\tmetering,\tor\tnet\tmetering,\tavailable\tto\tsolar\tcustomers.\tNet\tmetering\ttypically\tallows\tsolar\tcustomers\tto\ninterconnect\ttheir\tsolar\tenergy\tsystems\tto\tthe\tutility\tgrid\tand\toffset\ttheir\tutility\telectricity\tpurchases\tby\treceiving\ta\tbill\tcredit\tfor\texcess\tenergy\tgenerated\nby\ttheir\tsolar\tenergy\tsystem\tthat\tis\texported\tto\tthe\tgrid.\tIn\tcertain\tjurisdictions,\tregulators\tor\tutilities\thave\treduced\tor\teliminated\tthe\tbenefit\tavailable\nunder\tnet\tmetering\tor\thave\tproposed\tto\tdo\tso.\nCompetition\nAutomotive\nThe\tworldwide\tautomotive\tmarket\tis\thighly\tcompetitive\tand\twe\texpect\tit\twill\tbecome\teven\tmore\tcompetitive\tin\tthe\tfuture\tas\ta\tsignificant\tand\ngrowing\tnumber\tof\testablished\tand\tnew\tautomobile\tmanufacturers,\tas\twell\tas\tother\tcompanies,\thave\tentered,\tor\tare\treported\tto\thave\tplans\tto\tenter\tthe\nelectric\tvehicle\tmarket.']","Tesla faces regulatory challenges related to its direct-to-consumer sales model. Some states have laws that may be interpreted to limit this model, and there have been challenges to Tesla's ability to obtain dealer licenses in certain states.  Dealer associations have also lobbied against Tesla's operations and attempted to restrict its ability to sell vehicles directly to consumers. 
",State laws barring direct sales/dealer licensing; dealer associations’ legal and legislative challenges to Tesla’s store model,,0.99999999998,
What ongoing legal proceedings involve Tesla?,"['On\tFebruary\t27,\t2023,\ta\tproposed\tclass\taction\twas\tfiled\tin\tthe\tU.S.\tDistrict\tCourt\tfor\tthe\tNorthern\tDistrict\tof\tCalifornia\tagainst\tTesla,\tInc.,\tElon\tMusk\nand\tcertain\tcurrent\tand\tformer\tCompany\texecutives.\tThe\tcomplaint\talleges\tthat\tthe\tdefendants\tmade\tmaterial\tmisrepresentations\tand\tomissions\tabout\nthe\tCompany’s\tAutopilot\tand\tFSD\tCapability\ttechnologies\tand\tseeks\tmoney\tdamages\tand\tother\trelief\ton\tbehalf\tof\tpersons\twho\tpurchased\tTesla\tstock\nbetween\tFebruary\t19,\t2019\tand\tFebruary\t17,\t2023.\tAn\tamended\tcomplaint\twas\tfiled\ton\tSeptember\t5,\t2023,\tnaming\tonly\tTesla,\tInc.\tand\tElon\tMusk\tas\ndefendants.\tOn\tNovember\t6,\t2023,\tTesla\tmoved\tto\tdismiss\tthe\tamended\tcomplaint.\nOn\tMarch\t14,\t2023,\ta\tproposed\tclass\taction\twas\tfiled\tagainst\tTesla,\tInc.\tin\tthe\tU.S.\tDistrict\tCourt\tfor\tthe\tNorthern\tDistrict\tof\tCalifornia.\tSeveral\nsimilar\tcomplaints\thave\talso\tbeen\tfiled\tin\tthe\tsame\tcourt\tand\tthese\tcases\thave\tnow\tall\tbeen\tconsolidated.\tThese\tcomplaints\tallege\tthat\tTesla\tviolates\nfederal\tantitrust\tand\twarranty\tlaws\tthrough\tits\trepair,\tservice,\tand\tmaintenance\tpractices\tand\tseeks,\tamong\tother\trelief,\tdamages\tfor\tpersons\twho\tpaid\nTesla\tfor\trepairs\tservices\tor\tTesla\tcompatible\treplacement\tparts\tfrom\tMarch\t2019\tto\tMarch\t2023.\tOn\tJuly\t17,\t2023,\tthese\tplaintiffs\tfiled\ta\tconsolidated\namended\tcomplaint.\tOn\tSeptember\t27,\t2023,\tthe\tcourt\tgranted\tTesla’s\tmotion\tto\tcompel\tarbitration\tas\tto\tthree\tof\tthe\tplaintiffs,\tand\ton\tNovember\t17,\n2023,\tthe\tcourt\tgranted\tTesla’s\tmotion\tto\tdismiss\twithout\tprejudice.\tThe\tplaintiffs\tfiled\ta\tConsolidated\tSecond\tAmended\tComplaint\ton\tDecember\t12,\n2023,\twhich\tTesla\thas\tmoved\tto\tdismiss.\tPlaintiffs\thave\talso\tappealed\tthe\tcourt’s\tarbitration\torder.\tTrial\tis\tcurrently\tset\tfor\tJuly\t7,\t2025.\nThe\tCompany\tintends\tto\tvigorously\tdefend\titself\tin\tthese\tmatters;\thowever,\twe\tcannot\tpredict\tthe\toutcome\tor\timpact.\tWe\tare\tunable\tto\treasonably\nestimate\tthe\tpossible\tloss\tor\trange\tof\tloss,\tif\tany,\tassociated\twith\tthese\tclaims,\tunless\tnoted.\nCertain\tInvestigations\tand\tOther\tMatters\nWe\tregularly\treceive\trequests\tfor\tinformation,\tincluding\tsubpoenas,\tfrom\tregulators\tand\tgovernmental\tauthorities\tsuch\tas\tthe\tNational\tHighway\nTraffic\tSafety\tAdministration,\tthe\tNational\tTransportation\tSafety\tBoard,\tthe\tSecurities\tand\tExchange\tCommission\t(“SEC”),\tthe\tDepartment\tof\tJustice\n(“DOJ”),\tand\tvarious\tlocal,\tstate,\tfederal,\tand\tinternational\tagencies.\tThe\tongoing\trequests\tfor\tinformation\tinclude\ttopics\tsuch\tas\toperations,\ttechnology\n(e.g.,\tvehicle\tfunctionality,\tAutopilot\tand\tFSD\tCapability),\tcompliance,\tfinance,\tdata\tprivacy,\tand\tother\tmatters\trelated\tto\tTesla’s\tbusiness,\tits\tpersonnel,\nand\trelated\tparties.\tWe\troutinely\tcooperate\twith\tsuch\tformal\tand\tinformal\trequests\tfor\tinformation,\tinvestigations,\tand\tother\tinquiries.\tTo\tour\tknowledge\nno\tgovernment\tagency\tin\tany\tongoing\tinvestigation\thas\tconcluded\tthat\tany\twrongdoing\toccurred.\tWe\tcannot\tpredict\tthe\toutcome\tor\timpact\tof\tany\nongoing\tmatters.\tShould\tthe\tgovernment\tdecide\tto\tpursue\tan\tenforcement\taction,\tthere\texists\tthe\tpossibility\tof\ta\tmaterial\tadverse\timpact\ton\tour\nbusiness,\tresults\tof\toperation,\tprospects,\tcash\tflows,\tfinancial\tposition\tor\tbrand.\n89', 'Other\tLitigation\tRelated\tto\tOur\tProducts\tand\tServices\nWe\tare\talso\tsubject\tto\tvarious\tlawsuits\tthat\tseek\tmonetary\tand\tother\tinjunctive\trelief.\tThese\tlawsuits\tinclude\tproposed\tclass\tactions\tand\tother\nconsumer\tclaims\tthat\tallege,\tamong\tother\tthings,\tpurported\tdefects\tand\tmisrepresentations\trelated\tto\tour\tproducts\tand\tservices.\tFor\texample,\ton\nSeptember\t14,\t2022,\ta\tproposed\tclass\taction\twas\tfiled\tagainst\tTesla,\tInc.\tand\trelated\tentities\tin\tthe\tU.S.\tDistrict\tCourt\tfor\tthe\tNorthern\tDistrict\tof\nCalifornia,\talleging\tvarious\tclaims\tabout\tthe\tCompany’s\tdriver\tassistance\ttechnology\tsystems\tunder\tstate\tand\tfederal\tlaw.\tThis\tcase\twas\tlater\nconsolidated\twith\tseveral\tother\tproposed\tclass\tactions,\tand\ta\tConsolidated\tAmended\tComplaint\twas\tfiled\ton\tOctober\t28,\t2022,\twhich\tseeks\tdamages\tand\nother\trelief\ton\tbehalf\tof\tall\tpersons\twho\tpurchased\tor\tleased\tfrom\tTesla\tbetween\tJanuary\t1,\t2016\tto\tthe\tpresent.\tOn\tOctober\t5,\t2022\ta\tproposed\tclass\naction\tcomplaint\twas\tfiled\tin\tthe\tU.S.\tDistrict\tCourt\tfor\tthe\tEastern\tDistrict\tof\tNew\tYork\tasserting\tsimilar\tstate\tand\tfederal\tlaw\tclaims\tagainst\tthe\tsame\ndefendants.\tOn\tSeptember\t30,\t2023,\tthe\tCourt\tdismissed\tthis\taction\twith\tleave\tto\tamend\tthe\tcomplaint.\tOn\tNovember\t20,\t2023,\tthe\tplaintiff\tmoved\tto\namend\tthe\tcomplaint,\twhich\tTesla\topposed.\tOn\tMarch\t22,\t2023,\tthe\tplaintiffs\tin\tthe\tNorthern\tDistrict\tof\tCalifornia\tconsolidated\taction\tfiled\ta\tmotion\tfor\ta\npreliminary\tinjunction\tto\torder\tTesla\tto\t(1)\tcease\tusing\tthe\tterm\t“Full\tSelf-Driving\tCapability”\t(FSD\tCapability),\t(2)\tcease\tthe\tsale\tand\tactivation\tof\tFSD\nCapability\tand\tdeactivate\tFSD\tCapability\ton\tTesla\tvehicles,\tand\t(3)\tprovide\tcertain\tnotices\tto\tconsumers\tabout\tproposed\tcourt-findings\tabout\tthe\naccuracy\tof\tthe\tuse\tof\tthe\tterms\tAutopilot\tand\tFSD\tCapability.\tTesla\topposed\tthe\tmotion.\tOn\tSeptember\t30,\t2023,\tthe\tCourt\tdenied\tthe\trequest\tfor\ta\npreliminary\tinjunction,\tcompelled\tfour\tof\tfive\tplaintiffs\tto\tarbitration,\tand\tdismissed\tthe\tclaims\tof\tthe\tfifth\tplaintiff\twith\tleave\tto\tamend\tthe\tcomplaint.\tOn\nOctober\t31,\t2023,\tthe\tremaining\tplaintiff\tin\tthe\tNorthern\tDistrict\tof\tCalifornia\taction\tfiled\tan\tamended\tcomplaint,\twhich\tTesla\thas\tmoved\tto\tdismiss.\tOn\nOctober\t2,\t2023,\ta\tsimilar\tproposed\tclass\taction\twas\tfiled\tin\tSan\tDiego\tCounty\tSuperior\tCourt\tin\tCalifornia.\tTesla\tsubsequently\tremoved\tthe\tSan\tDiego\nCounty\tcase\tto\tfederal\tcourt\tand\ton\tJanuary\t8,\t2024,\tthe\tfederal\tcourt\tgranted\tTesla’s\tmotion\tto\ttransfer\tthe\tcase\tto\tthe\tU.S.\tDistrict\tCourt\tfor\tthe\nNorthern\tDistrict\tof\tCalifornia.\nOn\tFebruary\t27,\t2023,\ta\tproposed\tclass\taction\twas\tfiled\tin\tthe\tU.S.\tDistrict\tCourt\tfor\tthe\tNorthern\tDistrict\tof\tCalifornia\tagainst\tTesla,\tInc.,\tElon\tMusk\nand\tcertain\tcurrent\tand\tformer\tCompany\texecutives.\tThe\tcomplaint\talleges\tthat\tthe\tdefendants\tmade\tmaterial\tmisrepresentations\tand\tomissions\tabout\nthe\tCompany’s\tAutopilot\tand\tFSD\tCapability\ttechnologies\tand\tseeks\tmoney\tdamages\tand\tother\trelief\ton\tbehalf\tof\tpersons\twho\tpurchased\tTesla\tstock\nbetween\tFebruary\t19,\t2019\tand\tFebruary\t17,\t2023.\tAn\tamended\tcomplaint\twas\tfiled\ton\tSeptember\t5,\t2023,\tnaming\tonly\tTesla,\tInc.', 'Legal\tProceedings\nLitigation\tRelating\tto\t2018\tCEO\tPerformance\tAward\nOn\tJune\t4,\t2018,\ta\tpurported\tTesla\tstockholder\tfiled\ta\tputative\tclass\tand\tderivative\taction\tin\tthe\tDelaware\tCourt\tof\tChancery\tagainst\tElon\tMusk\tand\nthe\tmembers\tof\tTesla’s\tboard\tof\tdirectors\tas\tthen\tconstituted,\talleging\tcorporate\twaste,\tunjust\tenrichment\tand\tthat\tsuch\tboard\tmembers\tbreached\ttheir\nfiduciary\tduties\tby\tapproving\tthe\tstock-based\tcompensation\tplan\tawarded\tto\tElon\tMusk\tin\t2018.\tTrial\twas\theld\tNovember\t14-18,\t2022.\tPost-trial\tbriefing\nand\targument\tare\tnow\tcomplete.\nLitigation\tRelated\tto\tDirectors’\tCompensation\nOn\tJune\t17,\t2020,\ta\tpurported\tTesla\tstockholder\tfiled\ta\tderivative\taction\tin\tthe\tDelaware\tCourt\tof\tChancery,\tpurportedly\ton\tbehalf\tof\tTesla,\tagainst\ncertain\tof\tTesla’s\tcurrent\tand\tformer\tdirectors\tregarding\tcompensation\tawards\tgranted\tto\tTesla’s\tdirectors,\tother\tthan\tElon\tMusk,\tbetween\t2017\tand\n2020.\tThe\tsuit\tasserts\tclaims\tfor\tbreach\tof\tfiduciary\tduty\tand\tunjust\tenrichment\tand\tseeks\tdeclaratory\tand\tinjunctive\trelief,\tunspecified\tdamages\tand\nother\trelief.\tDefendants\tfiled\ttheir\tanswer\ton\tSeptember\t17,\t2020.\nOn\tJuly\t14,\t2023,\tthe\tparties\tfiled\ta\tStipulation\tand\tAgreement\tof\tCompromise\tand\tSettlement,\twhich\tdoes\tnot\tinvolve\tan\tadmission\tof\tany\nwrongdoing\tby\tany\tparty.\tIf\tthe\tsettlement\tis\tapproved\tby\tthe\tCourt,\tthis\taction\twill\tbe\tfully\tsettled\tand\tdismissed\twith\tprejudice.\tPursuant\tto\tthe\tterms\tof\nthe\tagreement,\tTesla\tprovided\tnotice\tof\tthe\tproposed\tsettlement\tto\tstockholders\tof\trecord\tas\tof\tJuly\t14,\t2023.\tThe\tCourt\theld\ta\thearing\tregarding\tthe\nsettlement\ton\tOctober\t13,\t2023,\tafter\twhich\tit\ttook\tthe\tsettlement\tand\tplaintiff\tcounsels’\tfee\trequest\tunder\tadvisement.\tThe\tsettlement\tis\tnot\texpected\nto\thave\tan\tadverse\timpact\ton\tour\tresults\tof\toperations,\tcash\tflows\tor\tfinancial\tposition.\nLitigation\tRelating\tto\tPotential\tGoing\tPrivate\tTransaction\nBetween\tAugust\t10,\t2018\tand\tSeptember\t6,\t2018,\t\nnine\n\tpurported\tstockholder\tclass\tactions\twere\tfiled\tagainst\tTesla\tand\tElon\tMusk\tin\tconnection\nwith\tMr.\tMusk’s\tAugust\t7,\t2018\tTwitter\tpost\tthat\the\twas\tconsidering\ttaking\tTesla\tprivate.\tOn\tJanuary\t16,\t2019,\tPlaintiffs\tfiled\ttheir\tconsolidated\tcomplaint\nin\tthe\tUnited\tStates\tDistrict\tCourt\tfor\tthe\tNorthern\tDistrict\tof\tCalifornia\tand\tadded\tas\tdefendants\tthe\tmembers\tof\tTesla’s\tboard\tof\tdirectors.\tThe\nconsolidated\tcomplaint\tasserts\tclaims\tfor\tviolations\tof\tthe\tfederal\tsecurities\tlaws\tand\tseeks\tunspecified\tdamages\tand\tother\trelief.\tThe\tparties\tstipulated\nto\tcertification\tof\ta\tclass\tof\tstockholders,\twhich\tthe\tcourt\tgranted\ton\tNovember\t25,\t2020.\tTrial\tstarted\ton\tJanuary\t17,\t2023,\tand\ton\tFebruary\t3,\t2023,\ta\njury\trendered\ta\tverdict\tin\tfavor\tof\tthe\tdefendants\ton\tall\tcounts.\tAfter\ttrial,\tplaintiffs\tfiled\ta\tmotion\tfor\tjudgment\tas\ta\tmatter\tof\tlaw\tand\ta\tmotion\tfor\tnew\ntrial,\twhich\tthe\tCourt\tdenied\tand\tjudgement\twas\tentered\tin\tfavor\tof\tdefendants\ton\tJuly\t11,\t2023.\tOn\tJuly\t14,\t2023,\tplaintiffs\tfiled\ta\tnotice\tof\tappeal.\n87', 'We\tare\talso\tsubject\tto\tvarious\tother\tlegal\tproceedings,\trisks\tand\tclaims\tthat\tarise\tfrom\tthe\tnormal\tcourse\tof\tbusiness\tactivities.\tFor\texample,\tduring\nthe\tsecond\tquarter\tof\t2023,\ta\tforeign\tnews\toutlet\treported\tthat\tit\tobtained\tcertain\tmisappropriated\tdata\tincluding,\tpurportedly\tnon-public\tTesla\tbusiness\nand\tpersonal\tinformation.\tTesla\thas\tmade\tnotifications\tto\tpotentially\taffected\tindividuals\t(current\tand\tformer\temployees)\tand\tregulatory\tauthorities\tand\nwe\tare\tworking\twith\tcertain\tlaw\tenforcement\tand\tother\tauthorities.\tOn\tAugust\t5,\t2023,\ta\tputative\tclass\taction\twas\tfiled\tin\tthe\tUnited\tStates\tDistrict\tCourt\nfor\tthe\tNorthern\tDistrict\tof\tCalifornia,\tpurportedly\ton\tbehalf\tof\tall\tU.S.\tindividuals\timpacted\tby\tthe\tdata\tincident,\tfollowed\tby\tseveral\tadditional\tlawsuits,\nthat\teach\tassert\tclaims\tunder\tvarious\tstate\tlaws\tand\tseeks\tmonetary\tdamages\tand\tother\trelief.\tIf\tan\tunfavorable\truling\tor\tdevelopment\twere\tto\toccur\tin\nthese\tor\tother\tpossible\tlegal\tproceedings,\trisks\tand\tclaims,\tthere\texists\tthe\tpossibility\tof\ta\tmaterial\tadverse\timpact\ton\tour\tbusiness,\tresults\tof\toperations,\nprospects,\tcash\tflows,\tfinancial\tposition\tor\tbrand.\nLetters\tof\tCredit\nAs\tof\tDecember\t31,\t2023,\twe\thad\t$\n525\n\tmillion\tof\tunused\tletters\tof\tcredit\toutstanding.\nNote\t16\t–\t\nVariable\tInterest\tEntity\tArrangements\nWe\thave\tentered\tinto\tvarious\tarrangements\twith\tinvestors\tto\tfacilitate\tthe\tfunding\tand\tmonetization\tof\tour\tsolar\tenergy\tsystems\tand\tvehicles.\tIn\nparticular,\tour\twholly\towned\tsubsidiaries\tand\tfund\tinvestors\thave\tformed\tand\tcontributed\tcash\tand\tassets\tinto\tvarious\tfinancing\tfunds\tand\tentered\tinto\nrelated\tagreements.\tWe\thave\tdetermined\tthat\tthe\tfunds\tare\tVIEs\tand\twe\tare\tthe\tprimary\tbeneficiary\tof\tthese\tVIEs\tby\treference\tto\tthe\tpower\tand\tbenefits\ncriterion\tunder\tASC\t810.\tWe\thave\tconsidered\tthe\tprovisions\twithin\tthe\tagreements,\twhich\tgrant\tus\tthe\tpower\tto\tmanage\tand\tmake\tdecisions\tthat\taffect\nthe\toperation\tof\tthese\tVIEs,\tincluding\tdetermining\tthe\tsolar\tenergy\tsystems\tand\tthe\tassociated\tcustomer\tcontracts\tto\tbe\tsold\tor\tcontributed\tto\tthese\nVIEs,\tredeploying\tsolar\tenergy\tsystems\tand\tmanaging\tcustomer\treceivables.\tWe\tconsider\tthat\tthe\trights\tgranted\tto\tthe\tfund\tinvestors\tunder\tthe\nagreements\tare\tmore\tprotective\tin\tnature\trather\tthan\tparticipating.\nAs\tthe\tprimary\tbeneficiary\tof\tthese\tVIEs,\twe\tconsolidate\tin\tthe\tfinancial\tstatements\tthe\tfinancial\tposition,\tresults\tof\toperations\tand\tcash\tflows\tof\nthese\tVIEs,\tand\tall\tintercompany\tbalances\tand\ttransactions\tbetween\tus\tand\tthese\tVIEs\tare\teliminated\tin\tthe\tconsolidated\tfinancial\tstatements.\tCash\ndistributions\tof\tincome\tand\tother\treceipts\tby\ta\tfund,\tnet\tof\tagreed\tupon\texpenses,\testimated\texpenses,\ttax\tbenefits\tand\tdetriments\tof\tincome\tand\tloss\nand\ttax\tcredits,\tare\tallocated\tto\tthe\tfund\tinvestor\tand\tour\tsubsidiary\tas\tspecified\tin\tthe\tagreements.\nGenerally,\tour\tsubsidiary\thas\tthe\toption\tto\tacquire\tthe\tfund\tinvestor’s\tinterest\tin\tthe\tfund\tfor\tan\tamount\tbased\ton\tthe\tmarket\tvalue\tof\tthe\tfund\tor\nthe\tformula\tspecified\tin\tthe\tagreements.\nUpon\tthe\tsale\tor\tliquidation\tof\ta\tfund,\tdistributions\twould\toccur\tin\tthe\torder\tand\tpriority\tspecified\tin\tthe\tagreements.', 'On\tDecember\t18,\t2023,\nTesla\tfiled\ta\tmotion\tto\tstay\tthe\tcase.\tSeparately,\ton\tDecember\t26,\t2023,\tTesla\tfiled\ta\tmotion\tto\tdismiss\tthe\tcase.\nOn\tJune\t16,\t2022,\t\ntwo\n\tTesla\tstockholders\tfiled\tseparate\tderivative\tactions\tin\tthe\tU.S.\tDistrict\tCourt\tfor\tthe\tWestern\tDistrict\tof\tTexas,\tpurportedly\ton\nbehalf\tof\tTesla,\tagainst\tcertain\tof\tTesla’s\tcurrent\tand\tformer\tdirectors.\tBoth\tsuits\tassert\tclaims\tfor\tbreach\tof\tfiduciary\tduty,\tunjust\tenrichment,\tand\nviolation\tof\tthe\tfederal\tsecurities\tlaws\tin\tconnection\twith\talleged\trace\tand\tgender\tdiscrimination\tand\tsexual\tharassment.\tAmong\tother\tthings,\tplaintiffs\nseek\tdeclaratory\tand\tinjunctive\trelief,\tunspecified\tdamages\tpayable\tto\tTesla,\tand\tattorneys’\tfees.\tOn\tJuly\t22,\t2022,\tthe\tCourt\tconsolidated\tthe\t\ntwo\n\tcases\nand\ton\tSeptember\t6,\t2022,\tplaintiffs\tfiled\ta\tconsolidated\tcomplaint.\tOn\tNovember\t7,\t2022,\tthe\tdefendants\tfiled\ta\tmotion\tto\tdismiss\tthe\tcase\tand\ton\nSeptember\t15,\t2023,\tthe\tCourt\tdismissed\tthe\taction\tbut\tgranted\tplaintiffs\tleave\tto\tfile\tan\tamended\tcomplaint.\tOn\tNovember\t2,\t2023,\tplaintiff\tfiled\tan\namended\tcomplaint\tpurportedly\ton\tbehalf\tof\tTesla,\tagainst\tElon\tMusk.\tOn\tDecember\t19,\t2023,\tthe\tdefendants\tmoved\tto\tdismiss\tthe\tamended\tcomplaint.\n88']","Tesla is involved in several ongoing legal proceedings. These include:

* **Class action lawsuits related to Autopilot and FSD Capability:** These lawsuits allege that Tesla made misrepresentations about its Autopilot and Full Self-Driving Capability technologies. 
* **Lawsuits related to repair, service, and maintenance practices:** These lawsuits allege that Tesla violates antitrust and warranty laws through its repair, service, and maintenance practices.
* **Litigation relating to 2018 CEO performance award:** This case involves a shareholder's claim that the 2018 stock-based compensation plan awarded to Elon Musk constituted corporate waste and a breach of fiduciary duty.
* **Litigation relating to directors' compensation:** This case involves a shareholder's claim that compensation awards granted to Tesla's directors were excessive and constituted a breach of fiduciary duty. This case has been settled.
* **Litigation relating to a potential going private transaction:** This case stems from Elon Musk's 2018 tweet suggesting he was considering taking Tesla private. 




","Various product‑liability suits, warranty claims, regulatory investigations detailed under Item 3 Legal Proceedings",,0.99999999998,1.0
What cybersecurity risks does Tesla disclose?,"['In\taddition,\tthe\tSEC\tmaintains\ta\twebsite\t(\nwww.sec.gov\n)\tthat\tcontains\nreports,\tproxy\tand\tinformation\tstatements,\tand\tother\tinformation\tregarding\tissuers\tthat\tfile\telectronically.\tOur\twebsite\tis\tlocated\tat\t\nwww.tesla.com\n,\tand\nour\treports,\tamendments\tthereto,\tproxy\tstatements\tand\tother\tinformation\tare\talso\tmade\tavailable,\tfree\tof\tcharge,\ton\tour\tinvestor\trelations\twebsite\tat\nir.tesla.com\n\tas\tsoon\tas\treasonably\tpracticable\tafter\twe\telectronically\tfile\tor\tfurnish\tsuch\tinformation\twith\tthe\tSEC.\tThe\tinformation\tposted\ton\tour\twebsite\nis\tnot\tincorporated\tby\treference\tinto\tthis\tAnnual\tReport\ton\tForm\t10-K.\nITEM\t1A.\tRISK\tFACTORS\nYou\tshould\tcarefully\tconsider\tthe\trisks\tdescribed\tbelow\ttogether\twith\tthe\tother\tinformation\tset\tforth\tin\tthis\treport,\twhich\tcould\tmaterially\taffect\tour\nbusiness,\tfinancial\tcondition\tand\tfuture\tresults.\tThe\trisks\tdescribed\tbelow\tare\tnot\tthe\tonly\trisks\tfacing\tour\tcompany.\tRisks\tand\tuncertainties\tnot\tcurrently\nknown\tto\tus\tor\tthat\twe\tcurrently\tdeem\tto\tbe\timmaterial\talso\tmay\tmaterially\tadversely\taffect\tour\tbusiness,\tfinancial\tcondition\tand\toperating\tresults.\nRisks\tRelated\tto\tOur\tAbility\tto\tGrow\tOur\tBusiness\nWe\tmay\texperience\tdelays\tin\tlaunching\tand\tramping\tthe\tproduction\tof\tour\tproducts\tand\tfeatures,\tor\twe\tmay\tbe\tunable\tto\tcontrol\nour\tmanufacturing\tcosts.\nWe\thave\tpreviously\texperienced\tand\tmay\tin\tthe\tfuture\texperience\tlaunch\tand\tproduction\tramp\tdelays\tfor\tnew\tproducts\tand\tfeatures.\tFor\texample,\nwe\tencountered\tunanticipated\tsupplier\tissues\tthat\tled\tto\tdelays\tduring\tthe\tinitial\tramp\tof\tour\tfirst\tModel\tX\tand\texperienced\tchallenges\twith\ta\tsupplier\tand\nwith\tramping\tfull\tautomation\tfor\tcertain\tof\tour\tinitial\tModel\t3\tmanufacturing\tprocesses.\tIn\taddition,\twe\tmay\tintroduce\tin\tthe\tfuture\tnew\tor\tunique\nmanufacturing\tprocesses\tand\tdesign\tfeatures\tfor\tour\tproducts.\tAs\twe\texpand\tour\tvehicle\tofferings\tand\tglobal\tfootprint,\tthere\tis\tno\tguarantee\tthat\twe\twill\nbe\table\tto\tsuccessfully\tand\ttimely\tintroduce\tand\tscale\tsuch\tprocesses\tor\tfeatures.\n14', 'Our\tcybersecurity\trisk\tmanagement\tand\tstrategy\tprocesses\tare\toverseen\tby\tleaders\tfrom\tour\tInformation\tSecurity,\tProduct\tSecurity,\tCompliance\nand\tLegal\tteams.\tSuch\tindividuals\thave\tan\taverage\tof\tover\t15\tyears\tof\tprior\twork\texperience\tin\tvarious\troles\tinvolving\tinformation\ttechnology,\tincluding\nsecurity,\tauditing,\tcompliance,\tsystems\tand\tprogramming.\tThese\tindividuals\tare\tinformed\tabout,\tand\tmonitor\tthe\tprevention,\tmitigation,\tdetection\tand\nremediation\tof\tcybersecurity\tincidents\tthrough\ttheir\tmanagement\tof,\tand\tparticipation\tin,\tthe\tcybersecurity\trisk\tmanagement\tand\tstrategy\tprocesses\ndescribed\tabove,\tincluding\tthe\toperation\tof\tour\tincident\tresponse\tplan,\tand\treport\tto\tthe\tAudit\tCommittee\ton\tany\tappropriate\titems.\nITEM\t2.\tPROPERTIES\nWe\tare\theadquartered\tin\tAustin,\tTexas.\tOur\tprincipal\tfacilities\tinclude\ta\tlarge\tnumber\tof\tproperties\tin\tNorth\tAmerica,\tEurope\tand\tAsia\tutilized\tfor\nmanufacturing\tand\tassembly,\twarehousing,\tengineering,\tretail\tand\tservice\tlocations,\tSupercharger\tsites\tand\tadministrative\tand\tsales\toffices.\tOur\tfacilities\nare\tused\tto\tsupport\tboth\tof\tour\treporting\tsegments,\tand\tare\tsuitable\tand\tadequate\tfor\tthe\tconduct\tof\tour\tbusiness.\tWe\tgenerally\tlease\tsuch\tfacilities\twith\nthe\tprimary\texception\tof\tsome\tmanufacturing\tfacilities.\tThe\tfollowing\ttable\tsets\tforth\tthe\tlocation\tof\tour\tprimary\towned\tand\tleased\tmanufacturing\nfacilities.\nPrimary\tManufacturing\tFacilities\nLocation\nOwned\tor\tLeased\nGigafactory\tTexas\nAustin,\tTexas\nOwned\nFremont\tFactory\nFremont,\tCalifornia\nOwned\nGigafactory\tNevada\nSparks,\tNevada\nOwned\nGigafactory\tBerlin-Brandenburg\nGrunheide,\tGermany\nOwned\nGigafactory\tShanghai\nShanghai,\tChina\n*\nGigafactory\tNew\tYork\nBuffalo,\tNew\tYork\nLeased\nMegafactory\nLathrop,\tCalifornia\nLeased\n*\nWe\town\tthe\tbuilding\tand\tthe\tland\tuse\trights\twith\tan\tinitial\tterm\tof\t50\tyears.\tThe\tland\tuse\trights\tare\ttreated\tas\toperating\tlease\tright-of-use\tassets.\nITEM\t3.\tLEGAL\tPROCEEDINGS\nFor\ta\tdescription\tof\tour\tmaterial\tpending\tlegal\tproceedings,\tplease\tsee\tNote\t15,\t\nCommitments\tand\tContingencies\n,\tto\tthe\tconsolidated\tfinancial\nstatements\tincluded\telsewhere\tin\tthis\tAnnual\tReport\ton\tForm\t10-K.\nIn\taddition,\teach\tof\tthe\tmatters\tbelow\tis\tbeing\tdisclosed\tpursuant\tto\tItem\t103\tof\tRegulation\tS-K\tbecause\tit\trelates\tto\tenvironmental\tregulations\tand\naggregate\tcivil\tpenalties\tthat\twe\tcurrently\tbelieve\tcould\tpotentially\texceed\t$1\tmillion.\tWe\tbelieve\tthat\tany\tproceeding\tthat\tis\tmaterial\tto\tour\tbusiness\tor\nfinancial\tcondition\tis\tlikely\tto\thave\tpotential\tpenalties\tfar\tin\texcess\tof\tsuch\tamount.\nDistrict\tattorneys\tin\tcertain\tCalifornia\tcounties\tconducted\tan\tinvestigation\tinto\tTesla’s\twaste\tsegregation\tpractices\tpursuant\tto\tCal.\tHealth\t&\tSaf.\nCode\t§\t25100\tet\tseq.\tand\tCal.\tCivil\tCode\t§\t1798.80.\tTesla\thas\timplemented\tvarious\tremedial\tmeasures,\tincluding\tconducting\ttraining\tand\taudits,\tand\nenhancements\tto\tits\tsite\twaste\tmanagement\tprograms,\tand\tsettlement\tdiscussions\tare\tongoing.\tWhile\tthe\toutcome\tof\tthis\tmatter\tcannot\tbe\tdetermined\nat\tthis\ttime,\tit\tis\tnot\tcurrently\texpected\tto\thave\ta\tmaterial\tadverse\timpact\ton\tour\tbusiness.\nITEM\t4.\tMINE\tSAFETY\tDISCLOSURES\nNot\tapplicable.\n30', 'Table\tof\tContents\nWe\tare\thighly\tdependent\ton\tthe\tservices\tof\tElon\tMusk,\tTechnoking\tof\tTesla\tand\tour\tChief\tExecutive\tOfficer.\nWe\tare\thighly\tdependent\ton\tthe\tservices\tof\tElon\tMusk,\tTechnoking\tof\tTesla\tand\tour\tChief\tExecutive\tOfficer.\tAlthough\tMr.\tMusk\tspends\tsignificant\ntime\twith\tTesla\tand\tis\thighly\tactive\tin\tour\tmanagement,\the\tdoes\tnot\tdevote\this\tfull\ttime\tand\tattention\tto\tTesla.\tMr.\tMusk\talso\tcurrently\tserves\tas\tChief\nExecutive\tOfficer\tand\tChief\tTechnical\tOfficer\tof\tSpace\tExploration\tTechnologies\tCorp.,\ta\tdeveloper\tand\tmanufacturer\tof\tspace\tlaunch\tvehicles,\tChairman\nand\tChief\tTechnical\tOfficer\tof\tX\tCorp.,\ta\tsocial\tmedia\tcompany,\tand\tis\tinvolved\tin\tother\temerging\ttechnology\tventures.\nOur\tinformation\ttechnology\tsystems\tor\tdata,\tor\tthose\tof\tour\tservice\tproviders\tor\tcustomers\tor\tusers\tcould\tbe\tsubject\tto\tcyber-\nattacks\tor\tother\tsecurity\tincidents,\twhich\tcould\tresult\tin\tdata\tbreaches,\tintellectual\tproperty\ttheft,\tclaims,\tlitigation,\tregulatory\ninvestigations,\tsignificant\tliability,\treputational\tdamage\tand\tother\tadverse\tconsequences.\nWe\tcontinue\tto\texpand\tour\tinformation\ttechnology\tsystems\tas\tour\toperations\tgrow,\tsuch\tas\tproduct\tdata\tmanagement,\tprocurement,\tinventory\nmanagement,\tproduction\tplanning\tand\texecution,\tsales,\tservice\tand\tlogistics,\tdealer\tmanagement,\tfinancial,\ttax\tand\tregulatory\tcompliance\tsystems.\tThis\nincludes\tthe\timplementation\tof\tnew\tinternally\tdeveloped\tsystems\tand\tthe\tdeployment\tof\tsuch\tsystems\tin\tthe\tU.S.\tand\tabroad.\tWhile,\twe\tmaintain\ninformation\ttechnology\tmeasures\tdesigned\tto\tprotect\tus\tagainst\tintellectual\tproperty\ttheft,\tdata\tbreaches,\tsabotage\tand\tother\texternal\tor\tinternal\tcyber-\nattacks\tor\tmisappropriation,\tour\tsystems\tand\tthose\tof\tour\tservice\tproviders\tare\tpotentially\tvulnerable\tto\tmalware,\transomware,\tviruses,\tdenial-of-service\nattacks,\tphishing\tattacks,\tsocial\tengineering,\tcomputer\thacking,\tunauthorized\taccess,\texploitation\tof\tbugs,\tdefects\tand\tvulnerabilities,\tbreakdowns,\ndamage,\tinterruptions,\tsystem\tmalfunctions,\tpower\toutages,\tterrorism,\tacts\tof\tvandalism,\tsecurity\tbreaches,\tsecurity\tincidents,\tinadvertent\tor\tintentional\nactions\tby\temployees\tor\tother\tthird\tparties,\tand\tother\tcyber-attacks.\nTo\tthe\textent\tany\tsecurity\tincident\tresults\tin\tunauthorized\taccess\tor\tdamage\tto\tor\tacquisition,\tuse,\tcorruption,\tloss,\tdestruction,\talteration\tor\ndissemination\tof\tour\tdata,\tincluding\tintellectual\tproperty\tand\tpersonal\tinformation,\tor\tour\tproducts\tor\tvehicles,\tor\tfor\tit\tto\tbe\tbelieved\tor\treported\tthat\tany\nof\tthese\toccurred,\tit\tcould\tdisrupt\tour\tbusiness,\tharm\tour\treputation,\tcompel\tus\tto\tcomply\twith\tapplicable\tdata\tbreach\tnotification\tlaws,\tsubject\tus\tto\ttime\nconsuming,\tdistracting\tand\texpensive\tlitigation,\tregulatory\tinvestigation\tand\toversight,\tmandatory\tcorrective\taction,\trequire\tus\tto\tverify\tthe\tcorrectness\nof\tdatabase\tcontents,\tor\totherwise\tsubject\tus\tto\tliability\tunder\tlaws,\tregulations\tand\tcontractual\tobligations,\tincluding\tthose\tthat\tprotect\tthe\tprivacy\tand\nsecurity\tof\tpersonal\tinformation.\tThis\tcould\tresult\tin\tincreased\tcosts\tto\tus\tand\tresult\tin\tsignificant\tlegal\tand\tfinancial\texposure\tand/or\treputational\tharm.\nWe\talso\trely\ton\tservice\tproviders,\tand\tsimilar\tincidents\trelating\tto\ttheir\tinformation\ttechnology\tsystems\tcould\talso\thave\ta\tmaterial\tadverse\teffect\ton\nour\tbusiness.\tThere\thave\tbeen\tand\tmay\tcontinue\tto\tbe\tsignificant\tsupply\tchain\tattacks.', 'Table\tof\tContents\nauthority\tinvestigations,\tlegal\tproceedings\tby\tinternational\tgovernmental\tentities\tor\tothers\tresulting\tin\tmandated\tdisclosure\tof\tsensitive\tdata\tor\tother\ncommercially\tunfavorable\tterms.\tNotwithstanding\tour\tefforts\tto\tprotect\tthe\tsecurity\tand\tintegrity\tof\tour\tcustomers’\tpersonal\tinformation,\twe\tmay\tbe\nrequired\tto\texpend\tsignificant\tresources\tto\tcomply\twith\tdata\tbreach\trequirements\tif,\tfor\texample,\tthird\tparties\timproperly\tobtain\tand\tuse\tthe\tpersonal\ninformation\tof\tour\tcustomers\tor\twe\totherwise\texperience\ta\tdata\tloss\twith\trespect\tto\tthe\tpersonal\tinformation\twe\tprocess\tand\thandle.\tA\tmajor\tbreach\tof\nour\tnetwork\tsecurity\tand\tsystems\tmay\toccur\tdespite\tdefensive\tmeasures,\tand\tmay\tresult\tin\tfines,\tpenalties\tand\tdamages\tand\tharm\tour\tbrand,\tprospects\nand\toperating\tresults.\nWe\tcould\tbe\tsubject\tto\tliability,\tpenalties\tand\tother\trestrictive\tsanctions\tand\tadverse\tconsequences\tarising\tout\tof\tcertain\ngovernmental\tinvestigations\tand\tproceedings.\nWe\tare\tcooperating\twith\tcertain\tgovernment\tinvestigations\tas\tdiscussed\tin\tNote\t15,\t\nCommitments\tand\tContingencies\n,\tto\tthe\tconsolidated\tfinancial\nstatements\tincluded\telsewhere\tin\tthis\tAnnual\tReport\ton\tForm\t10-K.\tTo\tour\tknowledge,\tno\tgovernment\tagency\tin\tany\tsuch\tongoing\tinvestigation\thas\nconcluded\tthat\tany\twrongdoing\toccurred.\tHowever,\twe\tcannot\tpredict\tthe\toutcome\tor\timpact\tof\tany\tsuch\tongoing\tmatters,\tand\tthere\texists\tthe\tpossibility\nthat\twe\tcould\tbe\tsubject\tto\tliability,\tpenalties\tand\tother\trestrictive\tsanctions\tand\tadverse\tconsequences\tif\tthe\tSEC,\tthe\tU.S.\tDepartment\tof\tJustice\tor\tany\nother\tgovernment\tagency\twere\tto\tpursue\tlegal\taction\tin\tthe\tfuture.\tMoreover,\twe\texpect\tto\tincur\tcosts\tin\tresponding\tto\trelated\trequests\tfor\tinformation\nand\tsubpoenas,\tand\tif\tinstituted,\tin\tdefending\tagainst\tany\tgovernmental\tproceedings.\nWe\tmay\tface\tregulatory\tchallenges\tto\tor\tlimitations\ton\tour\tability\tto\tsell\tvehicles\tdirectly.\nWhile\twe\tintend\tto\tcontinue\tto\tleverage\tour\tmost\teffective\tsales\tstrategies,\tincluding\tsales\tthrough\tour\twebsite,\twe\tmay\tnot\tbe\table\tto\tsell\tour\nvehicles\tthrough\tour\town\tstores\tin\tcertain\tstates\tin\tthe\tU.S.\twith\tlaws\tthat\tmay\tbe\tinterpreted\tto\timpose\tlimitations\ton\tthis\tdirect-to-consumer\tsales\nmodel.\tIt\thas\talso\tbeen\tasserted\tthat\tthe\tlaws\tin\tsome\tstates\tlimit\tour\tability\tto\tobtain\tdealer\tlicenses\tfrom\tstate\tmotor\tvehicle\tregulators,\tand\tsuch\nassertions\tpersist.\tIn\tcertain\tlocations,\tdecisions\tby\tregulators\tpermitting\tus\tto\tsell\tvehicles\thave\tbeen,\tand\tmay\tbe,\tchallenged\tby\tdealer\tassociations\nand\tothers\tas\tto\twhether\tsuch\tdecisions\tcomply\twith\tapplicable\tstate\tmotor\tvehicle\tindustry\tlaws.\tWe\thave\tprevailed\tin\tmany\tof\tthese\tlawsuits\tand\tsuch\nresults\thave\treinforced\tour\tcontinuing\tbelief\tthat\tstate\tfranchise\tlaws\twere\tnot\tintended\tto\tapply\tto\ta\tmanufacturer\tthat\tdoes\tnot\thave\tfranchise\tdealers\nanywhere\tin\tthe\tworld.\tIn\tsome\tstates,\tthere\thave\talso\tbeen\tregulatory\tand\tlegislative\tefforts\tby\tdealer\tassociations\tto\tpropose\tlaws\tthat,\tif\tenacted,\nwould\tprevent\tus\tfrom\tobtaining\tdealer\tlicenses\tin\ttheir\tstates\tgiven\tour\tcurrent\tsales\tmodel.\tA\tfew\tstates\thave\tpassed\tlegislation\tthat\tclarifies\tour\tability\nto\toperate,\tbut\tat\tthe\tsame\ttime\tlimits\tthe\tnumber\tof\tdealer\tlicenses\twe\tcan\tobtain\tor\tstores\tthat\twe\tcan\toperate.\tThe\tapplication\tof\tstate\tlaws\tapplicable\nto\tour\toperations\tcontinues\tto\tbe\tdifficult\tto\tpredict.', 'Table\tof\tContents\nAny\tunauthorized\tcontrol\tor\tmanipulation\tof\tour\tproducts’\tsystems\tcould\tresult\tin\tloss\tof\tconfidence\tin\tus\tand\tour\tproducts.\nOur\tproducts\tcontain\tcomplex\tinformation\ttechnology\tsystems.\tFor\texample,\tour\tvehicles\tand\tenergy\tstorage\tproducts\tare\tdesigned\twith\tbuilt-in\ndata\tconnectivity\tto\taccept\tand\tinstall\tperiodic\tremote\tupdates\tfrom\tus\tto\timprove\tor\tupdate\ttheir\tfunctionality.\tWhile\twe\thave\timplemented\tsecurity\nmeasures\tintended\tto\tprevent\tunauthorized\taccess\tto\tour\tinformation\ttechnology\tnetworks,\tour\tproducts\tand\ttheir\tsystems,\tmalicious\tentities\thave\nreportedly\tattempted,\tand\tmay\tattempt\tin\tthe\tfuture,\tto\tgain\tunauthorized\taccess\tto\tmodify,\talter\tand\tuse\tsuch\tnetworks,\tproducts\tand\tsystems\tto\tgain\ncontrol\tof,\tor\tto\tchange,\tour\tproducts’\tfunctionality,\tuser\tinterface\tand\tperformance\tcharacteristics\tor\tto\tgain\taccess\tto\tdata\tstored\tin\tor\tgenerated\tby\tour\nproducts.\tWe\tencourage\treporting\tof\tpotential\tvulnerabilities\tin\tthe\tsecurity\tof\tour\tproducts\tthrough\tour\tsecurity\tvulnerability\treporting\tpolicy,\tand\twe\naim\tto\tremedy\tany\treported\tand\tverified\tvulnerability.\tHowever,\tthere\tcan\tbe\tno\tassurance\tthat\tany\tvulnerabilities\twill\tnot\tbe\texploited\tbefore\tthey\tcan\nbe\tidentified,\tor\tthat\tour\tremediation\tefforts\tare\tor\twill\tbe\tsuccessful.\nAny\tunauthorized\taccess\tto\tor\tcontrol\tof\tour\tproducts\tor\ttheir\tsystems\tor\tany\tloss\tof\tdata\tcould\tresult\tin\tlegal\tclaims\tor\tgovernment\tinvestigations.\nIn\taddition,\tregardless\tof\ttheir\tveracity,\treports\tof\tunauthorized\taccess\tto\tour\tproducts,\ttheir\tsystems\tor\tdata,\tas\twell\tas\tother\tfactors\tthat\tmay\tresult\tin\nthe\tperception\tthat\tour\tproducts,\ttheir\tsystems\tor\tdata\tare\tcapable\tof\tbeing\thacked,\tmay\tharm\tour\tbrand,\tprospects\tand\toperating\tresults.\tWe\thave\tbeen\nthe\tsubject\tof\tsuch\treports\tin\tthe\tpast.\nOur\tbusiness\tmay\tbe\tadversely\taffected\tby\tany\tdisruptions\tcaused\tby\tunion\tactivities.\nIt\tis\tnot\tuncommon\tfor\temployees\tof\tcertain\ttrades\tat\tcompanies\tsuch\tas\tours\tto\tbelong\tto\ta\tunion,\twhich\tcan\tresult\tin\thigher\temployee\tcosts\tand\nincreased\trisk\tof\twork\tstoppages.\tMoreover,\tregulations\tin\tsome\tjurisdictions\toutside\tof\tthe\tU.S.\tmandate\temployee\tparticipation\tin\tindustrial\tcollective\nbargaining\tagreements\tand\twork\tcouncils\twith\tcertain\tconsultation\trights\twith\trespect\tto\tthe\trelevant\tcompanies’\toperations.\tAlthough\twe\twork\tdiligently\nto\tprovide\tthe\tbest\tpossible\twork\tenvironment\tfor\tour\temployees,\tthey\tmay\tstill\tdecide\tto\tjoin\tor\tseek\trecognition\tto\tform\ta\tlabor\tunion,\tor\twe\tmay\tbe\nrequired\tto\tbecome\ta\tunion\tsignatory.\tFrom\ttime\tto\ttime,\tlabor\tunions\thave\tengaged\tin\tcampaigns\tto\torganize\tcertain\tof\tour\toperations,\tas\tpart\tof\twhich\nsuch\tunions\thave\tfiled\tunfair\tlabor\tpractice\tcharges\tagainst\tus\twith\tthe\tNational\tLabor\tRelations\tBoard\t(the\t“NLRB”),\tand\tthey\tmay\tdo\tso\tin\tthe\tfuture.\nAny\tunfavorable\tultimate\toutcome\tfor\tTesla\tmay\thave\ta\tnegative\timpact\ton\tthe\tperception\tof\tTesla’s\ttreatment\tof\tour\temployees.\tFurthermore,\twe\tare\ndirectly\tor\tindirectly\tdependent\tupon\tcompanies\twith\tunionized\twork\tforces,\tsuch\tas\tsuppliers\tand\ttrucking\tand\tfreight\tcompanies.\tAny\twork\tstoppages\tor\nstrikes\torganized\tby\tsuch\tunions\tcould\tdelay\tthe\tmanufacture\tand\tsale\tof\tour\tproducts\tand\tmay\tharm\tour\tbusiness\tand\toperating\tresults.\nWe\tmay\tchoose\tto\tor\tbe\tcompelled\tto\tundertake\tproduct\trecalls\tor\ttake\tother\tsimilar\tactions.\nAs\ta\tmanufacturing\tcompany,\twe\tmust\tmanage\tthe\trisk\tof\tproduct\trecalls\twith\trespect\tto\tour\tproducts.']","Tesla discloses risks related to unauthorized access to their products' systems, which could lead to modifications of functionality, user interface, or performance characteristics. They also mention the possibility of data breaches and the potential for malicious entities to exploit vulnerabilities in their products' security. 


","Cybersecurity threats: unauthorized access, data breaches, IP theft, fraud, extortion, privacy violations, operational risks",1.0,0.99999999998,0.625
What unresolved staff comments are noted in the 10‑K?,"['This Annual Report on Form 10-K (“Form 10-K”) contains forward-looking statements, within the meaning of the Private \nSecurities Litigation Reform Act of 1995, that involve risks and uncertainties. Many of the forward-looking statements are \nlocated in Part I, Item 1 of this Form 10-K under the heading “Business” and Part II, Item 7 of this Form 10-K under the heading \n“Management’s Discussion and Analysis of Financial Condition and Results of Operations.” Forward-looking statements \nprovide current expectations of future events based on certain assumptions and include any statement that does not directly \nrelate to any historical or current fact. For example, statements in this Form 10-K regarding the potential future impact of \nmacroeconomic conditions on the Company’s business and results of operations are forward-looking statements. Forward-\nlooking statements can also be identified by words such as “future,” “anticipates,” “believes,” “estimates,” “expects,” \n“intends,” “plans,” “predicts,” “will,” “would,” “could,” “can,” “may,” and similar terms. Forward-looking statements are not \nguarantees of future performance and the Company’s actual results may differ significantly from the results discussed in the \nforward-looking statements. Factors that might cause such differences include, but are not limited to, those discussed in Part I, \nItem 1A of this Form 10-K under the heading “Risk Factors.” The Company assumes no obligation to revise or update any \nforward-looking statements for any reason, except as required by law.\nUnless otherwise stated, all information presented herein is based on the Company’s fiscal calendar, and references to \nparticular years, quarters, months or periods refer to the Company’s fiscal years ended in September and the associated \nquarters, months and periods of those fiscal years. Each of the terms the “Company” and “Apple” as used herein refers \ncollectively to Apple Inc. and its wholly owned subsidiaries, unless otherwise stated.\nPART I\nItem 1. Business\nCompany Background\nThe Company designs, manufactures and markets smartphones, personal computers, tablets, wearables and accessories, and \nsells a variety of related services. The Company’s fiscal year is the 52- or 53-week period that ends on the last Saturday of \nSeptember.\nProducts\niPhone\niPhone® is the Company’s line of smartphones based on its iOS operating system. The iPhone line includes iPhone 15 Pro, \niPhone 15, iPhone 14, iPhone 13 and iPhone SE®.\nMac\nMac® is the Company’s line of personal computers based on its macOS ® operating system. The Mac line includes laptops \nMacBook Air® and MacBook Pro®, as well as desktops iMac®, Mac mini®, Mac Studio® and Mac Pro®.\niPad\niPad® is the Company’s line of multipurpose tablets based on its iPadOS ® operating system. The iPad line includes iPad Pro ®, \niPad Air®, iPad and iPad mini®.\nWearables, Home and Accessories\nWearables includes smartwatches and wireless headphones. The Company’s line of smartwatches, based on its watchOS ® \noperating system, includes Apple Watch Ultra™ 2, Apple Watch ® Series 9 and Apple Watch SE ®. The Company’s line of \nwireless headphones includes AirPods®, AirPods Pro®, AirPods Max™ and Beats ® products.\nHome includes Apple TV ®, the Company’s media streaming and gaming device based on its tvOS ® operating system, and \nHomePod® and HomePod mini®, high-fidelity wireless smart speakers.\nAccessories includes Apple-branded and third-party accessories.\nApple Inc. | 2023 Form 10-K | 1', 'Apple Inc.\nForm 10-K\nFor the Fiscal Year Ended September\xa030, 2023\nTABLE OF CONTENTS\nPage\nPart I\nItem 1. Business 1\nItem 1A. Risk Factors 5\nItem 1B. Unresolved Staff Comments 16\nItem 1C. Cybersecurity 16\nItem 2. Properties 17\nItem 3. Legal Proceedings 17\nItem 4. Mine Safety Disclosures 17\nPart II\nItem 5. Market for Registrant’s Common Equity, Related Stockholder Matters and Issuer Purchases of Equity \nSecurities\n18\nItem 6. [Reserved] 19\nItem 7. Management’s Discussion and Analysis of Financial Condition and Results of Operations 20\nItem 7A. Quantitative and Qualitative Disclosures About Market Risk 26\nItem 8. Financial Statements and Supplementary Data 27\nItem 9. Changes in and Disagreements with Accountants on Accounting and Financial Disclosure 52\nItem 9A. Controls and Procedures 52\nItem 9B. Other Information 53\nItem 9C. Disclosure Regarding Foreign Jurisdictions that Prevent Inspections 53\nPart III\nItem 10. Directors, Executive Officers and Corporate Governance 53\nItem 11. Executive Compensation 53\nItem 12. Security Ownership of Certain Beneficial Owners and Management and Related Stockholder Matters 53\nItem 13. Certain Relationships and Related Transactions, and Director Independence 53\nItem 14. Principal Accountant Fees and Services 53\nPart IV\nItem 15. Exhibit and Financial Statement Schedules 54\nItem 16. Form 10-K Summary 57', 'Table\tof\tContents\nForward-Looking\tStatements\nThe\tdiscussions\tin\tthis\tAnnual\tReport\ton\tForm\t10-K\tcontain\tforward-looking\tstatements\treflecting\tour\tcurrent\texpectations\tthat\tinvolve\trisks\tand\nuncertainties.\tThese\tforward-looking\tstatements\tinclude,\tbut\tare\tnot\tlimited\tto,\tstatements\tconcerning\tsupply\tchain\tconstraints,\tour\tstrategy,\ncompetition,\tfuture\toperations\tand\tproduction\tcapacity,\tfuture\tfinancial\tposition,\tfuture\trevenues,\tprojected\tcosts,\tprofitability,\texpected\tcost\treductions,\ncapital\tadequacy,\texpectations\tregarding\tdemand\tand\tacceptance\tfor\tour\ttechnologies,\tgrowth\topportunities\tand\ttrends\tin\tthe\tmarkets\tin\twhich\twe\noperate,\tprospects\tand\tplans\tand\tobjectives\tof\tmanagement.\tThe\twords\t“anticipates,”\t“believes,”\t“could,”\t“estimates,”\t“expects,”\t“intends,”\t“may,”\n“plans,”\t“projects,”\t“will,”\t“would”\tand\tsimilar\texpressions\tare\tintended\tto\tidentify\tforward-looking\tstatements,\talthough\tnot\tall\tforward-looking\nstatements\tcontain\tthese\tidentifying\twords.\tWe\tmay\tnot\tactually\tachieve\tthe\tplans,\tintentions\tor\texpectations\tdisclosed\tin\tour\tforward-looking\nstatements\tand\tyou\tshould\tnot\tplace\tundue\treliance\ton\tour\tforward-looking\tstatements.\tActual\tresults\tor\tevents\tcould\tdiffer\tmaterially\tfrom\tthe\tplans,\nintentions\tand\texpectations\tdisclosed\tin\tthe\tforward-looking\tstatements\tthat\twe\tmake.\tThese\tforward-looking\tstatements\tinvolve\trisks\tand\tuncertainties\nthat\tcould\tcause\tour\tactual\tresults\tto\tdiffer\tmaterially\tfrom\tthose\tin\tthe\tforward-looking\tstatements,\tincluding,\twithout\tlimitation,\tthe\trisks\tset\tforth\tin\tPart\nI,\tItem\t1A,\t“Risk\tFactors”\tof\tthe\tAnnual\tReport\ton\tForm\t10-K\tfor\tthe\tfiscal\tyear\tended\tDecember\t31,\t2023\tand\tthat\tare\totherwise\tdescribed\tor\tupdated\nfrom\ttime\tto\ttime\tin\tour\tother\tfilings\twith\tthe\tSecurities\tand\tExchange\tCommission\t(the\t“SEC”).\tThe\tdiscussion\tof\tsuch\trisks\tis\tnot\tan\tindication\tthat\tany\nsuch\trisks\thave\toccurred\tat\tthe\ttime\tof\tthis\tfiling.\tWe\tdo\tnot\tassume\tany\tobligation\tto\tupdate\tany\tforward-looking\tstatements.', '104** Inline XBRL for the cover page of this Annual Report on Form 10-K, included in \nthe Exhibit 101 Inline XBRL Document Set.\nIncorporated by Reference\nExhibit \nNumber Exhibit Description Form Exhibit\nFiling Date/\nPeriod End \nDate\n* Indicates management contract or compensatory plan or arrangement.\n** Filed herewith.\n*** Furnished herewith.\n(1) Certain instruments defining the rights of holders of long-term debt securities of the Registrant are omitted pursuant to Item \n601(b)(4)(iii) of Regulation S-K. The Registrant hereby undertakes to furnish to the SEC, upon request, copies of any such \ninstruments.\nItem 16. Form 10-K Summary\nNone.\nApple Inc. | 2023 Form 10-K | 57', ""TESLA,\tINC.\nANNUAL\tREPORT\tON\tFORM\t10-K\tFOR\tTHE\tYEAR\tENDED\tDECEMBER\t31,\t2023\nINDEX\n\t\n\t\nPage\nPART\tI.\n\t\n\t\nItem\t1.\nBusiness\n4\nItem\t1A.\nRisk\tFactors\n14\nItem\t1B.\nUnresolved\tStaff\tComments\n28\nItem\t1C.\nCybersecurity\n29\nItem\t2.\nProperties\n30\nItem\t3.\nLegal\tProceedings\n30\nItem\t4.\nMine\tSafety\tDisclosures\n30\n\t\nPART\tII.\n\t\nItem\t5.\nMarket\tfor\tRegistrant's\tCommon\tEquity,\tRelated\tStockholder\tMatters\tand\tIssuer\tPurchases\tof\tEquity\tSecurities\n31\nItem\t6.\n[Reserved]\n32\nItem\t7.\nManagement's\tDiscussion\tand\tAnalysis\tof\tFinancial\tCondition\tand\tResults\tof\tOperations\n33\nItem\t7A.\nQuantitative\tand\tQualitative\tDisclosures\tabout\tMarket\tRisk\n45\nItem\t8.\nFinancial\tStatements\tand\tSupplementary\tData\n46\nItem\t9.\nChanges\tin\tand\tDisagreements\twith\tAccountants\ton\tAccounting\tand\tFinancial\tDisclosure\n93\nItem\t9A.\nControls\tand\tProcedures\n93\nItem\t9B.\nOther\tInformation\n94\nItem\t9C.\nDisclosure\tRegarding\tForeign\tJurisdictions\tthat\tPrevent\tInspections\n94\n\t\nPART\tIII.\n\t\nItem\t10.\nDirectors,\tExecutive\tOfficers\tand\tCorporate\tGovernance\n95\nItem\t11.\nExecutive\tCompensation\n95\nItem\t12.\nSecurity\tOwnership\tof\tCertain\tBeneficial\tOwners\tand\tManagement\tand\tRelated\tStockholder\tMatters\n95\nItem\t13.\nCertain\tRelationships\tand\tRelated\tTransactions,\tand\tDirector\tIndependence\n95\nItem\t14.\nPrincipal\tAccountant\tFees\tand\tServices\n95\n\t\nPART\tIV.\n\t\nItem\t15.\nExhibits\tand\tFinancial\tStatement\tSchedules\n96\nItem\t16.\nSummary\n111\n\t\nSignatures""]","Unresolved staff comments are noted on page 28.  
",None (there are no unresolved SEC staff comments) :contentReference[oaicite:0]{index=0}&#8203;:contentReference[oaicite:1]{index=1},0.0,0.6791666666496875,
